Azure Dreams Game Boy Color;399,99 EUR;+ 19,99 EUR de envío;desde España;
Azure Dreams. NINTEDO GAMEBOY COLOR Juego. UK PAL. completa;269,38 EUR;+ 35,57 EUR de envío estimado;desde Reino Unido;
GBC-Azure Dreams Nintendo Gameboy Game Boy Color solo carro Probado;63,81 EUR;Envío gratis;desde Estados Unidos;
Azure Dreams (Nintendo Game Boy Color, 1998) Raro Game Boy Color RPG, Completa!;425,99 EUR;Envío gratis;desde Estados Unidos;
Azure Dreams - Nintendo Game Boy Color - REgistration card RARE;26,71 EUR;+ 10,02 EUR de envío;desde Canadá;
🎮 Azure Dreams. PS1 Juego. Raro. completa (PAL) casi nuevo PlayStation One 🎮;175,68 EUR;+ 33,86 EUR de envío estimado;desde Reino Unido;
