Nuevo anuncioNintendo Game Boy Game-Lucky Luke-Embalaje original-pal-rar-Top;59,90 EUR;Envío no especificado;desde Alemania;
Game Boy Color-Lucky Luke-Top-Embalaje original-Pal;49,90 EUR;Envío no especificado;desde Alemania;
Lucky Luke quería! Nintendo Gameboy Advance GBA CIB en muy buen estado Probado L @ @ K;27,39 EUR;+ 16,86 EUR de envío estimado;desde Reino Unido;
Nintendo Game Boy Color Lucky Luke Banditen Express NOE Excellent état;6,90 EUR;+ 11,98 EUR de envío;desde Francia;
Game Boy Color Lucky Luke Desperado Tren En Caja Con Manual Free UK Post;31,47 EUR;+ 16,94 EUR de envío estimado;desde Reino Unido;
Nintendo Game Boy Game-Lucky Luke-Embalaje original-pal-Top;57,90 EUR;Envío no especificado;desde Alemania;
Lucky Luke: bandidos Express-Game Boy Color módulo con cubierta protectora & instrucciones;13,99 EUR;+ 6,90 EUR de envío;desde Alemania;
Nintendo Game Boy Color - Lucky Luke : Le Train Des Desperados - PAL - FRA;24,99 EUR;+ 9,50 EUR de envío;desde Francia;
Lucky Luke-gameboy color juego-módulo & instrucciones;11,11 EUR;+ 6,90 EUR de envío;desde Alemania;
Nintendo Gameboy Color juego-Lucky Luke (módulo) 11310730;1.111,11 EUR;+ 67,99 EUR de envío;desde Alemania;
Nintendo Game Boy - Lucky Luke - PAL - FAH;59,99 EUR;+ 29,20 EUR de envío;desde Francia;
Nintendo Gameboy Color Juego-Lucky Luke;10,45 EUR;+ 16,56 EUR de envío estimado;desde Reino Unido;
★ Game Boy Advance Wanted Lucky Luke ★ ESP;19,99 EUR;Envío no especificado;desde España;
Nintendo GameBoy Colour-Lucky Luke;34,96 EUR;+ 17,00 EUR de envío estimado;desde Reino Unido;
Lucky Luke Nintendo Gameboy Color Juego;8,73 EUR;+ 18,30 EUR de envío estimado;desde Reino Unido;
Notice d'origine instruction manual pour jeu game boy color Lucky Luke;4,99 EUR;+ 2,50 EUR de envío;desde Francia;
Nintendo Gameboy Color-Lucky Luke;10,45 EUR;+ 16,56 EUR de envío estimado;desde Reino Unido;
Lucky Luke (Nintendo Gameboy) PAL módulo;6,95 EUR;+ 9,00 EUR de envío;desde Alemania;
Nintendo Gameboy Color Classic juego/Lucky Luke bandidos Express;9,95 EUR;+ 6,00 EUR de envío;desde Alemania;
Nintendo Gameboy Juego-Lucky Luke;10,45 EUR;+ 16,56 EUR de envío estimado;desde Reino Unido;
Lucky Luke bandidos Express gameboy color OVP cib Boxed;16,90 EUR;+ 4,50 EUR de envío;desde Alemania;
Nintendo Gameboy juego Lucky Luke (GameBoy Classic);8,99 EUR;+ 2,00 EUR de envío;desde Alemania;
Nintendo Gameboy Advance juego-Lucky Luke: wanted (módulo) 11131359;5,99 EUR;+ 67,99 EUR de envío;desde Alemania;
Lucky Luke wanted! Game Boy Advance;20,00 EUR;+ 3,70 EUR de envío;desde Alemania;
Lucky Luke Wanted Jeu Gameboy Advance GBA - FRA;9,90 EUR;+ 10,00 EUR de envío;desde Francia;
Lucky Luke Carrito para Nintendo GameBoy Color (en muy buena condición, solo carro);10,48 EUR;+ 16,56 EUR de envío estimado;desde Reino Unido;
Gb-Lucky Luke para Nintendo GameBoy;8,95 EUR;+ 6,50 EUR de envío;desde Alemania;
★★ Jeu Game boy : Lucky Luke( Loose) ★★;8,88 EUR;+ 19,90 EUR de envío;desde Francia;
Nintendo Game Boy Advance juego Lucky Luke Wanted en OVP con instrucciones pal Game;24,99 EUR;+ 4,99 EUR de envío;desde Alemania;
Nintendo Gameboy loose jeu Lucky Luke le train des desperados;8,90 EUR;+ 5,00 EUR de envío;desde Francia;
Lucky Luke: wanted Nintendo Game Boy juego muy bien probado;9,99 EUR;+ 9,99 EUR de envío;desde Alemania;
Nintendo Game Boy Color - Lucky Luke : Le Train Des Desperados - PAL - FRA;7,99 EUR;+ 5,00 EUR de envío;desde Francia;
GBC-Lucky Luke: bandidos Express para Nintendo Gameboy Color;9,95 EUR;+ 9,95 EUR de envío;desde Alemania;
Lucky Luke Nintendo Game Boy OVP muy bien probado;7,99 EUR;+ 9,99 EUR de envío;desde Alemania;
GBC-Lucky Luke para Nintendo Gameboy Color;12,95 EUR;+ 9,95 EUR de envío;desde Alemania;
Nintendo GameBoy Advance juego - Lucky Luke: Wanted cartucho usado;18,99 EUR;Envío internacional gratis;desde Alemania;
Nintendo GameBoy Advance juego - Lucky Luke: Wanted en el embalaje usado;19,99 EUR;Envío internacional gratis;desde Alemania;
Gameboy Color juego-Lucky Luke bandidos Express (módulo);7,98 EUR;+ 67,99 EUR de envío;desde Alemania;
Notice NIntendo Game Boy  Lucky Luke + Poster FAH Très Bon état;11,90 EUR;+ 11,98 EUR de envío;desde Francia;
PUBLICITE / PUB / AD NINTENDO  GAME BOY Color Tintin, Astérix, Lucky Luke;6,00 EUR;+ 2,90 EUR de envío;desde Francia;
Nintendo Game Boy - Lucky Luke - Notice - Instruction Manual - FAH;4,99 EUR;+ 4,00 EUR de envío;desde Francia;
Nintendo Game Boy - Lucky Luke - Notice - Instruction Manual - FAH;5,99 EUR;+ 4,00 EUR de envío;desde Francia;
Notice jeu Nintendo Game Boy Color Lucky Luke Instruction Booklet EUR;4,99 EUR;+ 0,85 EUR de envío;desde Francia;
Gameboy-Lucky Luke (solo módulo);9,71 EUR;+ 6,50 EUR de envío;desde Alemania;
