F-18 Thunder Strike | With Manual | Game Boy Color 🕹|  Excellent Condition!;8,00 EUR;+3,50 EUR shipping;from Netherlands;
F-18 Thunder Strike Gameboy Color (Without Cardboard Inserts);11,66 EUR;+16,60 EUR shipping estimate;from United Kingdom;
F-18 Thunder Strike Instruction Booklet Manual For Game Boy Color;6,39 EUR;Free shipping;from United States;
F-18 Thunder Strike (Nintendo Game Boy Color, 2000) GBC Cartridge ;8,53 EUR;Free shipping;from United States;
F-18 Thunder Strike F18 Game Boy Color GBC GBA GameBoy Cart Only Game Authentic;10,88 EUR;Free shipping;from United States;
F-18 Thunder Strike (Nintendo Game Boy Color, 2000) GBC. complete;25,53 EUR;Free shipping;from United States;
F-18 Thunder Strike (Nintendo Game Boy Color, 2000) GBC;11,09 EUR;Free shipping;from United States;
F-18 Thunder Strike (Nintendo Game Boy Color) Authentic/Cleaned GBC Gameboy;6,70 EUR;+10,07 EUR shipping;from Canada;
Nintendo GBC Gameboy Color Game - F18 F-18 Thunder Strike - Module;4,42 EUR;+3,90 EUR shipping;from Germany;
Nintendo Gameboy color games F-18 Thunder Strike Tony Hawk's Pro Skater 2 + 1GBC;14,99 EUR;+3,41 EUR shipping;from United States;
Nintendo GBC Gameboy Color Game - F18 F-18 Thunder Strike - Module;4,53 EUR;+3,90 EUR shipping;from Germany;
F-18 Thunder Strike Nintendo Gameboy Color;8,53 EUR;Free shipping;from United States;
F-18 Thunder Strike Instruction Booklet Manual For Game Boy Color;5,93 EUR;+3,37 EUR shipping;from United States;
Game Boy F-18 Thunder Strike Boxed With Instructions Gwo;17,50 EUR;+16,71 EUR shipping estimate;from United Kingdom;
