Nintendo Game Boy Classic juego Bram Stoker's Dracula módulo fah;24,90 EUR;+ 8,99 EUR de envío;desde Alemania;
Bram Stoker's Dracula Nintendo Game Boy Juego Con Caja Y Folleto Completo En Caja;110,87 EUR;+ 17,06 EUR de envío;desde Alemania;
Bram Stoker's Dracula (casi Nuevo), Nintendo Game Boy;17,05 EUR;Envío gratis;desde Estados Unidos;
Bram Stoker's Dracula (casi Nuevo), carro de juego solamente, Nintendo Game Boy;20,47 EUR;+ 5,12 EUR de envío;desde Estados Unidos;
Bram Stoker's Dracula (Nintendo Game Boy Gameboy) Completo en Caja buena forma;125,37 EUR;Envío gratis;desde Estados Unidos;
Bram Stoker's Dracula-Nintendo Game Boy 1993-auténtica Probado;21,31 EUR;Envío gratis;desde Estados Unidos;
Bram Stoker's Dracula (casi Nuevo), carro de juego solamente, Nintendo Game Boy;15,34 EUR;+ 4,26 EUR de envío;desde Estados Unidos;
Bram Stoker's Dracula Nintendo Gameboy solo Manual ~ Juego Folleto de instrucciones;11,09 EUR;Envío gratis;desde Estados Unidos;
Bram Stoker's Dracula Nintendo Gameboy probado funciona sólo juego;21,31 EUR;Envío gratis;desde Estados Unidos;
Bram Stoker's Dracula Nintendo Gameboy probado obras de juego copia de alquiler;21,31 EUR;desde Estados Unidos;
Bram Stoker's Dracula-Super Nintendo Entertainment System (probados) PAL UKV;99,44 EUR;+ 29,09 EUR de envío;desde Reino Unido;
