Jim Henson's Muppets (Gameboy Color) completo Pal RARO;57,92 EUR;+ 17,39 EUR de envío;Vendidos  17 ago 2021Artículo vendido;desde Reino Unido;
Jim Henson's Muppets (Nintendo Game Boy Color, 2000) Con Manual;8,52 EUR;Envío gratis;Vendidos  18 sep 2021Artículo vendido;desde Estados Unidos;
Jim Henson's Muppets Gameboy Color Solo Manual De Instrucciones;3,42 EUR;+ 1,70 EUR de envío;Vendidos  4 sep 2021Artículo vendido;desde Estados Unidos;
Jim Henson's Muppets Nintendo Game Boy Color * Auténtico y ahorra *;7,68 EUR;Envío gratis;Vendidos  30 ago 2021Artículo vendido;desde Estados Unidos;
(Mega Game Boy Color Universo H-costura) (Cerrada de Fábrica Jim Henson's Muppets);23,88 EUR;+ 5,57 EUR de envío;Vendidos  12 ago 2021Artículo vendido;desde Estados Unidos;
Jim Henson's Muppets (Gameboy Color, 2000) sólo juego;4,27 EUR;+ 4,03 EUR de envío;Vendidos  4 ago 2021Artículo vendido;desde Estados Unidos;
Jim Henson's Muppets Party Cruise de Vídeo Juego Para Sony PlayStation PS2 Pal probado;6,95 EUR;+ 16,39 EUR de envío estimado;Vendidos  26 jul 2021Artículo vendido;desde Reino Unido;
Jim Henson's Muppets: en con el show - 2003 Juego de PC-rápido post-Completo;5,79 EUR;+ 6,67 EUR de envío;Vendidos  2 sep 2021Artículo vendido;desde Reino Unido;
