Original Juego De Nintendo Gameboy, Star Wars;35,13 EUR;+ 17,08 EUR de envío estimado;Vendidos  19 sep 2021Artículo vendido;desde Reino Unido;
Nuevo anuncioX200 Gameboy Advance carros Paquete. Rayman Crash Bandicoot Harry Potter Star Wars;468,49 EUR;+ 34,49 EUR de envío estimado;Vendidos  19 sep 2021Artículo vendido;desde Reino Unido;
Nintendo Gameboy Juego-Star Wars episodio I Racer;14,00 EUR;+ 16,69 EUR de envío estimado;Vendidos  17 sep 2021Artículo vendido;desde Reino Unido;
Game Boy Advance GBA del juego Star Wars Flight of the Falcon/ok;4,49 EUR;+ 9,60 EUR de envío;Vendidos  15 sep 2021Artículo vendido;desde Alemania;
Star Wars El Imperio Contraataca NINTENDO GAMEBOY Cartucho sólo * Free Uk P + P *;11,70 EUR;+ 11,71 EUR de envío;Vendidos  15 sep 2021Artículo vendido;desde Reino Unido;
Star Wars: Yoda Stories (Nintendo Game Boy Color, 1999) - EU Version;13,50 EUR;Envío no especificado;Vendidos  14 sep 2021Artículo vendido;desde Irlanda;
Instrucciones Gameboy Star Wars;12,00 EUR;+ 7,00 EUR de envío;Vendidos  14 sep 2021Artículo vendido;desde Alemania;
Star Wars-NINTENDO GAME BOY-PAL Versión en Caja;31,61 EUR;+ 20,77 EUR de envío estimado;Vendidos  13 sep 2021Artículo vendido;desde Reino Unido;
Star Wars Flight of the Falcon Nintendo Gameboy Advance DS;5,24 EUR;+ 4,95 EUR de envío;Vendidos  12 sep 2021Artículo vendido;desde Austria;
Lego Star Wars The Video Game Nintendo Gameboy Advance DS;6,74 EUR;+ 4,95 EUR de envío;Vendidos  12 sep 2021Artículo vendido;desde Austria;
Star Wars episodio 3 la venganza de los Sith-Juego Boy Advance-Cartucho y Manual;11,47 EUR;+ 6,44 EUR de envío;Vendidos  12 sep 2021Artículo vendido;desde Reino Unido;
Star Wars Nintendo GameBoy solo carro probado Juego Boy;9,36 EUR;+ 16,61 EUR de envío estimado;Vendidos  12 sep 2021Artículo vendido;desde Reino Unido;
Lego Star Wars: The Video Game-NINTENDO Game Boy Advance-GBA PAL-Original;4,67 EUR;+ 16,53 EUR de envío estimado;Vendidos  12 sep 2021Artículo vendido;desde Reino Unido;
Lego Star Wars 2 The Original Trilogy ps2 Juego Niños Niñas Niños II -;2,33 EUR;+ 18,78 EUR de envío estimado;Vendidos  12 sep 2021Artículo vendido;desde Reino Unido;
Nintendo Gameboy Advance GBA-Boxeo fiebre, WWF, Star Wars, Shrek & Narnia;15,17 EUR;+ 16,71 EUR de envío estimado;Vendidos  10 sep 2021Artículo vendido;desde Reino Unido;
Nintendo Gameboy Sp, Star Wars Piel De Vinilo Sticker Decal Reino Unido;4,69 EUR;+ 2,34 EUR de envío;Vendidos  10 sep 2021Artículo vendido;desde Reino Unido;
Star Wars Battlefront 1 ps2 juego 12+ chicos shooter de acción -;4,67 EUR;+ 18,82 EUR de envío estimado;Vendidos  9 sep 2021Artículo vendido;desde Reino Unido;
Star Wars Trilogy aprendiz de la fuerza GBA Game Boy Advance;10,53 EUR;+ 14,06 EUR de envío;Vendidos  8 sep 2021Artículo vendido;desde Reino Unido;
Nintendo Game Boy Advance Star Wars Episode III Revenge of the Sith EUR #3;8,90 EUR;+ 11,98 EUR de envío;Vendidos  7 sep 2021Artículo vendido;desde Francia;
Game Boy Advance Star Wars 2: Attack de los clones AGB-AS2X-EUR (ver foto);4,39 EUR;+ 16,51 EUR de envío estimado;Vendidos  7 sep 2021Artículo vendido;desde Reino Unido;
Genuine Gameboy juego Star Wars El Imperio Contraataca Pal Importación en en muy buena condición;5,84 EUR;+ 18,89 EUR de envío estimado;Vendidos  7 sep 2021Artículo vendido;desde Reino Unido;
Star Wars-Gameboy Nintendo — - solo carro;9,36 EUR;+ 16,61 EUR de envío estimado;Vendidos  6 sep 2021Artículo vendido;desde Reino Unido;
Lego Star Wars The Video Game Juego BOY ADVANCE GBA PAL Juego en Caja Completa;15,17 EUR;+ 16,71 EUR de envío estimado;Vendidos  6 sep 2021Artículo vendido;desde Reino Unido;
Nintendo Gameboy Advance Star Wars Vuelo del Halcón Nuevo Sellado;11,65 EUR;+ 17,78 EUR de envío estimado;Vendidos  6 sep 2021Artículo vendido;desde Reino Unido;
Jeux game boy advance Star Wars Episode 2 : Attaque Des Clones - Version FR RARE;9,90 EUR;+ 7,60 EUR de envío;Vendidos  6 sep 2021Artículo vendido;desde Francia;
Star Wars Flight of the Falcon para Gameboy Advance/GBA;4,44 EUR;+ 9,99 EUR de envío;Vendidos  5 sep 2021Artículo vendido;desde Alemania;
Star Wars Battlefront II ps2 juego 12+ chicos shooter de acción 2 posiciones;5,84 EUR;+ 18,85 EUR de envío estimado;Vendidos  5 sep 2021Artículo vendido;desde Reino Unido;
Star Wars Trilogy aprendiz de la fuerza-Nintendo Gameboy Advance GBA, Probado;16,40 EUR;+ 16,74 EUR de envío estimado;Vendidos  4 sep 2021Artículo vendido;desde Reino Unido;
Star Wars Flight Of The Falcon GBA game boy advance ita NUOVO SIGILLATO!;29,99 EUR;Envío no especificado;Vendidos  4 sep 2021Artículo vendido;desde Italia;
Star Wars Vuelo del Halcón para GBA-Juego Boy Advance. creador copia;8,20 EUR;+ 7,61 EUR de envío;Vendidos  3 sep 2021Artículo vendido;desde Reino Unido;
Nuevo Y Sellado Lego Star Wars The Force despierta Xbox 360 Juego Niños Niños Marron;9,36 EUR;+ 18,90 EUR de envío estimado;Vendidos  2 sep 2021Artículo vendido;desde Reino Unido;
Star Wars-Gameboy Nintendo Carro Nintendo Game Boy;9,36 EUR;+ 16,61 EUR de envío estimado;Vendidos  31 ago 2021Artículo vendido;desde Reino Unido;
Star Wars episodio I 1 Racer-Nintendo Game Boy Color/Advance Cartucho;5,84 EUR;+ 20,30 EUR de envío estimado;Vendidos  31 ago 2021Artículo vendido;desde Reino Unido;
Retorno de las Jedi De Star Wars Nintendo Gameboy solo carro Juego Boy;17,56 EUR;+ 16,76 EUR de envío estimado;Vendidos  28 ago 2021Artículo vendido;desde Reino Unido;
