Animaniacs: Luces, Cámara, Acción Juego Para Nintendo Game Boy Advance pal probado;11,69 EUR;+ 16,65 EUR de envío estimado;desde Reino Unido;
Animaniacs Lights Camera Action Videogioco Game Boy / Ignition Nuovo;19,90 EUR;+ 13,90 EUR de envío;desde Italia;
NINTENDO GAME BOY ADVANCE-Animaniacs Luces Cámara juego de acción, en Caja Completa;23,35 EUR;+ 16,86 EUR de envío estimado;desde Reino Unido;
Game Boy Advance Nintendo Animaniacs: Lights, Camera, Action , Sealed VGA ready;22,00 EUR;+ 24,00 EUR de envío;desde España;
Animaniacs NINTENDO GAMEBOY Juego;15,21 EUR;+ 18,50 EUR de envío estimado;desde Reino Unido;
Nintendo Game Boy Animaniacs manual de instrucciones-DMG-ANCE-USA-1 Konami;11,69 EUR;+ 17,77 EUR de envío estimado;desde Reino Unido;
1994 Animaniacs Snes Sega Genesis Game Boy Promo Mini Póster ad página arte enmarcado;29,25 EUR;+ 15,21 EUR de envío;desde Alemania;
1994 Animaniacs Super Nes Sega Genesis Game Boy Promo Mini Póster/AD página Enmarcado;35,11 EUR;+ 15,21 EUR de envío;desde Alemania;
1994 Animaniacs Snes Sega Genesis Game Boy Promo Mini Póster ad página arte enmarcado;32,76 EUR;+ 15,21 EUR de envío;desde Alemania;
Animaniacs Lights Camera Action CIB GBA Game Boy Advance / Ignition Complete;19,90 EUR;Envío no especificado;desde Italia;
6039-Animaniacs Light Camera Action! GameBoy Advance;8,25 EUR;Envío no especificado;desde Italia;
Nuevo anuncioAnimaniacs (Nintendo Game Boy, 1995) Auténtico Probado;13,59 EUR;Envío gratis;desde Estados Unidos;
Animaniacs - (Nintendo Game Boy, GB, 1995) Cartucho y Manual Probado;21,24 EUR;Envío gratis;desde Estados Unidos;
Animaniacs (Nintendo Game Boy, 1995);11,04 EUR;+ 3,78 EUR de envío;desde Estados Unidos;
Animaniacs Nintendo Original Nintendo Game Boy más difícil encontrar!;13,58 EUR;Envío gratis;desde Estados Unidos;
Animaniacs (Nintendo Game Boy, 1995) Sólo Cartucho;8,08 EUR;+ 3,78 EUR de envío;desde Estados Unidos;
Animaniacs (Nintendo Game Boy, 1995) **clean and tested***;10,31 EUR;+ 8,70 EUR de envío;desde Canadá;
Animaniacs-auténtico Nintendo Game Boy Juego;16,82 EUR;+ 2,51 EUR de envío;desde Estados Unidos;
Animaniacs (Nintendo Game Boy, 1995) Auténtico Konami cartucho de juego probadas;12,71 EUR;+ 3,78 EUR de envío;desde Estados Unidos;
Animaniacs (Nintendo Game Boy, 1995);11,04 EUR;+ 3,40 EUR de envío;desde Estados Unidos;
Jeu Game boy / GB Game Animaniacs original * Nintendo;10,99 EUR;+ 7,90 EUR de envío;desde Bélgica;
Animaniacs Luces Cámara Acción Video Juego Boy/Encendido Nuevo;20,02 EUR;+ 13,97 EUR de envío;desde Italia;
Animaniacs (Nintendo Game Boy, 1995) Cool;26,78 EUR;Envío no especificado;desde Canadá;
Animaniacs Nintendo Gameboy 1995 Cart Only * Authentic tested * Free Shipping;13,38 EUR;+ 4,68 EUR de envío;desde Canadá;
Nintendo Juego-Boy PACMAN MS, Super Mario, los Rugrats, Animaniacs.;29,75 EUR;+ 12,92 EUR de envío;desde Estados Unidos;
Animaniacs Game Boy Spiel #3939;22,87 EUR;+ 15,34 EUR de envío;desde Suiza;
Animaniacs Manual Gameboy Gameboy Nintendo GB;21,24 EUR;Envío gratis;desde Estados Unidos;
Konami hits 1994 Super Nes Genesis Game Boy desplegable insertar cartel Animaniacs Batman;11,04 EUR;+ 3,83 EUR de envío;desde Estados Unidos;
1994 Animaniacs SNES Sega Genesis Game Boy Promo Vintage Poster / Ad Art Print;20,42 EUR;+ 11,38 EUR de envío;desde Alemania;
1994 Animaniacs Super Nes Sega Genesis Game Boy Promo Mini Póster/AD página Enmarcado;33,99 EUR;+ 14,44 EUR de envío;desde Alemania;
1994 Animaniacs SNES Sega Genesis Game Boy Promo mini Poster / Ad Page Framed;40,84 EUR;+ 14,72 EUR de envío;desde Alemania;
1994 Animaniacs SNES Sega Genesis Game Boy Promo mini Poster / Ad Page Framed.;33,47 EUR;+ 14,72 EUR de envío;desde Alemania;
1994 Animaniacs SNES Sega Genesis Game Boy Promo mini Poster / Ad Page Framed;40,84 EUR;+ 14,72 EUR de envío;desde Alemania;
Manual De Gameboy Animaniacs;10,16 EUR;Envío gratis;desde Estados Unidos;
Animaniacs Nintendo Entertainment SNES Juego en Caja System;58,52 EUR;+ 29,26 EUR de envío;desde Reino Unido;
