Disney's The Lion King Nintendo Game Boy Cartridge;7,51 EUR;+ 8,68 EUR de envío;desde Canadá;
Disney's The Lion King: Simba's Mighty Adventure (Nintendo Game Boy Color) GBC;14,69 EUR;+ 4,00 EUR de envío;desde Canadá;
Nintendo Gameboy Advance GBA Disney's The Lion King 1½ (Manual, box and game);10,02 EUR;Envío no especificado;desde Canadá;
Disney's The Lion King: Simba's Mighty Adventure (Nintendo Game Boy Color);10,01 EUR;+ 4,67 EUR de envío;desde Canadá;
Nintendo Gameboy - Disney's The Lion King / the - only Module;5,66 EUR;+ 1,80 EUR de envío;desde Alemania;
Nintendo Gameboy Advance GBA SP - Disney's The Lion King + Manual;6,99 EUR;+ 3,00 EUR de envío;desde Países Bajos;
Disney's The Lion King (cassette + manual) nintendo gameboy gb;8,75 EUR;+ 20,00 EUR de envío;desde Países Bajos;
Disney's The Lion King (losse cassette) nintendo gameboy gb;5,25 EUR;+ 20,00 EUR de envío;desde Países Bajos;
