Disney's The Lion King Nintendo Game Boy Cartridge;7,48 EUR;+ 8,65 EUR de envío;desde Canadá;
Nintendo Gameboy Advance GBA Disney's The Lion King 1½ (Manual, box and game);9,98 EUR;Envío no especificado;desde Canadá;
Disney's The Lion King: Simba's Mighty Adventure (Nintendo Game Boy Color) GBC;13,17 EUR;+ 3,99 EUR de envío;desde Canadá;
Disney's The Lion King: Simba's Mighty Adventure (Nintendo Game Boy Color);9,97 EUR;+ 4,65 EUR de envío;desde Canadá;
Nintendo Gameboy - Disney's The Lion King / the - only Module;5,66 EUR;+ 1,80 EUR de envío;desde Alemania;
Nintendo Gameboy Advance GBA SP - Disney's The Lion King + Manual;6,99 EUR;+ 3,00 EUR de envío;desde Países Bajos;
Disney's The Lion King (cassette + manual) nintendo gameboy gb;8,75 EUR;+ 20,00 EUR de envío;desde Países Bajos;
Disney's The Lion King (losse cassette) nintendo gameboy gb;5,25 EUR;+ 20,00 EUR de envío;desde Países Bajos;
Super Nintendo Disney's The Lion King EUR Bon état;14,90 EUR;+ 14,98 EUR de envío;desde Francia;
Disney's The Lion King: Simba's Mighty Adventure PSX Ps1 Pal UK;19,50 EUR;+ 15,90 EUR de envío;desde España;
