Ninja Taro-Rare-Gran Etiqueta-Gameboy Game Chico-a14;34,93 EUR;+ 3,71 EUR de envío;Vendidos  12 sep 2021Artículo vendido;desde Estados Unidos;
Raro auténtico Ninja Taro Nintendo Gameboy;30,67 EUR;+ 2,98 EUR de envío;Vendidos  11 sep 2021Artículo vendido;desde Estados Unidos;
Ninja Taro (Nintendo Game Boy);191,70 EUR;+ 3,58 EUR de envío;Vendidos  9 sep 2021Artículo vendido;desde Estados Unidos;
Ninja Taro (Nintendo Gameboy GB) solo Carro Gran forma Juego Boy;85,19 EUR;Envío gratis;Vendidos  27 jul 2021Artículo vendido;desde Estados Unidos;
Sengoku Ninja-kun (Ninja Taro) (Nintendo Game Boy, 1991) de Japón;13,47 EUR;+ 5,96 EUR de envío;Vendidos  20 jul 2021Artículo vendido;desde Japón;
Ninja Taro (Nintendo Gameboy GB);42,58 EUR;Envío gratis;Vendidos  25 jun 2021Artículo vendido;desde Estados Unidos;
