Street Racer-Nintendo Game Boy;9,37 EUR;+ 16,61 EUR de env칤o estimado;desde Reino Unido;
Nintendo Game Boy Street Racer EUR Tr칟s Bon 칠tat;7,90 EUR;+11,98 EUR de env칤o;desde Francia;
Nintendo Gameboy-Street Racer;8,39 EUR;+ 16,60 EUR de env칤o estimado;desde Reino Unido;
GAME BOY Street Racer EUR FR NINTENDO COLOR ADVANCE CARTOUCHE SEULE;9,00 EUR;+15,00 EUR de env칤o;desde Francia;
Ultimate jugadores 10 Pack PC Juego Warrior Kings Bad Boys anarqu칤a Street Racer;5,84 EUR;+9,36 EUR de env칤o;desde Reino Unido;
Nintendo Gameboy (gb) // Street Racer + embalaje original + instrucciones // dt. PAL cib;199,99 EUR;+5,99 EUR de env칤o;desde Alemania;
Nintendo Gameboy juego-Street Racer-Embalaje original-Top-Pal;139,90 EUR;Env칤o no especificado;desde Alemania;
Nintendo Gameboy juego-Street Racer-solo m칩dulo;8,99 EUR;+1,80 EUR de env칤o;desde Alemania;
Nintendo Game Boy - Street Racer - PAL - FAH;9,99 EUR;+4,60 EUR de env칤o;desde Francia;
Nintendo Juego Gameboy - Street Racer - S칩lo M칩dulo;10,05 EUR;+1,80 EUR de env칤o;desde Alemania;
Gb-Street Racer para Nintendo GameBoy;9,95 EUR;+9,95 EUR de env칤o;desde Alemania;
Street Racer Gameboy;6,50 EUR;Env칤o no especificado;desde Francia;
Street Racer Nintendo Game Boy Gb solo Carro *;7,57 EUR;Env칤o gratis;desde Estados Unidos;
Authentic Street Racer (Nintendo Game Boy) Genuino;6,77 EUR;Env칤o gratis;desde Estados Unidos;
Street Racer (s칩lo Juego Nintendo Game Boy);7,96 EUR;Env칤o gratis;desde Estados Unidos;
Street Racer Nintendo Juego Original Boy * m치s dif칤cil encontrar *;8,49 EUR;Env칤o gratis;desde Estados Unidos;
Street Racer Nintendo Gameboy Juego-Juego Boy;9,36 EUR;Env칤o gratis;desde Estados Unidos;
Tom y Jerry Street Racer & Ol칤mpicos Juegos de Verano Lote Game Boy GB GBC;6,39 EUR;+4,56 EUR de env칤o;desde Estados Unidos;
Street Racer (Nintendo Game Boy);12,78 EUR;Env칤o gratis;desde Estados Unidos;
GB GAME BOY Street Racer Importado De Jap칩n Nuevo;242,82 EUR;+17,04 EUR de env칤o;desde Jap칩n;
Street Racer Nintendo Game Boy GB Jap칩n;57,87 EUR;+16,19 EUR de env칤o;desde Jap칩n;
Street Racer (Nintendo Gameboy GB) solo Carro Gran forma Juego Boy;6,55 EUR;Env칤o gratis;desde Estados Unidos;
Street Racer Nintendo Game Boy Jap칩n;25,47 EUR;+12,78 EUR de env칤o;desde Jap칩n;
Street Racer Original Nintendo Gameboy Aut칠ntico Caja Manual COMPLETO ULTRA RARO;191,69 EUR;+5,75 EUR de env칤o;desde Estados Unidos;
Game Boy Street Racer;213,00 EUR;+17,04 EUR de env칤o;desde M칠xico;
Street Racer sur Game Boy GB14;7,50 EUR;+5,70 EUR de env칤o;desde Francia;
Gameboy Street Racer Solo Cartucho Sin Caja;24,13 EUR;+17,04 EUR de env칤o;desde Jap칩n;
Super Nintendo Entertainment System Street Racer peque침o cartel/p치gina de anuncio vintage Enmarcado PS1 GAME BOY Sega Saturn;50,60 EUR;+14,48 EUR de env칤o;desde Alemania;
Nintendo Jeu Gameboy - Street Racer - Seulement Module;9,97 EUR;+1,80 EUR de env칤o;desde Alemania;
Nintendo Gameboy Juego-Street Racer-S칩lo M칩dulo;10,03 EUR;+1,80 EUR de env칤o;desde Alemania;
Sega Dreamcast 游눑 Metropolis Street Racer 游눑 Juego Con Manual 游눑;23,65 EUR;+23,37 EUR de env칤o;desde Reino Unido;
Street Racer-Raro 1996 PC Kart Racing juego r치pido post-con Manual;17,56 EUR;+6,97 EUR de env칤o;desde Reino Unido;
Sega Dreamcast 游눑 Metropolis Street Racer 游눑 Juego Con Manual 游눑;23,65 EUR;+23,37 EUR de env칤o;desde Reino Unido;
PS 1 游눑 Street Racer 游눑 Playstation Juego Sin Manual 游눑;8,14 EUR;+23,37 EUR de env칤o;desde Reino Unido;
Sega Dreamcast 游눑 Metropolis Street Racer 游눑 Juego Con Manual 游눑;8,14 EUR;+23,37 EUR de env칤o;desde Reino Unido;
Street Racer-Sega Mega Drive Juego (probado-Env칤o R치pido-Pal);8,14 EUR;+ 17,99 EUR de env칤o estimado;desde Reino Unido;
SNES Super Nintendo En Caja Juego: Street Racer;23,14 EUR;+ 16,85 EUR de env칤o estimado;desde Reino Unido;
Street Racer De V칤deo Juego Para Atari 2600 Probado;5,84 EUR;+ 16,55 EUR de env칤o estimado;desde Reino Unido;
Street Racer-PS1 Sony Playstation 1 Juego;7,02 EUR;+ 16,56 EUR de env칤o estimado;desde Reino Unido;
Street Racer Sony Playstation 1 juego PS1;7,02 EUR;+21,08 EUR de env칤o;desde Reino Unido;
Street Racer SNES SUPER NINTENDO En Caja Completo en Caja Buen Estado Ubi Suave juego de carreras;23,41 EUR;+14,06 EUR de env칤o;desde Reino Unido;
Street Racer Sega MegaDrive Juego BOXED PAL Reino Unido Probado;10,53 EUR;+ 20,38 EUR de env칤o estimado;desde Reino Unido;
Street Racer Sega Saturn Juegos De Consola De Video Juego Completo con Manual;23,41 EUR;+ 19,20 EUR de env칤o estimado;desde Reino Unido;
