Warlocked Nintendo Gameboy Color Gbc Raro Juego!;46,78 EUR;+ 17,27 EUR de envío estimado;desde Reino Unido;
Warlocked Warlock-Nintendo Game Boy Color GBC Advance auténtico funciona! Raro;28,29 EUR;Envío gratis;desde Estados Unidos;
Warlocked (Nintendo Game Boy Color, 2000);23,56 EUR;+ 11,44 EUR de envío;desde Canadá;
Warlocked (Nintendo Game Boy Color, 2000) Auténtico Juego sólo GBC;29,79 EUR;+ 3,53 EUR de envío;desde Estados Unidos;
Warlocked-Game Boy Color Gameboy;32,32 EUR;+ 2,51 EUR de envío;desde Estados Unidos;
Warlocked-Juego Original Nintendo GameBoy Color;42,12 EUR;+ 2,51 EUR de envío;desde Estados Unidos;
Warlocked Gameboy Color Manual Game Boy Authentic;12,79 EUR;+ 12,12 EUR de envío;desde Canadá;
Warlocked [Gameboy Color] [Solo Cartucho];34,04 EUR;Envío gratis;desde Estados Unidos;
Warlocked GBA Gameboy Color | 2000 Vintage Juego anuncio impreso arte cartel Rpg Raro;12,72 EUR;Envío gratis;desde Estados Unidos;
Warlocked Gameboy Color 2000 impresión de anuncio Cartel Vintage arte oficial de Promo Rpg Raro;12,76 EUR;Envío gratis;desde Estados Unidos;
