True Lies Nintendo Game Boy juego OVP como nuevo con instrucciones probado;46,99 EUR;+ 7,39 EUR de envío;desde Alemania;
True Lies Nintendo Game Boy Pal Version ;69,00 EUR;Envío no especificado;desde Italia;
Gameboy Classic juego True Lies EUR nuevo sin abrir sin usar;259,90 EUR;+ 36,99 EUR de envío;desde Alemania;
Nintendo Game Boy Game True Lies - USA - Gameboy - Genuino - Gratis P&P ;17,56 EUR;+ 16,76 EUR de envío estimado;desde Reino Unido;
True Lies | Nintendo Game Boy 🕹 Arnold Schwarzenegger;15,00 EUR;+ 4,00 EUR de envío;desde Países Bajos;
NINTENDO GAME BOY-True Lies (2) En Caja;93,64 EUR;Envío internacional gratis;desde Reino Unido;
NINTENDO GAME BOY-True Lies (en Caja);93,64 EUR;Envío internacional gratis;desde Reino Unido;
Notice Nintendo Game Boy True Lies EUR Excellent état;14,90 EUR;+ 11,98 EUR de envío;desde Francia;
True Lies EUR - Nintendo GameBoy - NGB;22,45 EUR;+ 19,95 EUR de envío;desde Países Bajos;
Gb-schwarzenegger: True Lies para Nintendo GameBoy;24,95 EUR;+ 9,95 EUR de envío;desde Alemania;
1994 True Lies Snes Game Boy Game Gear Sega Genesis Poster Vintage/AD Enmarcado;32,78 EUR;+ 15,21 EUR de envío;desde Alemania;
1994 True Lies SNES Game Boy Game Gear Sega Genesis Vintage Poster / Ad Print;20,37 EUR;+ 11,35 EUR de envío;desde Alemania;
True Lies Game Boy Folleto de instrucciones;8,20 EUR;+ 16,58 EUR de envío estimado;desde Reino Unido;
True Lies-Manual/instrucciones-GameBoy Classic;14,99 EUR;Envío no especificado;desde Alemania;
True Lies Nintendo Game Boy 1995 Cartucho sólo Auténtico Arnold Schwarzenegger;15,33 EUR;Envío gratis;desde Estados Unidos;
True Lies (Nintendo Game Boy, 1995);7,67 EUR;+ 3,54 EUR de envío;desde Estados Unidos;
True Lies Nintendo Original Game Boy * auténtico y más difícil encontrar * solo carro;17,03 EUR;Envío gratis;desde Estados Unidos;
True Lies (Nintendo Game Boy, 1995) manual del juego solamente;12,77 EUR;Envío gratis;desde Estados Unidos;
True Lies Nintendo Juego Original Boy Cartucho sólo envío gratuito;17,03 EUR;Envío gratis;desde Estados Unidos;
True Lies-Nintendo Gameboy-auténtica;15,32 EUR;Envío gratis;desde Estados Unidos;
True Lies (Nintendo Game Boy, 1995) (en muy buena condición;21,26 EUR;Envío gratis;desde Estados Unidos;
True Lies (Nintendo Game Boy, 1995) Auténtico Probado;19,59 EUR;+ 4,26 EUR de envío;desde Estados Unidos;
True Lies ORIGINAL NINTENDO GAMEBOY Juego Probado Funcionando & Auténtico!;23,00 EUR;Envío gratis;desde Estados Unidos;
True Lies (Nintendo Gameboy GB) Excelente Con Manual!;51,11 EUR;Envío gratis;desde Estados Unidos;
True Lies ORIGINAL NINTENDO GAMEBOY Probado & Auténtico! con Manual Buen;24,67 EUR;Envío gratis;desde Estados Unidos;
True Lies (1995) para NINTENDO GAMEBOY -- cartucho sólo;12,94 EUR;Envío gratis;desde Estados Unidos;
True Lies (Nintendo Gameboy) Game Only;20,03 EUR;+ 5,34 EUR de envío;desde Canadá;
True Lies Nintendo Juego Original Boy * auténtico y más difícil encontrar *;16,18 EUR;Envío gratis;desde Estados Unidos;
True Lies ORIGINAL NINTENDO GAMEBOY Juego Probado Funcionando & Auténtico!;19,55 EUR;+ 3,49 EUR de envío;desde Estados Unidos;
True Lies (Gameboy) Juego Completo * raros *;852,01 EUR;+ 12,78 EUR de envío;desde Estados Unidos;
True Lies Nintendo Game Boy Solo Manual ~ Folleto de instrucciones;11,93 EUR;Envío gratis;desde Estados Unidos;
True Lies Snes Sega Genesis Gameboy | 1995 Vintage Juego anuncio impreso arte cartel;12,74 EUR;Envío gratis;desde Estados Unidos;
True Lies (Sega Game Gear) - RARE-Probado-Libre P&p - ACCLAIM-Versión UK;58,55 EUR;+ 17,50 EUR de envío estimado;desde Reino Unido;
True Lies-Sega Mega Drive Juego (probado-Envío Rápido-Pal);187,34 EUR;+ 37,71 EUR de envío estimado;desde Reino Unido;
True Lies Sega Game Gear;35,14 EUR;+ 17,08 EUR de envío estimado;desde Reino Unido;
