Nintendo Game Boy True Lies EUR Excellent état;14,90 EUR;+ 11,98 EUR de envío;Vendidos  10 sep 2021Artículo vendido;desde Francia;
EUR Game boy: True Lies Manual Only NO GAME EN FR NL ES Nintendo Gameboy;10,49 EUR;Envío no especificado;Vendidos  27 ago 2021Artículo vendido;desde Países Bajos;
Gameboy * True Lies * EUR * cib * Nintendo * Game Boy!!!;77,50 EUR;+ 19,00 EUR de envío;Vendidos  22 ago 2021Artículo vendido;desde Alemania;
GB Gameboy True Lies Nueva fábrica sellada el juego Boy Nintendo Raro Vga Apnea;682,29 EUR;Envío gratis;Vendidos  9 sep 2021Artículo vendido;desde Estados Unidos;
True Lies-Nintendo Gameboy-Video Juego;3,40 EUR;+ 3,50 EUR de envío;Vendidos  1 sep 2021Artículo vendido;desde Estados Unidos;
True Lies (1995) para NINTENDO GAMEBOY -- Cartucho & caja de plástico;16,16 EUR;Envío gratis;Vendidos  2 ago 2021Artículo vendido;desde Estados Unidos;
True Lies-Nintendo Gameboy-Video Juego;10,23 EUR;Envío gratis;Vendidos  8 jul 2021Artículo vendido;desde Estados Unidos;
True Lies pal OVP módulo instrucciones video game Sega Mega Drive;60,00 EUR;+ 20,00 EUR de envío;Vendidos  2 sep 2021Artículo vendido;desde Alemania;
- True Lies Snes Juego De Reemplazo Estuche caja + portada funcionan sólo;8,15 EUR;+ 2,32 EUR de envío;Vendidos  31 jul 2021Artículo vendido;desde Reino Unido;
