Toki Tori. NINTEDO GAMEBOY COLOR Juego. UK PAL. en Caja Completo. precioso.;188,98 EUR;+ 33,80 EUR de envío estimado;desde Reino Unido;
Toki Tori Nintendo Gameboy Color GBC limpiado probado Auténtico Juego Boy;21,42 EUR;+ 3,68 EUR de envío;desde Estados Unidos;
Toki Tori (Game Boy Color, GBC) Auténtico-probado! buenas Batería!;15,41 EUR;+ 3,81 EUR de envío;desde Estados Unidos;
Nintendo Game Boy Color: Toki Tori;17,13 EUR;Envío gratis;desde Estados Unidos;
Toki Tori-Juego Boy Color;16,25 EUR;+ 3,38 EUR de envío;desde Estados Unidos;
Auténtico! Toki Tori, juego Boy Color Con Caja E Insertos! juego es jugable!;128,50 EUR;+ 4,28 EUR de envío;desde Estados Unidos;
Toki Tori-Nintendo Game Boy Color GBC;24,39 EUR;Envío gratis;desde Estados Unidos;
Toki Tori (Game Boy Color) Auténtico Original/carro/guardar trabajo Original;21,42 EUR;+ 3,43 EUR de envío;desde Estados Unidos;
Toki Tori (Nintendo Game Boy Color, 2001) Raro GBC, H-costura Nuevo Sellado De Fábrica!;342,65 EUR;Envío gratis;desde Estados Unidos;
Toki Tori (Game Boy Color, Game Boy Color 2001) Completa! - AUTHENTIC! - ex!;154,19 EUR;Envío gratis;desde Estados Unidos;
Toki Tori (Nintendo Game Boy Color, 2001) Completo en Caja Completo En Caja!!! auténtico!!!;162,76 EUR;+ 4,45 EUR de envío;desde Estados Unidos;
Toki Tori (Nintendo Game Boy Color, 2001) Completo en Caja Completo en Caja RARE!!!;127,64 EUR;+ 3,85 EUR de envío;desde Estados Unidos;
Vintage 2001 Nintendo Game Boy Color Toki Tori funciona! Raro Edición Limitada;23,13 EUR;desde Estados Unidos;
Toki Tori (Nintendo Game Boy Color, 2001). Cart Only. Torn label.;16,86 EUR;+ 3,37 EUR de envío;desde Canadá;
Toki Tori (Nintendo Game Boy Color, 2001) Auténtico CARTUCHO-PROBADO Y FUNCIONA;34,26 EUR;+ 3,43 EUR de envío;desde Estados Unidos;
Toki Tori Nintendo Gameboy Color GBC limpiado probado Auténtico Juego Boy;34,26 EUR;+ 5,10 EUR de envío;desde Estados Unidos;
Toki Tori Nintendo Gameboy Color GBC limpiado probado Auténtico Juego Boy;28,47 EUR;+ 5,10 EUR de envío;desde Estados Unidos;
Toki Tori Nintendo Gameboy Color Solo Manual ~ Video Juego Folleto de instrucciones ~;22,27 EUR;Envío gratis;desde Estados Unidos;
Lote de 6 Nintendo Gameboy Color GBC Juegos. Harry Toki Tori coches descapotables monopolio;32,55 EUR;Envío gratis;desde Estados Unidos;
