Looney Tunes Para El Nintendo Game Boy cartucho sólo;7,02 EUR;+ 16,56 EUR de envío estimado;desde Reino Unido;
Game Boy-Looney Tunes-DMG-LG-noe OVP & instrucciones Nintendo Gameboy cib Top;59,95 EUR;Envío no especificado;desde Alemania;
Looney Tunes de nuevo en Acción Nintendo Game Boy Advance GBA Juego Carro Genuino;7,03 EUR;+ 16,56 EUR de envío estimado;desde Reino Unido;
Nintendo Game Boy, Looney Tunes-Embalaje original-Top-alemán;59,90 EUR;Envío no especificado;desde Alemania;
Looney Tunes Game Boy USA-1 ;35,00 EUR;Envío internacional gratis;desde Francia;
Nintendo Gameboy-Lucas-Looney Tunes-Embalaje original-pal-Top;49,90 EUR;Envío no especificado;desde Alemania;
Gameboy Advance-Bob Esponja película Looney Tunes Increibles Tweety Magic Gemas;19,85 EUR;+ 16,80 EUR de envío estimado;desde Reino Unido;
Jeu Nintendo Game Boy Color - Looney Tunes - FRA - Loose;4,90 EUR;+ 6,70 EUR de envío;desde Francia;
Looney Tunes Gameboy UKV RARO CIB #0015;40,94 EUR;+ 21,28 EUR de envío estimado;desde Reino Unido;
Nintendo Gameboy juego-Looney Tunes-Embalaje original-pal-Top -;39,90 EUR;Envío no especificado;desde Alemania;
Gameboy Advance-Rey León Looney Tunes Disney Princesa Ace Lightning Atlantis;23,37 EUR;+ 16,87 EUR de envío estimado;desde Reino Unido;
Nintendo Console Game Boy Color ITA   Looney Tunes Collector Starring Bugs Bunny;29,00 EUR;+ 19,00 EUR de envío;desde Italia;
Nintendo Game Boy Advance-Looney Tunes Double Pack-nuevo & Sealed;33,90 EUR;Envío no especificado;desde Alemania;
Looney Tunes Para El Nintendo Game Boy cartucho sólo;11,70 EUR;+ 19,82 EUR de envío estimado;desde Reino Unido;
Gameboy Advance-Bob Esponja Looney Tunes Disney Princesa Bratz Jimmy Neutron;19,85 EUR;+ 16,80 EUR de envío estimado;desde Reino Unido;
Looney Tunes Juego De Carreras Boy Color En Caja Completa Probada Funcionando GBC Gameboy;58,55 EUR;+ 17,50 EUR de envío estimado;desde Reino Unido;
Nintendo Gameboy Color En Caja-Looney Tunes coleccionista Marciano venganza;32,74 EUR;+ 17,03 EUR de envío estimado;desde Reino Unido;
Jeu Game Boy Color en loose Anglais  Looney Tunes  sans etiquette  Envoi suivi;4,99 EUR;+ 8,00 EUR de envío;desde Francia;
Nintendo Gameboy-Looney Tunes-Embalaje original-Top-pal-Ocean;79,90 EUR;Envío no especificado;desde Alemania;
Nintendo Game Boy Classic juego Looney Tunes con embalaje original y guía fah;149,90 EUR;+ 36,99 EUR de envío;desde Alemania;
Nintendo Game Boy Looney Tunes FAH Très Bon état #1;4,90 EUR;+ 11,98 EUR de envío;desde Francia;
Looney Tunes: de nuevo en acción-solo Carro-Nintendo GBA Game Boy Advance;5,49 EUR;+ 16,54 EUR de envío estimado;desde Reino Unido;
Nintendo Game Boy Color Looney Tunes Racing FAH Excellent état;6,90 EUR;+ 11,98 EUR de envío;desde Francia;
VGA Gameboy Looney Tunes 90+;2.000,00 EUR;+ 11,39 EUR de envío;desde Alemania;
Nintendo Game Boy Advance Looney Tunes Double Pack UKV Très Bon état #1;6,90 EUR;+ 11,98 EUR de envío;desde Francia;
Looney Tunes Juego De Carreras Boy Color En Caja Completa Probada Funcionando GBC Gameboy;49,19 EUR;+ 19,67 EUR de envío estimado;desde Reino Unido;
Nintendo Game Boy Advance GBA - Looney Tunes Back In Action - PAL - EUR;9,99 EUR;+ 4,80 EUR de envío;desde Francia;
Looney Tunes Racing Nintendo Game Boy Color solo carro buena;17,51 EUR;+ 16,76 EUR de envío estimado;desde Reino Unido;
Nintendo Gameboy Juego-Looney Tunes;21,02 EUR;+ 16,82 EUR de envío estimado;desde Reino Unido;
Nintendo Gameboy Juego-Los Clasicos Looney Tunes Pato LUCAS NEGOCIOS PATOSOS;15,17 EUR;+ 16,71 EUR de envío estimado;desde Reino Unido;
Nintendo Gameboy Color En Caja-Clásico Looney Tunes El Pato Lucas aves Play;40,94 EUR;+ 17,18 EUR de envío estimado;desde Reino Unido;
Looney Tunes Collector: la venganza de marte gameboy color OVP cib Boxed #2;19,90 EUR;+ 4,50 EUR de envío;desde Alemania;
Looney Tunes 👍 en Acción Nintendo Game Boy Advance GBA Juego Carro Genuino;5,39 EUR;+ 19,16 EUR de envío estimado;desde Reino Unido;
Nintendo Gameboy Juego-Looney Tunes;9,31 EUR;+ 16,61 EUR de envío estimado;desde Reino Unido;
Nintendo Gameboy Juego-Looney Tunes;8,14 EUR;+ 16,58 EUR de envío estimado;desde Reino Unido;
Nintendo Gameboy Advance En Caja-Looney Tunes de nuevo en acción;29,22 EUR;+ 16,97 EUR de envío estimado;desde Reino Unido;
Nintendo Gameboy Color En Caja-Clásico Looney Tunes El Pato Lucas aves Play;46,79 EUR;+ 17,29 EUR de envío estimado;desde Reino Unido;
Nintendo Gameboy Color-Looney Tunes Racing;11,65 EUR;+ 16,66 EUR de envío estimado;desde Reino Unido;
Tazmanian Devil Nintendo Gameboy Juego-isla Chase Looney Tunes 2;16,34 EUR;+ 16,74 EUR de envío estimado;desde Reino Unido;
Tazmanian Devil Nintendo Gameboy Juego-isla Chase Looney Tunes 2;16,34 EUR;+ 16,74 EUR de envío estimado;desde Reino Unido;
1992 Looney Tunes Nintendo Game Boy Sunsoft EUR;4,50 EUR;+ 23,50 EUR de envío;desde Bélgica;
Looney Tunes Gameboy Juego en Caja;53,87 EUR;+ 17,42 EUR de envío estimado;desde Reino Unido;
Nintendo Gameboy Juegos-Instinto asesino, Looney Tunes & Kirby's Pinball Land;15,77 EUR;+ 16,73 EUR de envío estimado;desde Reino Unido;
Looney Tunes (Nintendo Game Boy Color GBC 1999) Solo cartucho;6,07 EUR;+ 9,90 EUR de envío;desde España;
Nintendo Gameboy Color-Crazy Castle 4 & Looney Tunes Marciano alerta & Revenge;19,85 EUR;+ 16,80 EUR de envío estimado;desde Reino Unido;
Looney Tunes: de nuevo en acción Cartucho sólo Nintendo GBA Game Boy Advance;5,84 EUR;+ 16,55 EUR de envío estimado;desde Reino Unido;
Looney Tunes Back in Action GBA Game Boy Advance PAL;4,95 EUR;+ 19,95 EUR de envío;desde España;
