Nintendo Game Boy-Raging Fighter (en Caja);157,34 EUR;Envío internacional gratis;desde Reino Unido;
Raging Fighter Nintendo Game Boy Vga oro 85+ Casi Nuevo + Sellado de fábrica Rara;2.345,42 EUR;+ 17,06 EUR de envío;desde Rusia;
Raging Fighter Nintendo Game Boy Vga 80 H-costura Casi Nuevo Sellado De Fábrica Nueva Raro;767,59 EUR;+ 17,06 EUR de envío;desde Rusia;
Nuevo anuncioRaging Fighter-juego de módulo-Nintendo-Game Boy-gb;9,99 EUR;+ 7,99 EUR de envío;desde Alemania;
Nintendo Gameboy Raging Fighter en Caja con Manual de EE. UU. Gratis Reino Unido franqueo;69,94 EUR;+ 22,34 EUR de envío estimado;desde Reino Unido;
Raging Fighter-Nintendo Gameboy;9,32 EUR;+ 18,67 EUR de envío estimado;desde Reino Unido;
Raging Fighter-GAMEBOY Juego-UKV;13,98 EUR;+ 16,61 EUR de envío estimado;desde Reino Unido;
Nintendo Gameboy Juego-Raging Fighter;13,93 EUR;+ 16,61 EUR de envío estimado;desde Reino Unido;
Raging Fighter ** ** Oficial Nintendo Gameboy Cartucho versión UK;9,62 EUR;+ 16,54 EUR de envío estimado;desde Reino Unido;
Gb-Raging Fighter para Nintendo GameBoy;12,95 EUR;+ 6,50 EUR de envío;desde Alemania;
Gameboy juego-Raging Fighter (PAL) (módulo) 10822944;7,99 EUR;+ 67,99 EUR de envío;desde Alemania;
Gameboy juego-Raging Fighter (PAL) (módulo);9,89 EUR;+ 67,99 EUR de envío;desde Alemania;
Gameboy-Raging Fighter (solo módulo);6,47 EUR;+ 3,90 EUR de envío;desde Alemania;
Raging Fighter (Nintendo Game Boy, 1993);68,23 EUR;+ 3,58 EUR de envío;desde Estados Unidos;
Raging Fighter Nintendo Game Boy KONAMI Cartucho en Caja Completo Con Claro Protector;85,27 EUR;Envío gratis;desde Estados Unidos;
Raging Fighter (Nintendo Game Boy, 1993) Juego, Manual Y caso claro.;8,52 EUR;+ 3,67 EUR de envío;desde Estados Unidos;
Nintendo Game Boy ~ Raging Fighter 1993 ~ ~ sólo de juego probadas limpiado (envío gratuito);8,49 EUR;Envío gratis;desde Estados Unidos;
Raging Fighter (Nintendo Game Boy, 1993) Gb Carro Y Estuche;8,52 EUR;Envío gratis;desde Estados Unidos;
Raging Fighter-NINTENDO GAME BOY;12,34 EUR;+ 3,37 EUR de envío;desde Estados Unidos;
Nintendo Game Boy Konami Raging Fighter liberación de Estados Unidos;8,52 EUR;desde Estados Unidos;
Raging Fighter Para Nintendo Video Game Boy Cartucho! envío rápido! probado;4,26 EUR;+ 3,80 EUR de envío;desde Estados Unidos;
Raging Fighter Para Nintendo Game Boy Probado;4,26 EUR;+ 3,80 EUR de envío;desde Estados Unidos;
Raging Fighter (Nintendo Game Boy, 1993);6,81 EUR;+ 3,80 EUR de envío;desde Estados Unidos;
Raging Fighter Nintendo Game Boy Gb Carro Probado Y Funcionando!;7,68 EUR;Envío gratis;desde Estados Unidos;
Lote de 4 Juegos Gameboy; Sergy, Raging Fighter, Tony Hawk, WWF-todos probado y trabajo;17,05 EUR;+ 4,22 EUR de envío;desde Estados Unidos;
Game Boy Raging Fighter;1.279,32 EUR;+ 17,06 EUR de envío;desde México;
Raging Fighter (gdl) Pre-owned Gameboy;9,34 EUR;Envío gratis;desde Estados Unidos;
Raging Fighter (Nintendo Game Boy, 1993) Original, SP o Advance Cartucho;8,49 EUR;+ 2,86 EUR de envío;desde Estados Unidos;
Raging Fighter Game Boy 1993 ANUNCIO IMPRESO DE COLECCIÓN/cartel oficial Auténtico Konami;12,78 EUR;Envío gratis;desde Estados Unidos;
De Colección Nintendo Super Power Club desafío Trading Card #96 Raging Fighter Game Boy;1,70 EUR;+ 0,61 EUR de envío;desde Estados Unidos;
1993 Vintage video juego Print AD-Raging Fighter-Game Boy-Konami;6,82 EUR;+ 1,70 EUR de envío;desde Estados Unidos;
Raging Fighter Juego De Nintendo Game Boy Y Manual;17,05 EUR;Envío gratis;desde Estados Unidos;
Raging Fighter Para Nintendo Video Game Boy Cartucho! envío rápido! probado;8,52 EUR;Envío gratis;desde Estados Unidos;
Gameboy-Raging Fighter (sólo módulo);8,11 EUR;+ 3,93 EUR de envío;desde Alemania;
