Contra Go Konami Nintendo Gameboy D'Origine TESTE  1991;15,00 EUR;Envío no especificado;Vendidos  23 ago 2021Artículo vendido;desde Francia;
Contra GameBoy Japón vendedor del Reino Unido;23,40 EUR;+ 16,86 EUR de envío estimado;Vendidos  5 ago 2021Artículo vendido;desde Reino Unido;
Nintendo Game Boy Advance Contra Advance: las Guerras De Liberación Europeo ex alienígena NUEVO;114,75 EUR;+ 22,95 EUR de envío;Vendidos  2 ago 2021Artículo vendido;desde Grecia;
SHINCHAN Contra los muñecos de Shock gahn. Game Boy Advance - Nuevo Precintado. ;22,00 EUR;Envío no especificado;Vendidos  26 jul 2021Artículo vendido;desde España;
SHINCHAN Contra los muñecos de Shock gahn. Game Boy Advance - Nuevo Precintado. ;22,00 EUR;Envío no especificado;Vendidos  14 jul 2021Artículo vendido;desde España;
Operación C/Contra-Gameboy Carro de cartucho de juego solamente-Probado;30,42 EUR;+ 19,79 EUR de envío estimado;Vendidos  1 jul 2021Artículo vendido;desde Reino Unido;
Contra Advance: las guerras alienígena ex (GameBoy Advance GBA, 2002) Completo en Caja Cartucho;212,51 EUR;+ 8,49 EUR de envío;Vendidos  15 sep 2021Artículo vendido;desde Estados Unidos;
Contra Advance: The Alien Wars EX (Nintendo GameBoy Advance);33,48 EUR;+ 13,39 EUR de envío;Vendidos  13 sep 2021Artículo vendido;desde Canadá;
Contra Advance: las guerras alienígena ex (Nintendo Game Boy Advance, GBA) Auténtico;38,25 EUR;+ 3,78 EUR de envío;Vendidos  8 sep 2021Artículo vendido;desde Estados Unidos;
Contra Advance: The Alien Wars EX (Nintendo Game Boy Advance 2002)  **Tested;44,18 EUR;+ 10,04 EUR de envío;Vendidos  4 sep 2021Artículo vendido;desde Canadá;
Contra Advance: las guerras alienígena ex (Nintendo Game Boy Advance probado, 2002);150,47 EUR;+ 7,18 EUR de envío;Vendidos  4 sep 2021Artículo vendido;desde Estados Unidos;
Contra Alien Wars EX Nintendo Game Boy Gameboy Advance Auténtico Original!;38,23 EUR;Envío gratis;Vendidos  3 sep 2021Artículo vendido;desde Estados Unidos;
Contra el Alien Wars Gameboy Auténtico Raro Probado;33,99 EUR;Envío gratis;Vendidos  1 sep 2021Artículo vendido;desde Estados Unidos;
Contra Advance: las guerras alienígena ex (Nintendo Game Boy Advance, GBA) Auténtico;29,75 EUR;+ 3,53 EUR de envío;Vendidos  1 sep 2021Artículo vendido;desde Estados Unidos;
Contra el Alien Wars Gameboy Auténtico Raro/Probado;38,25 EUR;+ 3,78 EUR de envío;Vendidos  30 ago 2021Artículo vendido;desde Estados Unidos;
Contra Advance: las guerras alienígena ex (Nintendo Game Boy Advance, GBA) Auténtico;28,90 EUR;Envío gratis;Vendidos  27 ago 2021Artículo vendido;desde Estados Unidos;
Contra: la operación Alien Wars + C (Nintendo Game Boy) - auténtico-Lote De Juegos;100,30 EUR;Envío gratis;Vendidos  27 ago 2021Artículo vendido;desde Estados Unidos;
Contra Advance The Alien Wars Gameboy Advance GBA Authentic;28,79 EUR;+ 12,72 EUR de envío;Vendidos  26 ago 2021Artículo vendido;desde Canadá;
Contra Advance: las guerras alienígena ex-GBA Game Boy Advance-Nuevo Caja Abierta;110,50 EUR;+ 4,21 EUR de envío;Vendidos  23 ago 2021Artículo vendido;desde Estados Unidos;
Contra The Alien Wars Gameboy Box And Manual Only Authentic;117,17 EUR;+ 12,72 EUR de envío;Vendidos  21 ago 2021Artículo vendido;desde Canadá;
Contra Advance: las guerras alienígena ex-GBA Game Boy Advance Caja y manual solamente!;51,00 EUR;Envío gratis;Vendidos  13 ago 2021Artículo vendido;desde Estados Unidos;
Contra Advance: las guerras alienígena ex (Game Boy Advance GBA) * Auténtico solo Carro *;39,10 EUR;Envío gratis;Vendidos  10 ago 2021Artículo vendido;desde Estados Unidos;
Lote De Juego De Snes-Dirt Trax Fx, Contra Iii, Super Game Boy, Stunt Racer;25,50 EUR;+ 5,10 EUR de envío;Vendidos  10 ago 2021Artículo vendido;desde Estados Unidos;
Nintendo Game Boy Advance GBA CARTUCHO sólo Contra Advance: las guerras alienígena ex;21,24 EUR;Envío gratis;Vendidos  9 ago 2021Artículo vendido;desde Estados Unidos;
Contra Alien Wars Nintendo Gameboy Cartucho De Juego Caja y Manual Envío Gratuito;59,51 EUR;+ 1,16 EUR de envío;Vendidos  5 ago 2021Artículo vendido;desde Estados Unidos;
Contra Alien Wars (Nintendo Gameboy Advance GBA) ;30,12 EUR;+ 13,81 EUR de envío;Vendidos  5 ago 2021Artículo vendido;desde Canadá;
Contra el Alien Wars Gameboy solo Manual, 100% Original, Muy Buena;31,05 EUR;Envío gratis;Vendidos  5 ago 2021Artículo vendido;desde Estados Unidos;
Contra el Alien Wars Gameboy auténtico raro;33,99 EUR;Envío gratis;Vendidos  3 ago 2021Artículo vendido;desde Estados Unidos;
Contra: el Alien Wars (Nintendo Game Boy, 1989) Clásico divertido juego auténtico!;50,96 EUR;Envío gratis;Vendidos  2 ago 2021Artículo vendido;desde Estados Unidos;
Contra: el Alien Wars (Nintendo Game Boy, 1989) (Completo);194,67 EUR;+ 3,39 EUR de envío;Vendidos  1 ago 2021Artículo vendido;desde Estados Unidos;
Contra Advance: las guerras alienígena ex (Nintendo Game Boy Advance, 2002) REPRO;17,00 EUR;+ 3,78 EUR de envío;Vendidos  31 jul 2021Artículo vendido;desde Estados Unidos;
Contra Shattered Soldier - game console PLAYSTATION PS2 NTSC JAPAN JAP JP SHMUP;29,97 EUR;+ 18,00 EUR de envío;Vendidos  7 sep 2021Artículo vendido;desde Bélgica;
