Zool-UKV Nintendo Game Boy En Caja Con Manual-Gameboy;58,55 EUR;+ 17,50 EUR de envío estimado;Vendidos  6 sep 2021Artículo vendido;desde Reino Unido;
Zool Gameboy Original Nintendo Cartucho PAL;23,41 EUR;+ 16,87 EUR de envío estimado;Vendidos  22 jul 2021Artículo vendido;desde Reino Unido;
Nintendo Game Boy-Zool Ninja of the "Nth" dimensión-Embalaje original-pal-Top;134,90 EUR;Envío no especificado;Vendidos  5 jul 2021Artículo vendido;desde Alemania;
Zool-ninja of the "Nth" dimensión guía manual Nintendo GameBoy;8,95 EUR;+ 1,70 EUR de envío;Vendidos  22 jun 2021Artículo vendido;desde Alemania;
Zool: Ninja de enésima dimensión (Nintendo Game Boy, 1993) Cartucho Con Estuche;42,59 EUR;+ 4,35 EUR de envío;Vendidos  22 jul 2021Artículo vendido;desde Estados Unidos;
Zool Sega Megadrive Juego en Caja (No Manual) EA Ninja Juego De Plataformas Retro;7,03 EUR;+ 20,08 EUR de envío estimado;Vendidos  9 ago 2021Artículo vendido;desde Reino Unido;
