Pokemon Gold Reproduction Replacement Box for Game Boy Nintendo;5,47 EUR;+ 9,19 EUR de envío;desde Polonia;
Juego Pokemon Gold, Boy Color En Caja-casi Nuevo * Original Y Probado *;257,51 EUR;+ 24,00 EUR de envío;desde Reino Unido;
Pokemon Gold Nintendo Game Boy Gameboy juego oficial versión UK/euro GB;52,66 EUR;+ 4,45 EUR de envío;desde Reino Unido;
Pokemon Gold Oro - Game Boy Gameboy No Sealed Gb With Box - Ho Oh Silver US;249,00 EUR;+ 20,00 EUR de envío;desde Italia;
Pokemon Gold Version (Game Boy Color, 2000);35,00 EUR;+ 10,00 EUR de envío;desde Francia;
Pokemon Gold Version Game Boy Color Nintendo usa RIPRODUZIONE DELL'EPOCA ;29,90 EUR;+ 25,00 EUR de envío;desde Italia;
Pokemon Gold EUR Reemplazo Etiqueta/Adhesivo Para Game Boy;3,80 EUR;+ 4,68 EUR de envío;desde Reino Unido;
Pokemon Gold & Silver Versions Authentic (Game Boy Color, 2000) BOX ONLY;335,00 EUR;Envío no especificado;desde Bélgica;
NINTENDO Gameboy Advance Pokemon Gold UKG/VGA clasificados 80+ casi como nuevo 2001 Sellado;4.682,22 EUR;+ 18,72 EUR de envío;desde Reino Unido;
Pokemon Gold Version Nintendo Gameboy Color Game Boy Japan;9,00 EUR;+ 2,80 EUR de envío;desde Francia;
Genuine Pokemon Gold-Batería Nueva | Game Boy Color | solo carro | EUR;45,64 EUR;+ 17,25 EUR de envío estimado;desde Reino Unido;
Nuevo anuncioPokemon Gold-Gameboy Color-Ntsc-Completo En Caja - 100% Auténtico-Nr Menta-leer;204,85 EUR;+ 10,48 EUR de envío;desde Reino Unido;
Pokemon Gold Reproduction Replacement Box for Game Boy Nintendo + Inner Tray;8,75 EUR;+ 9,19 EUR de envío;desde Polonia;
Nintendo Game Boy Color Pokemon Gold Japan New Save Battery installed;14,95 EUR;+ 2,50 EUR de envío;desde Francia;
Pokemon Gold Version Nintendo Gameboy Color Game Boy Japan;8,00 EUR;+ 2,80 EUR de envío;desde Francia;
Pokemon Gold Trainer's Guide | Gameboy Color 🕹| GBC | Orginal;12,00 EUR;+ 3,50 EUR de envío;desde Países Bajos;
Genuine Pokemon Gold-Batería Nueva | Game Boy Color | solo carro | EUR;38,62 EUR;+ 17,14 EUR de envío estimado;desde Reino Unido;
