The Flash (Nintendo Gameboy Classic juego, Game Boy) módulo con funda;11,79 EUR;Envío no especificado;Vendidos  27 ago 2021Artículo vendido;desde Alemania;
Justice League Heroes The Flash para Gameboy Advance/GBA;4,90 EUR;Envío no especificado;Vendidos  5 ago 2021Artículo vendido;desde Alemania;
The Flash Game Boy FAH ;10,00 EUR;Envío internacional gratis;Vendidos  19 jul 2021Artículo vendido;desde Francia;
Nintendo Game Boy Classic juego The Flash con embalaje original y guía Noe;159,90 EUR;+ 36,99 EUR de envío;Vendidos  11 jul 2021Artículo vendido;desde Alemania;
★ Game Boy Advance Justice League Heroes The Flash ★ PAL 2;12,99 EUR;Envío no especificado;Vendidos  23 jun 2021Artículo vendido;desde España;
Justice League Heroes The Flash (Gameboy Advance GBA) [Complete in Box CIB];32,70 EUR;+ 6,65 EUR de envío;Vendidos  29 jul 2021Artículo vendido;desde Canadá;
