Rhino Rumble-Juego Boy Color;59,73 EUR;+ 3,37 EUR de envío;desde Estados Unidos;
Rhino Rumble (Nintendo Game Boy Color Gameboy) Nuevo Sellado De Fábrica;341,48 EUR;Envío gratis;desde Estados Unidos;
Rhino Rumble Gameboy Color Raro Caja/bandeja & Inserto sólo (sin juego o manual) K31;17,03 EUR;+ 5,04 EUR de envío;desde Estados Unidos;
Rhino Rumble Vga 90 Oro! Raro Nintendo GameBoy Color como nuevo H-costura GBC!;1.707,39 EUR;desde Estados Unidos;
Rhino Rumble (Nintendo Game Boy Color Gameboy) Nuevo Sellado De Fábrica;256,11 EUR;Envío gratis;desde Estados Unidos;
Game Boy Color Rhino Rumble;426,86 EUR;+ 17,07 EUR de envío;desde México;
