NFL Football | Nintendo Game Boy Usa | Sin Caja;7,00 EUR;Envío no especificado;Vendidos  29 ago 2021Artículo vendido;desde Reino Unido;
Original Nintendo Game Boy DMG-01 - probado y trabajo con NFL Football & Mia Hamm;55,25 EUR;+ 6,76 EUR de envío;Vendidos  1 sep 2021Artículo vendido;desde Estados Unidos;
Lote de 6 Juegos Originales GAMEBOY. NFL Football, Tetris, fortaleza de miedo y más;33,96 EUR;+ 5,31 EUR de envío;Vendidos  27 ago 2021Artículo vendido;desde Estados Unidos;
NFL Football-Nintendo Juego Original Boy-limpiado & Probado;4,46 EUR;Envío gratis;Vendidos  26 ago 2021Artículo vendido;desde Estados Unidos;
NFL Football, Konami (Nintendo Game Boy, 1990) cartucho sólo!;5,52 EUR;Envío gratis;Vendidos  21 ago 2021Artículo vendido;desde Estados Unidos;
NFL Football Quarterback Club 96 Paquete + para GameBoy auténtico probado juego solamente;4,24 EUR;+ 3,95 EUR de envío;Vendidos  18 ago 2021Artículo vendido;desde Estados Unidos;
NFL Football auténticas (Nintendo Game Boy, 1990);1,06 EUR;+ 2,71 EUR de envío;Vendidos  9 ago 2021Artículo vendido;desde Estados Unidos;
Konami NFL Football cartucho Nintendo Gameboy-probado, Funciona-AUTHENTIC!;5,94 EUR;Envío gratis;Vendidos  6 ago 2021Artículo vendido;desde Estados Unidos;
NINTENDO GAMEBOY Konami NFL Football cartucho de juego (1990) Packers Vaqueros Rams;3,02 EUR;+ 2,54 EUR de envío;Vendidos  23 jul 2021Artículo vendido;desde Estados Unidos;
Konami NFL Football cartucho Nintendo Gameboy-probado, Funciona-AUTHENTIC!;5,09 EUR;Envío gratis;Vendidos  22 jul 2021Artículo vendido;desde Estados Unidos;
NFL Football liga profesional fan abrebotellas con llavero kyrbonfatl nuevo;7,99 EUR;+ 30,00 EUR de envío;Vendidos  6 sep 2021Artículo vendido;desde Alemania;
Día de juego NFL Football licencia oficial equipo insignia MARCO SHADES SUNGLASSES;4,89 EUR;+ 2,76 EUR de envío;Vendidos  28 jun 2021Artículo vendido;desde Estados Unidos;
