GAME BOY COLOR NINTENDO Dance Dance Revolution GB JAPÓN Completo;39,00 EUR;+ 19,90 EUR de envío;desde España;
Dance Dance Revolution GB Disney mezcla Game Boy Color Nintendo;74,27 EUR;Envío internacional gratis;desde Japón;
Dance Dance Revolution GB NINTENDO GAME BOY COLOR video juego de Konami japonés;59,35 EUR;+ 16,90 EUR de envío;desde Japón;
Konami Game Boy Color Dance Dance Revolution GB Usado F/S Japón;95,78 EUR;Envío internacional gratis;desde Japón;
Ohasuta Dance Dance Revolution GB GAMEBOY Color versión japonesa;48,65 EUR;Envío internacional gratis;desde Japón;
Nintendo Game Boy Color Dance Dance Revolution GB Konami 2000 Japan NTSC-J;91,35 EUR;Envío internacional gratis;desde Japón;
Dance Dance Revolution GB Disney mezcla/juego Boy Color Nintendo;69,58 EUR;Envío internacional gratis;desde Japón;
Nintendo GAMEBOY Color Dance Dance Revolution GB3 Japón ver Con Caja Y Manual;86,25 EUR;+ 17,07 EUR de envío;desde Japón;
Nintendo GameBoy Color-Dance Dance Revolution GB3 Japón "Yubi Kon" sólo;54,63 EUR;Envío internacional gratis;desde Japón;
Nintendo GameBoy Color-Dance Dance Revolution GB3 Japón En Caja Como Nuevo Jp;128,95 EUR;+ 3,41 EUR de envío;desde Japón;
GAME BOY COLOR Dance Dance Revolution GB KONAMI Nintendo Entertainment Juego;75,72 EUR;Envío internacional gratis;desde Japón;
Konami Dance Dance Revolution GB Disney mezcla GameBoy Color Nintendo de Japón;64,02 EUR;Envío internacional gratis;desde Japón;
Dance Dance Revolution GB Mix Game Boy Color Cartel De Disney;66,22 EUR;Envío internacional gratis;desde Japón;
GameBoy Color - Dance Dance Revolution GB2 Japan;22,27 EUR;+ 9,28 EUR de envío;desde Australia;
