Nintendo Gameboy Color-Spider-Man 1 & 2;24,46 EUR;+ 16,84 EUR de envío estimado;Vendidos  17 sep 2021Artículo vendido;desde Reino Unido;
Spider-Man 2 Spiderman 2 - 2001-Game Boy Color-Probado Y Funcionando;11,66 EUR;+ 16,60 EUR de envío estimado;Vendidos  9 sep 2021Artículo vendido;desde Reino Unido;
GAME BOY Spider-Man X-men FAH FR NINTENDO COLOR CARTOUCHE SEULE;9,00 EUR;+ 15,00 EUR de envío;Vendidos  2 ago 2021Artículo vendido;desde Francia;
Spider-Man 2 Spiderman 2 (Nintendo Game Boy Colour GBC 2001) Solo Cartucho;17,50 EUR;+ 18,62 EUR de envío estimado;Vendidos  28 jul 2021Artículo vendido;desde Reino Unido;
Original Spider-Man NINTENDO GAMEBOY COLOR COLOUR juego probado Funcionando;15,17 EUR;+ 16,66 EUR de envío estimado;Vendidos  28 jul 2021Artículo vendido;desde Reino Unido;
The Sinister Six Spider-Man 2 [PAL-EUR] - Game Boy Color ;59,99 EUR;Envío no especificado;Vendidos  21 jul 2021Artículo vendido;desde Francia;
Nintendo Game Boy Color Aqua Azul con Donkey Kong Country & Spider-Man;55,49 EUR;+ 12,98 EUR de envío;Vendidos  23 sep 2021Artículo vendido;desde Estados Unidos;
Auténtico X-men: Wolverine Rage Spider-Man 2 Batman Beyond Gameboy Color;24,75 EUR;Envío gratis;Vendidos  16 sep 2021Artículo vendido;desde Estados Unidos;
Spider-Man Juego Boy Color Video Juego Carro Nintendo Spiderman;5,37 EUR;+ 3,41 EUR de envío;Vendidos  11 sep 2021Artículo vendido;desde Estados Unidos;
The Amazing Spider-Man-Nintendo Game Boy Auténtico-Color;10,23 EUR;Envío gratis;Vendidos  10 sep 2021Artículo vendido;desde Estados Unidos;
Spider-Man Gameboy Color & Gameboy Advance Juegos Lote De 3;17,07 EUR;+ 2,56 EUR de envío;Vendidos  5 sep 2021Artículo vendido;desde Estados Unidos;
Spider-Man Juego Boy Color GBC probado y trabajo auténtico envío rápido;12,80 EUR;Envío gratis;Vendidos  2 sep 2021Artículo vendido;desde Estados Unidos;
Spider-Man 2 & Godzilla: la serie Nintendo Gameboy Color Lote Probado;8,49 EUR;Envío gratis;Vendidos  20 ago 2021Artículo vendido;desde Estados Unidos;
Spider-Man 2-Original Nintendo GameBoy Color Juego Completo;25,61 EUR;+ 7,77 EUR de envío;Vendidos  1 ago 2021Artículo vendido;desde Estados Unidos;
Spider-Man Juego (Nintendo Game Boy Color, 2000);6,83 EUR;Envío gratis;Vendidos  1 ago 2021Artículo vendido;desde Estados Unidos;
Spider-Man (Nintendo Game Boy Color, 2000) -Cart Only ;14,62 EUR;+ 4,03 EUR de envío;Vendidos  20 jul 2021Artículo vendido;desde Canadá;
Spider-Man Mysterio's Menace-Nintendo Game Boy Advance-Cartucho únicamente;8,16 EUR;+ 16,53 EUR de envío estimado;Vendidos  18 ago 2021Artículo vendido;desde Reino Unido;
Nintendo Game Boy-The Amazing Spider-Man-Top-Embalaje original-pal alemán;169,90 EUR;Envío no especificado;Vendidos  30 jul 2021Artículo vendido;desde Alemania;
Ultimate Spider-Man, pal, completa, NINTENDO GAMECUBE Juego;22,10 EUR;+ 11,67 EUR de envío;Vendidos  25 ago 2021Artículo vendido;desde Reino Unido;
Spider-Man PlayStation 2 (PS2) juego + Manual;5,24 EUR;+ 16,49 EUR de envío estimado;Vendidos  23 sep 2021Artículo vendido;desde Reino Unido;
