Momotarou Densetsu 1-2 Nintendo Game Boy Color GBC NTSC-J Región FREE Rare;9,99 EUR;+ 19,99 EUR de envío;desde España;
Gameboy Color Momotarou Densetsu 1-2 gameboy * COMPLETE * Japan Import * CIB *;15,00 EUR;+ 14,50 EUR de envío;desde Bélgica;
Nintendo GameBoy Color game - Momotarou Densetsu 1-2 JAPAN cartridge;16,80 EUR;Envío internacional gratis;desde Alemania;
Nintendo GameBoy Color gioco - Momotarou Densetsu 1-2 JAPAN cartuccia usato;22,99 EUR;Envío internacional gratis;desde Alemania;
Nintendo GameBoy Color jeu - Momotarou Densetsu 1-2 JAPAN cartouche utilisé;20,99 EUR;Envío internacional gratis;desde Alemania;
Nintendo GameBoy Color juego - Momotarou Densetsu 1-2 JAPAN cartucho usado;22,99 EUR;Envío internacional gratis;desde Alemania;
Momotarou Densetsu 1-2 JAPAN WORKING SAVE GameBoy Color;3,52 EUR;+ 5,62 EUR de envío;desde Canadá;
