Dracula Densetsu - Game Boy - JAP - DMG-CVJ;54,99 EUR;+ 35,00 EUR de envío;desde Francia;
Dracula Densetsu II japonés Nintendo Game Boy Juego Completo;127,50 EUR;+ 17,00 EUR de envío;desde Alemania;
✨ Dracula Densetsu II Castlevania II Game Boy 1991 Nintendo Boxed GB DMG-CWJ ✨;139,00 EUR;+ 28,10 EUR de envío;desde Francia;
Dracula Densetsu - Castlevania (Game Boy GB 1989) Solo cartucho;25,00 EUR;+ 12,90 EUR de envío;desde España;
Castlevania Dracula Densetsu leyenda Nintendo Gameboy Japonés Cartucho De Juego;11,69 EUR;+ 16,65 EUR de envío estimado;desde Reino Unido;
Dracula Densetsu Castlevania the Adventure Nintendo Game Boy GB Jap NTSC;83,00 EUR;+ 36,00 EUR de envío;desde Francia;
Castlevania Dracula Densetsu leyenda Nintendo Gameboy Cartucho de juego japonés #2;11,69 EUR;+ 16,65 EUR de envío estimado;desde Reino Unido;
Castlevania Dracula Densetsu leyenda Nintendo Gameboy Cartucho de juego japonés #4;11,69 EUR;+ 16,65 EUR de envío estimado;desde Reino Unido;
Castlevania Dracula Densetsu leyenda Nintendo Gameboy Cartucho de juego japonés #5;11,69 EUR;+ 16,65 EUR de envío estimado;desde Reino Unido;
Castlevania Dracula Densetsu leyenda Nintendo Gameboy Cartucho de juego japonés #3;11,69 EUR;+ 16,65 EUR de envío estimado;desde Reino Unido;
Nintendo Gameboy juego japonés-DMG-CVJ-Castlevania Dracula Densetsu Leyenda;17,50 EUR;+ 16,75 EUR de envío estimado;desde Reino Unido;
Japonés Nintendo Gameboy Juego-Castlevania Dracula Densetsu Legend-DMG-cvj;21,07 EUR;+ 14,05 EUR de envío;desde España;
Castlevania 2-Dracula Densetsu II para Nintendo Gameboy, Importación de Japón -;76,09 EUR;Envío no especificado;desde República Checa;
Dracula Densetsu Castlevania GB Nintendo Game Boy Japón importación algo Usado;67,15 EUR;+ 16,16 EUR de envío;desde Japón;
Nintendo Gameboy Dracula Densetsu 1 Castlevania juego probado funciona Japón Importación;12,74 EUR;Envío gratis;desde Estados Unidos;
Dracula Densetsu 1 2 Juego Boy GB Nintendo Japón juegos de video oficial;35,70 EUR;Envío internacional gratis;desde Japón;
Nintendo Game Boy Dracula Densetsu II Importado De Japón -;66,48 EUR;+ 17,00 EUR de envío;desde Japón;
Dracula Densetsu II (Castlevania II) (Nintendo Gameboy Game Boy)-No Manual ;56,91 EUR;+ 4,02 EUR de envío;desde Canadá;
Dracula Densetsu 2 Nintendo Gameboy GB Japón EN CAJA DE KONAMI CARTUCHO Completo En Caja;96,90 EUR;+ 8,49 EUR de envío;desde Japón;
Dracula Densetsu Castlevania Konami Nintendo Gameboy Japón importación Probado;34,00 EUR;Envío gratis;desde Estados Unidos;
Konami Castlevania la aventura NIntendo Gameboy Dracula Densetsu GB;72,16 EUR;+ 14,28 EUR de envío;desde Japón;
Dracula Densetsu Nintendo Gameboy GB Japón En Caja Konami;60,56 EUR;+ 8,49 EUR de envío;desde Japón;
Dracula Densetsu II (Castlevania II: Belmont's Revenge) Nintendo Game Boy jp F/S;24,87 EUR;Envío internacional gratis;desde Japón;
Dracula Densetsu Castlevania Juego Boy GB Nintendo Japón Juego;8,49 EUR;+ 16,15 EUR de envío;desde Japón;
Castlevania la aventura Gameboy Dracula Densetsu GB DMG-CVJ cartucho sólo;11,48 EUR;+ 5,95 EUR de envío;desde Japón;
Dracula Densetsu Juego Castlevania Gameboy GB Konami Japón Probado Funcionando 1991;148,77 EUR;Envío internacional gratis;desde Japón;
Lote 2 Nintendo Game Boy Dracula Densetsu Dr. Mario Set GB Japón JP importación C121;23,80 EUR;+ 17,00 EUR de envío;desde Japón;
Dracula Densetsu 2 Castlevania Con Caja Y Manual Gameboy versión japonesa [];74,40 EUR;+ 17,00 EUR de envío;desde Japón;
Game Boy GB Nintendo-Dracula Densetsu DMG-CVJ versión Japón Completo;72,53 EUR;+ 17,00 EUR de envío;desde España;
Lote de 2 Castlevania Dracula Densetsu I II 1 2 Nintendo Gameboy GB Japón Probado;20,40 EUR;+ 17,00 EUR de envío;desde Japón;
Dracula Densetsu 2 Nintendo Gameboy GB Japón KONAMI EN CAJA;71,41 EUR;Envío internacional gratis;desde Japón;
GB Dracula Densetsu 2/2 Castlevania: Belmont's Revenge Juego Boy;35,28 EUR;Envío internacional gratis;desde Japón;
Dracula Densetsu con Manual Japón Nintendo Gameboy GB Muy Buen Estado!;17,68 EUR;+ 7,48 EUR de envío;desde Japón;
Dracula Densetsu 2 Castlevania II Japón Nintendo Gameboy GB Muy Buen Estado!;19,38 EUR;+ 7,48 EUR de envío;desde Japón;
Dracula Densetsu/Castlevania NINTENDO GAME BOY GB;55,26 EUR;+ 17,00 EUR de envío;desde Japón;
Dracula Densetsu - Castlevania (Game Boy GB 1989) Solo Cartridge;39,11 EUR;+ 0,37 EUR de envío;desde España;
Dracula Densetsu - Castlevania (Game Boy GB 1989) Solo Cartridge;25,41 EUR;+ 12,90 EUR de envío;desde España;
Dracula Densetsu 1 2 Japón Nintendo Gameboy GB japonés;31,28 EUR;Envío internacional gratis;desde Japón;
Dracula Densetsu Castlevania GB KONAMI Nintendo Gameboy de Japón;21,05 EUR;+ 21,25 EUR de envío;desde Japón;
Dracula Densetsu Japón Nintendo Gameboy GB Muy Buen Estado!;9,34 EUR;+ 7,48 EUR de envío;desde Japón;
Gameboy Juegos GB/GBC "Dracula Densetsu 2 Castlevania" probado/G0179;13,60 EUR;+ 21,25 EUR de envío;desde Japón;
Gameboy Juegos GB/GBC "Dracula Densetsu 2 Castlevania" probado/G0180;14,45 EUR;+ 21,25 EUR de envío;desde Japón;
Gameboy Juegos GB/GBC "Dracula Densetsu Castlevania" probado/G0001;11,90 EUR;+ 21,25 EUR de envío;desde Japón;
Nintendo Gameboy GB Dracula Densetsu JP importación J1721;