Super Robot Wars J-Game Boy Advance (en Caja Incluye Manual);35,12 EUR;+ 13,81 EUR de envío;Vendidos  15 sep 2021Artículo vendido;desde Reino Unido;
Super Robot Wars G 2nd Nintendo Gameboy Japonés Original Cartucho De Juego;11,69 EUR;+ 16,65 EUR de envío estimado;Vendidos  14 sep 2021Artículo vendido;desde Reino Unido;
Super Robot Wars J Para Nintendo Game Boy Advance GBA tarjeta de juegos de consola;3,50 EUR;+ 16,49 EUR de envío estimado;Vendidos  27 jul 2021Artículo vendido;desde Reino Unido;
Super Robot Wars un "buen estado" Gameboy Advance GBA Japón;33,96 EUR;+ 11,90 EUR de envío;Vendidos  14 sep 2021Artículo vendido;desde Japón;
Super Robot Wars Original Generation 2 Gameboy Advance GBA GAME BOY Japón Importación;7,64 EUR;Envío gratis;Vendidos  3 sep 2021Artículo vendido;desde Estados Unidos;
Super Robot Wars Original Generation 2 Gameboy Advance Nintendo Gba;10,20 EUR;+ 14,45 EUR de envío;Vendidos  28 ago 2021Artículo vendido;desde Japón;
Super Robot Wars Original Generation Nintendo Gameboy Advance GBA Japón muy bien!!!;11,05 EUR;+ 6,80 EUR de envío;Vendidos  27 ago 2021Artículo vendido;desde Japón;
Super Robot Wars Taisen J traducción al inglés GBA GameBoy Advance NTSC;21,25 EUR;Envío gratis;Vendidos  26 ago 2021Artículo vendido;desde Estados Unidos;
C524 Nintendo Gameboy Color Super Robot Wars enlace Battler Japón GB Game Boy Color Con Caja;0,84 EUR;+ 16,15 EUR de envío;Vendidos  24 ago 2021Artículo vendido;desde Japón;
Super Robot Wars J Game Boy Advance GBA Nintendo 32 Bit Versión Usa;9,34 EUR;Envío internacional gratis;Vendidos  14 ago 2021Artículo vendido;desde China;
E725 Nintendo Gameboy Color Super Robot Wars enlace Battler Japón GB Game Boy Color Con Caja Bx;2,76 EUR;+ 16,15 EUR de envío;Vendidos  31 jul 2021Artículo vendido;desde Japón;
E689 Super Robot Wars Nintendo GameBoy Japón GB Con Caja;8,93 EUR;+ 16,15 EUR de envío;Vendidos  31 jul 2021Artículo vendido;desde Japón;
E715 2nd Nintendo Gameboy Super Robot Wars G GB Japón Con Caja Bx;6,38 EUR;+ 16,15 EUR de envío;Vendidos  31 jul 2021Artículo vendido;desde Japón;
E734 Nintendo Gameboy Advance Super Robot Wars D Japón Game Boy Advance Con Caja;3,61 EUR;+ 16,15 EUR de envío;Vendidos  31 jul 2021Artículo vendido;desde Japón;
U1925 Super Robot Wars Nintendo Gameboy 2nd G GB Japón Con Caja;0,84 EUR;+ 12,75 EUR de envío;Vendidos  27 jul 2021Artículo vendido;desde Japón;
Super Robot Wars J Game Boy Advance GBA Nintendo 32 Bit Versión Usa;9,34 EUR;Envío internacional gratis;Vendidos  18 jul 2021Artículo vendido;desde China;
Super Robot Wars Taisen enlace Battler Nintendo Gameboy GB Importado De Japón MC709;6,37 EUR;Envío gratis;Vendidos  15 jul 2021Artículo vendido;desde Estados Unidos;
Super Robot Wars Original Generation Gameboy Advance Nintendo Gba;17,00 EUR;+ 14,45 EUR de envío;Vendidos  7 jul 2021Artículo vendido;desde Japón;
Super Robot Wars un Gameboy Advance Nintendo CCC Gba;12,75 EUR;+ 14,45 EUR de envío;Vendidos  7 jul 2021Artículo vendido;desde Japón;
Gundam Super Robot Wars Para Game Boy Color japanease ver operación y guardar Ok;0,85 EUR;+ 10,20 EUR de envío;Vendidos  4 jul 2021Artículo vendido;desde Japón;
Super Robot Wars Taisen D + J Lote Completo En Caja Japón ver GameBoy Advance GBA;38,25 EUR;+ 4,42 EUR de envío;Vendidos  3 jul 2021Artículo vendido;desde Estados Unidos;
Super Robot Wars Carro! (Nintendo Gameboy Advance, GBA) Japón Importación! nos Sel;1,49 EUR;Envío gratis;Vendidos  30 jun 2021Artículo vendido;desde Estados Unidos;
E688 Nintendo Gameboy Advance Super Robot Wars R Japón Game Boy Advance Con Caja;5,10 EUR;+ 16,15 EUR de envío;Vendidos  25 jun 2021Artículo vendido;desde Japón;
E663 Nintendo Gameboy Advance Super Robot Wars D Japón Game Boy Advance Con Caja;5,10 EUR;+ 16,15 EUR de envío;Vendidos  25 jun 2021Artículo vendido;desde Japón;
E687 Nintendo Gameboy Advance Super Robot Wars un Japón Game Boy Advance Con Caja;4,68 EUR;+ 16,15 EUR de envío;Vendidos  25 jun 2021Artículo vendido;desde Japón;
Super Robot Wars Original generaciones Playstation 2 Juego NTSC-J Japonés Importado;3,51 EUR;+ 5,85 EUR de envío;Vendidos  15 ago 2021Artículo vendido;desde Reino Unido;
