Dragon Warrior III 3 fábrica sellada durante 9.6 a + juego Boy Color Muy Raro;943,17 EUR;+ 10,68 EUR de envío;desde Estados Unidos;
Dragon Warrior III (Nintendo Game Boy Color, 2001) probado y funciona muy bien!;55,37 EUR;+ 3,49 EUR de envío;desde Estados Unidos;
Nuevo anuncioDragon Warrior III (Nintendo Game Boy Color, 2001);35,74 EUR;+ 2,73 EUR de envío;desde Estados Unidos;
Dragon Warrior III (Nintendo Game Boy Color, 2001) Envío Rápido Gratis;42,59 EUR;Envío gratis;desde Estados Unidos;
Dragon Warrior III 3 Nintendo Game Boy Color cartel & Enix Lote de tarjeta de registro;51,11 EUR;Envío gratis;desde Estados Unidos;
Dragon Warrior III Quest 3 Nintendo Game Boy Color GBC Probado Funcionando Auténtico;50,27 EUR;+ 3,54 EUR de envío;desde Estados Unidos;
Dragon Warrior III (Nintendo Game Boy Color, 2001) Game Boy Color Probado;59,60 EUR;+ 7,28 EUR de envío;desde Estados Unidos;
Nintendo Game Boy Color Dragon Warrior III 3 casi completa Caja Manual Mapa;340,79 EUR;Envío gratis;desde Estados Unidos;
Dragon Warrior III prima's official game boy color guía de estrategia;76,67 EUR;Envío gratis;desde Estados Unidos;
Dragon Warrior III game boy color guía de estrategia oficial;59,60 EUR;Envío gratis;desde Estados Unidos;
Dragon Warrior III prima oficial 3 guía de estrategia Game Boy Color;72,41 EUR;Envío gratis;desde Estados Unidos;
Dragon Warrior III 3 Nintendo Game Boy Color Solo Manual Auténtico condición en muy buena condición;33,23 EUR;Envío gratis;desde Estados Unidos;
Dragon Warrior III (Nintendo Game Boy Color, 2001) Raro Game Boy Color Enix RPG, Completa!;425,99 EUR;Envío gratis;desde Estados Unidos;
Dragon Warrior III Quest 3 Nintendo Game Boy Color GBC Probado Funcionando Auténtico;51,12 EUR;Envío gratis;desde Estados Unidos;
Dragon Warrior III-GameBoy Color Juego;67,47 EUR;+ 2,51 EUR de envío;desde Estados Unidos;
GBC-Dragon Warrior III 3 Nintendo Gameboy Game Boy Color solo carro Probado;46,77 EUR;Envío gratis;desde Estados Unidos;
Dragon Warrior III-Nintendo Game Boy Color-NTSC JAP-A-Ware;13,37 EUR;+ 0,99 EUR de envío;desde Austria;
Dragon Warrior III--Nintendo Game Boy Color--NTSC JAP--A-Ware;11,86 EUR;+ 0,99 EUR de envío;desde Austria;
Dragon Warrior III--Nintendo Game Boy Color--NTSC JAP--B-Ware;11,27 EUR;+ 0,99 EUR de envío;desde Austria;
Dragon Warrior III JAPAN WORKING SAVE GameBoy Color;7,51 EUR;+ 5,58 EUR de envío;desde Canadá;
Dragon Warrior III Gameboy Color Excelente Estado Funciona Perfecto;68,15 EUR;+ 2,55 EUR de envío;desde Estados Unidos;
Dragon Warrior III Nintendo Gameboy Color - Complete Great Condition;387,44 EUR;+ 0,84 EUR de envío;desde Canadá;
Dragon Warrior III-auténtico-Nintendo Game Boy Color-Solo Manual! USA-1;40,10 EUR;Envío gratis;desde Estados Unidos;
Dragon Warrior III-auténtico-Nintendo Game Boy Color-Solo Manual!;31,67 EUR;Envío gratis;desde Estados Unidos;
