GBC-Lucky Luke: bandidos Express para Nintendo Gameboy Color;9,95 EUR;+ 9,95 EUR de envío;Vendidos  25 sep 2021Artículo vendido;desde Alemania;
Lucky Luke Nintendo Game Boy Colour Color solo carro PAL Gameboy;10,45 EUR;+ 16,58 EUR de envío estimado;Vendidos  13 sep 2021Artículo vendido;desde Reino Unido;
GBC-Lucky Luke para Nintendo Gameboy Color;12,95 EUR;+ 9,95 EUR de envío;Vendidos  6 sep 2021Artículo vendido;desde Alemania;
Lucky Luke bandidos Express-Nintendo Game Boy Color (módulo);6,98 EUR;+ 4,50 EUR de envío;Vendidos  27 ago 2021Artículo vendido;desde Alemania;
Lucky Luke bandidos Express-Game Boy Color-módulo-Nintendo-GameBoy GBC;4,22 EUR;Envío no especificado;Vendidos  2 ago 2021Artículo vendido;desde Alemania;
Lucky Luke (Nintendo Game Boy Color, 1999);7,99 EUR;+ 5,99 EUR de envío;Vendidos  2 ago 2021Artículo vendido;desde Alemania;
Jeu Seul Nintendo Game Boy Color Lucky Luke Le Train Des Desperados FRA;5,00 EUR;Envío no especificado;Vendidos  26 jul 2021Artículo vendido;desde Francia;
Game Boy ** Lucky Luke juego módulo Nintendo Gameboy Color GBC;9,95 EUR;+ 13,00 EUR de envío;Vendidos  12 jul 2021Artículo vendido;desde Alemania;
Lucky Luke Nintendo Gameboy Color GBC limpiado probado Auténtico Juego Boy;16,38 EUR;Envío gratis;Vendidos  7 sep 2021Artículo vendido;desde Estados Unidos;
Lucky Luke (Nintendo Game Boy Color, 1999) suelto Probado Funcionando;11,20 EUR;+ 4,31 EUR de envío;Vendidos  7 sep 2021Artículo vendido;desde Estados Unidos;
Lucky Luke (Nintendo Game Boy Color, 1999) suelto Probado Funcionando;13,79 EUR;Envío gratis;Vendidos  28 ago 2021Artículo vendido;desde Estados Unidos;
Lucky Luke (Nintendo Gameboy Color, 1999) Completo con Manual Envío Gratuito Rápido;43,11 EUR;Envío gratis;Vendidos  24 ago 2021Artículo vendido;