GBC-Lucky Luke: bandidos Express para Nintendo Gameboy Color;9,95 EUR;+ 9,95 EUR de envío;Vendidos  25 sep 2021Artículo vendido;desde Alemania;
Lucky Luke Nintendo Game Boy Colour Color solo carro PAL Gameboy;10,45 EUR;+ 16,58 EUR de envío estimado;Vendidos  13 sep 2021Artículo vendido;desde Reino Unido;
GBC-Lucky Luke para Nintendo Gameboy Color;12,95 EUR;+ 9,95 EUR de envío;Vendidos  6 sep 2021Artículo vendido;desde Alemania;
Lucky Luke bandidos Express-Nintendo Game Boy Color (módulo);6,98 EUR;+ 4,50 EUR de envío;Vendidos  27 ago 2021Artículo vendido;desde Alemania;
Lucky Luke bandidos Express-Game Boy Color-módulo-Nintendo-GameBoy GBC;4,22 EUR;Envío no especificado;Vendidos  2 ago 2021Artículo vendido;desde Alemania;
Lucky Luke (Nintendo Game Boy Color, 1999);7,99 EUR;+ 5,99 EUR de envío;Vendidos  2 ago 2021Artículo vendido;desde Alemania;
Jeu Seul Nintendo Game Boy Color Lucky Luke Le Train Des Desperados FRA;5,00 EUR;Envío no especificado;Vendidos  26 jul 2021Artículo vendido;desde Francia;
Game Boy ** Lucky Luke juego módulo Nintendo Gameboy Color GBC;9,95 EUR;+ 13,00 EUR de envío;Vendidos  12 jul 2021Artículo vendido;desde Alemania;
Lucky Luke Game Boy Color FAH ;8,00 EUR;Envío internacional gratis;Vendidos  2 jul 2021Artículo vendido;desde Francia;
Lucky Luke Nintendo Gameboy Color GBC limpiado probado Auténtico Juego Boy;16,21 EUR;Envío gratis;Vendidos  7 sep 2021Artículo vendido;desde Estados Unidos;
Lucky Luke (Nintendo Game Boy Color, 1999) suelto Probado Funcionando;11,09 EUR;+ 4,27 EUR de envío;Vendidos  7 sep 2021Artículo vendido;desde Estados Unidos;
Lucky Luke (Nintendo Game Boy Color, 1999) suelto Probado Funcionando;13,65 EUR;Envío gratis;Vendidos  28 ago 2021Artículo vendido;desde Estados Unidos;
Lucky Luke (Nintendo Gameboy Color, 1999) Completo con Manual Envío Gratuito Rápido;42,68 EUR;Envío gratis;Vendidos  24 ago 2021Artículo vendido;desde Estados Unidos;
Lucky Luke-Nintendo Gameboy Color Juego-Probado-trabajo-AUTHENTIC!;12,80 EUR;Envío gratis;Vendidos  18 ago 2021Artículo vendido;desde Estados Unidos;
Lucky Luke (Nintendo Gameboy Color, 1999) Completo En Caja;40,97 EUR;+ 4,35 EUR de envío;Vendidos  13 ago 2021Artículo vendido;desde Estados Unidos;
Lucky Luke-Nintendo Gameboy Color Juego-Probado-trabajo-AUTHENTIC!;8,54 EUR;+ 2,55 EUR de envío;Vendidos  11 jul 2021Artículo vendido;desde Estados Unidos;
Lucky Luke (Nintendo Gameboy Color) limpio; probado; 100% Auténtico Con Estuche;12,80 EUR;Envío gratis;Vendidos  9 jul 2021Artículo vendido;desde Estados Unidos;
Lucky Luke-Nintendo Gameboy Color Juego-AUTHENTIC!;11,10 EUR;Envío gratis;Vendidos  7 jul 2021Artículo vendido;desde Estados Unidos;
Lucky Luke-Nintendo Gameboy Color probado Auténtico Raro amarillo cartucho sólo;11,95 EUR;+ 4,23 EUR de envío;Vendidos  5 jul 2021Artículo vendido;desde Estados Unidos;
Lucky Luke - Nintendo Game Boy ;4,90 EUR;+ 4,00 EUR de envío;Vendidos  7 jul 2021Artículo vendido;desde Francia;
Lucky Luke Manuel - Instruction Booklet Game Boy FAH ;5,00 EUR;Envío internacional gratis;Vendidos  11 sep 2021Artículo vendido;desde Francia;
Lucky Luke Gameboy Game Boy gb Classic OVP Noe;39,90 EUR;Envío no especificado;Vendidos  17 jul 2021Artículo vendido;desde Alemania;
Nintendo Game Boy Lucky Luke FAH Très Bon état;7,90 EUR;+ 11,98 EUR de envío;Vendidos  30 jul 2021Artículo vendido;desde Francia;
