Nintendo Game Boy Color Uva Con MadCatz Speakers Army Men Joust Rampart Pac-Man;54,47 EUR;+ 8,13 EUR de envío;Vendidos  19 sep 2021Artículo vendido;desde Estados Unidos;
Rampart juego Boy Color Nueva Sellado;22,94 EUR;Envío gratis;Vendidos  5 sep 2021Artículo vendido;desde Estados Unidos;
Rampart-Game Boy Color;8,06 EUR;+ 2,51 EUR de envío;Vendidos  3 sep 2021Artículo vendido;desde Estados Unidos;
Rampart (Nintendo Game Boy Color, 1999);4,26 EUR;+ 3,49 EUR de envío;Vendidos  25 ago 2021Artículo vendido;desde Estados Unidos;
Rampart GBC Game Boy Color ~ con caja y las instrucciones: sin probar ~ Nintendo GameBoy;11,06 EUR;+ 3,40 EUR de envío;Vendidos  23 ago 2021Artículo vendido;desde Estados Unidos;
Nintendo Game Boy Color Auténtico con Pokémon Verde And Rampart;55,32 EUR;+ 4,17 EUR de envío;Vendidos  21 ago 2021Artículo vendido;desde Estados Unidos;
Rampart Para Nintendo Game Boy Color, Advance & SP probado y de trabajo;3,40 EUR;+ 3,49 EUR de envío;Vendidos  20 ago 2021Artículo vendido;desde Estados Unidos;
