Super Breakout Nintendo Game Boy Colour Color COMPLETO PAL;17,49 EUR;+ 16,74 EUR de envío estimado;desde Reino Unido;
Super Breakout Nintendo Game Boy Colour Color solo carro PAL;10,47 EUR;+ 16,61 EUR de envío estimado;desde Reino Unido;
Super Breakout Nintendo Game Boy Color Juego en Caja Completa genuino salón de juegos;18,66 EUR;+ 14,04 EUR de envío;desde Reino Unido;
Super Breakout Nintendo Game Boy Color Juego en Caja Completa genuino salón de juegos;35,08 EUR;+ 20,68 EUR de envío estimado;desde Reino Unido;
Nintendo Game Boy Color Super Breakout EUR Très Bon état;9,90 EUR;+ 11,98 EUR de envío;desde Francia;
Nintendo Game Boy Color - Super Breakout - PAL - EUR;9,99 EUR;+ 4,60 EUR de envío;desde Francia;
Super Breakout EUR - Nintendo GameBoy Color - GBC;5,70 EUR;+ 19,95 EUR de envío;desde Países Bajos;
Nintendo GameBoy Color Cartucho De Juego Super Breakout;6,80 EUR;Envío internacional gratis;desde Alemania;
Nintendo GameBoy Color game - Super Breakout cartridge;11,44 EUR;Envío internacional gratis;desde Alemania;
Nintendo GameBoy Color Cartucho De Juego Super Breakout;11,69 EUR;Envío internacional gratis;desde Alemania;
Nintendo GameBoy Color juego - Super Breakout cartucho usado;17,99 EUR;Envío internacional gratis;desde Alemania;
Nintendo GameBoy Color jeu - Super Breakout cartouche utilisé;15,99 EUR;Envío internacional gratis;desde Alemania;
Game Boy Color Super Breakout en caja con instrucciones Gwo Free UK Post;23,38 EUR;Envío no especificado;desde Reino Unido;
Super Breakout (Nintendo Game Boy Color, 1999);25,50 EUR;Envío no especificado;desde Italia;
Nintendo GameBoy Color gioco - Super Breakout cartuccia usato;17,99 EUR;Envío internacional gratis;desde Alemania;
Super Breakout (Nintendo Game Boy Color, 1999);6,80 EUR;Envío gratis;desde Estados Unidos;
Nintendo Game Boy Color Uva Con Super Breakout! CBG-001, PROBADO Y FUNCIONANDO, LEER;51,92 EUR;+ 4,43 EUR de envío;desde Estados Unidos;
Nintendo Game Boy Color Atomic Púrpura Con Estuche Y Super Breakout Juego Paquete;34,04 EUR;+ 8,60 EUR de envío;desde Estados Unidos;
Super Breakout GBC (Nueva Sellado de fábrica juego Boy Color versión de EE. UU.);16,16 EUR;Envío gratis;desde Estados Unidos;
Super Breakout (Nintendo Game Boy Color, 1999) GBC a estrenar, sellado de fábrica;42,56 EUR;desde Estados Unidos;
Super Breakout (Nintendo Game Boy Color, 1999);8,51 EUR;+ 3,53 EUR de envío;desde Estados Unidos;
Super Breakout (Nintendo Game Boy Color, 1999) PROBADO/OBRAS;5,78 EUR;Envío gratis;desde Estados Unidos;
Super Breakout (Nintendo Game Boy Color GBC, 1999) sólo juego;6,38 EUR;Envío gratis;desde Estados Unidos;
Super Breakout Juego Boy Color;4,66 EUR;+ 3,36 EUR de envío;desde Estados Unidos;
Cartucho De Juego Super Breakout/Battlezone-NINTENDO GAME Chico + COLOR;11,78 EUR;Envío gratis;desde Estados Unidos;
Super Breakout | Nintendo Game Boy Color GBC, 1998 | Probado;2,54 EUR;+ 3,53 EUR de envío;desde Estados Unidos;
Super Breakout (Nintendo Game Boy Color, 1999) Gameboy Con Manual;12,76 EUR;Envío gratis;desde Estados Unidos;
Super Breakout Nintendo Game Boy Color * limpiado & Probado *;6,78 EUR;Envío gratis;desde Estados Unidos;
Super Breakout (Nintendo Game Boy Color, 1999) Cartucho De Juego Solamente;3,83 EUR;desde Estados Unidos;
Super Breakout (Nintendo Game Boy Color, 1999) ~ ~ FABRICANTE DE EQUIPOS ORIGINALES Genuino;7,65 EUR;Envío gratis;desde Estados Unidos;
Super Breakout (Nintendo Game Boy Color, Solo Caja 1999);5,10 EUR;+ 4,43 EUR de envío;desde Estados Unidos;
Super Breakout Nintendo Game Boy Gameboy Color GBC Cartucho en Caja Completa! muy bien!;25,52 EUR;Envío gratis;desde Estados Unidos;
Super Breakout-Nintendo Game Boy Color Nuevo Sellado De Fábrica GameBoy Nuevo en Caja GBC difícil de encontrar;106,34 EUR;Envío gratis;desde Estados Unidos;
Super Breakout (Nintendo Game Boy Color, 1999) Completo en Caja, Excelente Estado;17,01 EUR;+ 3,79 EUR de envío;desde Estados Unidos;
Super Breakout (Nintendo Game Boy Color, 1999);8,50 EUR;Envío gratis;desde Estados Unidos;
Super Breakout (Nintendo Game Boy Color, 1999) sólo juego de trabajo;7,23 EUR;Envío gratis;desde Estados Unidos;
Super Breakout Original Nintendo Game Boy Color Juego Probado Funcionando auténtico!;7,23 EUR;Envío gratis;desde Estados Unidos;
Super Breakout (Nintendo Game Boy Color, 1999) sólo juego de trabajo;9,57 EUR;Envío gratis;desde Estados Unidos;
Nintendo Game Boy Color Super Breakout-Completa Auténtico/probado!;7,23 EUR;+ 5,96 EUR de envío;desde Estados Unidos;
Super Breakout (Nintendo Game Boy Color) Game Boy Color Auténtico Probado;8,42 EUR;+ 3,66 EUR de envío;desde Estados Unidos;
Super Breakout (Nintendo Game Boy Color, 1999);7,65 EUR;Envío gratis;desde Estados Unidos;
Super Breakout (Nintendo Game Boy Color, 1999);8,50 EUR;Envío gratis;desde Estados Unidos;
Super Breakout (Nintendo Game Boy Color, 1999) hecho en Japón Excelente;8,50 EUR;Envío gratis;desde Estados Unidos;
Super Breakout (Nintendo Game Boy Color, 1999) Gameboy;8,08 EUR;Envío gratis;desde Estados Unidos;
Super Breakout (Nintendo Game Boy Color, 1999) Sólo Cartucho;4,25 EUR;+ 4,64 EUR de envío;desde Estados Unidos;
Super Breakout (Nintendo Gameboy Game Boy Color, de 1999, GBA) probado;11,02 EUR;Envío gratis;desde Estados Unidos;
Super Breakout (Game Boy Color, Cartucho * SOLAMENTE *) suele enviarse en 12 horas!!!;12,12 EUR;Envío gratis;desde Estados Unidos;
Super Breakout! (Nintendo Gameboy Color) GBC;5,10 EUR;+ 2,98 EUR de envío;desde Estados Unidos;
Super Breakout (Nintendo Game Boy Color, 1999) solo carro;6,80 EUR;+ 3,40 EUR de envío;desde Estados Unidos;
Super Breakout Para Original GameBoy + Color | auténtico probado Break Out Game Boy Color;3,40 EUR;+ 4,21 EUR de envío;desde Estados Unidos;
Arcade Classic Super Breakout y Battlezone Nintendo Gameboy COLOR GB Bolsillo;12,76 EUR;Envío gratis;desde Estados Unidos;
(RI4) Super Breakout (Nintendo Game Boy Color, 1999) Gameboy;7,27 EUR;+ 8,43 EUR de envío;desde Estados Unidos;
Super Breakout-Nintendo Game Boy Color GBC;8,49 EUR;Envío gratis;desde Estados Unidos;
Super Breakout (Nintendo Game Boy Color, 1999) Gameboy probado funciona Auténtico;8,51 EUR;+ 3,28 EUR de envío;desde Estados Unidos;
Super Breakout (Nintendo Game Boy Color, 1999);5,09 EUR;+ 3,79 EUR de envío;desde Estados Unidos;
Super Breakout (Nintendo Game Boy Color, 1999);6,80 EUR;+ 3,79 EUR de envío;desde Estados Unidos;
Super Breakout (Nintendo Game Boy Color, 1999) r5419;7,63 EUR;Envío gratis;desde Estados Unidos;
Super Breakout Nintendo gameboy color/colour game Oz50;21,74 EUR;+ 16,79 EUR de envío;desde Australia;
Super Breakout-auténtico-Nintendo Game Boy Color-Solo Manual!;4,26 EUR;Envío gratis;desde Estados Unidos;
Super Breakout game boy color folleto de instrucciones Manual insertar Vintage Nintendo;4,42 EUR;Envío gratis;desde Estados Unidos;
Super Breakout - Majesco - Faded Label - Game Cart - Tested - GameBoy Color;2,29 EUR;+ 10,97 EUR de envío;desde Canadá;
Vintage Super Breakout Battlezone Nintendo Game Boy Gameboy * solo Cartucho *;15,20 EUR;+ 16,69 EUR de envío estimado;desde Reino Unido;
Super Breakout Nintendo Game Boy Vga 75+ ex + H-costura Casi Nuevo Sellado De Fábrica Nueva;553,22 EUR;+ 17,02 EUR de envío;desde Rusia;
