Super Breakout (Nintendo Game Boy Color, 1999) PROBADO/OBRAS;5,80 EUR;Envío gratis;Vendidos  25 sep 2021Artículo vendido;desde Estados Unidos;
Juego Super Breakout Nintendo Game Boy Color 1998 Majesco Probado Funciona;4,23 EUR;+ 3,20 EUR de envío;Vendidos  16 sep 2021Artículo vendido;desde Estados Unidos;
Super Breakout Nintendo Gameboy Color Majesco limpiado probado-auténtica;2,13 EUR;+ 3,67 EUR de envío;Vendidos  1 sep 2021Artículo vendido;desde Estados Unidos;
Super Breakout! Nintendo Gameboy Color Solo Manual;2,55 EUR;Envío gratis;Vendidos  30 ago 2021Artículo vendido;desde Estados Unidos;
Super Breakout (Nintendo Game Boy Color, 1999);1,92 EUR;+ 0,85 EUR de envío;Vendidos  29 ago 2021Artículo vendido;desde Estados Unidos;
Super Breakout Original Nintendo Game Boy Color Juego Probado Funcionando auténtico!;2,56 EUR;+ 3,80 EUR de envío;Vendidos  27 ago 2021Artículo vendido;desde Estados Unidos;
Super Breakout Original Nintendo Game Boy Color Juego Probado Funcionando auténtico!;7,25 EUR;Envío gratis;Vendidos  17 ago 2021Artículo vendido;desde Estados Unidos;
Lote de 4 Juegos GameBoy (Color), Bugs Bunny Crazy Super Breakout, MIB2, Animorphs;12,81 EUR;+ 8,53 EUR de envío;Vendidos  3 ago 2021Artículo vendido;desde Estados Unidos;
Super Breakout (Nintendo Game Boy Color, 1999) Cartucho De Juego Solamente;2,55 EUR;+ 3,80 EUR de envío;Vendidos  21 jul 2021Artículo vendido;desde Estados Unidos;
Juego Super Breakout Nintendo Game Boy Color 1998 Majesco Sellado;17,07 EUR;+ 3,41 EUR de envío;Vendidos  17 jul 2021Artículo vendido;desde Estados Unidos;
Asteroids Frogger Super Breakout Sergy introducir el Gecko Gameboy Color 4 Juegos Lote;23,05 EUR;+ 3,41 EUR de envío;Vendidos  15 jul 2021Artículo vendido;desde Estados Unidos;
Juego Super Breakout ATARI 2600 Black Label cartucho sólo;1,16 EUR;+ 34,32 EUR de envío estimado;Vendidos  21 ago 2021Artículo vendido;desde Reino Unido;
