51313 manual de instrucciones-Wordtris-Nintendo Game Boy () DMG-Wt-EE. UU.;11,70 EUR;+ 5,84 EUR de envío;desde Reino Unido;
Wordtris Nintendo game boy classic videogioco gba funzionante pal cartridge;10,99 EUR;+ 18,00 EUR de envío;desde Italia;
Gameboy Wordtris Usa Solo Manual;7,02 EUR;Envío no especificado;desde Reino Unido;
Game Boy Juego ~ Wordtris;7,63 EUR;Envío gratis;desde Estados Unidos;
Wordtris NINTENDO GAME BOY Cartucho en Caja Completo En Caja * como * Tetris;46,82 EUR;Envío gratis;desde Estados Unidos;
De Colección Nintendo Super Power Club desafío Trading Card #83 Wordtris Game Boy;1,70 EUR;+ 0,60 EUR de envío;desde Estados Unidos;
Wordtris Nintendo Game Boy GB;8,52 EUR;Envío gratis;desde Estados Unidos;
Wordtris (Nintendo Game Boy, 1992) -Cart Only ;15,20 EUR;+ 4,01 EUR de envío;desde Canadá;
Wordtris (Nintendo Game Boy, 1992);4,26 EUR;+ 3,54 EUR de envío;desde Estados Unidos;
Wordtris (Nintendo Game Boy, 1992) Completo Raro Nueva Sellado;170,39 EUR;Envío gratis;desde Estados Unidos;
Wordtris (Nintendo Game Boy, 1992) Con Caja De Fabricante de Equipos Originales Excelente Estado cartucho sólo;10,22 EUR;Envío gratis;desde Estados Unidos;
Nuevo anuncioWordtris (Nintendo Game Boy, 1992);12,78 EUR;+ 2,72 EUR de envío;desde Estados Unidos;
Wordtris (Nintendo Game Boy, 1992) Manual de instrucciones no sólo cartucho de juego;4,26 EUR;+ 3,79 EUR de envío;desde Estados Unidos;
Wordtris-Nintendo Game Boy Video Juego-juego solamente;8,48 EUR;+ 2,51 EUR de envío;desde Estados Unidos;
Arcade GameBoy Juego Wordtris en estuche de plástico;4,25 EUR;+ 3,41 EUR de envío;desde Estados Unidos;
Wordtris para Nintendo GAME BOY Con Estuche;5,11 EUR;+ 2,56 EUR de envío;desde Estados Unidos;
Wordtris Manual Nintendo Gameboy;3,83 EUR;+ 2,55 EUR de envío;desde Estados Unidos;
Wordtris Nintendo Gameboy;7,67 EUR;Envío gratis;desde Estados Unidos;
Wordtris (Nintendo Game Boy, 1992) #15;4,47 EUR;+ 3,79 EUR de envío;desde Estados Unidos;
Wordtris Original Game Boy Carro Plus juego caso 1992 Buen Estado Funciona;6,81 EUR;+ 5,07 EUR de envío;desde Estados Unidos;
Wordtris (Nintendo Game Boy, 1992);7,67 EUR;Envío gratis;desde Estados Unidos;
Nintendo Gameboy 5 Juegos Lote Dr Mario NBA JAM Wordtris repartidor de periódicos Texas Hold 'em;29,81 EUR;+ 8,43 EUR de envío;desde Estados Unidos;
Wordtris Manual Nintendo Gameboy Gameboy GB;5,07 EUR;Envío gratis;desde Estados Unidos;
Wordtris (Nintendo Game Boy, 1992);16,69 EUR;+ 10,01 EUR de envío;desde Canadá;
Wordtris (Nintendo Game Boy Carro, 1992);4,26 EUR;+ 4,22 EUR de envío;desde Estados Unidos;
Nintendo Game Boy GameBoy Wordtris Juego;5,07 EUR;+ 5,07 EUR de envío;desde Estados Unidos;
Wordtris Gameboy Perfectas Condiciones Envío rápido;5,05 EUR;+ 3,40 EUR de envío;desde Estados Unidos;
Wordtris Snes game boy piezas 1993 ANUNCIO IMPRESO DE COLECCIÓN/cartel auténtico oficial TETRIS;12,77 EUR;Envío gratis;desde Estados Unidos;
Wordtris Snes game boy 1993 ANUNCIO IMPRESO DE COLECCIÓN/arte cartel auténtico oficial! Raro!;12,77 EUR;Envío gratis;desde Estados Unidos;
Wordtris palabra tris Original Nintendo Gameboy solo manual de instrucciones;8,51 EUR;+ 1,70 EUR de envío;desde Estados Unidos;
Wordtris 🔥 Manual Folleto De Instrucciones Casi Nuevo Excelente Nintendo Gameboy;10,22 EUR;Envío gratis;desde Estados Unidos;
Wordtris (Nintendo Game Boy, 1992) solo carro;6,39 EUR;Envío gratis;desde Estados Unidos;
Wordtris (NINTENDO GAMEBOY 1992) liberado y probado con Envío gratuito auténtico..;8,51 EUR;Envío gratis;desde Estados Unidos;
