Catz-Nintendo Game Boy Color GBC Juego-EUR PAL-probado/trabajo Bater칤a Nueva;4,61 EUR;+ 18,61 EUR de env칤o estimado;desde Reino Unido;
Nuevo anuncioCatz (Game Boy Color) versi칩n USA;2,32 EUR;+8,16 EUR de env칤o;desde Reino Unido;
Catz-Nintendo Gameboy Color;9,32 EUR;Env칤o no especificado;desde Reino Unido;
lot de deux jeu Game Boy Color - PAL  ( Spider man 2   + Catz )  ;15,00 EUR;+5,90 EUR de env칤o;desde Francia;
GBC-Catz para Gameboy Color;6,95 EUR;+9,95 EUR de env칤o;desde Alemania;
Kit de Viaje Paquete p칰rpura Mad Catz Magnifier Pack Nuevo! Gameboy Color Power!;29,18 EUR;+35,01 EUR de env칤o;desde Reino Unido;
Mad Catz Game Boy Advance Game Boy Color cable de transferencia;8,49 EUR;+12,81 EUR de env칤o;desde Hungr칤a;
Catz-Nintendo Gameboy Color GBC Solo Manual;5,83 EUR;+ 16,50 EUR de env칤o estimado;desde Reino Unido;
GameBoy Color AC Adaptador + nos fuente de alimentaci칩n at칩mica p칰rpura Mad Catz] [Enchufe EE. UU.;17,50 EUR;Env칤o internacional gratis;desde Alemania;
GameBoy Color AC Adaptador + nos fuente de alimentaci칩n #Atomic P칰rpura (Enchufe EE. UU.) [Mad Catz];23,04 EUR;Env칤o internacional gratis;desde Alemania;
GameBoy Color Ac Adapter + US power supply #Atomic Purple (US plug) [Mad Catz];24,87 EUR;+53,78 EUR de env칤o;desde Alemania;
Catz-Nintendo Game Boy Color GBC PAL -;9,33 EUR;+7,00 EUR de env칤o;desde Reino Unido;
Nuevo en el paquete-Mad Catz Bater칤a Puck (Game Boy Game Boy bolsillo Neogeo bolsillo) WE3;17,51 EUR;Env칤o no especificado;desde Reino Unido;
Nintendo Game Boy Color Atomic p칰rpura de no lee con Mad Catz Kit De Accesorios;59,75 EUR;+7,30 EUR de env칤o;desde Estados Unidos;
Catz (Nintendo Game Boy Color, 1999) Completo! probado funciona!! env칤o Gratuito!;15,36 EUR;Env칤o gratis;desde Estados Unidos;
Catz (Nintendo Game Boy Color GBC) Nuevo Sellado De F치brica;18,77 EUR;+3,15 EUR de env칤o;desde Estados Unidos;
Catz Nintendo Game Boy Color Juego probado + +! Funcionando!;7,56 EUR;desde Estados Unidos;
Catz (Nintendo Game Boy Color) Aut칠ntico Cartucho * Probado * Env칤o R치pido;7,67 EUR;Env칤o gratis;desde Estados Unidos;
Nintendo Game Boy Color Catz juego clasificado E abrir la caja en muy buena condici칩n Con Folleto;25,60 EUR;+8,45 EUR de env칤o;desde Estados Unidos;
Game Boy Color Catz Probado;6,82 EUR;Env칤o gratis;desde Estados Unidos;
Catz (Nintendo Game Boy Color GBC, 1999) Completo en Caja Cartucho Caja Manual del juego probadas;25,61 EUR;+4,27 EUR de env칤o;desde Estados Unidos;
Catz (Nintendo Game Boy Color GBC 1999) completa probada gran condici칩n;19,63 EUR;+4,26 EUR de env칤o;desde Estados Unidos;
Mad Catz Game Boy Color Recargable Bater칤a Power Pack-Cargador, Adaptador, Enchufe;25,60 EUR;+4,87 EUR de env칤o;desde Estados Unidos;
Catz Nintendo Game Boy Color Juego probado + +! Funcionando!;2,13 EUR;+3,54 EUR de env칤o;desde Estados Unidos;
Catz Nintendo Game Boy Color Juego Solamente;5,08 EUR;+2,52 EUR de env칤o;desde Estados Unidos;
Catz-Game Boy Color Gameboy;3,82 EUR;+3,37 EUR de env칤o;desde Estados Unidos;
Catz Nintendo Game Boy Color Juego r치pido env칤o!!!;4,27 EUR;+3,80 EUR de env칤o;desde Estados Unidos;
Catz (Nintendo Game Boy Color, 1999) duro encontrar nuevas;42,64 EUR;+3,41 EUR de env칤o;desde Estados Unidos;
Monopolio Catz Pet Vet (Nintendo Game Boy Color, 1999) Completo en Caja Completo En Caja;29,84 EUR;+3,59 EUR de env칤o;desde Estados Unidos;
Catz (NINTENDO GAMEBOY COLOR, DE 2006, GBC) -! env칤o Gratis!;12,80 EUR;Env칤o gratis;desde Estados Unidos;
Mad Catz gameblox SP 8 protectores de caso de colores para Gameboy Advance Games Nuevo en Paquete;11,53 EUR;+5,98 EUR de env칤o;desde Estados Unidos;
2 Gameboy Color Juegos-Dogz & Catz tanto Completa;25,60 EUR;Env칤o gratis;desde Estados Unidos;
Catz-aut칠ntico-Nintendo Game Boy Color-Solo Manual!;5,36 EUR;Env칤o gratis;desde Estados Unidos;
Paquete Doble de Piel de colecci칩n Mad Catz Game Boy Color Consolas Azul Blanco objetivos 1999 Nuevo;13,05 EUR;Env칤o gratis;desde Estados Unidos;
Nuevo Paquete Doble de Piel Mad Catz Para Game Boy Color Consolas Verde y Negro Copos;11,94 EUR;+3,80 EUR de env칤o;desde Estados Unidos;
Catz - Slightly Faded Label - Game Cart - Tested & Works - GameBoy Color;4,64 EUR;+10,96 EUR de env칤o;desde Canad치;
Paquete Doble de Piel de colecci칩n Mad Catz Game Boy Color Consolas Azul Blanco objetivos 1999 MIP;12,81 EUR;+4,27 EUR de env칤o;desde Estados Unidos;
Paquete Doble de Piel Mad Catz Para Game Boy Color Consolas-Oro Y Plata Sellado;12,81 EUR;Env칤o gratis;desde Estados Unidos;
Catz GBC [];5,71 EUR;Env칤o gratis;desde Estados Unidos;
Catz-cartucho de juego solamente-no probado-GAMEBOY COLOR;3,41 EUR;+3,80 EUR de env칤o;desde Estados Unidos;
Mad Catz Power Solution para Game Boy Advance color nuevo sin abrir 2003;11,95 EUR;+4,99 EUR de env칤o;desde Estados Unidos;
Vintage Mad Catz cables de enlace de m칰ltiples para Game Boy GB Bolsillo GB Color Azul;42,68 EUR;Env칤o gratis;desde Estados Unidos;
Mad Catz Game Boy & Color Paquete de Bater칤a Power Advanced/Cargador Leer descripci칩n;34,11 EUR;+8,45 EUR de env칤o;desde Estados Unidos;
Mad Catz Recargable Power Pack Para Gameboy Color;21,64 EUR;+4,96 EUR de env칤o;desde Estados Unidos;
Nintendo Gameboy Color Mad Catz Huesos Esqueleto De Luz Luz-Brillan En La Oscuridad;12,30 EUR;+4,06 EUR de env칤o;desde Estados Unidos;
MadCatz Mad Catz Nintendo Game Boy Advance Color Link Cable de transferencia Usado;8,49 EUR;+13,66 EUR de env칤o;desde Canad치;
游눤 2005 Mad Catz gameblox SP 8 Color Gameboy Advance Juego casos/Protectores;13,15 EUR;+4,78 EUR de env칤o;desde Estados Unidos;
Cable de transferencia de enlace Mad Catz Ultra Nintendo GameBoy Advance/Color GBA/GBC;15,36 EUR;Env칤o gratis;desde Estados Unidos;
Mad Catz Gameboy Color Agarre y Stick Pack Bater칤a Recargable Agarre y adaptador de corriente alterna;42,69 EUR;+5,08 EUR de env칤o;desde Estados Unidos;
Cable de transferencia de enlace Mad Catz Nintendo GameBoy Advance GBA a GameBoy Colour GBC;6,82 EUR9,38 EUR;+4,27 EUR de env칤o;desde Estados Unidos;
Nuevo 2005 Mad Catz gameblox SP 8 Color Gameboy Advance Juego casos/Protectores;15,36 EUR;+8,45 EUR de env칤o;desde Estados Unidos;
Mad Catz Caso Protector De Color Amarillo Para Gameboy Advance Juego;4,17 EUR;+4,26 EUR de env칤o;desde Estados Unidos;
Lote de 2 Mad Catz SY-03200 & 2344 Adaptador 3V fuente de alimentaci칩n de CA para GameBoy Color;13,74 EUR;desde Estados Unidos;
Catz Instructions manual ONLY Nintendo Gameboy Color;4,09 EUR;+4,87 EUR de env칤o;desde Estados Unidos;
2005 Mad Catz gameblox SP 8 Color Gameboy Advance Juego casos/Protectores;16,83 EUR;Env칤o gratis;desde Estados Unidos;
Gameboy Color Advance SP Mad Catz 2852 DC adaptador de coche;7,67 EUR;Env칤o gratis;desde Estados Unidos;
Gameboy Color Advance SP Mad Catz 2852 Adaptador de corriente alterna Car & Pared Combo;12,80 EUR;Env칤o gratis;desde Estados Unidos;
Mad Catz Recargable Power Pack Para Gameboy Color;12,80 EUR;+8,96 EUR de env칤o;desde Estados Unidos;
