Nintendo Game Boy Color, Army Men: Sarge's Heroes 2 VGA oro 90 nm +/MT;549,00 EUR;+ 55,00 EUR de envío;desde Alemania;
Army Men Jeu Nintendo Game Boy Color PAL EUR;3,00 EUR;+ 4,00 EUR de envío;desde Francia;
Nintendo Game Boy Color, Army Men VGA oro 85+ nm +;599,00 EUR;+ 55,00 EUR de envío;desde Alemania;
Nintendo Game Boy Color, Army Men: air combat VGA oro 90 nm +/MT;539,00 EUR;+ 55,00 EUR de envío;desde Alemania;
Nintendo Game Boy Color Army Men 2 real Combat Plastic Men 3do renderizas 2000;19,99 EUR;+ 19,99 EUR de envío;desde Italia;
Army Men: Sarge's Heroes 2 para Nintendo Game Boy Color (Colour) * solo Cartucho *;4,64 EUR;+ 16,41 EUR de envío estimado;desde Reino Unido;
Nintendo Game Boy Color - Army Men - PAL - FRA;6,99 EUR;+ 5,00 EUR de envío;desde Francia;
Army Men Sarge's Heroes 2 para Nintendo Gameboy Color Genuino Caja y Insertos sólo;23,25 EUR;+ 20,22 EUR de envío estimado;desde Reino Unido;
Army Men para Gameboy Color/GBC #1;5,99 EUR;+ 9,99 EUR de envío;desde Alemania;
Army Men para Gameboy Color/GBC;5,99 EUR;+ 9,99 EUR de envío;desde Alemania;
Vintage Nintendo Game Boy Color Juego 'Army Men' Retro Coleccionable En Caja;23,26 EUR;+ 16,75 EUR de envío estimado;desde Reino Unido;
Nintendo 64 Game Boy Color Big n soluciones podréis Lylat Wars Army Men Sarge's +++;24,99 EUR;+ 16,99 EUR de envío;desde Alemania;
Army Men NINTENDO GAMEBOY COLOR ADVANCE NUEVO PRECINTADO GB GBA PAL ESPANA;89,99 EUR;+ 4,99 EUR de envío;desde Portugal;
Nintendo GameBoy Color juego - Army Men 2 cartucho usado;18,99 EUR;Envío internacional gratis;desde Alemania;
GameBoy Color - Army Men: Real Combat Plastic Men cartucha con manual usado;22,99 EUR;Envío internacional gratis;desde Alemania;
Nintendo GameBoy Color juego - Army Men: Air Combat cartucho usado;18,99 EUR;Envío internacional gratis;desde Alemania;
Gameboy Color juego-Army Men Air Combat (módulo);9,98 EUR;+ 67,99 EUR de envío;desde Alemania;
Gameboy Color-Army Men-Sarge 's Heroes 2 (incl. caja original) - Nintendo;16,19 EUR;+ 9,50 EUR de envío;desde Alemania;
Juego Game Boy Color Army Men;5,03 EUR;Envío no especificado;desde Francia;
Army Men Sarge's Heroes 2 (Game Boy Color);5,80 EUR;Envío no especificado;desde Reino Unido;
