Magical Drop Game boy color gbc advance;5,49 EUR;Envío no especificado;desde España;
Nintendo Game Boy Color Magical Drop EUR Très Bon état #1;11,90 EUR;+ 11,98 EUR de envío;desde Francia;
Magical Drop Nintendo Gameboy Color Juego;10,25 EUR;+ 19,20 EUR de envío estimado;desde Reino Unido;
Nintendo Game Boy Color Magical Drop EUR Très Bon état;6,90 EUR;+ 11,98 EUR de envío;desde Francia;
2000 Magical Drop Nintendo Game Boy Color complete PAL;32,45 EUR;+ 23,50 EUR de envío;desde Bélgica;
Nintendo Game Boy Color - Magical Drop - PAL - EUR;14,99 EUR;+ 5,00 EUR de envío;desde Francia;
Magical Drop (Nintendo Game Boy Color, 2000);21,08 EUR;+ 20,80 EUR de envío estimado;desde Reino Unido;
Nuevo anuncioJeu Gameboy Color Gbc Magical Drop ;45,59 EUR;+ 39,00 EUR de envío;desde Francia;
GBC-Magical Drop para Nintendo Gameboy Color;4,95 EUR;+ 9,95 EUR de envío;desde Alemania;
Nintendo Game Boy Color - Notice Magical Drop - EUR;3,90 EUR;+ 6,70 EUR de envío;desde Francia;
Magical Drop (losse cassette) Nintendo GameBoy Color GBC;6,97 EUR;+ 20,00 EUR de envío;desde Países Bajos;
Magical Drop GBC SEALED / PRECINTADO PAL EUR Game Boy Color;59,00 EUR;Envío no especificado;desde España;
Magical Drop Nintendo Game Boy Color 2000 GBC Cartucho sólo auténtico raro;29,90 EUR;Envío gratis;desde Estados Unidos;
Magical Drop-auténtico-NINTENDO GAME BOY COLOR GBC-Solo Manual!;18,75 EUR;Envío gratis;desde Estados Unidos;
Magical Drop (Game Boy Color, Game Boy Color 2000) H-Costura Sellada! - Ultra Poco común! - ex!;427,32 EUR;Envío gratis;desde Estados Unidos;
Magical Drop Nintendo Game Boy Color Gbc Caja Manual Insertos cartel sólo Sin Juego;68,33 EUR;Envío gratis;desde Estados Unidos;
Magical Drop Vga clasificados 85 NINTENDO GAMEBOY COLOR GBC Nuevo en caja verdadero Nueva Sellado;427,32 EUR;Envío gratis;desde Estados Unidos;
