Magical Drop Game boy color gbc advance;5,49 EUR;Envío no especificado;desde España;
Yu Gi Oh ! + Magical Drop + Buffy : 3 jeux Game Boy Color;14,90 EUR;+ 19,90 EUR de envío;desde Francia;
Nintendo Game Boy Color Magical Drop EUR Très Bon état #1;11,90 EUR;+ 11,98 EUR de envío;desde Francia;
Magical Drop Nintendo Gameboy Color Juego;10,15 EUR;+ 19,00 EUR de envío estimado;desde Reino Unido;
Nintendo Game Boy Color Magical Drop EUR Très Bon état;6,90 EUR;+ 11,98 EUR de envío;desde Francia;
2000 Magical Drop Nintendo Game Boy Color complete PAL;32,45 EUR;+ 23,50 EUR de envío;desde Bélgica;
Nintendo Game Boy Color - Magical Drop - PAL - EUR;14,99 EUR;+ 5,00 EUR de envío;desde Francia;
Magical Drop (Nintendo Game Boy Color, 2000);20,87 EUR;+ 20,59 EUR de envío estimado;desde Reino Unido;
GBC-Magical Drop para Nintendo Gameboy Color;4,95 EUR;+ 9,95 EUR de envío;desde Alemania;
Nintendo Game Boy Color - Notice Magical Drop - EUR;3,90 EUR;+ 6,70 EUR de envío;desde Francia;
Magical Drop (losse cassette) Nintendo GameBoy Color GBC;6,97 EUR;+ 20,00 EUR de envío;desde Países Bajos;
Magical Drop GBC SEALED / PRECINTADO PAL EUR Game Boy Color;59,00 EUR;Envío no especificado;desde España;
Magical Drop Nintendo Game Boy Color 2000 GBC Cartucho sólo auténtico raro;29,97 EUR;Envío gratis;desde Estados Unidos;
Nuevo anuncioMagical Drop Nintendo Game Boy Color GAMEBOY Data East 100% completo en caja nos menta completa;94,22 EUR;+ 4,27 EUR de envío;desde Estados Unidos;
Magical Drop (Game Boy Color, Game Boy Color 2000) H-Costura Sellada! - Ultra Poco común! - ex!;428,31 EUR;Envío gratis;desde Estados Unidos;
Magical Drop Nintendo Game Boy Color Gbc Caja Manual Insertos cartel sólo Sin Juego;68,49 EUR;Envío gratis;desde Estados Unidos;
Magical Drop-auténtico-NINTENDO GAME BOY COLOR GBC-Solo Manual!;18,79 EUR;Envío gratis;desde Estados Unidos;
Magical Drop Vga clasificados 85 NINTENDO GAMEBOY COLOR GBC Nuevo en caja verdadero Nueva Sellado;428,31 EUR;Envío gratis;desde Estados Unidos;
