Dr. Franken 2 II Nintendo Game Boy DMG | Carro-Original-Libre P&P;11,70 EUR;+ 16,66 EUR de envío estimado;desde Reino Unido;
NINTENDO GAME BOY-Dr. Franken II (en Caja);103,48 EUR;Envío internacional gratis;desde Reino Unido;
Dr. Franken 2-Nintendo Game Boy (solo Cartucho);8,49 EUR;+ 4,69 EUR de envío;desde Reino Unido;
Nintendo Game Boy Dr. Franken II FAH Très Bon état;34,90 EUR;+ 11,98 EUR de envío;desde Francia;
NINTENDO GAME BOY-Dr. Franken II (BOXED2);103,48 EUR;Envío internacional gratis;desde Reino Unido;
Dr. Franken II Nintendo GameBoy Cartucho De Juego Original;10,53 EUR;+ 6,44 EUR de envío;desde Reino Unido;
NINTENDO GAME BOY-Dr. Franken (en Caja);105,35 EUR;+ 23,07 EUR de envío estimado;desde Reino Unido;
Super Mario Land/Bust a Move 4 y el Dr. Franken 2 Nintendo Game Boy Paquete;25,77 EUR;+ 16,91 EUR de envío estimado;desde Reino Unido;
Nintendo Gameboy En Caja Juego-Dr. Franken;31,58 EUR;+ 17,02 EUR de envío estimado;desde Reino Unido;
Dr. Franken II (2) - GAMEBOY Juego-EE. UU.;8,77 EUR;+ 16,60 EUR de envío estimado;desde Reino Unido;
Nintendo Gameboy Juego-Dr. Franken;11,65 EUR;+ 16,66 EUR de envío estimado;desde Reino Unido;
Nintendo Gameboy Juego-Dr. Franken;11,65 EUR;+ 16,66 EUR de envío estimado;desde Reino Unido;
Nintendo Gameboy Juego-Dr. Franken;11,65 EUR;+ 16,66 EUR de envío estimado;desde Reino Unido;
Nintendo Gameboy Juego-Dr. Franken II 2;11,65 EUR;+ 16,66 EUR de envío estimado;desde Reino Unido;
Nintendo Gameboy Juego-Dr. Franken;11,65 EUR;+ 16,66 EUR de envío estimado;desde Reino Unido;
Dr. Franken 2-Nintendo Game Boy (cartucho, caja Y Manual);16,40 EUR;+ 17,86 EUR de envío estimado;desde Reino Unido;
Dr. Franken 2 Cartucho sólo Gameboy;14,04 EUR;+ 16,69 EUR de envío estimado;desde Reino Unido;
Nintendo GameBoy juego - Dr. Franken en el embalaje usado;48,99 EUR;+ 69,99 EUR de envío;desde Alemania;
Manual De Nintendo Gameboy-Dr. Franken;11,55 EUR;+ 16,64 EUR de envío estimado;desde Reino Unido;
Dr. Franken II | Nintendo Game Boy UKV | Sin Caja;11,70 EUR;Envío no especificado;desde Reino Unido;
NINTENDO GAMEBOY GB Game Dr. Franken II;14,04 EUR;Envío no especificado;desde Reino Unido;
Dr. Franken Nintendo Gameboy Juego Cartucho Solo;10,75 EUR;Envío no especificado;desde Reino Unido;
