Quarth Game Boy USA;69,00 EUR;Envío internacional gratis;desde Francia;
Quarth Nintendo Game Boy Color Advance Juego Solo Carro Genuino Konami;40,94 EUR;+ 7,03 EUR de envío;desde Reino Unido;
Vintage Video Juego Nintendo GameBoy Quarth * Importado Japonés *;17,57 EUR;+ 11,13 EUR de envío;desde Reino Unido;
Nintendo Game Boy-Quarth (en Caja);93,64 EUR;+ 14,00 EUR de envío;desde Reino Unido;
Ultra Quarth Game Boy Spiel #1485;18,21 EUR;+ 15,28 EUR de envío;desde Suiza;
Nintendo Game Boy Handheld Consola Juego-Quarth-juego de NTSC;17,56 EUR;+ 11,12 EUR de envío;desde Reino Unido;
Quarth - Booklet Only | Nintendo GameBoy🕹| Instruction Manual | NOE;5,00 EUR;+ 1,75 EUR de envío;desde Países Bajos;
Quarth Nintendo Gameboy Japonés Original Cartucho De Juego DMG-qrj #3;10,53 EUR;+ 16,63 EUR de envío estimado;desde Reino Unido;
Quarth Nintendo Gameboy Japonés Original Cartucho De Juego DMG-qrj #2;10,53 EUR;+ 16,63 EUR de envío estimado;desde Reino Unido;
Quarth Nintendo Gameboy Japonés Original Cartucho De Juego DMG-qrj;10,53 EUR;+ 16,63 EUR de envío estimado;desde Reino Unido;
Quarth ultra para GameBoy color y advance;9,99 EUR;+ 7,00 EUR de envío;desde Alemania;
Quarth // Nintendo Gameboy - Cartucho // USA;9,95 EUR;+ 14,95 EUR de envío;desde España;
Original Gameboy Quarth Nintendo * LOOSE CARTRIDGE & COVER *;10,00 EUR;+ 14,00 EUR de envío;desde Bélgica;
Quarth ultra Nintendo Gameboy USK 6;13,79 EUR;+ 9,99 EUR de envío;desde Alemania;
Quarth Game boy Region libre USA Cartucho Envio Combinado ;9,90 EUR;Envío no especificado;desde España;
Notice / Booklet - Quarth - USA - Game Boy - No Annotation;9,00 EUR;Envío no especificado;desde Francia;
Notice / Booklet - Quarth - USA - Game Boy - No Annotation;9,00 EUR;Envío no especificado;desde Francia;
