Nintendo Game Boy Classic Mickey's Dangerous Chase con embalaje original y guía Noe;49,90 EUR;+ 8,99 EUR de envío;desde Alemania;
Nintendo Game boy DMG-001 1989 Classic Originale + Mickey's Dangerous Chase;64,99 EUR;Envío no especificado;desde Alemania;
Mickey's Dangerous Chase (Mickey's Dangerous Chase) Nintendo Game Boy ? Clásico de GameBoy ? Aceptable ;4,90 EUR;Envío no especificado;desde Alemania;
Mickey's Dangerous Chase - Game Boy - DMG-MC-EUR;6,00 EUR;Envío no especificado;desde España;
Game Boy Mickey's Dangerous Chase DMG-mc-EUR OVP & instrucciones cib Nintendo Top;59,95 EUR;Envío no especificado;desde Alemania;
Mickey's Dangerous Chase Nintendo Gameboy OVP cib Boxed;30,90 EUR;Envío no especificado;desde Alemania;
Mickey's Dangerous Chase-Capcom-Game Boy juego-módulo & instrucciones;12,99 EUR;+ 6,90 EUR de envío;desde Alemania;
Nintendo Game Boy Mickey's Dangerous Chase FAH Très Bon état;9,90 EUR;+ 14,98 EUR de envío;desde Francia;
Mickey's Dangerous Chase GameBoy GIG ITA topolino (no zelda kid dracula pokemon);279,99 EUR;+ 16,99 EUR de envío;desde Italia;
Nintendo Game Boy Mickey's Dangerous Chase USA Très Bon état;6,90 EUR;+ 11,98 EUR de envío;desde Francia;
Nintendo Game Boy Mickey's Dangerous Chase EUR Très Bon état #1;7,90 EUR;+ 11,98 EUR de envío;desde Francia;
Nintendo Game Boy Mickey's Dangerous Chase UKV Bon état;7,90 EUR;+ 11,98 EUR de envío;desde Francia;
Gameboy -- Mickey's Dangerous Chase -- Game jeux giocchi;4,99 EUR;+ 4,99 EUR de envío;desde Alemania;
Nintendo Game Boy - Mickey's Dangerous Chase - USA;5,99 EUR;+ 5,00 EUR de envío;desde Francia;
Mickey's Dangerous Chase - EUR - Nintendo Gameboy;6,00 EUR;+ 25,00 EUR de envío;desde Países Bajos;
Mickey's Dangerous Chase (Game Boy GB 1991) Solo Cartucho;9,90 EUR;+ 12,90 EUR de envío;desde España;
Mickey's Dangerous Chase (Mickey's Dangerous Chase) Nintendo GameBoy ? MÓDULO SOLAMENTE ? CONDICIÓN MUY BUENA;5,90 EUR;+ 35,00 EUR de envío;desde Alemania;
Mickey's Dangerous Chase - NOE - Nintendo Gameboy Classic;25,00 EUR;+ 25,00 EUR de envío;desde Países Bajos;
Mickey's Dangerous Chase (Game Boy GB 1991) Solo Cartucho;9,90 EUR;+ 12,90 EUR de envío;desde España;
Mickey's Dangerous Chase (Game Boy GB 1991) Solo Cartucho;9,90 EUR;+ 12,90 EUR de envío;desde España;
GAME BOY Mickey's Dangerous Chase USA NINTENDO COLOR ADVANCE CARTOUCHE SEULE;7,00 EUR;+ 15,00 EUR de envío;desde Francia;
Mickey's Dangerous Chase para Nintendo GameBoy;4,75 EUR;+ 9,99 EUR de envío;desde Alemania;
Mickey's Dangerous Chase (Nintendo Gameboy) PAL módulo;5,95 EUR;+ 9,50 EUR de envío;desde Alemania;
Notice Nintendo Game Boy Mickey's Dangerous Chase EUR Très Bon état;14,90 EUR;+ 11,98 EUR de envío;desde Francia;
Notice NIntendo Game Boy  Mickey's Dangerous Chase FAH Très Bon état;14,90 EUR;+ 11,98 EUR de envío;desde Francia;
Notice Nintendo GB Game Boy Mickey's Dangerous Chase FAH, Très Bon état;14,90 EUR;+ 11,98 EUR de envío;desde Francia;
