Taz-Mania Juego Boy Nintendo Gameboy probado, muy Buen Estado;5,25 EUR;+ 18,60 EUR de envío estimado;Vendidos  22 ago 2021Artículo vendido;desde Reino Unido;
Taz-Mania (losse cassette) nintendo gameboy gb;4,95 EUR;+ 20,00 EUR de envío;Vendidos  19 ago 2021Artículo vendido;desde Países Bajos;
Taz-Mania-Nintendo Game Boy-Probado-Cartucho únicamente;6,98 EUR;+ 12,77 EUR de envío;Vendidos  16 ago 2021Artículo vendido;desde Reino Unido;
Taz-Mania-Nintendo Gameboy-Cartucho únicamente;6,28 EUR;+ 16,47 EUR de envío estimado;Vendidos  31 jul 2021Artículo vendido;desde Reino Unido;
Nintendo Gameboy Game Boy Taz-Mania 2 Cartucho De Juego;5,97 EUR;Envío gratis;Vendidos  15 sep 2021Artículo vendido;desde Estados Unidos;
Nintendo Game Boy Taz-Mania Video Juego ver Tienda! envío Gratuito!;1,70 EUR;+ 5,12 EUR de envío;Vendidos  3 sep 2021Artículo vendido;desde Estados Unidos;
Taz-Mania-Juego Boy GB Con Manual;8,52 EUR;+ 3,83 EUR de envío;Vendidos  2 sep 2021Artículo vendido;desde Estados Unidos;
Taz-Mania Nintendo Game Boy limpiado & probado Auténtico;7,67 EUR;Envío gratis;Vendidos  29 ago 2021Artículo vendido;desde Estados Unidos;
Nintendo Gameboy Juegos (x5): Bugs Bunny, Toy Story, Taz-Mania y más,! Funcionando!;17,01 EUR;Envío gratis;Vendidos  28 ago 2021Artículo vendido;desde Estados Unidos;
Taz-Mania 1 (Nintendo Gameboy Game Boy GB) Auténtico. juego y manual de instrucciones;17,06 EUR;+ 3,50 EUR de envío;Vendidos  25 ago 2021Artículo vendido;desde Estados Unidos;
Taz-Mania, Nintendo Game Boy, carro de juego solamente, Probado;3,54 EUR;+ 3,41 EUR de envío;Vendidos  23 ago 2021Artículo vendido;desde Estados Unidos;
Taz-Mania (Original Nintendo Game Boy) juego probado +! Funcionando!;7,25 EUR;Envío gratis;Vendidos  6 ago 2021Artículo vendido;desde Estados Unidos;
Taz-Mania (Nintendo Game Boy) - Solo juego-auténticos-Probado;3,41 EUR;+ 3,58 EUR de envío;Vendidos  5 ago 2021Artículo vendido;desde Estados Unidos;
Taz-Mania-Nintendo Game Boy Auténtico-Color;6,78 EUR;Envío gratis;Vendidos  2 ago 2021Artículo vendido;desde Estados Unidos;
Taz-Mania 2 (Nintendo Game Boy, 1994) Con Manual Probado Funcionando;16,20 EUR;Envío gratis;Vendidos  26 jul 2021Artículo vendido;desde Estados Unidos;
Taz-Mania (Nintendo Game Boy) Gameboy;6,81 EUR;Envío gratis;Vendidos  12 jul 2021Artículo vendido;desde Estados Unidos;
Taz-Mania-Nintendo Gameboy;8,44 EUR;Envío gratis;Vendidos  12 jul 2021Artículo vendido;desde Estados Unidos;
Taz-Mania 1 (Nintendo Gameboy Game Boy GB) Auténtico, Probado;11,00 EUR;Envío gratis;Vendidos  12 jul 2021Artículo vendido;desde Estados Unidos;
Taz-Mania-Sega Mega Drive Juego (probado-Envío Rápido-Pal);6,98 EUR;+ 17,88 EUR de envío estimado;Vendidos  18 sep 2021Artículo vendido;desde Reino Unido;
Taz-Mania-Sega Mega Drive Juego-solo carro sin Caja Ni Manual;8,73 EUR;+ 5,83 EUR de envío;Vendidos  5 sep 2021Artículo vendido;desde Reino Unido;
Sega Master Sistema Pal juego Taz-Mania-Completo con Manual libre de Reino Unido P&p;12,81 EUR;+ 16,60 EUR de envío estimado;Vendidos  16 sep 2021Artículo vendido;desde Reino Unido;
Taz-Mania SEGA Master Sistema Pal juego en caja;