Game Boy Color GBA color Tabaluga juego buen estado con embalaje original manual catálogo;28,90 EUR;Envío no especificado;desde Alemania;
Tabaluga - 1999-Infogrames-Game Boy Color juego módulo con Case (cubierta protectora);7,77 EUR;+ 6,90 EUR de envío;desde Alemania;
Tabaluga (Nintendo Game Boy Color, 1999);3,49 EUR;+ 5,99 EUR de envío;desde Alemania;
Tabaluga | Nintendo Game Boy juego | gameboy color módulo | bien;5,45 EUR;+ 2,25 EUR de envío;desde Alemania;
Tabaluga-gameboy color juego módulo-usado, probado función;6,66 EUR;+ 6,90 EUR de envío;desde Alemania;
Tabaluga en OVP con instrucciones Nintendo Gameboy Color juego Boxed;13,99 EUR;+ 9,00 EUR de envío;desde Alemania;
GBC-Tabaluga para Nintendo Gameboy Color;4,95 EUR;+ 9,95 EUR de envío;desde Alemania;
Gameboy Color juego-Tabaluga (módulo) 10822302;5,98 EUR;+ 67,99 EUR de envío;desde Alemania;
Tabaluga (Nintendo Game Boy Color, 1999);5,00 EUR;Envío no especificado;desde Alemania;
Tabaluga gameboy color OVP cib Boxed;19,90 EUR;Envío no especificado;desde Alemania;
Gameboy Color Tabaluga completamente en usadas OVP;15,99 EUR;Envío no especificado;desde Alemania;
Tabaluga para gameboy color y Advance;4,99 EUR;Envío no especificado;desde Alemania;
Tabaluga (Nintendo Game Boy Color 1999 ) German Import;7,39 EUR;+ 6,04 EUR de envío;desde Canadá;
Tabaluga Game Boy Gameboy Color (Solo Manual) F;6,61 EUR;+ 6,39 EUR de envío;desde Francia;
