Gameboy Kirby's Dream Land;11,00 EUR;+ 3,70 EUR de envío;desde Alemania;
Kirby's Dream Land Game Boy - Nintendo gameboy;13,99 EUR;+ 10,00 EUR de envío;desde Francia;
Kirby's Dream Land 2 Jeu Nintendo Game Boy en Anglais NTSC-US USA;24,99 EUR;+ 3,00 EUR de envío;desde Francia;
Kirby's Dream Land 2 - Nintendo Game boy - NTSC-J JAP;9,17 EUR;+ 3,00 EUR de envío;desde Francia;
Kirby's Dream Land (Game Boy GB 1992) Solo Cartucho;22,00 EUR;+ 12,90 EUR de envío;desde España;
Game Boy Kirby's Dream Land 2 DMG-akbp-frg OVP & instrucciones cib Kirbys Nintendo;119,95 EUR;Envío no especificado;desde Alemania;
Kirby's Dream Land - Nintendo Game Boy GB DMG - FAH - 100% Original ;19,00 EUR;+ 9,90 EUR de envío;desde Francia;
Kirby's Dream Land 2 - Nintendo Game boy -  PAL Eur - Cartucho 100% original;38,50 EUR;Envío no especificado;desde España;
Nintendo Game Boy Kirby's Dream Land Classics Vers. EUR voir descriptif;56,00 EUR;Envío no especificado;desde Francia;
Genuine Kirby's Dream Land 2 para Nintendo Game Boy japonés Probado;11,62 EUR;+ 16,54 EUR de envío estimado;desde Reino Unido;
Genuine Kirby's Dream Land 2 para Nintendo Game Boy japonés Probado;5,80 EUR;+ 16,43 EUR de envío estimado;desde Reino Unido;
Kirby's Dream Land + Pinball Land Nintendo Game Boy Color Advance Paquete De Juegos;39,48 EUR;+ 17,04 EUR de envío estimado;desde Reino Unido;
Nintendo Gameboy dmg Kirby's Dream Land Genuino Carro;23,25 EUR;+ 11,63 EUR de envío;desde Reino Unido;
Kirby's Dream Land-Nintendo Game Boy probada cartucho sólo;16,27 EUR;+ 12,73 EUR de envío;desde Reino Unido;
Kirby's Dream Land-Juego Boy Usa Solo Carro Probado;16,27 EUR;+ 16,62 EUR de envío estimado;desde Reino Unido;
Nuevo anuncioKirby's Dream Land-Nintendo Game Boy-Completo en Caja Completo En Caja;63,07 EUR;+ 6,82 EUR de envío;desde Portugal;
Kirby's Dream Land 1 / 2 Jeux Nintendo Game Boy FAH;99,90 EUR;+ 10,00 EUR de envío;desde Francia;
Kirby's Dream Land pour Game Boy;25,00 EUR;+ 5,50 EUR de envío;desde Francia;
Kirby's Dream Land 2 - REPRO box with insert - GB/ GAMEBOY. HQ!;11,21 EUR;+ 5,17 EUR de envío;desde Polonia;
Kirby's Dream Land (Game Boy GB 1992) solo cartucho;22,00 EUR;+ 12,90 EUR de envío;desde España;
Nintendo GameBoy Kirby's Dream Land cartucho de juego poco común;13,36 EUR;+ 18,34 EUR de envío estimado;desde Reino Unido;
Kirby's Dream Land ~ Nintendo GAME BOY JUEGO ~ Color ~ GBA Advance SP ~ Original;15,11 EUR;+ 11,62 EUR de envío;desde Reino Unido;
Kirby's Dream Land para Nintendo GameBoy;13,99 EUR;+ 9,99 EUR de envío;desde Alemania;
1992 Kirby's Dream Land Game Boy Vintage Pequeño Cartel Promo/AD página Enmarcado;42,60 EUR;+ 14,48 EUR de envío;desde Alemania;
