Jurassic Park De Vídeo Juego Para Nintendo Game Boy PAL Probado;9,36 EUR;+ 18,93 EUR de envío estimado;Vendidos  15 sep 2021Artículo vendido;desde Reino Unido;
Nintendo Game Boy Classic juego Jurassic Park módulo Noe;14,90 EUR;+ 8,99 EUR de envío;Vendidos  12 sep 2021Artículo vendido;desde Alemania;
Jurassic Park 3 Parque constructor-Nintendo Gameboy Advance Juego-Jurassic Park III;23,41 EUR;+ 20,60 EUR de envío estimado;Vendidos  4 sep 2021Artículo vendido;desde Reino Unido;
Nintendo Gameboy-Jurassic Park-Embalaje original-Top-pal-Ocean;89,90 EUR;Envío no especificado;Vendidos  1 sep 2021Artículo vendido;desde Alemania;
Jurassic Park Nintendo Game Boy original juego Pak (con Estuche) en en muy buena condición;11,69 EUR;+ 18,16 EUR de envío estimado;Vendidos  30 ago 2021Artículo vendido;desde Reino Unido;
The Lost World Jurassic Park-Game Boy módulo-Nintendo Gameboy-Top estado;28,49 EUR;Envío no especificado;Vendidos  23 ago 2021Artículo vendido;desde Alemania;
Jurassic Park De Vídeo Juego Para Nintendo Game Boy PAL Probado;11,69 EUR;+ 16,65 EUR de envío estimado;Vendidos  17 ago 2021Artículo vendido;desde Reino Unido;
Jurassic Park * juego BOY PAL *;9,35 EUR;+ 16,60 EUR de envío estimado;Vendidos  8 ago 2021Artículo vendido;desde Reino Unido;
Jurassic Park Nintendo GameBoy Cartucho y Manual Solamente;10,46 EUR;+ 16,62 EUR de envío estimado;Vendidos  6 ago 2021Artículo vendido;desde Reino Unido;
Jurassic Park 3 Parque constructor-Nintendo Gameboy Advance Juego-Jurassic Park III;26,86 EUR;+ 18,83 EUR de envío estimado;Vendidos  5 ago 2021Artículo vendido;desde Reino Unido;
Jurassic Park ** ** Oficial Nintendo Gameboy Cartucho versión UK;7,32 EUR;+ 16,56 EUR de envío estimado;Vendidos  1 ago 2021Artículo vendido;desde Reino Unido;
Gameboy juego-Jurassic Park-usado probado;13,45 EUR;Envío no especificado;Vendidos  30 jul 2021Artículo vendido;desde Alemania;
Jurassic Park Gameboy juego! busque en la tienda!;9,36 EUR;+ 18,35 EUR de envío estimado;Vendidos  28 jul 2021Artículo vendido;desde Reino Unido;
Jurassic Park NINTENDO GAMEBOY Juego Original Oficial Carro De Reino Unido * * Probado Funcionando;14,04 EUR;+ 16,68 EUR de envío estimado;Vendidos  25 jul 2021Artículo vendido;desde Reino Unido;
Jurassic Park III Park constructor Nintendo Game Boy Advance GBA solo carro;11,65 EUR;+ 16,65 EUR de envío estimado;Vendidos  25 jul 2021Artículo vendido;desde Reino Unido;
Jurassic Park, Boy Juego, Sin Caja De Juego, Plástico Transparente Nintendo caso juego;14,05 EUR;+ 16,68 EUR de envío estimado;Vendidos  22 jul 2021Artículo vendido;desde Reino Unido;
Nintendo Gameboy Juego-Jurassic Park-Sólo cartucho genuino-Probado Libre P&P;11,69 EUR;+ 16,65 EUR de envío estimado;Vendidos  14 jul 2021Artículo vendido;desde Reino Unido;
Jurassic Park Nintendo Gameboy solo carro;10,48 EUR;+ 16,62 EUR de envío estimado;Vendidos  13 jul 2021Artículo vendido;desde Reino Unido;
Jurassic Park El Mundo Perdido Nintendo Game Boy (más barato en eBay) GB Gameboy;24,58 EUR;+ 16,88 EUR de envío estimado;Vendidos  8 jul 2021Artículo vendido;desde Reino Unido;
Jurassic Park Dino ataque Nintendo Gameboy Advance GBA (probados);11,69 EUR;+ 20,16 EUR de envío estimado;Vendidos  6 jul 2021Artículo vendido;desde Reino Unido;
GAME BOY The Lost World Jurassic Park EUR NINTENDO COLOR ADVANCE CARTOUCHE SEULE;12,00 EUR;+ 15,00 EUR de envío;Vendidos  29 jun 2021Artículo vendido;desde Francia;
Jurassic Park (Nintendo Game Boy) -!!! top!!!;11,95 EUR;Envío no especificado;Vendidos  25 jun 2021Artículo vendido;desde Alemania;
