Dragon Quest III 3 - Nintendo Game Boy Color GBC JAP Japan complet (2);29,90 EUR;Envío no especificado;Vendidos  10 ago 2021Artículo vendido;desde Francia;
Dragon Quest III en caja Famicom Juego NTSC-J Japonés Importado;16,98 EUR;+ 5,86 EUR de envío;Vendidos  11 jul 2021Artículo vendido;desde Reino Unido;
Dragon Quest III Super Famicom en caja juego de NTSC-J Japonés Importado;15,23 EUR;+ 34,39 EUR de envío estimado;Vendidos  19 sep 2021Artículo vendido;desde Reino Unido;
Dragon Quest III Super Famicom en caja juego de NTSC-J Japonés Importado;20,80 EUR;+ 34,49 EUR de envío estimado;Vendidos  29 ago 2021Artículo vendido;desde Reino Unido;
Dragon Quest III/3 Nintendo Famicom Juego NTSC-J Japonés Importado;3,51 EUR;+ 5,86 EUR de envío;Vendidos  5 sep 2021Artículo vendido;desde Reino Unido;
Dragon Quest III Jeu Super Nintendo / SNES - Game Retro Video - PAL EUR ;35,50 EUR;Envío internacional gratis;Vendidos  18 sep 2021Artículo vendido;desde Francia;
Dragon Quest III-Famicom juego;10,53 EUR;+ 17,76 EUR de envío estimado;Vendidos  16 jul 2021Artículo vendido;desde Reino Unido;
Dragon Quest III 3- Nintendo Game Soundtrack JAPAN PROMO CD *SEALED NEW* 1996;46,84 EUR;+ 15,81 EUR de envío;Vendidos  5 jul 2021Artículo vendido;desde Reino Unido;
