Nintendo GameBoy Color game - Tonka Construction Site cartridge;12,77 EUR;Envío internacional gratis;desde Alemania;
Nintendo GameBoy Color jeu - Tonka Construction Site cartouche utilisé;16,99 EUR;Envío internacional gratis;desde Alemania;
Nintendo GameBoy Color - Tonka Construction Site cartouche avec manuel utilisÃ©;34,99 EUR;Envío internacional gratis;desde Alemania;
Nintendo GameBoy Color gioco - Tonka Construction Site cartuccia usato;18,99 EUR;Envío internacional gratis;desde Alemania;
Nintendo GameBoy Color game - Tonka Construction Site cartridge with manual;31,59 EUR;Envío internacional gratis;desde Alemania;
Nintendo GameBoy Color - Tonka Construction Site cartuccia con il manuale usato;36,99 EUR;Envío internacional gratis;desde Alemania;
Nintendo GameBoy Color juego - Tonka Construction Site cartucho usado;18,99 EUR;Envío internacional gratis;desde Alemania;
Nintendo GameBoy Color juego - Tonka Construction Site cartucha con manual usado;36,99 EUR;Envío internacional gratis;desde Alemania;
