Nintendo Game Boy Advance Earthworm Jim con embalaje original y guía EUR;39,90 EUR;+ 8,99 EUR de envío;Vendidos  15 sep 2021Artículo vendido;desde Alemania;
Earthworm Jim Menace 2 The Galaxy Nintendo Game Boy Colour GBA PAL;6,98 EUR;+ 16,49 EUR de envío estimado;Vendidos  5 sep 2021Artículo vendido;desde Reino Unido;
Nintendo Gameboy Advance En Caja-Earthworm Jim;26,19 EUR;+ 16,84 EUR de envío estimado;Vendidos  4 sep 2021Artículo vendido;desde Reino Unido;
Mystical Ninja protagonizada por Goemon & Earthworm Jim-Nintendo Gameboy Juegos Raro;34,98 EUR;+ 17,00 EUR de envío estimado;Vendidos  2 sep 2021Artículo vendido;desde Reino Unido;
Earthworm Jim  gioco videogioco Nintendo Game Boy Advance funzionante;13,99 EUR;+ 1,00 EUR de envío;Vendidos  21 ago 2021Artículo vendido;desde Italia;
Nintendo Gameboy En Caja Completo-Earthworm Jim 2;32,59 EUR;+ 16,95 EUR de envío estimado;Vendidos  21 ago 2021Artículo vendido;desde Reino Unido;
Earthworm Jim: Menace 2 the Galaxy Juego Boy Color Cartucho sólo 1999-Libre P&P;6,70 EUR;+ 16,49 EUR de envío estimado;Vendidos  20 ago 2021Artículo vendido;desde Reino Unido;
Earthworm Jim Menace 2 The Galaxy Nintendo Game Boy Color;6,41 EUR;+ 16,49 EUR de envío estimado;Vendidos  11 ago 2021Artículo vendido;desde Reino Unido;
Earthworm Jim Gameboy Advance Gba EUR;9,32 EUR;+ 18,67 EUR de envío estimado;Vendidos  18 jul 2021Artículo vendido;desde Reino Unido;
Earthworm Jim 2-Game Boy Advance GBA Juego;47,74 EUR;+ 3,37 EUR de envío;Vendidos  21 sep 2021Artículo vendido;desde Estados Unidos;
Nintendo Gameboy Advance Earthworm Jim Con Manual;25,58 EUR;Envío gratis;Vendidos  21 sep 2021Artículo vendido;desde Estados Unidos;
Nintendo Gameboy Advance GBA Earthworm Jim cartucho sólo;12,78 EUR;Envío gratis;Vendidos  20 sep 2021Artículo vendido;desde Estados Unidos;
Earthworm Jim: Menace 2 The Galaxy Nintendo Game Boy Color * limpiado & Probado *;15,33 EUR;Envío gratis;Vendidos  20 sep 2021Artículo vendido;desde Estados Unidos;
Earthworm Jim (Nintendo Game Boy Advance, 2001);10,23 EUR;+ 3,50 EUR de envío;Vendidos  19 sep 2021Artículo vendido;desde Estados Unidos;
Earthworm Jim   [Gameboy Advance Game GBA] TESTED VGC UK PAL;9,32 EUR;+ 12,53 EUR de envío;Vendidos  17 sep 2021Artículo vendido;desde Reino Unido;
Earthworm Jim Nintendo Gameboy Advance Video Juego Cartucho;12,71 EUR;Envío gratis;Vendidos  13 sep 2021Artículo vendido;desde Estados Unidos;
Earthworm Jim (Nintendo Game Boy Advance, 2001);8,53 EUR;+ 2,86 EUR de envío;Vendidos  13 sep 2021Artículo vendido;desde Estados Unidos;
Earthworm Jim (Nintendo Game Boy Advance, 2001);10,23 EUR;+ 3,41 EUR de envío;Vendidos  7 sep 2021Artículo vendido;desde Estados Unidos;
Earthworm Jim (Game Boy, 2006) * Compre 2 lleve Q Libre + Envío Gratuito *;21,31 EUR;Envío gratis;Vendidos  7 sep 2021Artículo vendido;desde Estados Unidos;
Earthworm Jim (Nintendo Game Boy) Manual;8,49 EUR;+ 2,98 EUR de envío;Vendidos  7 sep 2021Artículo vendido;desde Estados Unidos;
Earthworm Jim (Nintendo Game Boy Advance, 2001);10,15 EUR;+ 3,54 EUR de envío;Vendidos  6 sep 2021Artículo vendido;desde Estados Unidos;
Earthworm Jim 2 Nintendo Gameboy Advance GBA caja tiene desgaste pesado Nueva;85,27 EUR;+ 3,80 EUR de envío;Vendidos  5 sep 2021Artículo vendido;desde Estados Unidos;
Earthworm Jim Nintendo Gameboy Advance Video Juego Cartucho;12,78 EUR;Envío gratis;Vendidos  4 sep 2021Artículo vendido;desde Estados Unidos;
Earthworm Jim Para El Nintendo Gameboy;12,70 EUR;Envío gratis;Vendidos  3 sep 2021Artículo vendido;desde Estados Unidos;
Earthworm Jim: Menace 2 The Galaxy (Nintendo Game Boy Color Auténtico, 1999);13,64 EUR;+ 3,41 EUR de envío;Vendidos  2 sep 2021Artículo vendido;desde Estados Unidos;
Earthworm Jim (Nintendo Game Boy Advance, 2001) - juego solamente;7,67 EUR;+ 3,80 EUR de envío;Vendidos  30 ago 2021Artículo vendido;desde Estados Unidos;
Earthworm Jim (Nintendo Gameboy Advance GBA) Cartucho Y Manual-auténtica;17,05 EUR;+ 4,26 EUR de envío;Vendidos  28 ago 2021Artículo vendido;desde Estados Unidos;
Earthworm Jim 2 (Nintendo Game Boy Advance, 2002) Cartridge Only;29,94 EUR;+ 11,97 EUR de envío;Vendidos  27 ago 2021Artículo vendido;desde Canadá;
Earthworm Jim (Nintendo Gameboy Advance, 2001)  CARTRIDGE ONLY;19,29 EUR;+ 13,30 EUR de envío;Vendidos  26 ago 2021Artículo vendido;desde Canadá;
Earthworm Jim (Nintendo Game Boy Advance, 2001);10,23 EUR;+ 3,41 EUR de envío;Vendidos  24 ago 2021Artículo vendido;desde Estados Unidos;
Earthworm Jim: Menace 2 the Galaxy, juego solo, Nintendo Gameboy (Color);11,08 EUR;Envío gratis;Vendidos  19 ago 2021Artículo vendido;desde Estados Unidos;
Earthworm Jim Nintendo Game Boy Advance GBA auténtico Funciona;12,14 EUR;+ 3,40 EUR de envío;Vendidos  18 ago 2021Artículo vendido;desde Estados Unidos;
Gameboy Silver Advance SP Sistema Metroid Self Four Swords Earthworm Jim Fusion;170,57 EUR;+ 6,91 EUR de envío;Vendidos  17 ago 2021Artículo vendido;desde Estados Unidos;
Earthworm Jim GBA Gameboy avanzada;12,78 EUR;Envío gratis;Vendidos  15 ago 2021Artículo vendido;desde Estados Unidos;
Earthworm Jim (Nintendo Game Boy Advance, 2001);8,44 EUR;+ 3,62 EUR de envío;Vendidos  13 ago 2021Artículo vendido;desde Estados Unidos;
Earthworm Jim (Nintendo Game Boy, 1995) liberado probado auténtico cartucho sólo;14,07 EUR;+ 3,80 EUR de envío;Vendidos  13 ago 2021Artículo vendido;desde Estados Unidos;
Earthworm Jim Menace 2 the Galaxy, Nintendo Game Boy Color, juego de 1999, solo carro;9,34 EUR;+ 3,41 EUR de envío;Vendidos  9 ago 2021Artículo vendido;desde Estados Unidos;
Earthworm Jim Game Boy Advance GBA Game Only 100% AUTHENTIC;13,30 EUR;+ 11,97 EUR de envío;Vendidos  8 ago 2021Artículo vendido;desde Canadá;
Earthworm Jim (Nintendo Gameboy Advance GBA). solo carro PROBADO/OBRAS.;10,58 EUR;+ 3,80 EUR de envío;Vendidos  8 ago 2021Artículo vendido;desde Estados Unidos;
Earthworm Jim 2 (Nintendo Game Boy Advance) - probado y funciona, auténtico Carro;25,54 EUR;+ 3,50 EUR de envío;Vendidos  6 ago 2021Artículo vendido;desde Estados Unidos;
Earthworm Jim 2 Gameboy Advance GBA auténtico Cartucho en Caja Caja de carro completo manual;110,83 EUR;+ 3,58 EUR de envío;Vendidos  6 ago 2021Artículo vendido;desde Estados Unidos;
Earthworm Jim Menace 2 The Galaxy (Nintendo Game Boy Color, 1999) Sólo Cartucho;13,64 EUR;Envío gratis;Vendidos  5 ago 2021Artículo vendido;desde Estados Unidos;
Earthworm Jim (Nintendo Gameboy Advance GBA). solo carro PROBADO/OBRAS.;10,23 EUR;+ 2,72 EUR de envío;Vendidos  3 ago 2021Artículo vendido;desde Estados Unidos;
Earthworm Jim 2 (Nintendo Game Boy Advance) - probado y funciona, auténtico Carro;17,01 EUR;+ 3,80 EUR de envío;Vendidos  2 ago 2021Artículo vendido;desde Estados Unidos;
Earthworm Jim (Nintendo Game Boy Advance, 2001);11,09 EUR;+ 3,80 EUR de envío;Vendidos  2 ago 2021Artículo vendido;desde Estados Unidos;
* Auténtico * Earthworm Jim 2 (Nintendo Game Boy Advance, 2002) Sellado * Nueva *;68,23 EUR;+ 2,35 EUR de envío;Vendidos  1 ago 2021Artículo vendido;desde Estados Unidos;
Earthworm Jim Nintendo Game Boy y Estuche auténtico Original Retro Clásico Probado;16,16 EUR;Envío gratis;Vendidos  30 jul 2021Artículo vendido;desde Estados Unidos;
Mega Drive Juego Earthworm Jim Sega En Caja Con Manual;34,96 EUR;+ 17,00 EUR de envío estimado;Vendidos  19 jul 2021Artículo vendido;desde Reino Unido;
Earthworm Jim 2 -  Super Nintendo / SNES Jeu Game Video Retrogaming - PAL EUR ;35,99 EUR;Envío internacional gratis;Vendidos  7 sep 2021Artículo vendido;desde Francia;
Mega Drive Juego Earthworm Jim Sega En Caja Con Manual | PAL;34,96 EUR;+ 20,73 EUR de envío estimado;Vendidos  15 ago 2021Artículo vendido;desde Reino Unido;
Earthworm Jim-Sega Mega Drive Juego (probado-Env��o Rápido-Pal);23,26 EUR;+ 20,40 EUR de envío estimado;Vendidos  19 sep 2021Artículo vendido;desde Reino Unido;
Earthworm Jim-Sega Mega Drive Juego (probado-Envío Rápido-Pal);17,43 EUR;+ 18,08 EUR de envío estimado;Vendidos  4 sep 2021Artículo vendido;desde Reino Unido;
Earthworm Jim 2-Sega Mega Drive Juego (probado-Envío Rápido-Pal);23,26 EUR;+ 18,19 EUR de envío estimado;Vendidos  4 sep 2021Artículo vendido;desde Reino Unido;
En Caja SEGA MEGADRIVE Earthworm Jim Completa Retro videojuego probado Manual PAL;33,75 EUR;+ 20,46 EUR de envío estimado;Vendidos  31 ago 2021Artículo vendido;desde Reino Unido;
* Earthworm Jim 2 * - 100% Original SEGA SATURN JUEGO-probado y trabajo-PAL;45,46 EUR;+ 20,67 EUR de envío estimado;Vendidos  4 jul 2021Artículo vendido;desde Reino Unido;
Earthworm Jim juego de Mega Drive;23,31 EUR;+ 19,41 EUR de envío estimado;Vendidos  2 jul 2021Artículo vendido;desde Reino Unido;
Earthworm Jim-PC CD-ROM juego 1999-Windows Activision;4,08 EUR;+ 9,09 EUR de envío;Vendidos  26 jul 2021Artículo vendido;desde Reino Unido;
Earthworm Jim 3D N64 Retro Vintage Nintendo 64 Juego;17,48 EUR;+ 20,41 EUR de envío estimado;Vendidos  26 ago 2021Artículo vendido;desde Reino Unido;
Earthworm Jim 3D-Pc Arcade Juego De Plataforma (nuevo);4,61 EUR;+ 3,44 EUR de envío;Vendidos  27 ago 2021Artículo vendido;desde Reino Unido;
Juego De Sega Genesis Earthworm Jim Cubierta FRIDGE MAGNET con Soporte;1,75 EUR;+ 5,83 EUR de envío;Vendidos  20 sep 2021Artículo vendido;desde Reino Unido;
Earthworm Jim (Computer Game & años 90 dibujos animados Camiseta para hombre de la serie de televisión);15,33 EUR;+ 16,64 EUR de envío estimado;Vendidos  6 jul 2021Artículo vendido;desde Reino Unido;
Mega Drive Juego Earthworm Jim Sega En Caja Con Manual;34,96 EUR;Envío no especificado;Vendidos  6 ago 2021Artículo vendido;desde Reino Unido;
