Yoshi's Cookie Game Boy FAH ;10,00 EUR;Envío internacional gratis;Vendidos  16 sep 2021Artículo vendido;desde Francia;
Yoshi's Cookie-GAMEBOY Juego-UKV;8,72 EUR;+ 16,49 EUR de envío estimado;Vendidos  9 ago 2021Artículo vendido;desde Reino Unido;
Yoshi's Cookie-japonés Nintendo Gameboy Juego en Caja;23,26 EUR;+ 16,76 EUR de envío estimado;Vendidos  8 ago 2021Artículo vendido;desde Reino Unido;
Yoshi's Cookie Yoshi Yoshis Game Boy GB Nintendo Pal ou Jap Japan Jpn NTSC-J;2,99 EUR;+ 1,50 EUR de envío;Vendidos  12 jul 2021Artículo vendido;desde Francia;
Genuine NINTENDO GAME BOY ORIGINAL juego Yoshi's Cookie Completo Caja Y Manual;23,21 EUR;+ 16,76 EUR de envío estimado;Vendidos  9 jul 2021Artículo vendido;desde Reino Unido;
Juego Yoshi's Cookie + Estuche Y Manual (Nintendo Game Boy, 1994) - Raro Original;15,12 EUR;+ 16,61 EUR de envío estimado;Vendidos  1 jul 2021Artículo vendido;desde Reino Unido;
Yoshi's Cookie (Nintendo Game Boy, 1993 GB) - Solo Cartucho-Auténticos;5,12 EUR;+ 3,80 EUR de envío;Vendidos  13 sep 2021Artículo vendido;desde Estados Unidos;
Yoshi's Cookie (Nintendo Game Boy, 1993) Cartucho [Excelente] probado Auténtico;6,92 EUR;Envío gratis;Vendidos  13 sep 2021Artículo vendido;desde Estados Unidos;
Yoshi's Cookie Nintendo Game Boy video juego y manual ~ probado y de trabajo;7,68 EUR;+ 4,26 EUR de envío;Vendidos  9 sep 2021Artículo vendido;desde Estados Unidos;
Yoshi's Cookie (Nintendo GameBoy GB) [Game Only];12,59 EUR;+ 1,30 EUR de envío;Vendidos  9 sep 2021Artículo vendido;desde Canadá;
Las cookies Yoshi's Cookie yossy Gameboy Nintendo CCC GB;8,53 EUR;+ 14,50 EUR de envío;Vendidos  2 sep 2021Artículo vendido;desde Japón;
Yoshi's Cookie (Nintendo Game Boy, 1993) W Manual Auténtico probado!;12,79 EUR;Envío gratis;Vendidos  2 sep 2021Artículo vendido;desde Estados Unidos;
Yoshi's Cookie Nintendo Game Boy Completa cerca de como nuevoITION Auténtico;59,70 EUR;Envío gratis;Vendidos  31 ago 2021Artículo vendido;desde Estados Unidos;
Yoshi's Cookie Nintendo Juego Original Boy * limpiado & Probado * forma agradable!;15,33 EUR;Envío gratis;Vendidos  29 ago 2021Artículo vendido;desde Estados Unidos;
Yoshi & Yoshi's Cookie Juego Boy Original * limpiado & Probado *! envío rápido!;17,03 EUR;Envío gratis;Vendidos  26 ago 2021Artículo vendido;desde Estados Unidos;
Yoshi's Cookie-Nintendo Game Boy, auténtico Cartucho, probado, Funciona & Ahorra;8,53 EUR;Envío gratis;Vendidos  25 ago 2021Artículo vendido;desde Estados Unidos;
Yoshi's Cookie + Sanrio Uranai Fiesta + J. League lucha Fútbol Japón ver GameBoy;5,12 EUR;+ 3,80 EUR de envío;Vendidos  22 ago 2021Artículo vendido;desde Estados Unidos;
Yoshi's Cookie (Nintendo Game Boy, 1993) - Probado Y Funcionando;8,10 EUR;+ 3,80 EUR de envío;Vendidos  22 ago 2021Artículo vendido;