Mighty Morphin Power Rangers La Película Nintendo Game Boy limpiado totalmente probado;12,78 EUR;+ 2,72 EUR de envío;Vendidos  9 sep 2021Artículo vendido;desde Estados Unidos;
Nintendo Game Boy Cartucho sólo probado Mighty Morphin Power Rangers: la Película;10,22 EUR;+ 3,79 EUR de envío;Vendidos  4 sep 2021Artículo vendido;desde Estados Unidos;
Mighty Morphin Power Rangers La Película Nintendo Game Boy FOLLETO Manual Retro;7,63 EUR;Envío gratis;Vendidos  31 ago 2021Artículo vendido;desde Estados Unidos;
Mighty Morphin Power Rangers-Nintendo Game Boy-Probado;4,26 EUR;+ 3,41 EUR de envío;Vendidos  30 ago 2021Artículo vendido;desde Estados Unidos;
Gameboy Mighty Morphin Power Rangers;13,62 EUR;Envío gratis;Vendidos  28 ago 2021Artículo vendido;desde Estados Unidos;
Mighty Morphin Power Rangers (Nintendo Gameboy, 1994) cartucho sólo probado;8,52 EUR;+ 3,79 EUR de envío;Vendidos  22 ago 2021Artículo vendido;desde Estados Unidos;
Auténtico Mighty Morphin Power Rangers-NINTENDO GAMEBOY GB Juego. envío gratuito;12,77 EUR;Envío gratis;Vendidos  19 ago 2021Artículo vendido;desde Estados Unidos;
Mighty Morphin Power Rangers (Nintendo Gameboy, 1994) Auténtico solo carro Probado;12,75 EUR;Envío gratis;Vendidos  11 ago 2021Artículo vendido;desde Estados Unidos;
Mighty Morphin Power Rangers (Nintendo Gameboy, 1994) cartucho sólo probado;12,27 EUR;Envío gratis;Vendidos  7 ago 2021Artículo vendido;desde Estados Unidos;
Mighty Morphin Power Rangers video juego Nintendo Game Boy Solo Manual;10,83 EUR;Envío gratis;Vendidos  5 ago 2021Artículo vendido;desde Estados Unidos;
Mighty Morphin Power Rangers (Nintendo Game Boy, 1994);19,59 EUR;+ 3,58 EUR de envío;Vendidos  3 ago 2021Artículo vendido;desde Estados Unidos;
Mighty Morphin Power Rangers La Película Con Manual Original Juego Boy * AUTÉNTICO *;29,79 EUR;Envío gratis;Vendidos  1 ago 2021Artículo vendido;desde Estados Unidos;
Mighty Morphin Power Rangers (Nintendo Game Boy, 1994) caso/manual incluido;18,74 EUR;Envío gratis;Vendidos  25 jul 2021Artículo vendido;desde Estados Unidos;
⭐⭐ ⭐⭐ auténtico Mighty Morphin Power Rangers-NINTENDO GAMEBOY GB Juego ⭐⭐⭐⭐;11,50 EUR;+ 3,79 EUR de envío;Vendidos  21 jul 2021Artículo vendido;desde Estados Unidos;
Mighty Morphin Power Rangers – Nintendo Gameboy;10,00 EUR;+ 11,00 EUR de envío;Vendidos  21 jul 2021Artículo vendido;desde Países Bajos;
Mighty Morphin Power Rangers La Película (Game Boy Color, 1995) Auténtico!;17,88 EUR;Envío gratis;Vendidos  17 jul 2021Artículo vendido;desde Estados Unidos;
Mighty Morphin Power Rangers La Película Nintendo Game Boy limpiado totalmente probado;17,03 EUR;Envío gratis;Vendidos  16 jul 2021Artículo vendido;desde Estados Unidos;
Mighty Morphin Power Rangers La Película (Game Boy Color, 1995) Auténtico!;15,33 EUR;Envío gratis;Vendidos  16 jul 2021Artículo vendido;desde Estados Unidos;
⭐⭐ ⭐⭐ auténtico Mighty Morphin Power Rangers-NINTENDO GAMEBOY GB Juego ⭐⭐⭐⭐;12,12 EUR;Envío gratis;Vendidos  13 jul 2021Artículo vendido;desde Estados Unidos;
Mighty Morphin Power Rangers (Nintendo Gameboy, 1994) cartucho sólo probado;11,20 EUR;Envío gratis;Vendidos  9 jul 2021Artículo vendido;desde Estados Unidos;
Mighty Morphin Power Rangers De Rescate Nintendo Gameboy Color Juego-Game Boy Color;3,23 EUR;+ 2,56 EUR de envío;Vendidos  2 jul 2021Artículo vendido;desde Estados Unidos;
Mighty Morphin Power Rangers (Nintendo Gameboy, 1994);4,25 EUR;+ 4,09 EUR de envío;Vendidos  2 jul 2021Artículo vendido;desde Estados Unidos;
Nintendo Gameboy Manual Authentic Mighty Morphin Power Rangers;10,02 EUR;+ 3,34 EUR de envío;Vendidos  21 jun 2021Artículo vendido;desde Canadá;
Legado Dragonzord-Mighty Morphin Power Rangers-power Rangers-Bandai Venta;467,92 EUR;+ 44,04 EUR de envío estimado;Vendidos  7 jul 2021Artículo vendido;desde Reino Unido;
Mighty Morphin Power Rangers Morpher;249,00 EUR;+ 23,10 EUR de envío;Vendidos  1 jul 2021Artículo vendido;desde Francia;
Mighty Morphin Power Rangers legado casco MMPR Red Ranger 1:1 Bandai;175,69 EUR;+ 38,71 EUR de envío estimado;Vendidos  15 sep 2021Artículo vendido;desde Reino Unido;
Mighty Morphin Power Rangers Vintage Paquete;140,55 EUR;+ 49,78 EUR de envío estimado;Vendidos  15 sep 2021Artículo vendido;desde Reino Unido;
Mighty Morphin Power Rangers Megazord heredados y verde-Completa En Caja;380,66 EUR;+ 52,99 EUR de envío estimado;Vendidos  22 ago 2021Artículo vendido;desde Reino Unido;
Mighty Morphin Power Rangers Original Thunder Megazord Deluxe 2 Pack Set 1993;146,41 EUR;+ 48,72 EUR de envío estimado;Vendidos  27 ago 2021Artículo vendido;desde Reino Unido;
Mighty Morphin Power Rangers legado casco MMPR Red Ranger 1:1 Bandai;117,11 EUR;+ 37,64 EUR de envío estimado;Vendidos  26 ago 2021Artículo vendido;desde Reino Unido;
1994 Bandai Mighty Morphin Power Rangers poder cúpula Playset casi completo;81,98 EUR;Envío no especificado;Vendidos  21 jun 2021Artículo vendido;desde Reino Unido;
Mighty Morphin Power Rangers Megazord Deluxe Set Caja Original Completo 1993 Juguete;197,94 EUR;+ 49,66 EUR de envío estimado;Vendidos  20 ago 2021Artículo vendido;desde Reino Unido;
1995 Mighty Morphin Power Rangers poder Blaster 5 armas en un Bandai Saban;105,40 EUR;+ 37,43 EUR de envío estimado;Vendidos  16 sep 2021Artículo vendido;desde Reino Unido;
Vintage Mighty Morphin Power Rangers poder Morpher con 1 moneda;81,98 EUR;+ 28,50 EUR de envío estimado;Vendidos  30 ago 2021Artículo vendido;desde Reino Unido;
Mighty Morphin Power Rangers legado Morpher Verde Blanco Ranger Tommy, Bandai;292,81 EUR;+ 51,15 EUR de envío estimado;Vendidos  12 ago 2021Artículo vendido;desde Reino Unido;
Mighty Morphin Power Rangers Ranger Original El Verde Tommy Moc Flip Cabeza Auto;93,64 EUR;+ 41,91 EUR de envío estimado;Vendidos  31 ago 2021Artículo vendido;desde Reino Unido;
Original Mighty Morphin Power Rangers Juguete JOBLOT Megazord Thunderzord Dragonzord;64,36 EUR;+ 36,70 EUR de envío estimado;Vendidos  10 jul 2021Artículo vendido;desde Reino Unido;
MMPR Verde Ranger Dragon Zord-Mighty Morphin Power Rangers Zord Ranger Verde;104,24 EUR;+ 42,33 EUR de envío estimado;Vendidos  13 sep 2021Artículo vendido;desde Reino Unido;
Mighty Morphin Power Rangers Blanco Ranger Saba Daga Repuestos & Reparaciones;22,24 EUR;+ 25,06 EUR de envío estimado;Vendidos  26 jul 2021Artículo vendido;desde Reino Unido;
Década de 1990 Bandai MMPR Mighty Morphin Power Rangers Deluxe Megazord 2260 En Caja;175,69 EUR;+ 53,88 EUR de envío estimado;Vendidos  17 jul 2021Artículo vendido;desde Reino Unido;
Mighty Morphin Power Rangers Dino Megazord 5 Zords 100% completo Dino NUEVO;104,24 EUR;+ 41,16 EUR de envío estimado;Vendidos  28 jul 2021Artículo vendido;desde Reino Unido;
Mighty Morphin Power Rangers poder alimentación Morpher & pistola/espada Vintage 1993 En Caja;105,40 EUR;+ 34,90 EUR de envío estimado;Vendidos  27 jul 2021Artículo vendido;desde Reino Unido;
Mighty Morphin Power Rangers Mmpr Lightning Colección Daga Dragón Verde;115,95 EUR;+ 42,55 EUR de envío estimado;Vendidos  24 ago 2021Artículo vendido;desde Reino Unido;
7 Vintage 1993 Bandai Mighty Morphin Power Rangers Flip cabeza 5.5" figuras;46,84 EUR;+ 44,51 EUR de envío estimado;Vendidos  8 ago 2021Artículo vendido;desde Reino Unido;
1993 BAN DAI Mighty Morphin Power Rangers Deluxe Megazord 99% Completo;117,13 EUR;+ 43,50 EUR de envío estimado;Vendidos  13 sep 2021Artículo vendido;desde Reino Unido;
Mighty Morphin Power Rangers malvados espacio extraterrestres Vapor depuradas;23,41 EUR;+ 40,87 EUR de envío estimado;Vendidos  11 ago 2021Artículo vendido;desde Reino Unido;
Mighty Morphin Power Rangers (como Polly Pocket) Morpher caso solamente-NO FIGURAS;11,70 EUR;+ 39,48 EUR de envío estimado;Vendidos  4 ago 2021Artículo vendido;desde Reino Unido;
Mighty Morphin Power Rangers Vintage 6x 8" Figuras De Acción Bandai 93;35,13 EUR;+ 40,26 EUR de envío estimado;Vendidos  26 jul 2021Artículo vendido;desde Reino Unido;
Mighty Morphin Power Rangers legado Communicator, Bandai;152,26 EUR;+ 48,60 EUR de envío estimado;Vendidos  16 ago 2021Artículo vendido;desde Reino Unido;
1993 Bandai Europa Mighty Morphin Power Rangers Conjunto completo de 4.5" figuras en perfecto estado en cartón sellado;937,00 EUR;+ 63,10 EUR de envío estimado;Vendidos  20 jul 2021Artículo vendido;desde Reino Unido;
Mighty Morphin Power Rangers malvados espacio extraterrestres Baboo;29,27 EUR;+ 40,97 EUR de envío estimado;Vendidos  23 ago 2021Artículo vendido;desde Reino Unido;
White Ranger Mighty Morphin Power Rangers Flip cabeza 1993 Acción Figura Bandai;19,90 EUR;+ 20,45 EUR de envío;Vendidos  9 ago 2021Artículo vendido;desde Reino Unido;
Mighty Morphin Power Rangers La Película Ranger Vintage Figura 5" Rojo Metálico;9,36 EUR;+ 35,69 EUR de envío estimado;Vendidos  1 jul 2021Artículo vendido;desde Reino Unido;