Ganbare Goemon Kurofune Tou no Nazo - Jeu Game Boy GB JAP Japan ;5,17 EUR;Envío no especificado;Vendidos  18 sep 2021Artículo vendido;desde Francia;
Vintage Nintendo GameBoy Ganbare Goemon Sarawareta Ebisumaru * Importado Japonés *;5,59 EUR;+ 16,43 EUR de envío estimado;Vendidos  29 jul 2021Artículo vendido;desde Reino Unido;
Ganbare Goemon Japón Nintendo Gameboy;5,81 EUR;+ 16,44 EUR de envío estimado;Vendidos  22 jul 2021Artículo vendido;desde Reino Unido;
Gameboy juego Ganbare Goemon Sarawareta Ebisumaru;1,71 EUR;+ 4,44 EUR de envío;Vendidos  20 sep 2021Artículo vendido;desde Estados Unidos;
Ganbare Goemon: Sarawareta Ebisumaru! en Caja + Manual Japón Ver Nintendo GameBoy;20,47 EUR;+ 3,80 EUR de envío;Vendidos  14 sep 2021Artículo vendido;desde Estados Unidos;
Ganbare Goemon Game Boy Advance GBA Japón versión Famicom Mini;9,37 EUR;+ 21,32 EUR de envío;Vendidos  13 sep 2021Artículo vendido;desde Japón;
Ganbare Goemon Game Boy Advance GBA Japón versión Famicom Mini;9,37 EUR;+ 21,32 EUR de envío;Vendidos  20 ago 2021Artículo vendido;desde Japón;
Ganbare Goemon Tengu Tou no Gyakushu Completo Conjunto! Japón Nintendo Gameboy GB Muy Bueno +;12,62 EUR;+ 7,51 EUR de envío;Vendidos  20 ago 2021Artículo vendido;desde Japón;
Nintendo Game Boy GB Ganbare Goemon-kurofunetou no Nazo Japón ver vendedor de Estados Unidos;7,24 EUR;+ 3,40 EUR de envío;Vendidos  16 ago 2021Artículo vendido;desde Estados Unidos;
Ganbare Goemon Ebisumaru Nintendo Gameboy GB Japón importación místico Ninja;8,52 EUR;+ 3,80 EUR de envío;Vendidos  10 ago 2021Artículo vendido;desde Estados Unidos;
Complete Ganbare Goemon Tengu-Tou Juego Boy japonés Importado GB Japón jp Vendedor de Estados Unidos;23,87 EUR;Envío gratis;