F-1 World Grand Prix 2 II para Nintendo Gameboy Color En Caja;26,88 EUR;+ 16,93 EUR de envío estimado;Vendidos  7 sep 2021Artículo vendido;desde Reino Unido;
F-1 World Grand Prix Nintendo 64 N64 1999 Nueva y sellado de fábrica limpio;84,61 EUR;+ 8,46 EUR de envío;Vendidos  2 sep 2021Artículo vendido;desde Estados Unidos;
F-1 World Grand Prix II (Nintendo 64, 1999) * Completo-Probado-Muy Bueno *;17,08 EUR;Envío gratis;Vendidos  31 ago 2021Artículo vendido;desde Estados Unidos;
F-1 World Grand Prix II Nintendo 64 N64;3,41 EUR;+ 4,27 EUR de envío;Vendidos  20 ago 2021Artículo vendido;desde Estados Unidos;
F-1 World Grand Prix Nintendo 64 N64 Carro de video juego de carreras auténtico Probado;5,11 EUR;+ 4,44 EUR de envío;Vendidos  8 ago 2021Artículo vendido;desde Estados Unidos;
F-1 World Grand Prix (Nintendo 64) N64 Auténtico;5,98 EUR;Envío gratis;Vendidos  28 jul 2021Artículo vendido;desde Estados Unidos;
F-1 World Grand Prix 2 Box Caja N64 Nintendo 64 PAL Sin Juego! ORIGINAL!;9,99 EUR;+ 19,99 EUR de envío;Vendidos  8 ago 2021Artículo vendido;desde España;
F-1 World Grand Prix 2-Nintendo 64-N64 - (solo Cartucho);3,46 EUR;+ 7,73 EUR de envío;Vendidos  7 ago 2021Artículo vendido;desde Reino Unido;
F-1 World Grand Prix 2 Box Caja N64 Nintendo 64 PAL Sin Juego! ORIGINAL!;9,99 EUR;+ 19,99 EUR de envío;Vendidos  20 ago 2021Artículo vendido;desde España;
NINTENDO 64 F-1 World Grand Prix II N64 PAL Juego en Caja Completa Con Manual;10,53 EUR;+ 16,63 EUR de envío estimado;Vendidos  16 sep 2021Artículo vendido;desde Reino Unido;
Video Juego-Nintendo N64 F-1 World Grand Prix II Juego Completo Pal 1999 3+;17,57 EUR;+ 20,57 EUR de envío estimado;Vendidos  6 sep 2021Artículo vendido;desde Reino Unido;
F-1 World Grand Prix-Nintendo 64-N64 - (solo Cartucho) - PAL;3,46 EUR;+ 7,73 EUR de envío;Vendidos  23 sep 2021Artículo vendido;desde Reino Unido;
F-1 World Grand Prix Nintendo N64 juego solo carro totalmente probado;2,68 EUR;+ 18,35 EUR de envío estimado;Vendidos  12 jul 2021Artículo vendido;desde Reino Unido;
F-1 World Grand Prix 2-Nintendo 64-PAL-B-Ware;4,60 EUR;+ 1,09 EUR de envío;Vendidos  3 ago 2021Artículo vendido;desde Austria;
F-1 World Grand Prix II (2) - Nintendo 64 N64 juego PAL solo carro;5,84 EUR;+ 16,55 EUR de envío estimado;Vendidos  17 sep 2021Artículo vendido;desde Reino Unido;
Nintendo 64-F-1 World Grand Prix II (F1 - 2) Completo en Caja PAL N64-juego de carreras arcade!;19,85 EUR;+ 23,43 EUR de envío;Vendidos  1 ago 2021Artículo vendido;desde Reino Unido;
F-1 World Grand Prix II Nintendo N64 Cartucho Gratis P&P;4,67 EUR;+ 16,53 EUR de envío estimado;Vendidos  4 jul 2021Artículo vendido;desde Reino Unido;
F-1 World Grand Prix video juego de vídeo juego para Nintendo N64 Pal probado;4,67 EUR;+ 16,53 EUR de envío estimado;Vendidos  15 jul 2021Artículo vendido;desde Reino Unido;
F-1 World Grand Prix Box Caja N64 Nintendo 64 PAL-FRA Sin Juego! ORIGINAL!;8,99 EUR;+ 19,99 EUR de envío;Vendidos  9 sep 2021Artículo vendido;desde España;
