Klax - Game Boy Color GB Nintendo - PAL;16,90 EUR;+ 12,00 EUR de envío;desde Italia;
Nintendo Gameboy Juego-Klax;12,51 EUR;+ 16,55 EUR de envío estimado;desde Reino Unido;
Klax - Game Boy Japonés - Nuevo a Estrenar - New;34,59 EUR;Envío no especificado;desde España;
Marble Madness Klax (Nintendo Gameboy Advance, 2005) Cart Only GBA Game Boy;4,01 EUR;+ 2,67 EUR de envío;desde Canadá;
Marble Madness/Klax (Nintendo Game Boy Advance, 2005) Cart Only ;5,01 EUR;+ 10,02 EUR de envío;desde Canadá;
Marble Madness/Klax (Nintendo Game Boy Advance, 2005) GBA;5,01 EUR;+ 3,33 EUR de envío;desde Canadá;
Marble Madness/Klax (Nintendo Game Boy Advance, 2005) Brand New Sealed!;13,36 EUR;+ 13,37 EUR de envío;desde Canadá;
Nintendo Game Boy Advance Marble Madness & Klax Nuevo Sellado;25,56 EUR;+ 21,67 EUR de envío;desde Grecia;
