Toonsylvania - Nintendo Game Boy Color;6,90 EUR;+ 5,50 EUR de envío;desde Francia;
En Caja con Instrucciones Nintendo Gameboy Game Boy Color Juego Toonsylvania;17,50 EUR;+ 16,71 EUR de envío estimado;desde Reino Unido;
NINTENDO GAME BOY COLOR Juego-Toonsylvania;9,34 EUR;+ 16,56 EUR de envío estimado;desde Reino Unido;
Nintendo Game Boy Color - Toonsylvania - PAL - EUR;9,99 EUR;+ 5,00 EUR de envío;desde Francia;
Nintendo Game Boy Color Toonsylvania EUR Très Bon état;6,90 EUR;+ 11,98 EUR de envío;desde Francia;
Toonsylvania para gameboy color y Advance;6,50 EUR;+ 7,00 EUR de envío;desde Alemania;
Nintendo Gameboy Color-Toonsylvania;9,28 EUR;+ 16,56 EUR de envío estimado;desde Reino Unido;
Nintendo Gameboy Color-Toonsylvania Shrek Harry Potter Scooby Doo Creep Capers;18,62 EUR;+ 16,73 EUR de envío estimado;desde Reino Unido;
Nintendo Gameboy Color Toonsylvania;21,00 EUR;+ 16,77 EUR de envío estimado;desde Reino Unido;
Nintendo Gameboy Color-Toonsylvania. gastos de envío gratis;9,33 EUR;+ 16,56 EUR de envío estimado;desde Reino Unido;
Manual - Toonsylvania // Nintendo Gameboy Color - En castellano;3,95 EUR;+ 15,00 EUR de envío;desde España;
Nintendo Game Boy Color Toonsylvania Halloween/veis/Monster/horror Adventure;3,90 EUR;+ 5,00 EUR de envío;desde Alemania;
Toonsylvania (Nintendo Game Boy Color, 2000) como nuevo;24,90 EUR;Envío no especificado;desde Alemania;
Toonsylvania, Nintendo Game Boy Color, Pal-eur;4,45 EUR;Envío no especificado;desde España;
Game Boy COLOR GBC Toonsylvania Ubi Soft nintendo Nuovo ;12,90 EUR;Envío no especificado;desde Italia;
GameBoy Color.Toonsylvania;9,00 EUR;Envío no especificado;desde España;
Toonsylvania (Nintendo Game Boy Color, 2000) -Cart Only ;15,30 EUR;+ 4,03 EUR de envío;desde Canadá;
Toonsylvania (Nintendo GameBoy Color GBC) [Game Only];10,72 EUR;+ 1,31 EUR de envío;desde Canadá;
Toonsylvania EUR - Nintendo GameBoy Color - GBC;18,36 EUR;+ 19,95 EUR de envío;desde Países Bajos;
Toonsylvania Gameboy Color Authentic;8,07 EUR;+ 12,78 EUR de envío;desde Canadá;
Toonsylvania Nintendo GameBoy Color/Colour game Oz129;18,53 EUR;+ 16,70 EUR de envío;desde Australia;
Gameboy Color Toonsylvania;31,59 EUR;Envío internacional gratis;desde Rumanía;
