Pokemon Cristal Game Boy Español;13,50 EUR;+ 9,00 EUR de envío;desde España;
Pokemon Cristal Game Boy Color;60,00 EUR;Envío no especificado;desde España;
Pokemon Cristal Nintendo Game Boy Color GBC Con Manual Español Caja Original;400,00 EUR;Envío no especificado;desde España;
NINTENDO Gameboy Color Pokemon Cristal VGA/UKG graduada 85+casi como nuevo oro 2001;40.727,05 EUR;+ 18,61 EUR de envío;desde Reino Unido;
Gameboy Español - Pokemon Cristal - Cartucho Modificado + Caja;14,99 EUR;+ 14,95 EUR de envío;desde España;
Genuine Pokemon Cristal NINTENDO GAMEBOY COLOR COLOUR Juego - * ver Descripción *;63,99 EUR;+ 22,19 EUR de envío estimado;desde Reino Unido;
