El Pokémon Pinball Nintendo Game Boy Color OVP mercancía nueva todo ello;300,00 EUR;+ 35,00 EUR de envío;desde Alemania;
GAME BOY COLOR NINTENDO Pokémon Pinball NINTENDO DMG-P-VPHJ-JPN Versión JAPÓN ;54,90 EUR;+ 19,90 EUR de envío;desde España;
Pokémon Pinball (Game Boy Color, 2000);12,50 EUR;Envío no especificado;desde Francia;
Notice Nintendo Game Boy Color Pokémon Pinball EUR état correct;4,90 EUR;+ 11,98 EUR de envío;desde Francia;
Pokémon Pinball-Nintendo Game Boy Color UE-Game & Rumble trabajo rápido post;21,00 EUR;+ 16,77 EUR de envío estimado;desde Reino Unido;
Notice Nintendo Game Boy Color Pokémon Pinball EUR Bon état;9,90 EUR;+ 11,98 EUR de envío;desde Francia;
Notice Nintendo Game Boy Color Pokémon Pinball EUR Très Bon état;5,90 EUR;+ 11,98 EUR de envío;desde Francia;
Notice Nintendo Game Boy Color Pokémon Pinball EUR Bon état #1;9,90 EUR;+ 11,98 EUR de envío;desde Francia;
Pokémon Pinball (Game Boy Color, 2000);5,00 EUR11,50 EUR;+ 5,50 EUR de envío;desde Francia;
Nintendo Pokémon Pinball Game Boy Color DMG-vphp-EUR w/manual;9,45 EUR;+ 23,50 EUR de envío;desde Bélgica;
Pokémon Pinball (Nintendo Game Boy Color);35,02 EUR;+ 17,02 EUR de envío estimado;desde Reino Unido;
Nintendo Gameboy Color Pokémon Pinball Manual;4,66 EUR;+ 33,57 EUR de envío estimado;desde Reino Unido;
Pokémon Pinball Nintendo Gameboy Pocket Color Advance looooook!!!;7,30 EUR;+ 16,52 EUR de envío estimado;desde Reino Unido;
