Crystal Quest Nintendo Gameboy juego muy buen estado probado;12,99 EUR;+ 9,99 EUR de envío;desde Alemania;
Crystal Quest-Nintendo Game Boy Probado Funcionando Shooter Original;20,36 EUR;Envío gratis;desde Estados Unidos;
Crystal Quest-Nintendo Game Boy-limpiado Probado Funcionando Shooter Original;17,00 EUR;+ 4,42 EUR de envío;desde Estados Unidos;
Crystal Quest Nintendo Juego Original Boy probado y trabajo solo carro;25,49 EUR;Envío gratis;desde Estados Unidos;
Crystal Quest probado Gameboy;12,74 EUR;Envío gratis;desde Estados Unidos;
Game Boy Crystal Quest;340,03 EUR;+ 17,00 EUR de envío;desde México;
Crystal Quest (Nintendo Game Boy, 1991) Cartucho Y Manual;29,74 EUR;Envío gratis;desde Estados Unidos;
Crystal Quest Nintendo Game Boy Fridge Magnet Magnete Frigorifero;2,22 EUR;+ 2,50 EUR de envío;desde España;
Crystal Quest Game Boy Nintendo Llavero;2,18 EUR;+ 2,51 EUR de envío;desde España;
Crystal Quest Nintendo Game Boy FRIDGE MAGNET;2,18 EUR;+ 2,51 EUR de envío;desde España;
