Battletoads Nintendo Game Boy Juego Completo;81,60 EUR;+ 41,65 EUR de envío estimado;desde Reino Unido;
Battletoads Ragnarok's World-Game Boy-módulo-GameBoy-muy buen estado;11,99 EUR;Envío no especificado;desde Alemania;
Game Boy-Battletoads-DMG-BV - frg-OVP & instrucciones cib Nintendo Gameboy Top;199,95 EUR;Envío no especificado;desde Alemania;
NINTENDO SUPER GAME BOY Battletoads Vintage COMPUTER juego portátil PAL Tradewest;116,59 EUR;+ 17,49 EUR de envío;desde Reino Unido;
Nintendo Gameboy Battletoads Game boy Fat;24,90 EUR;+ 12,00 EUR de envío;desde Francia;
Battletoads en ragnaroks mundo Nintendo Game Boy solo carro región libre Gameboy;17,43 EUR;+ 16,68 EUR de envío estimado;desde Reino Unido;
Nintendo Game Boy Battletoads in Ragnarok's World DMG-R7-ITA MADE in JAPAN;15,00 EUR;+ 28,00 EUR de envío;desde Italia;
Genuine Nintendo Gameboy Juego-Battletoads en ragnaroks World-probado/trabajo;25,65 EUR;+ 16,84 EUR de envío estimado;desde Reino Unido;
Nintendo-Game Boy Classic-juego-Battletoads-Embalaje original-cib-estado de coleccionista;199,99 EUR;+ 75,00 EUR de envío;desde Alemania;
Juego Battletoads Gameboy;17,49 EUR;+ 18,60 EUR de envío estimado;desde Reino Unido;
Gb-Battletoads: en Ragnarok's World para Nintendo GameBoy;12,95 EUR;+ 9,95 EUR de envío;desde Alemania;
Battletoads en el mundo de Ragnarok GameBoy Original Nintendo Cartucho PAL;17,48 EUR;+ 16,68 EUR de envío estimado;desde Reino Unido;
Jeu Gameboy Gb Battletoads;18,09 EUR;+ 39,00 EUR de envío;desde Francia;
NINTENDO GAMEBOY-Battletoads en ragnaroks World #G92;26,34 EUR;+ 20,41 EUR de envío estimado;desde Reino Unido;
Battletoads-Nintendo Gameboy Cartucho de juego solo carro;15,12 EUR;+ 11,65 EUR de envío;desde Reino Unido;
GB - Battletoads: Probado en el mundo de Ragnarok para Nintendo Gameboy Classic ;10,95 EUR;Envío no especificado;desde Alemania;
Giochi game boy tetris Tennis Terminator Battletoads Ecc;40,00 EUR;Envío no especificado;desde Italia;
Battletoads en Ragnarok's World (DMG-r7-noe) Nintendo Game Boy;40,00 EUR;Envío no especificado;desde Alemania;
