Nintendo Game Boy Battletoads FAH Bon état;12,90 EUR;+ 11,98 EUR de envío;Vendidos  21 sep 2021Artículo vendido;desde Francia;
Battletoads game boy Gameboy Originale Nintendo ITA (no zelda pokemon metroid);22,35 EUR;+ 12,99 EUR de envío;Vendidos  17 sep 2021Artículo vendido;desde Italia;
Battletoads game boy Gameboy Originale Nintendo NOE (no zelda pokemon metroid);19,90 EUR;+ 9,00 EUR de envío;Vendidos  12 sep 2021Artículo vendido;desde Italia;
Game Boy-Battletoads-DMG-BV - frg-OVP & instrucciones cib Nintendo Gameboy Top;199,95 EUR;Envío no especificado;Vendidos  9 sep 2021Artículo vendido;desde Alemania;
Battletoads - Double Dragon - UKV - Nintendo GameBoy;35,00 EUR;+ 25,00 EUR de envío;Vendidos  7 sep 2021Artículo vendido;desde Países Bajos;
Battletoads en ragnaroks mundo Gameboy Carro + Manual;46,49 EUR;+ 20,32 EUR de envío estimado;Vendidos  5 sep 2021Artículo vendido;desde Reino Unido;
Battletoads in Ragnarok's World Game Boy ESP-1;15,00 EUR;Envío internacional gratis;Vendidos  3 sep 2021Artículo vendido;desde Francia;
Battletoads in Ragnarok's World Game Boy ESP-1;15,00 EUR;Envío internacional gratis;Vendidos  2 sep 2021Artículo vendido;desde Francia;
Battletoads en Ragnarok's World (bien) cómo jugar Gameboy instrucciones spielbeg;5,39 EUR;+ 5,00 EUR de envío;Vendidos  29 ago 2021Artículo vendido;desde Alemania;
Battletoads batalla sapos en ragnaroks Mundo para Game Boy Gameboy GB;7,56 EUR;+ 31,76 EUR de envío estimado;Vendidos  25 ago 2021Artículo vendido;desde Reino Unido;
Battletoads.. Nintendo Gameboy.. buen Estado..;26,75 EUR;+ 16,81 EUR de envío estimado;Vendidos  25 ago 2021Artículo vendido;desde Reino Unido;
Battletoads Double Dragon-GAMEBOY Juego-Raro ukv;58,17 EUR;+ 17,38 EUR de envío estimado;Vendidos  15 ago 2021Artículo vendido;desde Reino Unido;
Battletoads & Double Dragon: The Ultimate Team - REPRO box with tray - Gameboy. ;11,26 EUR;+ 5,20 EUR de envío;Vendidos  14 ago 2021Artículo vendido;desde Polonia;
Gb-Battletoads: en Ragnarok's World para Nintendo GameBoy;12,95 EUR;+ 9,95 EUR de envío;Vendidos  12 ago 2021Artículo vendido;desde Alemania;
Battletoads Ragnarok's World-Game Boy-módulo-GameBoy-muy buen estado;11,99 EUR;Envío no especificado;Vendidos  12 ago 2021Artículo vendido;desde Alemania;
Battletoads - Cart - Gameboy;13,00 EUR;+ 11,00 EUR de envío;Vendidos  1 ago 2021Artículo vendido;desde Países Bajos;
Battletoads-Nintendo Gameboy;15,09 EUR;+ 13,38 EUR de envío;Vendidos  25 jul 2021Artículo vendido;desde Reino Unido;
Nintendo Gameboy juego Battletoads. probado;69,82 EUR;+ 17,45 EUR de envío;Vendidos  24 jul 2021Artículo vendido;desde Reino Unido;
Battletoads pour GameBoy;12,00 EUR;Envío no especificado;Vendidos  28 jun 2021Artículo vendido;desde Francia;
Battletoads Double Dragon auténtico USA Ver. carro Nintendo GameBoy;50,32 EUR;+ 3,54 EUR de envío;Vendidos  21 sep 2021Artículo vendido;desde Estados Unidos;
Battletoads Para Nintendo Game Boy ~ ~ ~ GameBoy sólo de juego probadas;17,05 EUR;Envío gratis;Vendidos  20 sep 2021Artículo vendido;desde Estados Unidos;
Battletoads-Nintendo Game Boy-auténtico-probado y funciona ***;13,22 EUR;+ 3,80 EUR de envío;Vendidos  18 sep 2021Artículo vendido;desde Estados Unidos;
Nintendo Gameboy Battletoads Double Dragon Auténtico;34,12 EUR;Envío gratis;Vendidos  17 sep 2021Artículo vendido;desde Estados Unidos;
Battletoads (Nintendo Game Boy)  Cart Only!;13,29 EUR;+ 5,32 EUR de envío;Vendidos  17 sep 2021Artículo vendido;desde Canadá;
Vintage Battletoads auténtico Nintendo Gameboy Juego De Trabajo;16,21 EUR a 17,91 EUR;Envío gratis;Vendidos  17 sep 2021Artículo vendido;desde Estados Unidos;
Battletoads Nintendo Game Boy;17,89 EUR;+ 2,52 EUR de envío;Vendidos  13 sep 2021Artículo vendido;desde Estados Unidos;
Battletoads (Nintendo Game Boy, 1991);7,25 EUR;+ 3,58 EUR de envío;Vendidos  11 sep 2021Artículo vendido;desde Estados Unidos;
Battletoads (Nintendo Game Boy, 1991) - Probado;14,93 EUR;+ 3,80 EUR de envío;Vendidos  11 sep 2021Artículo vendido;desde Estados Unidos;
Battletoads (Nintendo Game Boy 1991) Auténtico-Probado-Cartucho únicamente;17,02 EUR;Envío gratis;Vendidos  11 sep 2021Artículo vendido;desde Estados Unidos;
Battletoads en el mundo Nintendo Game Boy ragnorak 100% Auténtico solo carro;12,75 EUR;+ 5,12 EUR de envío;Vendidos  11 sep 2021Artículo vendido;desde Estados Unidos;
Battletoads-Nintendo Game Boy-auténtico-probado y funciona ***;17,05 EUR;+ 3,62 EUR de envío;Vendidos  10 sep 2021Artículo vendido;desde Estados Unidos;
Battletoads (Nintendo Game Boy, 1991);11,86 EUR;+ 7,29 EUR de envío;Vendidos  9 sep 2021Artículo vendido;desde Estados Unidos;
Battletoads (Nintendo Game Boy, 1991) probado y funcionando Auténtico Original Equipment Manufacturer;21,31 EUR;+ 3,62 EUR de envío;Vendidos  8 sep 2021Artículo vendido;desde Estados Unidos;
Battletoads (Gameboy) Set Completo;149,26 EUR;+ 17,06 EUR de envío;Vendidos  8 sep 2021Artículo vendido;desde Estados Unidos;
Battletoads en el mundo de Ragnarok Nintendo Game Boy GB Cartucho en Caja Completo Con Manual Y Caja;213,22 EUR;+ 4,43 EUR de envío;Vendidos  8 sep 2021Artículo vendido;desde Estados Unidos;
Battletoads en el mundo de Ragnarok (Nintendo Game Boy) Con Manual;20,90 EUR;+ 3,50 EUR de envío;Vendidos  5 sep 2021Artículo vendido;desde Estados Unidos;
Battletoads ragnaroks mundo Nintendo Gameboy Auténtico Original Caja Completa;255,87 EUR;+ 5,46 EUR de envío;Vendidos  5 sep 2021Artículo vendido;desde Estados Unidos;
Battletoads (Nintendo GameBoy) Auténtico -- Completo En Caja;149,22 EUR;Envío gratis;Vendidos  5 sep 2021Artículo vendido;desde Estados Unidos;
Battletoads (Nintendo Game Boy 1991) Auténtico-Probado-Cartucho únicamente;17,05 EUR;Envío gratis;Vendidos  2 sep 2021Artículo vendido;desde Estados Unidos;
Battletoads (Nintendo Game Boy, 1991), auténtico, cartucho sólo, Probado;17,06 EUR;+ 3,54 EUR de envío;Vendidos  28 ago 2021Artículo vendido;desde Estados Unidos;
Nintendo Game Boy Battletoads en el mundo de Ragnarok solo carro Probado;16,96 EUR;+ 3,17 EUR de envío;Vendidos  27 ago 2021Artículo vendido;desde Estados Unidos;
Battletoads (Nintendo Game Boy, 1991) Auténtico probado Cartucho De Juego;15,35 EUR;+ 3,80 EUR de envío;Vendidos  27 ago 2021Artículo vendido;desde Estados Unidos;
Battletoads (Nintendo Game Boy, 1991);12,79 EUR;+ 3,84 EUR de envío;Vendidos  25 ago 2021Artículo vendido;desde Estados Unidos;
Battletoads en el mundo de Ragnarok 1991 Nintendo Game Boy probado y funciona;8,96 EUR;+ 5,07 EUR de envío;Vendidos  25 ago 2021Artículo vendido;desde Estados Unidos;
Cartucho De Juego Boy Battletoads;10,23 EUR;+ 3,41 EUR de envío;Vendidos  24 ago 2021Artículo vendido;desde Estados Unidos;
Battletoads en el mundo de Ragnarok (Nintendo Game Boy, 1991 GBA DS) cartucho sólo;13,64 EUR;Envío gratis;Vendidos  24 ago 2021Artículo vendido;desde Estados Unidos;
Battletoads (Nintendo GameBoy) Auténtico -- Completo en Caja Con Todo;119,83 EUR;+ 6,81 EUR de envío;Vendidos  22 ago 2021Artículo vendido;desde Estados Unidos;
Battletoads Nintendo Game Boy 1991 Cartucho sólo Auténtico;20,46 EUR;Envío gratis;Vendidos  22 ago 2021Artículo vendido;desde Estados Unidos;
Battletoads (Nintendo Game Boy, 1991) Auténtico probado Cartucho De Juego descolorida;11,90 EUR;Envío gratis;Vendidos  20 ago 2021Artículo vendido;desde Estados Unidos;
Battletoads (Nintendo GameBoy) -- Auténtico Juego Con Manual --;31,52 EUR;Envío gratis;Vendidos  18 ago 2021Artículo vendido;desde Estados Unidos;
Lote De Juegos Game Boy con unidad de batalla Metroid 2, Zeoth, Battletoads y más;72,50 EUR;Envío gratis;Vendidos  18 ago 2021Artículo vendido;desde Estados Unidos;
Battletoads (Nintendo Game Boy, 1991) Auténtico probado Cartucho De Juego;12,79 EUR;Envío gratis;Vendidos  17 ago 2021Artículo vendido;desde Estados Unidos;
Battletoads Nintendo Game Boy 1991 * Auténtico * - Probado Y Funcionando;8,52 EUR;+ 3,50 EUR de envío;Vendidos  16 ago 2021Artículo vendido;desde Estados Unidos;
Battletoads (Nintendo Game Boy, 1991) Auténtico probado Cartucho De Juego;15,34 EUR;Envío gratis;Vendidos  13 ago 2021Artículo vendido;desde Estados Unidos;
