Magical Quest 2 Mickey Mouse Nintendo Gameboy Advance manual de usuario en vgwc;4,68 EUR;+ 16,52 EUR de envío estimado;Vendidos  16 sep 2021Artículo vendido;desde Reino Unido;
Juego De Mesa Disney Mickey Mouse Pinata Aniversario Cumpleaños Bash Niños Niñas Niños;24,57 EUR;+ 21,60 EUR de envío estimado;Vendidos  14 sep 2021Artículo vendido;desde Reino Unido;
Nintendo Gameboy-Mickey Mouse 5 Varas-Top-Embalaje original-Pal;54,90 EUR;Envío no especificado;Vendidos  8 sep 2021Artículo vendido;desde Alemania;
Nintendo Gameboy Color CGB-001 + Mickey Mouse Juego (trabajo sin tapa de la batería);43,78 EUR;+ 21,07 EUR de envío;Vendidos  21 ago 2021Artículo vendido;desde Reino Unido;
Gb-Mickey Mouse para Nintendo GameBoy;6,95 EUR;+ 9,95 EUR de envío;Vendidos  18 ago 2021Artículo vendido;desde Alemania;
Nintendo Gameboy-Disney 's Mickey Mouse varitas mágicas elección de los jugadores;17,50 EUR;+ 16,75 EUR de envío estimado;Vendidos  16 ago 2021Artículo vendido;desde Reino Unido;
Nintendo Game Boy-Mickey Mouse (2) En Caja;40,91 EUR;+ 12,82 EUR de envío;Vendidos  31 jul 2021Artículo vendido;desde Reino Unido;
Mickey Mouse-Game Boy-Módulo de juego-Nintendo-Game Boy-buen estado - 2;7,49 EUR;Envío no especificado;Vendidos  31 jul 2021Artículo vendido;desde Alemania;
Nintendo Game Boy Mickey Mouse-Top-Embalaje original-Pal;109,90 EUR;Envío no especificado;Vendidos  30 jul 2021Artículo vendido;desde Alemania;
Vintage Video Juego Nintendo GameBoy Mickey Mouse 2 II * Importado Japonés *;9,36 EUR;+ 9,95 EUR de envío;Vendidos  30 jul 2021Artículo vendido;desde Reino Unido;
Chicos de Mickey Dangerous Chase Nintendo Gameboy juego bien Game Boy gb Mickey Mouse;5,90 EUR;Envío no especificado;Vendidos  26 jul 2021Artículo vendido;desde Alemania;
Gb-Mickey Mouse V: varas para Nintendo GameBoy;9,95 EUR;+ 9,95 EUR de envío;Vendidos  18 jul 2021Artículo vendido;desde Alemania;
Original Juego-Mickey Mouse Gameboy solo manual de instrucciones original de Reino Unido Folleto.;11,69 EUR;+ 16,65 EUR de envío estimado;Vendidos  14 jul 2021Artículo vendido;desde Reino Unido;
Notice - Instruction Booklet Mickey Mouse Game Boy FAH ;4,49 EUR;Envío no especificado;Vendidos  12 jul 2021Artículo vendido;desde Francia;
Nintendo Gameboy Carro Cartucho Rugrats Mickey Mouse Star Wars Nigel Mansell's;16,35 EUR;+ 15,22 EUR de envío;Vendidos  9 jul 2021Artículo vendido;desde Reino Unido;
Mickey Mouse Magical Quest (Game Boy Advance, 2002);12,00 EUR;+ 11,00 EUR de envío;Vendidos  4 jul 2021Artículo vendido;desde Irlanda;
Mickey Mouse Gameboy Nintendo GB Cartucho Original;6,44 EUR;+ 16,55 EUR de envío estimado;Vendidos  2 jul 2021Artículo vendido;desde Reino Unido;
Mickey 'Ultimate Challenge & Mickey Mouse: varitas mágicas (Nintendo Game Boy);15,30 EUR;Envío gratis;Vendidos  17 sep 2021Artículo vendido;desde Estados Unidos;
EE. UU. versión Lote Laboratorio De Dexter + + Mickey Mouse Donald Duck + Toy Story 2 GameBoy Color GBC;10,20 EUR;+ 3,78 EUR de envío;Vendidos  16 sep 2021Artículo vendido;desde Estados Unidos;
Mickey Mouse IV4 el mágico laberinto Nintendo Game Boy, Japón;42,42 EUR;+ 12,75 EUR de envío;Vendidos  11 sep 2021Artículo vendido;desde Japón;
Mickey Mouse IV 4 Nintendo Game Boy GB;10,20 EUR;Envío gratis;Vendidos  9 sep 2021Artículo vendido;desde Estados Unidos;
Quest mágico protagonizada por Mickey Mouse-juego solamente-Gameboy Advance - 86a;11,04 EUR;Envío gratis;Vendidos  4 sep 2021Artículo vendido;desde Estados Unidos;
Lote 2 Disney Mickey Mouse Boy Juegos peligrosos Chase Juego Original + varitas mágicas;19,53 EUR;Envío gratis;Vendidos  3 sep 2021Artículo vendido;desde Estados Unidos;
Disney's Mickey Mouse: varitas mágicas (Nintendo Game Boy, 1998) solo carro;7,56 EUR;Envío gratis;Vendidos  3 sep 2021Artículo vendido;desde Estados Unidos;
Mickey Mouse IV Mahou no laberinto juego Boy GB Japón importación Vendedor de Estados Unidos;9,31 EUR;Envío gratis;Vendidos  2 sep 2021Artículo vendido;desde Estados Unidos;
Mickey Mouse varitas mágicas Nintendo Game Boy limpiado & probado Auténtico;6,79 EUR;Envío gratis;Vendidos  2 sep 2021Artículo vendido;desde Estados Unidos;
Disney's Mickey Mouse: varitas mágicas (Nintendo Game Boy, 1998);3,39 EUR;+ 3,78 EUR de envío;Vendidos  1 sep 2021Artículo vendido;desde Estados Unidos;
Mickey Mouse (Nintendo Game Boy GB, 1989) Japan Import;7,36 EUR;+ 3,85 EUR de envío;Vendidos  25 ago 2021Artículo vendido;desde Canadá;
NINTENDO GAMEBOY-Mickey Mouse: Varitas Mágicas Juego Completo Nuevo Sellado De Fábrica GB;391,89 EUR;+ 4,17 EUR de envío;Vendidos  24 ago 2021Artículo vendido;desde Estados Unidos;
12 Mickey Mouse Chupete Collares Baby Shower Juego favores premios Niño Decoración;15,29 EUR;Envío gratis;Vendidos  21 ago 2021Artículo vendido;desde Estados Unidos;
Pin de Mickey Mouse Fiesta Juego la nariz;9,31 EUR;+ 4,42 EUR de envío;Vendidos  17 ago 2021Artículo vendido;desde Estados Unidos;
Mickey Mouse Clubhouse Fiesta Juego;11,89 EUR;Envío gratis;Vendidos  8 ago 2021Artículo vendido;desde Estados Unidos;
Magical Quest 2 Mickey Mouse GBA Completa Caja Auténtica Juego Boy GameBoy Advance;85,00 EUR;Envío gratis;Vendidos  4 ago 2021Artículo vendido;desde Estados Unidos;
12 bloques de Mickey Mouse Rellenable Baby Shower Recuerdos premios juego ~ Boy Decoraciones;15,29 EUR;+ 3,39 EUR de envío;Vendidos  2 ago 2021Artículo vendido;desde Estados Unidos;
Japón Gameboy. la leyenda de Drácula. Río Pesca. día Deportes. Mickey Mouse .4set;6,80 EUR;+ 5,95 EUR de envío;Vendidos  1 ago 2021Artículo vendido;desde Japón;
Magical Quest 2 Mickey Mouse GBA Completa Caja Auténtica Juego Boy GameBoy Advance;102,00 EUR;Envío gratis;Vendidos  26 jul 2021Artículo vendido;desde Estados Unidos;
Magical Quest 2 Mickey Mouse Nintendo Gameboy Advance GBA solo Carro-Probado;11,05 EUR;+ 3,78 EUR de envío;Vendidos  13 jul 2021Artículo vendido;desde Estados Unidos;
Nintendo Game Boy Pocket Rojo Sistema Portátil con Mickey Mouse Juego probado!;51,50 EUR;Envío gratis;Vendidos  9 jul 2021Artículo vendido;desde Estados Unidos;
Mickey Mouse varitas mágicas Nintendo Game Boy limpiado & probado Auténtico;9,31 EUR;Envío gratis;Vendidos  8 jul 2021Artículo vendido;desde Estados Unidos;
Magical Quest 2 Mickey Mouse Nintendo Gameboy Advance GBA solo Carro-Probado;11,05 EUR;Envío gratis;Vendidos  3 jul 2021Artículo vendido;desde Estados Unidos;
Original Game Boy Mickey Mouse varitas mágicas Nintendo Video Juego Cartucho;8,46 EUR;Envío gratis;Vendidos  1 jul 2021Artículo vendido;desde Estados Unidos;
Disney's Mickey Mouse: varitas mágicas (Nintendo Game Boy, 1998);7,64 EUR;Envío gratis;Vendidos  1 jul 2021Artículo vendido;desde Estados Unidos;
12 Baby Mickey Mouse Azul Chupete Collares Baby Shower Game Boy favores premios;16,99 EUR;Envío gratis;Vendidos  30 jun 2021Artículo vendido;desde Estados Unidos;
Magical Quest 2 Mickey Mouse Nintendo Gameboy Advance GBA solo Carro-Probado;11,04 EUR;+ 3,36 EUR de envío;Vendidos  30 jun 2021Artículo vendido;desde Estados Unidos;
Mundo De Ilusión protagonizada por Mickey Mouse-Sega Megadrive Juego-Completo;14,04 EUR;+ 16,68 EUR de envío estimado;Vendidos  12 ago 2021Artículo vendido;desde Reino Unido;
Sega Mega Drive juego 4 Paquete-Mickey Mouse Kid Chameleon-PAL;46,81 EUR;+ 17,28 EUR de envío estimado;Vendidos  15 jul 2021Artículo vendido;desde Reino Unido;
Nintendo Game & Watch * Mickey Mouse * OVP cib;229,95 EUR;+ 35,99 EUR de envío;Vendidos  31 jul 2021Artículo vendido;desde Alemania;
Espejo mágico protagonizada por Mickey Mouse NINTENDO GAMECUBE PAL Juego en Caja Inc Manual;17,55 EUR;+ 16,75 EUR de envío estimado;Vendidos  2 ago 2021Artículo vendido;desde Reino Unido;
Leyenda de ilusión protagonizada por Mickey Mouse Sega GAME GEAR NTSC;24,58 EUR;+ 19,02 EUR de envío estimado;Vendidos  21 ago 2021Artículo vendido;desde Reino Unido;
Sega Mega Drive juego del mundo de ilusión con Mickey Mouse-Raro;14,04 EUR;+ 26,20 EUR de envío;Vendidos  9 jul 2021Artículo vendido;desde Reino Unido;
Castillo de ilusión protagonizada por Mickey Mouse Sega Mega Drive Juego, En Caja Con Manual;17,55 EUR;+ 20,50 EUR de envío estimado;Vendidos  25 ago 2021Artículo vendido;desde Reino Unido;
El Mágico Quest protagonizada por Mickey Mouse Super NINTENDO SNES Juego PAL Reino Unido V EUR;23,40 EUR;+ 16,86 EUR de envío estimado;Vendidos  2 jul 2021Artículo vendido;desde Reino Unido;
Nintendo Gamecube Juego-Disney Mágico Espejo Mickey Mouse-Sin Manual;9,36 EUR;+ 7,01 EUR de envío;Vendidos  24 ago 2021Artículo vendido;desde Reino Unido;
Castillo de ilusión protagonizada por Mickey Mouse SEGA MasterSystem juego rápido y libre Post;5,74 EUR;+ 16,53 EUR de envío estimado;Vendidos  14 ago 2021Artículo vendido;desde Reino Unido;
Castillo de ilusión protagonizada por Mickey Mouse-SEGA GAME GEAR-ukfreepost;17,55 EUR;+ 16,75 EUR de envío estimado;Vendidos  12 sep 2021Artículo vendido;desde Reino Unido;
Tierra de ilusión protagonizada por Mickey Mouse SEGA GAME GEAR Juego-Cartucho únicamente;5,84 EUR;+ 18,52 EUR de envío estimado;Vendidos  5 ago 2021Artículo vendido;desde Reino Unido;
Sega Master Sistema Juego ~ tierra de ilusión protagonizada por Mickey Mouse;7,61 EUR;+ 20,66 EUR de envío estimado;Vendidos  16 ago 2021Artículo vendido;desde Reino Unido;
SEGA Mega Drive Juego Mundo De Ilusión Disney Mickey Mouse Box Booklet megadrive;18,72 EUR;+ 20,29 EUR de envío estimado;Vendidos  5 sep 2021Artículo vendido;desde Reino Unido;
Vintage Mickey Mouse Famicom Famiclone Amarillo Cartucho 60 pines juego de consola de TV;8,49 EUR;+ 9,34 EUR de envío;Vendidos  20 jul 2021Artículo vendido;desde Hungría;
Sega Game Gear Pal Castillo de ilusión protagonizada por Mickey Mouse 1693;5,85 EUR;+ 18,68 EUR de envío estimado;Vendidos  12 ago 2021Artículo vendido;desde Reino Unido;
Castillo de ilusión protagonizada por Mickey Mouse (Mega Drive Juego en Caja de juego de Disney) un;11,71 EUR;+ 20,39 EUR de envío estimado;Vendidos  13 sep 2021Artículo vendido;desde Reino Unido;
Sega Game Gear Castillo de ilusión mirando Juego De Mickey Mouse;14,02 EUR;+ 17,56 EUR de envío;Vendidos  24 jun 2021Artículo vendido;desde Reino Unido;
Sega Megadrive Consola Juego-Mickey Mouse-Castillo de ilusión;20,47 EUR;+ 11,11 EUR de envío;Vendidos  30 jun 2021Artículo vendido;desde Reino Unido;
Genuine SEGA Mega Drive Juego-castillo de ilusión-Mickey Mouse 16 Bits;17,55 EUR;+ 20,73 EUR de envío estimado;Vendidos  3 jul 2021Artículo vendido;desde Reino Unido;
Tierra de ilusión protagonizada por Mickey Mouse-Sega Game Gear (Cartucho Solamente);8,14 EUR;+ 4,68 EUR de envío;Vendidos  17 sep 2021Artículo vendido;desde Reino Unido;
Mickey Mouse no Castle Illusion SEGA Game Gear Japan Import;45,99 EUR;+ 18,50 EUR de envío;Vendidos  9 sep 2021Artículo vendido;desde España;
Mickey Mouse el equipo juego Commodore 64 probado ver fotos en muy buen estado COMPLETO RARO;23,40 EUR;+ 18,73 EUR de envío estimado;Vendidos  20 jun 2021Artículo vendido;desde Reino Unido;
Castillo de ilusión protagonizada por Mickey Mouse Sega Game Gear Juego + Estuche comprar ahora FREEpp;7,01 EUR;+ 11,71 EUR de envío;Vendidos  6 sep 2021Artículo vendido;desde Reino Unido;
