Nintendo Game Boy Classic juego Beavis and Butt-Head con embalaje original y guía EUR;249,90 EUR;+ 36,99 EUR de envío;Vendidos  22 ago 2021Artículo vendido;desde Alemania;
Beavis and Butt-Head-muy Raro Nintendo Gameboy Juego Original;46,82 EUR;+ 11,71 EUR de envío;Vendidos  21 jun 2021Artículo vendido;desde Reino Unido;
Raro MTV's Beavis and Butt-Head Nintendo Gameboy genuino cartucho de juego;35,06 EUR;+ 17,07 EUR de envío estimado;Vendidos  19 jun 2021Artículo vendido;desde Reino Unido;
Raro Beavis and Butt-Head Butthead Nintendo Game Boy Video Juego Cartucho MTV;59,51 EUR;+ 2,54 EUR de envío;Vendidos  6 sep 2021Artículo vendido;desde Estados Unidos;
Raro Beavis and Butt-Head Butthead Nintendo Game Boy Video Juego Cartucho MTV;29,74 EUR;+ 4,12 EUR de envío;Vendidos  26 ago 2021Artículo vendido;desde Estados Unidos;
Beavis and Butt-Head NINTENDO GAME BOY KEYRING;2,18 EUR;+ 2,51 EUR de envío;Vendidos  21 ago 2021Artículo vendido;desde España;
Sega Mega Drive Beavis and Butt-Head.;45,65 EUR;+ 10,54 EUR de envío;Vendidos  11 sep 2021Artículo vendido;desde Croacia;
Beavis and Butt-Head Trading Cards.;5,84 EUR;+ 30,98 EUR de envío estimado;Vendidos  7 jul 2021Artículo vendido;desde Reino Unido;
Mike Judge's Beavis and Butt-Head, The Complete Collection (DVD) Region 1;40,97 EUR;+ 21,89 EUR de envío estimado;Vendidos  28 ago 2021Artículo vendido;desde Reino Unido;
Beavis and Butt-Head The Mike Judge Collection (DVD, 2012, 10-Disc Set);35,11 EUR;+ 21,78 EUR de envío estimado;Vendidos  21 ago 2021Artículo vendido;desde Reino Unido;
Beavis and Butt-Head: The Complete Collection [New DVD] Boxed Set, Full Frame,;33,54 EUR;Envío gratis;Vendidos  2 sep 2021Artículo vendido;desde Estados Unidos;
Beavis and Butt-Head Do America DVD (2000) Mike Judge cert 12 ;2,34 EUR;+ 16,47 EUR de envío estimado;Vendidos  4 sep 2021Artículo vendido;desde Reino Unido;
Beavis and Butt-Head Do America DVD;2,75 EUR;+ 16,48 EUR de envío estimado;Vendidos  14 jul 2021Artículo vendido;desde Reino Unido;
[DISC ONLY] Beavis and Butt-Head Do America DVD (2000) Mike Judge cert 12;2,33 EUR;+ 16,47 EUR de envío estimado;Vendidos  1 sep 2021Artículo vendido;desde Reino Unido;
Oficial Beavis and Butt-Head World Tour'93 Negro T-Shirt;26,91 EUR;+ 5,79 EUR de envío;Vendidos  8 ago 2021Artículo vendido;desde Reino Unido;
Beavis and Butt-Head Reaction figura de Butt-head;19,89 EUR;+ 35,85 EUR de envío estimado;Vendidos  12 sep 2021Artículo vendido;desde Reino Unido;
Beavis and Butt-Head MTV cartoon series single trading card  by Topps MTV 1994;1,74 EUR;+ 17,63 EUR de envío estimado;Vendidos  13 jul 2021Artículo vendido;desde Reino Unido;
Beavis and Butt-Head reacción el gran cornulito figura;19,89 EUR;+ 35,85 EUR de envío estimado;Vendidos  13 sep 2021Artículo vendido;desde Reino Unido;
Oficial Beavis and Butt-Head trabajo apesta Taza de Mango Negro;11,69 EUR;+ 5,79 EUR de envío;Vendidos  11 sep 2021Artículo vendido;desde Reino Unido;
AF1 de Colección Dr Martens MTV Beavis and Butt-Head Men 90s Negro Algodón Camiseta Camiseta M;32,78 EUR;Envío internacional gratis;Vendidos  11 jul 2021Artículo vendido;desde Lituania;
Beavis and Butt-Head Set Vinilo Calcomanía Auto Dormitorio de color pared etiqueta de la ventana Regalo;7,01 EUR;+ 16,55 EUR de envío estimado;Vendidos  12 ago 2021Artículo vendido;desde Reino Unido;
Beavis and Butt-Head Postcard Classico 304-001;2,33 EUR;+ 3,51 EUR de envío;Vendidos  29 ago 2021Artículo vendido;desde Reino Unido;
Beavis and Butt-Head Postcard Classico 304-003;2,33 EUR;+ 3,51 EUR de envío;Vendidos  29 ago 2021Artículo vendido;desde Reino Unido;
Oficial Mujeres Classic Beavis and Butt-Head Blanco Ajustada Camiseta;23,40 EUR;+ 5,79 EUR de envío;Vendidos  22 ago 2021Artículo vendido;desde Reino Unido;
Beavis and Butt-Head Experience (1993) + CD + Nirvana, Anthrax, Megadeth, Run...;5,11 EUR;+ 1,90 EUR de envío;Vendidos  22 ago 2021Artículo vendido;desde Alemania;
