Animorphs (Nintendo Game Boy Color) Auténtico Cartucho * Probado * Envío Rápido;8,52 EUR;Envío gratis;Vendidos  21 sep 2021Artículo vendido;desde Estados Unidos;
Animorphs (Nintendo Game Boy Color) Auténtico Cartucho * Probado * Envío Rápido;8,12 EUR;Envío gratis;Vendidos  20 sep 2021Artículo vendido;desde Estados Unidos;
Animorphs (Nintendo Game Boy Color) Cartucho sólo;8,54 EUR;Envío gratis;Vendidos  6 sep 2021Artículo vendido;desde Estados Unidos;
Nintendo Gameboy Color + Animorphs JUEGO-PÚRPURA GBC Consola CGB-001 Game Boy;38,46 EUR;+ 4,44 EUR de envío;Vendidos  6 sep 2021Artículo vendido;desde Estados Unidos;
Nintendo GBC Gameboy color 3 games bundle. Animorphs gift kirikou NEW OLD STOCK;115,96 EUR;+ 35,14 EUR de envío;Vendidos  31 ago 2021Artículo vendido;desde Grecia;
Game Boy Game Boy Color Juegos Lote Wwf Attitude Animorphs Ready 2 Rumble Boxing;4,26 EUR;+ 3,50 EUR de envío;Vendidos  27 ago 2021Artículo vendido;desde Estados Unidos;
Animorphs (Nintendo Game Boy Color, 2000);4,23 EUR;+ 3,84 EUR de envío;Vendidos  26 ago 2021Artículo vendido;desde Estados Unidos;
Lote de 4 Juegos GameBoy (Color), Bugs Bunny Crazy Super Breakout, MIB2, Animorphs;12,82 EUR;+ 8,54 EUR de envío;Vendidos  3 ago 2021Artículo vendido;desde Estados Unidos;
Animorphs (Nintendo Game Boy Color, 2000) solo carro forma agradable Funciona;12,81 EUR;Envío gratis;Vendidos  24 jul 2021Artículo vendido;desde Estados Unidos;
Lote - 5 Nintendo Gameboy (Color) Juegos MIB2 Skateboarding Animorphs Toy Story 2;17,08 EUR;+ 4,23 EUR de envío;Vendidos  12 jul 2021Artículo vendido;desde Estados Unidos;
Animorphs GBC Gameboy Color;2,14 EUR;+ 3,42 EUR de envío;Vendidos  9 jul 2021Artículo vendido;desde Estados Unidos;
Nintendo Gameboy Color lot GBC Shadowgate, Harry potter, Animorphs and Yu Gi Oh;77,09 EUR;+ 12,85 EUR de envío;Vendidos  2 jul 2021Artículo vendido;desde Canadá;
Animorphs (Nintendo Game Boy Color) Cartucho sólo;4,27 EUR;+ 4,27 EUR de envío;Vendidos  1 jul 2021Artículo vendido;desde Estados Unidos;
