Hollywood Pinball (Nintendo Game Boy Color, 1999) - Versión Europea;15,17 EUR;+ 16,66 EUR de envío estimado;desde Reino Unido;
GBC Game Boy Color Hollywood Pinball PAL EUR ORIGINAL Gameboy Genuine Nintendo;9,95 EUR;+ 2,50 EUR de envío;desde España;
Hollywood Pinball * solo carro * EUR Nintendo GameBoy Color GBC DMG;5,13 EUR;+ 16,47 EUR de envío estimado;desde Reino Unido;
Hollywood Pinball (Nintendo Game Boy Color, 1999) - Versión Europea;9,92 EUR;+ 23,35 EUR de envío;desde Reino Unido;
Nintendo GameBoy Color juego - Hollywood Pinball JAPAN cartucho usado;28,99 EUR;Envío internacional gratis;desde Alemania;
Hollywood Pinball Gameboy módulo Game Boy Color GBC;7,90 EUR;Envío no especificado;desde Alemania;
Vintage 1999 Hollywood Pinball Nintendo Gameboy Color Cartucho de versión europea;4,66 EUR;Envío no especificado;desde Reino Unido;
Game Boy Colour Nintendo Hollywood Pinball estrellas de mar DMG-AHNJ-JPN Japón;52,90 EUR;+ 17,07 EUR de envío;desde España;
Nintendo GameBoy Color Cartucho De Juego Hollywood Pinball Japón;20,48 EUR;Envío internacional gratis;desde Alemania;
Hollywood Pinball für Gameboy Color;9,99 EUR;+ 15,10 EUR de envío;desde Austria;
Nintendo GameBoy Color Cartucho De Juego Hollywood Pinball Japón;23,34 EUR;Envío internacional gratis;desde Alemania;
Nintendo GameBoy Color game - Hollywood Pinball JAPAN cartridge;22,85 EUR;Envío internacional gratis;desde Alemania;
Nintendo GameBoy Color jeu - Hollywood Pinball JAPAN cartouche utilisé;26,99 EUR;Envío internacional gratis;desde Alemania;
Nintendo GameBoy Color gioco - Hollywood Pinball JAPAN cartuccia usato;28,99 EUR;Envío internacional gratis;desde Alemania;
Hollywood Pinball (losse cassette) Nintendo GameBoy Color GBC;5,57 EUR;+ 20,00 EUR de envío;desde Países Bajos;
