Double Dragon II 1990s Juego Boy Cartucho sólo Probado Buena Condición-Libre Post;12,88 EUR;+ 16,68 EUR de envío estimado;desde Reino Unido;
NINTENDO GAME BOY-Double Dragon II (en Caja);117,07 EUR;Envío internacional gratis;desde Reino Unido;
NINTENDO GAME BOY / Notice Instruction / Double Dragon II 2 [ DMG-D2-USA ];14,99 EUR;+ 8,25 EUR de envío;desde Francia;
Nintendo Game Boy Double Dragon II FAH Très Bon état;16,90 EUR;+ 11,98 EUR de envío;desde Francia;
Nintendo Game Boy Double Dragon II FAH Très Bon état #1;16,90 EUR;+ 11,98 EUR de envío;desde Francia;
Double Dragon II Nintendo Game Boy Color Advance Juego Solo Carro Genuino;19,85 EUR;+ 7,03 EUR de envío;desde Reino Unido;
GAME BOY Double Dragon II: The Revenge FR NINTENDO COLOR CARTOUCHE SEULE;22,90 EUR;+ 29,00 EUR de envío;desde Francia;
Game Boy GB:Double Dragon II [TOP TECHNOS JAPAN & 1ERE EDITION] Fr;29,90 EUR;+ 4,30 EUR de envío;desde Francia;
NINTENDO GAMEBOY-Double Dragon II-usa carro solo Carro-fwo;14,00 EUR;+ 16,69 EUR de envío estimado;desde Reino Unido;
Nintendo Gameboy loose jeu Double Dragon II;12,90 EUR;+ 4,00 EUR de envío;desde Francia;
Double Dragon II (PAL) + i (japonés) - GameBoy Game Boy Nintendo gb módulo;17,00 EUR;Envío no especificado;desde Alemania;
Gameboy Double Dragon II CARTUCHO gwo;17,56 EUR;Envío no especificado;desde Reino Unido;
Juego Game Boy Advance 108 En 1 - Double Dragon+Double Dragon II+Double Dragon I;6,00 EUR;Envío no especificado;desde España;
Double Dragon II/2-Manual/instrucciones-GameBoy Classic;14,99 EUR;Envío no especificado;desde Alemania;
