Gb-NBA Jam para Nintendo GameBoy;6,95 EUR;+ 6,50 EUR de envío;Vendidos  16 sep 2021Artículo vendido;desde Alemania;
Nintendo Gameboy Color Classic juego/NBA Jam 99;4,95 EUR;+ 6,00 EUR de envío;Vendidos  14 sep 2021Artículo vendido;desde Alemania;
GBC-NBA Jam 99 para Nintendo Gameboy Color;4,95 EUR;+ 9,95 EUR de envío;Vendidos  4 sep 2021Artículo vendido;desde Alemania;
NBA Jam 2002 video juego para Nintendo Game Boy Advance GBA PAL;6,34 EUR;+ 16,44 EUR de envío estimado;Vendidos  26 ago 2021Artículo vendido;desde Reino Unido;
7 Game Boy Advance juegos no demostrado Yu-Gi-Oh Tekken Advance NBA Jam Bob Esponja;15,50 EUR;Envío no especificado;Vendidos  15 ago 2021Artículo vendido;desde Alemania;
Gb-NBA Jam para Nintendo GameBoy;6,95 EUR;+ 6,50 EUR de envío;Vendidos  7 jul 2021Artículo vendido;desde Alemania;
NBA Jam 2002 video juego para Nintendo Game Boy Advance GBA PAL Probado;6,97 EUR;+ 16,45 EUR de envío estimado;Vendidos  24 jun 2021Artículo vendido;desde Reino Unido;
NBA Jam Te (Nintendo Game Boy, 1994);7,51 EUR;Envío gratis;Vendidos  20 sep 2021Artículo vendido;desde Estados Unidos;
NBA Jam (Nintendo Gameboy, 1994) * con manual * caja de video juego & Carro De Baloncesto;12,58 EUR;Envío gratis;Vendidos  19 sep 2021Artículo vendido;desde Estados Unidos;
NBA Jam Juego BOY Gameboy-Gran Etiqueta-a124;4,26 EUR;+ 3,71 EUR de envío;Vendidos  19 sep 2021Artículo vendido;desde Estados Unidos;
NBA Jam 2001 (Nintendo Game Boy Color GBC) Manual de instrucciones;5,11 EUR;Envío gratis;Vendidos  18 sep 2021Artículo vendido;desde Estados Unidos;
NBA Jam: edición del torneo-Nintendo Game Boy-Caja y manual ONLY-Sin juego;29,84 EUR;Envío gratis;Vendidos  18 sep 2021Artículo vendido;desde Estados Unidos;
NBA Jam (Nintendo Game Boy, 1994) Sólo Cartucho;9,34 EUR;Envío gratis;Vendidos  15 sep 2021Artículo vendido;desde Estados Unidos;
NBA Jam Acclaim Game Boy GameBoy Juego Con Caja + Manual de instrucciones NES;42,64 EUR;Envío gratis;Vendidos  13 sep 2021Artículo vendido;desde Estados Unidos;
NBA Jam (Nintendo Game Boy probado, 1994);0,84 EUR;+ 4,69 EUR de envío;Vendidos  12 sep 2021Artículo vendido;desde Estados Unidos;
NBA Jam-Nintendo Game Boy Auténtico-Color;5,12 EUR;+ 3,80 EUR de envío;Vendidos  9 sep 2021Artículo vendido;desde Estados Unidos;
NBA Jam 2002 (Nintendo Game Boy Advance probado y auténtico, 2002);5,97 EUR;+ 2,72 EUR de envío;Vendidos  8 sep 2021Artículo vendido;desde Estados Unidos;
Lote De Gameboy CAJA E INSTRUCCIONES NBA Jam Te & Caesar's Palace aceptable;12,79 EUR;+ 5,11 EUR de envío;Vendidos  8 sep 2021Artículo vendido;desde Estados Unidos;
NBA Jam 99 (Nintendo Game Boy Color, 1999) Completo Cartucho en Caja Buen Estado Probado;19,61 EUR;Envío gratis;Vendidos  7 sep 2021Artículo vendido;desde Estados Unidos;
NBA Jam (Nintendo Game Boy, 1994) suelto;11,08 EUR;Envío gratis;Vendidos  7 sep 2021Artículo vendido;desde Estados Unidos;
NBA Jam (Nintendo Game Boy, 1994) Original Equipment Manufacturer Cartucho probado auténtico Nintendo GB;5,72 EUR;+ 3,80 EUR de envío;Vendidos  4 sep 2021Artículo vendido;desde Estados Unidos;
NBA Jam 2002 (Nintendo Game Boy Advance, 2002);7,24 EUR;Envío gratis;Vendidos  3 sep 2021Artículo vendido;desde Estados Unidos;
NBA Jam-Nintendo Game Boy Auténtico-Color;8,53 EUR;Envío gratis;Vendidos  29 ago 2021Artículo vendido;desde Estados Unidos;
NBA Jam (Nintendo Game Boy, 1994) Original Equipment Manufacturer Cartucho probado auténtico Nintendo GB;8,52 EUR;Envío gratis;Vendidos  29 ago 2021Artículo vendido;desde Estados Unidos;
NBA Jam Acclaim Game Boy GameBoy Juego Con Caja + Manual de instrucciones!! casi Como Nuevo!!!;34,11 EUR;+ 4,35 EUR de envío;Vendidos  26 ago 2021Artículo vendido;desde Estados Unidos;
NBA Jam 99 Nintendo Game Boy;3,80 EUR;+ 2,98 EUR de envío;Vendidos  25 ago 2021Artículo vendido;desde Estados Unidos;
NBA Jam 99 (Nintendo Game Boy Color, 1999) Cartucho De Juego;6,78 EUR;Envío gratis;Vendidos  25 ago 2021Artículo vendido;desde Estados Unidos;
NBA Jam Te (Nintendo Game Boy, 1994) Envío Gratuito;8,53 EUR;Envío gratis;Vendidos  24 ago 2021Artículo vendido;desde Estados Unidos;
NBA Jam (Nintendo Game Boy probado auténtico, 1994);12,75 EUR;Envío gratis;Vendidos  24 ago 2021Artículo vendido;desde Estados Unidos;
NBA Jam 99 Nintendo Game Boy Color * limpiado & Probado *;8,50 EUR;Envío gratis;Vendidos  22 ago 2021Artículo vendido;desde Estados Unidos;
