NINTENDO GAME BOY-Jack Nicklaus Golf (en Caja);46,58 EUR;Envío internacional gratis;Vendidos  8 sep 2021Artículo vendido;desde Reino Unido;
Jack Nicklaus Golf (Nintendo Game Boy, 1992);5,97 EUR;+ 3,80 EUR de envío;Vendidos  27 ago 2021Artículo vendido;desde Estados Unidos;
Jack Nicklaus Golf Nueva fábrica sellada Nintendo Game Boy Nuevo en caja Rare Gameboy;221,71 EUR;+ 10,23 EUR de envío;Vendidos  14 ago 2021Artículo vendido;desde Estados Unidos;
Jack Nicklaus Golf (Nintendo Game Boy, 1992). probado, auténtico, solo carro;2,55 EUR;+ 3,80 EUR de envío;Vendidos  11 ago 2021Artículo vendido;desde Estados Unidos;
Jack Nicklaus Golf NINTENDO NES limpiado & probado PAL un;3,49 EUR;+ 18,70 EUR de envío estimado;Vendidos  6 sep 2021Artículo vendido;desde Reino Unido;
Jack Nicklaus Golf para el cartucho de Super Nintendo Usa;4,65 EUR;+ 16,45 EUR de envío estimado;Vendidos  31 ago 2021Artículo vendido;desde Reino Unido;
Para Hombre conjunto completo de Jack Nicklaus Golf Clubs;186,54 EUR;+ 62,76 EUR de envío estimado;Vendidos  17 jul 2021Artículo vendido;desde Reino Unido;
