GameBoy Color Juego Kawaii Pet Shop Monogatari 2 Japón En Caja Perfecto Estado;23,18 EUR;Envío internacional gratis;desde Alemania;
Kawaii Pet Shop Monogatari 2 Carro (japonés) - Nintendo Game Boy Color Japón;5,21 EUR;Envío no especificado;desde Reino Unido;
GameBoy Color game - Kawaii Pet Shop Monogatari 2 JAPAN boxed  MINT CONDITION;22,92 EUR;Envío internacional gratis;desde Alemania;
GameBoy Color Juego-Kawaii Pet Shop Monogatari 2 Japón En Caja Perfecto Estado;20,55 EUR;Envío internacional gratis;desde Alemania;
Nintendo GameBoy Color - Kawaii Pet Shop Monogatari 2 JAPAN cartouche utilisé;26,99 EUR;Envío internacional gratis;desde Alemania;
Nintendo GameBoy Color - Kawaii Pet Shop Monogatari 2 JAPAN cartuccia usato;28,99 EUR;Envío internacional gratis;desde Alemania;
GameBoy Color Kawaii Pet Shop Monogatari 2 JAPAN en el embalaje usado COMO NUEVO;28,99 EUR;Envío internacional gratis;desde Alemania;
Nintendo GameBoy Color Juego Kawaii Pet Shop Monogatari 2 Cartucho de Japón;23,18 EUR;Envío internacional gratis;desde Alemania;
Nintendo GameBoy Color Juego-Kawaii Pet Shop Monogatari 2 Cartucho de Japón;20,55 EUR;Envío internacional gratis;desde Alemania;
Nintendo GameBoy Color game - Kawaii Pet Shop Monogatari 2 JAPAN cartridge;22,92 EUR;Envío internacional gratis;desde Alemania;
GameBoy Color Kawaii Pet Shop Monogatari 2 JAPAN dans l'emballage utilisÃ© COMME;26,99 EUR;Envío internacional gratis;desde Alemania;
GameBoy Color Kawaii Pet Shop Monogatari 2 JAPAN nell'imballaggio usato COME NUO;28,99 EUR;Envío internacional gratis;desde Alemania;
Nintendo GameBoy Color juego - Kawaii Pet Shop Monogatari 2 JAPAN cartucho usado;28,99 EUR;Envío internacional gratis;desde Alemania;
Kawaii Pet Shop Monogatari 2 Gameboy Color DMG-bmnj-Envío gratuito Japón auténtica;7,28 EUR;Envío gratis;desde Estados Unidos;
Game Boy Colour Nintendo-Kawaii Pet Shop Monogatari 2-versión De Japón Completo;37,83 EUR;+ 17,13 EUR de envío;desde España;
Usado GAMEBOY COLOR Kawaii Pet Shop Monogatari 2 Juegos Set 1 2 Taito GBC De Jp;21,41 EUR;+ 17,13 EUR de envío;desde Japón;
Gameboy Color Nintendo Kawaii Pet Shop Monogatari 2 GB;34,27 EUR;+ 14,56 EUR de envío;desde Japón;
