Prince of Persia (Nintendo Game Boy Color, 1999) Completo En Caja;35,01 EUR;+ 17,02 EUR de envío estimado;desde Reino Unido;
Game Boy Color-Prince of Persia-Top-pataco Box-Embalaje original-nuevo-VGA Ready;649,90 EUR;Envío no especificado;desde Alemania;
Prince of Persia (Game Boy Color GBC 1999) Solo cartucho;22,00 EUR;+ 12,90 EUR de envío;desde España;
Prince of Persia Nintendo Gameboy Color Advance Juego, Genuine! gc!;17,28 EUR;+ 16,70 EUR de envío estimado;desde Reino Unido;
Prince of Persia (Nintendo Game Boy Color, 1999) Caja completa, Manual y Juego.;25,00 EUR;+ 25,00 EUR de envío;desde España;
Nintendo Game Boy Color/Gameboy Prince of Persia instrucciones cómo jugar;6,99 EUR;+ 10,00 EUR de envío;desde Alemania;
Guía de Prince of Persia para Gameboy Color;5,99 EUR;+ 9,99 EUR de envío;desde Alemania;
Prince of Persia (Nintendo Game Boy Color, 1999) suelto probado y de trabajo;11,09 EUR;+ 4,27 EUR de envío;desde Estados Unidos;
Prince of Persia Nintendo Game Boy Color GBC Cart Cleaned Tested Authentic;16,80 EUR;+ 3,36 EUR de envío;desde Canadá;
Prince of Persia-Nintendo Game Boy Juego Auténtico-Color GBA;14,50 EUR;Envío gratis;desde Estados Unidos;
Nintendo Game Boy Color Jordan Mechner's Prince of Persia Nuevo Sellado;115,24 EUR;+ 5,08 EUR de envío;desde Estados Unidos;
Prince of Persia-Nintendo Game Boy Juego Auténtico-Color GBA;7,68 EUR;+ 4,27 EUR de envío;desde Estados Unidos;
Prince of Persia Nintendo Game Boy Color GBC Cart Cleaned Tested Authentic;15,46 EUR;+ 5,38 EUR de envío;desde Canadá;
Prince of Persia Nintendo Gameboy Game Boy Color 1999 Suelto Probado Funcionando ESRB;16,21 EUR;Envío gratis;desde Estados Unidos;
Nintendo Game Boy Color Jordan Mechner's Prince of Persia Nueva Sellado GBC;597,59 EUR;Envío gratis;desde Estados Unidos;
Prince of Persia (Nintendo Game Boy Color, 1999) suelto probado y de trabajo;11,82 EUR;Envío gratis;desde Estados Unidos;
Prince of Persia con Estuche Nintendo Game Boy Color limpiado & probado Auténtico;21,33 EUR;Envío gratis;desde Estados Unidos;
Wings Of Fury/Prince of Persia Game Boy Color 1999 Print Ad/cartel GBC Pop Art;11,52 EUR;Envío gratis;desde Estados Unidos;
Game Boy Color Prince of Persia Manual;12,80 EUR;+ 2,72 EUR de envío;desde Estados Unidos;
Prince of Persia (Nintendo Game Boy Color, 1999) - Game Only;18,82 EUR;+ 9,41 EUR de envío;desde Canadá;
Prince of Persia (Nintendo Game Boy Color, 1999 Gameboy)-Cart Only ;17,99 EUR;+ 4,03 EUR de envío;desde Canadá;
Prince of Persia (Nintendo Game Boy Color, 1999);16,80 EUR;+ 1,34 EUR de envío;desde Canadá;
Prince of Persia (Game Boy Colour GBC 1999) Solo Cartucho;35,97 EUR;Envío internacional gratis;desde España;
Prince of Persia-auténtico-NINTENDO GAME BOY COLOR GBC-Solo Manual! OGB;28,09 EUR;Envío gratis;desde Estados Unidos;
Prince of Persia (solo manual, sin juego) Nintendo Game Boy Color;7,67 EUR;Envío gratis;desde Estados Unidos;
1999 ANUNCIO IMPRESO DE COLECCIÓN-Game Boy Color ad.. alas de furia.. Prince of Persia;11,74 EUR;Envío gratis;desde Estados Unidos;
Game Boy Color GBC Game CASE ONLY - Prince of Persia (AU);8,63 EUR;+ 17,01 EUR de envío;desde Australia;
Prince of Persia (Nintendo Game Boy Color, 1999) - Game Only;19,16 EUR;+ 10,09 EUR de envío;desde Canadá;
Gameboy Color-Prince of Persia (Mindscape, 1999) suelto;13,66 EUR;+ 5,98 EUR de envío;desde Estados Unidos;
Prince of Persia Nintendo Game Boy;24,90 EUR;+ 5,50 EUR de envío;desde Francia;
Nintendo Game Boy Advance Prince of Persia con embalaje original y guía EUR;24,90 EUR;+ 8,99 EUR de envío;desde Alemania;
Prince of Persia de vídeo juego para Super Nintendo SNES PAL Probado en Caja;40,85 EUR;+ 17,13 EUR de envío estimado;desde Reino Unido;
Prince of Persia-Xbox 360 Juego-Envío Gratis;5,83 EUR;+ 16,50 EUR de envío estimado;desde Reino Unido;
Nintendo Game Boy Advance GBA * Prince of Persia-the Sands of Time * OVP cib;25,00 EUR;Envío no especificado;desde Alemania;
Prince of Persia Guerrero dentro-Sony PS2 Disco de Juego-Completo con Manual!;6,18 EUR;+ 18,28 EUR de envío estimado;desde Reino Unido;
Nuevo anuncioSega Game Gear Juego-Prince of Persia;2,57 EUR;+ 32,76 EUR de envío estimado;desde Reino Unido;
Nuevo anuncioPrince of Persia: las Arenas De Tiempo (Sony PS2 Video Juego, 2003);1,16 EUR;+ 18,27 EUR de envío estimado;desde Reino Unido;
Prince of Persia de vídeo juego para Nintendo Game Boy Probado;21,00 EUR;+ 16,77 EUR de envío estimado;desde Reino Unido;
Prince of Persia Game Boy Spiel #3132;22,98 EUR;+ 15,42 EUR de envío;desde Suiza;
Prince of Persia-solo Carro-Nintendo Game Boy GB;15,75 EUR;+ 16,67 EUR de envío estimado;desde Reino Unido;
Prince of Persia Las Arenas De Tiempo Original Antiguo Xbox Juego Chicos Chicas Marron;4,66 EUR;+ 18,76 EUR de envío estimado;desde Reino Unido;
Prince of Persia Nintendo Game Boy Juego;26,84 EUR;+ 21,01 EUR de envío;desde Reino Unido;
Prince of Persia Las Arenas Olvidadas Xbox 360 Chicos Juego Acción Marron;2,32 EUR;+ 18,72 EUR de envío estimado;desde Reino Unido;
Video Juego 💎 🌟 PSP Prince of Persia: rival espadas 🌟 💎 Caja Y Manual Incluido;15,83 EUR;+ 23,29 EUR de envío;desde Reino Unido;
Prince of Persia Las Arenas De Tiempo Nintendo Game Boy Advance GBA Carro Genuino;8,17 EUR;+ 18,86 EUR de envío estimado;desde Reino Unido;
Prince of Persia & Tomb Raider-JUEGO NINTENDO GAME BOY ADVANCE GBA Multi 5;13,95 EUR;+ 16,64 EUR de envío estimado;desde Reino Unido;
Prince of Persia Guerrero dentro-Playstatio. 2 Juego Completo;6,99 EUR;+ 16,51 EUR de envío estimado;desde Reino Unido;
Prince of Persia: las dos tronos Xbox Juego Sin Manual + Guerrero dentro de disco;1,40 EUR;+ 32,92 EUR de envío estimado;desde Reino Unido;
Prince of Persia Las Arenas De Tiempo Nintendo Game Boy Advance GBA Carro Genuino;8,17 EUR;+ 16,53 EUR de envío estimado;desde Reino Unido;
Prince of Persia GAME GEAR JUEGO-trabajo-sólo Juego-Envío Gratis;11,62 EUR;+ 16,60 EUR de envío estimado;desde Reino Unido;
NINTENDO GAME BOY ADVANCE GBA-Prince of Persia Las Arenas De Tiempo solo carro;8,11 EUR;+ 16,53 EUR de envío estimado;desde Reino Unido;
Nuevo anuncioSONY PSP Prince of Persia Revelations JUEGO 16YRS +;15,76 EUR;+ 34,94 EUR de envío estimado;desde Reino Unido;
Prince of Persia Arenas De Tiempo Guerrero dentro de dos tronos PS2 PAL 3 Paquete De Juegos;17,45 EUR;+ 20,79 EUR de envío estimado;desde Reino Unido;
Prince of Persia Las Arenas De Tiempo Nintendo Game Boy Advance GBA Carro Genuino;9,33 EUR;+ 16,56 EUR de envío estimado;desde Reino Unido;
