Prince of Persia (Nintendo Game Boy Color, 1999) Completo En Caja;34,77 EUR;+ 16,90 EUR de envío estimado;desde Reino Unido;
Game Boy Color-Prince of Persia-Top-pataco Box-Embalaje original-nuevo-VGA Ready;649,90 EUR;Envío no especificado;desde Alemania;
Prince of Persia (Game Boy Color GBC 1999) Solo cartucho;22,00 EUR;+ 12,90 EUR de envío;desde España;
Prince of Persia Nintendo Gameboy Color Advance Juego, Genuine! gc!;17,16 EUR;+ 16,58 EUR de envío estimado;desde Reino Unido;
Nintendo Game Boy Color/Gameboy Prince of Persia instrucciones cómo jugar;6,99 EUR;+ 10,00 EUR de envío;desde Alemania;
Nuevo anuncioPrince of Persia (Nintendo Game Boy Color, 1999);12,84 EUR;+ 10,76 EUR de envío;desde Estados Unidos;
Prince of Persia (Nintendo Game Boy Color, 1999) suelto probado y de trabajo;11,13 EUR;+ 4,28 EUR de envío;desde Estados Unidos;
Prince of Persia-Nintendo Game Boy Juego Auténtico-Color GBA;14,55 EUR;Envío gratis;desde Estados Unidos;
Prince of Persia Nintendo Game Boy Color GBC Cart Cleaned Tested Authentic;16,85 EUR;+ 3,37 EUR de envío;desde Canadá;
Nintendo Game Boy Color Jordan Mechner's Prince of Persia Nuevo Sellado;115,64 EUR;+ 5,10 EUR de envío;desde Estados Unidos;
Prince of Persia Nintendo Game Boy Color GBC Cart Cleaned Tested Authentic;15,51 EUR;+ 5,40 EUR de envío;desde Canadá;
Nintendo Game Boy Color Jordan Mechner's Prince of Persia Nueva Sellado GBC;582,51 EUR;Envío gratis;desde Estados Unidos;
Prince of Persia Nintendo Gameboy Game Boy Color 1999 Suelto Probado Funcionando ESRB;16,27 EUR;Envío gratis;desde Estados Unidos;
Prince of Persia con Estuche Nintendo Game Boy Color limpiado & probado Auténtico;21,41 EUR;Envío gratis;desde Estados Unidos;
Prince of Persia (Nintendo Game Boy Color, 1999) suelto probado y de trabajo;11,86 EUR;desde Estados Unidos;
Wings Of Fury/Prince of Persia Game Boy Color 1999 Print Ad/cartel GBC Pop Art;11,56 EUR;desde Estados Unidos;
Game Boy Color Prince of Persia Manual;12,84 EUR;+ 2,73 EUR de envío;desde Estados Unidos;
Prince of Persia (Nintendo Game Boy Color, 1999) - Game Only;18,88 EUR;+ 9,44 EUR de envío;desde Canadá;
Prince of Persia (Nintendo Game Boy Color, 1999 Gameboy)-Cart Only ;18,04 EUR;+ 4,05 EUR de envío;desde Canadá;
Prince of Persia (Nintendo Game Boy Color, 1999);16,85 EUR;+ 1,34 EUR de envío;desde Canadá;
Prince of Persia-auténtico-NINTENDO GAME BOY COLOR GBC-Solo Manual! OGB;28,18 EUR;Envío gratis;desde Estados Unidos;
Prince of Persia (Game Boy Colour GBC 1999) Solo Cartucho;35,72 EUR;Envío internacional gratis;desde España;
Prince of Persia (solo manual, sin juego) Nintendo Game Boy Color;7,70 EUR;Envío gratis;desde Estados Unidos;
1999 ANUNCIO IMPRESO DE COLECCIÓN-Game Boy Color ad.. alas de furia.. Prince of Persia;11,78 EUR;desde Estados Unidos;
Game Boy Color GBC Game CASE ONLY - Prince of Persia (AU);8,65 EUR;+ 17,05 EUR de envío;desde Australia;
Prince of Persia (Nintendo Game Boy Color, 1999) - Game Only;19,21 EUR;+ 10,12 EUR de envío;desde Canadá;
Gameboy Color-Prince of Persia (Mindscape, 1999) suelto;13,71 EUR;+ 6,00 EUR de envío;desde Estados Unidos;
Prince of Persia Nintendo Game Boy Juego;26,66 EUR;+ 20,87 EUR de envío;desde Reino Unido;
Nintendo Game Boy Advance Prince of Persia con embalaje original y guía EUR;24,90 EUR;+ 8,99 EUR de envío;desde Alemania;
Prince of Persia de vídeo juego para Super Nintendo SNES PAL Probado en Caja;40,57 EUR;+ 17,01 EUR de envío estimado;desde Reino Unido;
Prince of Persia de vídeo juego para Nintendo Game Boy Probado;20,86 EUR;+ 16,65 EUR de envío estimado;desde Reino Unido;
Nuevo anuncioNintendo Game Boy Classic juego Prince of Persia con embalaje original y guía Noe;99,90 EUR;+ 36,99 EUR de envío;desde Alemania;
Prince of Persia Game Boy Spiel #3132;22,97 EUR;+ 15,40 EUR de envío;desde Suiza;
Prince of Persia-Xbox 360 Juego-Envío Gratis;5,79 EUR;+ 16,38 EUR de envío estimado;desde Reino Unido;
Prince of Persia: las Arenas De Tiempo De Juego Para Sony PlayStation PS2 Pal probado;4,63 EUR;+ 16,36 EUR de envío estimado;desde Reino Unido;
Prince of Persia Guerrero dentro-Sony PS2 Disco de Juego-Completo con Manual!;6,13 EUR;+ 18,16 EUR de envío estimado;desde Reino Unido;
Prince of Persia Las Arenas De Tiempo Original Antiguo Xbox Juego Chicos Chicas Marron;4,63 EUR;+ 18,63 EUR de envío estimado;desde Reino Unido;
Prince of Persia-solo Carro-Nintendo Game Boy GB;15,64 EUR;+ 16,56 EUR de envío estimado;desde Reino Unido;
Prince of Persia Las Arenas Olvidadas Xbox 360 Chicos Juego Acción Marron;2,31 EUR;+ 18,59 EUR de envío estimado;desde Reino Unido;
Prince of Persia Nintendo Game Boy;24,90 EUR;+ 5,50 EUR de envío;desde Francia;
Prince of Persia Las Arenas De Tiempo Nintendo Game Boy Advance GBA Carro Genuino;8,12 EUR;+ 18,73 EUR de envío estimado;desde Reino Unido;
Nuevo anuncioPrince of Persia game gear juego;4,38 EUR;+ 33,84 EUR de envío estimado;desde Reino Unido;
Sega Game Gear Juego-Prince of Persia;3,71 EUR;+ 32,55 EUR de envío estimado;desde Reino Unido;
Prince of Persia Las Arenas De Tiempo Nintendo Game Boy Advance GBA Carro Genuino;8,12 EUR;+ 16,42 EUR de envío estimado;desde Reino Unido;
Prince of Persia Guerrero dentro-Playstatio. 2 Juego Completo;6,95 EUR;+ 16,39 EUR de envío estimado;desde Reino Unido;
Prince of Persia & Tomb Raider-JUEGO NINTENDO GAME BOY ADVANCE GBA Multi 5;13,86 EUR;+ 16,52 EUR de envío estimado;desde Reino Unido;
Prince of Persia Steelbook edición PS3-Raro Juego De Video;17,38 EUR;+ 20,65 EUR de envío estimado;desde Reino Unido;
Nuevo anuncioPrince of Persia-Sega Game Gear (Cartucho Solamente);8,70 EUR;+ 4,64 EUR de envío;desde Reino Unido;
NINTENDO GAME BOY ADVANCE GBA-Prince of Persia Las Arenas De Tiempo solo carro;8,06 EUR;+ 16,42 EUR de envío estimado;desde Reino Unido;
Prince of Persia Arenas De Tiempo Guerrero dentro de dos tronos PS2 PAL 3 Paquete De Juegos;17,33 EUR;+ 20,65 EUR de envío estimado;desde Reino Unido;
