Nintendo Game Boy Advance Soccer Mania USA Bon état;4,90 EUR;+ 14,98 EUR de envío;desde Francia;
Nintendo GameBoy Advance juego - Lego Soccer Mania cartucho usado;38,99 EUR;+ 69,99 EUR de envío;desde Alemania;
Game Boy ★ Soccer Mania  ★ PAL;4,99 EUR;Envío no especificado;desde España;
Soccer Mania Nintendo Game Boy japonés de importación;12,74 EUR;+ 1,66 EUR de envío;desde Estados Unidos;
Soccer Boy / Soccer Mania (Nintendo Game Boy GB, 1990) Japan Import;5,35 EUR;+ 3,85 EUR de envío;desde Canadá;
Soccer Mania LEGO (Nintendo Game Boy Advance, 2002) GBA Cartridge;5,02 EUR;+ 7,36 EUR de envío;desde Canadá;
Nintendo Game Boy Soccer Mania Juego (DMG-sb-EE. UU.) Sony Imagesoft 1992 (G014);6,84 EUR;+ 3,57 EUR de envío;desde Estados Unidos;
Soccer Mania (Nintendo Game Boy Advance, 2002 GBA)-Cart Only ;13,38 EUR;