GBC-Magical Tetris Challenge para Nintendo Gameboy Color;29,95 EUR;+ 6,50 EUR de envío;desde Alemania;
Magical Tetris Challenge-Game Boy Color-módulo-GameBoy GBC #c2;19,95 EUR;Envío no especificado;desde Alemania;
Magical Tetris Challenge instrucciones cuadernillo Nintendo Gameboy Color GBC Game Boy;26,99 EUR;Envío no especificado;desde Alemania;
Magical Tetris Challenge Nintendo Game Boy Color Caja Manual-sin bandeja interior;56,04 EUR;Envío gratis;desde Estados Unidos;
Magical Tetris Challenge-Game Boy Color batería de trabajo guardar GBC Capcom;17,20 EUR;Envío gratis;desde Estados Unidos;
Magical Tetris Challenge (Nintendo Game Boy Color, 2000) Carro Y Manual;29,32 EUR;+ 3,62 EUR de envío;desde Estados Unidos;
Magical Tetris Challenge juego Boy Color;15,50 EUR;+ 3,41 EUR de envío;desde Estados Unidos;
Magical Tetris Challenge (Nintendo Game Boy Color, 2000);14,14 EUR;+ 4,10 EUR de envío;desde Estados Unidos;
