Disney Magical Tetris Challenge Gameboy Color GBC Nintendo PAL;13,00 EUR;Envío no especificado;Vendidos  16 ago 2021Artículo vendido;desde Francia;
Jeu Nintendo Game Boy Color - Magical Tetris Challenge - Complet - CIB;29,90 EUR;+ 12,80 EUR de envío;Vendidos  16 ago 2021Artículo vendido;desde Francia;
Disney Magical Tetris Challenge GBC Game boy Color PAL Eur Envio Combinado Leer;56,90 EUR;Envío no especificado;Vendidos  7 jul 2021Artículo vendido;desde España;
Magical Tetris Challenge (Nintendo Game Boy Color, 2000);17,25 EUR;+ 2,76 EUR de envío;Vendidos  2 oct 2021Artículo vendido;desde Estados Unidos;
Magical Tetris Challenge juego Boy Color;15,50 EUR;+ 3,41 EUR de envío;Vendidos  19 sep 2021Artículo vendido;desde Estados Unidos;
Magical Tetris Challenge Nintendo Game Boy Color * Auténtico y ahorra * duro encontrar!;17,22 EUR;Envío gratis;Vendidos  18 sep 2021Artículo vendido;desde Estados Unidos;
Magical Tetris Challenge Completo auténticas (Nintendo Game Boy Color, 2000);26,73 EUR;+ 4,74 EUR de envío;Vendidos  13 sep 2021Artículo vendido;desde Estados Unidos;
Magical Tetris Challenge juego Boy Color;14,63 EUR;+ 3,41 EUR de envío;Vendidos  11 sep 2021Artículo vendido;desde Estados Unidos;
Magical Tetris Challenge Gameboy Color cartucho sólo;14,62 EUR;Envío gratis;Vendidos  25 ago 2021Artículo vendido;desde Estados Unidos;
Magical Tetris Challenge GameBoy Color -! envío Gratis!;14,62 EUR;Envío gratis;