GBC-Magical Tetris Challenge para Nintendo Gameboy Color;29,95 EUR;+ 6,50 EUR de envío;desde Alemania;
Magical Tetris Challenge-Game Boy Color-módulo-GameBoy GBC #c2;19,95 EUR;Envío no especificado;desde Alemania;
Magical Tetris Challenge instrucciones cuadernillo Nintendo Gameboy Color GBC Game Boy;26,99 EUR;Envío no especificado;desde Alemania;
Magical Tetris Challenge-Game Boy Color batería de trabajo guardar GBC Capcom;20,38 EUR;Envío gratis;desde Estados Unidos;
Magical Tetris Challenge juego Boy Color;15,29 EUR;+ 3,36 EUR de envío;desde Estados Unidos;
Magical Tetris Challenge (Nintendo Game Boy Color, 2000) Carro Y Manual;28,94 EUR;+ 3,57 EUR de envío;desde Estados Unidos;
Magical Tetris Challenge (Nintendo Game Boy Color, 2000);13,96 EUR;+ 3,79 EUR de envío;desde Estados Unidos;
Magical Tetris Challenge (Nintendo Game Boy Color, 2000);18,72 EUR;+ 3,53 EUR de envío;desde Estados Unidos;
Magical Tetris Challenge GameBoy Color -! envío Gratis!;14,38 EUR;desde Estados Unidos;
Magical Tetris Challenge Gameboy Color Excelente Estado Envío rápido;15,27 EUR;+ 3,40 EUR de envío;desde Estados Unidos;
Magical Tetris Challenge (Nintendo Game Boy Color);16,16 EUR;Envío gratis;desde Estados Unidos;
Magical Tetris Challenge Folleto de instrucciones Manual Para Game Boy Color;5,92 EUR;+ 3,36 EUR de envío;desde Estados Unidos;
Magical Tetris Challenge GBC Manual Nintendo Game Boy Color Disney Mickey Colour;8,72 EUR;+ 1,00 EUR de envío;desde Canadá;
Magical Tetris Challenge Nintendo Game Boy Color 2000 anuncio impreso de colección arte C;12,72 EUR;Envío gratis;desde Estados Unidos;
Magical Tetris Challenge Nintendo Gameboy Color GBC * Solo Manual * Sin Juego;8,51 EUR;Envío gratis;desde Estados Unidos;
Magical Tetris Challenge Nintendo 64 N64 juego PAL Versión;9,35 EUR;+ 6,73 EUR de envío;desde Reino Unido;
Magical Tetris Challenge juego n64 Nintendo 64 PAL;15,21 EUR;+ 16,69 EUR de envío estimado;desde Reino Unido;
Magical Tetris Challenge Disney PS1 Sony Playstation Computer disco de juego PAL;11,69 EUR;+ 17,54 EUR de envío;desde Reino Unido;
