Disney Magical Tetris Challenge Gameboy Color GBC Nintendo PAL;13,00 EUR;Envío no especificado;Vendidos  16 ago 2021Artículo vendido;desde Francia;
Jeu Nintendo Game Boy Color - Magical Tetris Challenge - Complet - CIB;29,90 EUR;+ 12,80 EUR de envío;Vendidos  16 ago 2021Artículo vendido;desde Francia;
Disney Magical Tetris Challenge GBC Game boy Color PAL Eur Envio Combinado Leer;56,90 EUR;Envío no especificado;Vendidos  7 jul 2021Artículo vendido;desde España;
Magical Tetris Challenge juego Boy Color;15,34 EUR;+ 3,37 EUR de envío;Vendidos  19 sep 2021Artículo vendido;desde Estados Unidos;
Magical Tetris Challenge Nintendo Game Boy Color * Auténtico y ahorra * duro encontrar!;17,05 EUR;Envío gratis;Vendidos  18 sep 2021Artículo vendido;desde Estados Unidos;
Magical Tetris Challenge Completo auténticas (Nintendo Game Boy Color, 2000);26,47 EUR;+ 4,44 EUR de envío;Vendidos  13 sep 2021Artículo vendido;desde Estados Unidos;
Magical Tetris Challenge juego Boy Color;14,49 EUR;+ 3,37 EUR de envío;Vendidos  11 sep 2021Artículo vendido;desde Estados Unidos;
Magical Tetris Challenge Gameboy Color cartucho sólo;14,47 EUR;Envío gratis;Vendidos  25 ago 2021Artículo vendido;desde Estados Unidos;
Magical Tetris Challenge GameBoy Color -! envío Gratis!;14,47 EUR;Envío gratis;Vendidos  16 ago 2021Artículo vendido;desde Estados Unidos;
Magical Tetris Challenge Nintendo Game Boy Color 2000 Disney Capcom;12,76 EUR;+ 3,37 EUR de envío;Vendidos  11 ago 2021Artículo vendido;desde Estados Unidos;
Magical Tetris Challenge (Nintendo GameBoy Color) Game Boy Color trabajando Batería Capcom;21,33 EUR;Envío gratis;Vendidos  5 ago 2021Artículo vendido;desde Estados Unidos;
Magical Tetris Challenge (Nintendo Game Boy Color, 2000) Sólo Cartucho;11,09 EUR;+ 4,09 EUR de envío;Vendidos  28 jul 2021Artículo vendido;desde Estados Unidos;
Magical Tetris Challenge (Nintendo GameBoy Color, 2000) Carro. sólo Con Manual;20,48 EUR;Envío gratis;Vendidos  27 jul 2021Artículo vendido;desde Estados Unidos;
Magical Tetris Challenge (Nintendo Game Boy Color, 2000) Capcom Probado Funcionando;14,51 EUR;+ 1,70 EUR de envío;Vendidos  18 jul 2021Artículo vendido;desde Estados Unidos;
Game Boy Color, Magical Tetris Challenge, Con Caja E Insertos! jugable!;42,69 EUR;+ 3,41 EUR de envío;Vendidos  12 jul 2021Artículo vendido;desde Estados Unidos;
Magical Tetris Challenge-Nintendo Game Boy Color Juego-Probado Funciona;8,54 EUR;+ 4,23 EUR de envío;Vendidos  7 jul 2021Artículo vendido;desde Estados Unidos;
Magical Tetris Challenge | Sony PlayStation 1 juego PS1;17,50 EUR;+ 12,77 EUR de envío;Vendidos  28 jun 2021Artículo vendido;desde Reino Unido;
