Juego Nintendo GAME BOY Color GBC Bomberman Quest Versión Japonesa dmg-ab5j-jpn;9,95 EUR;+ 20,95 EUR de envío;desde España;
Bomberman Quest & Bolsillo Bomberman NINTENDO GAMEBOY COLOR & DMG Japón Importación;14,02 EUR;+ 16,69 EUR de envío estimado;desde Reino Unido;
Nintendo GameBoy Color juego - Bomberman Quest JAPAN cartucho usado;28,99 EUR;Envío internacional gratis;desde Alemania;
Nintendo Gameboy Color (GBC) // Bomberman Quest-instrucciones/instructions/dt. PAL;7,99 EUR;+ 5,99 EUR de envío;desde Alemania;
Bomberman Quest (Nintendo Game Boy Color, 1999);93,72 EUR;+ 3,66 EUR de envío;desde Estados Unidos;
Nintendo Game Boy Color Bomberman Quest DMG-AB5J-JPN importación Japón jp Envío Gratis;10,22 EUR;Envío gratis;desde Estados Unidos;
Gameboy Color Nintendo Bomberman Quest GB de Hudson;34,08 EUR;+ 14,48 EUR de envío;desde Japón;
Bomberman Quest-Nintendo Game Boy Color-NTSC JAP-B-Ware;9,99 EUR;+ 0,99 EUR de envío;desde Austria;
Bomberman Quest Juego Boy Color GBC Japón nueva batería de vendedor de Estados Unidos;12,77 EUR;Envío gratis;desde Estados Unidos;
Bomberman Quest Juego Boy Color GBC Japón nueva batería de vendedor de Estados Unidos;12,77 EUR;Envío gratis;desde Estados Unidos;
Bomberman Quest (DMG-AB5J-JPN) para Game Boy Color * Versión Japonesa * Vendedor de EE. UU.;12,77 EUR;+ 3,79 EUR de envío;desde Estados Unidos;
Game Boy Colour Nintendo-Bomberman Quest-Versión Japonesa;32,90 EUR;+ 17,04 EUR de envío;desde España;
Bomberman Quest Gameboy Color Nintendo 089 GB;25,56 EUR;+ 14,48 EUR de envío;desde Japón;
Gameboy Color Nintendo Bomberman Quest Cartucho sólo GB;8,52 EUR;+ 14,48 EUR de envío;desde Japón;
Lote de 2 Bomberman Quest Poket Bomberman NINTENDO Game Boy Color Retro De Video;25,55 EUR;+ 15,34 EUR de envío;desde Japón;
Bomberman Quest Hero (Gameboy Color) Japanese. Box, Manual & Cartridge.;33,39 EUR;+ 8,68 EUR de envío;desde Canadá;
Nintendo Game Boy GB Color Japón Bomberman Quest;24,28 EUR;+ 15,34 EUR de envío;desde Japón;
Bomberman Quest Gameboy Color Completo En Caja Japón versión!;34,08 EUR;Envío gratis;desde Estados Unidos;
Nintendo Game Boy Color Bomberman Quest DMG-AB5J-JPN importación Japón jp;8,43 EUR;+ 6,82 EUR de envío;desde Japón;
Nintendo GameBoy Color Cartucho De Juego Bomberman Quest Japón;23,41 EUR;Envío internacional gratis;desde Alemania;
Nintendo GameBoy Color Cartucho De Juego Bomberman Quest Japón;20,44 EUR;Envío internacional gratis;desde Alemania;
Nintendo GameBoy Color game - Bomberman Quest JAPAN cartridge;22,71 EUR;Envío internacional gratis;desde Alemania;
Nintendo GameBoy Color gioco - Bomberman Quest JAPAN cartuccia usato;28,99 EUR;Envío internacional gratis;desde Alemania;
Nintendo GameBoy Color jeu - Bomberman Quest JAPAN cartouche utilisé;26,99 EUR;Envío internacional gratis;desde Alemania;
GameBoy Color - Bomberman Quest Cartridge Japan;17,35 EUR;+ 9,30 EUR de envío;desde Australia;
Bomberman Quest Bomber Man Hudson Nintendo Game Boy Color Gbc En Caja;16,37 EUR;+ 21,30 EUR de envío;desde Japón;
