NINTENDO GAME BOY COLOR & ADVANCE - Pocket Soccer;4,90 EUR;+ 18,90 EUR de envío;desde Italia;
Notice Nintendo Game Boy Color Pocket Soccer EUR Très Bon état;4,90 EUR;+ 11,98 EUR de envío;desde Francia;
Nintendo Game Boy Color Pocket Soccer EUR Très Bon état;3,90 EUR;+ 11,98 EUR de envío;desde Francia;
Pocket Soccer Nintendo Game Boy Color juego muy buen estado probado;4,99 EUR;+ 9,99 EUR de envío;desde Alemania;
Nintendo GameBoy Color juego - Pocket Soccer cartucho usado;14,99 EUR;Envío internacional gratis;desde Alemania;
Nintendo GameBoy Color juego - Pocket Soccer en el embalaje usado;28,99 EUR;Envío internacional gratis;desde Alemania;
Pocket Soccer, Nintendo Game Boy Color, Pal-eur;4,95 EUR;Envío no especificado;desde España;
Pocket Soccer gameboy color Game Boy juegos rayo GBC envío módulo de fútbol;6,90 EUR;Envío no especificado;desde Alemania;
Pocket Soccer Nintendo GameBoy GB Color PAL FR;5,00 EUR;Envío no especificado;desde Francia;
GameBoy Color.Pocket Soccer;10,00 EUR;Envío no especificado;desde España;
Pocket Soccer Gameboy Color/Colour game GBC oz271;18,74 EUR;+ 16,90 EUR de envío;desde Australia;
Pocket Soccer Gameboy Color / GBC;9,99 EUR;+ 15,10 EUR de envío;desde Austria;
Nintendo GameBoy Color game - Pocket Soccer cartridge;8,84 EUR;Envío internacional gratis;desde Alemania;
Nintendo GameBoy Color jeu - Pocket Soccer cartouche utilisé;12,99 EUR;Envío internacional gratis;desde Alemania;
Nintendo GameBoy Color gioco - Pocket Soccer cartuccia usato;14,99 EUR;Envío internacional gratis;desde Alemania;
Nintendo GameBoy Color gioco - Pocket Soccer nell'imballaggio usato;28,99 EUR;Envío internacional gratis;desde Alemania;
Nintendo GameBoy Color jeu - Pocket Soccer dans l'emballage utilisé;26,99 EUR;Envío internacional gratis;desde Alemania;
Pocket Soccer (losse cassette) Nintendo GameBoy Color GBC;3,95 EUR;+ 20,00 EUR de envío;desde Países Bajos;
Nintendo GameBoy Color game - Pocket Soccer boxed;23,12 EUR;Envío internacional gratis;desde Alemania;
