Kid Dracula - Nintendo Game Boy - TESTED AND WORKING;59,90 EUR;+ 12,00 EUR de envío;Vendidos  14 sep 2021Artículo vendido;desde Italia;
Kid Dracula USA - Gameboy - Very rare game!;119,00 EUR;+ 20,00 EUR de envío;Vendidos  3 sep 2021Artículo vendido;desde Países Bajos;
GameBoy Kid Dracula-reproducido caja de sustitución;10,20 EUR;+ 5,95 EUR de envío;Vendidos  27 ago 2021Artículo vendido;desde Grecia;
Gameboy Kid Dracula;92,03 EUR;+ 3,70 EUR de envío;Vendidos  24 jul 2021Artículo vendido;desde Alemania;
Kid Dracula - Game Boy GB Nintendo - PAL;69,00 EUR;Envío no especificado;Vendidos  13 jul 2021Artículo vendido;desde Austria;
Kid Dracula, Game Boy, Nintendo, Gameboy;40,50 EUR;Envío no especificado;Vendidos  4 jul 2021Artículo vendido;desde Alemania;
Kid Dracula Nintendo Gameboy Game ;9,99 EUR;Envío no especificado;Vendidos  4 jul 2021Artículo vendido;desde Irlanda;
Kid Dracula per Nintendo Game Boy // DMG-DF-ITA;40,00 EUR;Envío no especificado;Vendidos  25 jun 2021Artículo vendido;desde Italia;
Kid Dracula Nintendo Gameboy Game ;9,99 EUR;Envío no especificado;Vendidos  23 jun 2021Artículo vendido;desde Irlanda;
Gameboy Kid Dracula instrucciones;29,50 EUR;+ 3,70 EUR de envío;Vendidos  19 jun 2021Artículo vendido;desde Alemania;
Gameboy Kid Dracula;55,00 EUR;+ 13,99 EUR de envío;Vendidos  19 jun 2021Artículo vendido;desde Alemania;
Kid Dracula (Nintendo Game Boy, 1993) USA, Authentic Tested;98,09 EUR;+ 10,04 EUR de envío;Vendidos  11 sep 2021Artículo vendido;desde Canadá;
Kid Dracula Nintendo Gameboy Cartucho auténtico de EE. UU. NTSC hecho en Japón;127,47 EUR;Envío gratis;Vendidos  30 ago 2021Artículo vendido;desde Estados Unidos;
Kid Dracula-Gameboy-Manual De Instrucciones-folleto-auténtico-Juego Boy;95,63 EUR;+ 4,42 EUR de envío;Vendidos  30 ago 2021Artículo vendido;desde Estados Unidos;
Kid Dracula EE. UU. NTSC (Nintendo Game Boy) Auténtico Juego Carro GameBoy Konami;169,17 EUR;Envío gratis;Vendidos  29 ago 2021Artículo vendido;desde Estados Unidos;
Kid Dracula (Nintendo Game Boy, 1993) USA, Authentic Tested;142,62 EUR;+ 10,04 EUR de envío;Vendidos  29 ago 2021Artículo vendido;desde Canadá;
Kid Dracula (Nintendo Game Boy) -- Auténtico Juego Carro -- GameBoy;169,97 EUR;Envío gratis;Vendidos  24 ago 2021Artículo vendido;desde Estados Unidos;
Kid Dracula (Nintendo Game Boy, 1993);116,46 EUR;+ 3,66 EUR de envío;Vendidos  19 ago 2021Artículo vendido;desde Estados Unidos;
Kid Dracula Gameboy Color;10,20 EUR;+ 3,78 EUR de envío;Vendidos  10 ago 2021Artículo vendido;desde Estados Unidos;
Kid Dracula (Game Boy, 1993) - Auténtico Importado Japonés, sólo cartucho;34,85 EUR;+ 3,78 EUR de envío;Vendidos  10 ago 2021Artículo vendido;desde Estados Unidos;
Kid Dracula Game Boy Pocket Personalizado OSD IPS LCD V.2 Lote Original Godzilla Raro;83,19 EUR;+ 8,50 EUR de envío;Vendidos  1 ago 2021Artículo vendido;desde Estados Unidos;
Kid Dracula Para Game Boy-Solo Manual GB;39,10 EUR;+ 7,63 EUR de envío;Vendidos  24 jul 2021Artículo vendido;desde Estados Unidos;
Kid Dracula auténtico Nintendo Game Boy GB Carro probado defectos DMG NTSC;80,76 EUR;+ 11,04 EUR de envío;Vendidos  19 jul 2021Artículo vendido;desde Canadá;
Kid Dracula (Nintendo Game Boy, 1993);17,00 EUR;+ 3,78 EUR de envío;Vendidos  17 jul 2021Artículo vendido;desde Estados Unidos;
Kid Dracula Gameboy Nintendo Excelente Estado Original.;174,69 EUR;+ 3,40 EUR de envío;Vendidos  14 jul 2021Artículo vendido;desde Estados Unidos;
Kid Dracula (Nintendo Game Boy, 1993) NTSC (sólo juego auténtico, Probado);148,77 EUR;+ 3,40 EUR de envío;Vendidos  9 jul 2021Artículo vendido;desde Estados Unidos;
AKUMAJOU Special Boku Dracula Kun Kid Dracula Nintendo GB GameBoy Japón Importación;21,24 EUR;+ 11,04 EUR de envío;Vendidos  7 jul 2021Artículo vendido;desde Japón;
Kid Dracula GameBoy auténticos de Estados Unidos 1993 Cartucho;169,17 EUR;+ 3,66 EUR de envío;Vendidos  5 jul 2021Artículo vendido;desde Estados Unidos;
Kid Dracula (Nintendo Game Boy, 1993);127,51 EUR;+ 3,66 EUR de envío;Vendidos  26 jun 2021Artículo vendido;desde Estados Unidos;
Kid Dracula Gameboy Color;10,20 EUR;+ 3,78 EUR de envío;Vendidos  23 jun 2021Artículo vendido;desde Estados Unidos;
Game Boy AKUMAJOU Special Boku Dracula Kun Kid Dracula versión japonesa Vendedor de Estados Unidos;36,12 EUR;+ 3,39 EUR de envío;Vendidos  21 jun 2021Artículo vendido;desde Estados Unidos;
