Notice Nintendo GB Game Boy Kid Dracula import FAH, Très Bon état;34,90 EUR;+ 11,98 EUR de envío;Vendidos  20 sep 2021Artículo vendido;desde Francia;
Nintendo Gameboy (gb) // Kid Dracula + embalaje original + instrucciones // dt. PAL cib;399,99 EUR;+ 5,99 EUR de envío;Vendidos  19 sep 2021Artículo vendido;desde Alemania;
Kid Dracula - Nintendo Game Boy - TESTED AND WORKING;59,90 EUR;+ 12,00 EUR de envío;Vendidos  14 sep 2021Artículo vendido;desde Italia;
Kid Dracula USA - Gameboy - Very rare game!;119,00 EUR;+ 20,00 EUR de envío;Vendidos  3 sep 2021Artículo vendido;desde Países Bajos;
GameBoy Kid Dracula-reproducido caja de sustitución;8,51 EUR;+ 5,97 EUR de envío;Vendidos  27 ago 2021Artículo vendido;desde Grecia;
Kid Dracula - Game Boy GB Nintendo - PAL;69,00 EUR;Envío no especificado;Vendidos  13 jul 2021Artículo vendido;desde Austria;
Kid Dracula Nintendo Gameboy Game ;9,99 EUR;Envío no especificado;Vendidos  4 jul 2021Artículo vendido;desde Irlanda;
Kid Dracula Nintendo Gameboy Cartucho auténtico de EE. UU. NTSC hecho en Japón;127,80 EUR;Envío gratis;Vendidos  30 ago 2021Artículo vendido;desde Estados Unidos;
Kid Dracula EE. UU. NTSC (Nintendo Game Boy) Auténtico Juego Carro GameBoy Konami;169,60 EUR;Envío gratis;Vendidos  29 ago 2021Artículo vendido;desde Estados Unidos;
Kid Dracula (Nintendo Game Boy) -- Auténtico Juego Carro -- GameBoy;170,41 EUR;Envío gratis;Vendidos  24 ago 2021Artículo vendido;desde Estados Unidos;
Kid Dracula Gameboy Color;10,23 EUR;+ 3,79 EUR de envío;Vendidos  10 ago 2021Artículo vendido;desde Estados Unidos;
Kid Dracula Para Game Boy-Solo Manual GB;39,20 EUR;+ 7,65 EUR de envío;Vendidos  24 jul 2021Artículo vendido;desde Estados Unidos;
Kid Dracula (Nintendo Game Boy, 1993);17,05 EUR;+ 3,79 EUR de envío;Vendidos  17 jul 2021Artículo vendido;desde Estados Unidos;
Kid Dracula (Nintendo Game Boy, 1993) NTSC (sólo juego auténtico, Probado);149,15 EUR;+ 3,41 EUR de envío;Vendidos  9 jul 2021Artículo vendido;desde Estados Unidos;
AKUMAJOU Special Boku Dracula Kun Kid Dracula Nintendo GB GameBoy Japón Importación;21,30 EUR;+ 11,07 EUR de envío;Vendidos  7 jul 2021Artículo vendido;desde Japón;
Kid Dracula GameBoy auténticos de Estados Unidos 1993 Cartucho;169,60 EUR;+ 3,66 EUR de envío;Vendidos  5 jul 2021Artículo vendido;desde Estados Unidos;
