Nintendo Game Boy Color Donkey Kong Country EUR con embalaje original y guía;69,90 EUR;+ 8,99 EUR de envío;desde Alemania;
Donkey Kong Country-en Caja-Nintendo Game Boy Color-GBC;40,98 EUR;+ 17,18 EUR de envío estimado;desde Reino Unido;
Nintendo Game Boy Color Donkey Kong Country libre poste del Reino Unido;22,24 EUR;Envío no especificado;desde Reino Unido;
Caja repro Donkey Kong Country , Game Boy Color,  NO incluye juego.;8,95 EUR;Envío no especificado;desde España;
Donkey Kong Country GBNintendo Game boy Color PAL EUR Multilenguaje SOLO MANUAL ;6,56 EUR;+ 8,90 EUR de envío;desde España;
Donkey Kong Country-Carro y las instrucciones-Nintendo Game Boy Color GBC;15,21 EUR;+ 19,04 EUR de envío estimado;desde Reino Unido;
Genuine NINTENDO GAME BOY COLOR juego Donkey Kong Country GBC probado y guardar Funciona;17,51 EUR;+ 16,76 EUR de envío estimado;desde Reino Unido;
Nintendo Gameboy Color En Caja-Donkey Kong Country;32,74 EUR;+ 17,03 EUR de envío estimado;desde Reino Unido;
Donkey Kong Country Nintendo Gameboy Color Juego;17,56 EUR;+ 18,68 EUR de envío estimado;desde Reino Unido;
Donkey Kong Country Nintendo Game Boy Color;17,56 EUR;+ 16,40 EUR de envío;desde Reino Unido;
GBC: Donkey Kong Country  GAME BOY COLOR  Molto RARO!!!;18,99 EUR;+ 8,50 EUR de envío;desde Italia;
Donkey Kong Country (Nintendo Game Boy Color, 2000);18,14 EUR;+ 18,56 EUR de envío estimado;desde Reino Unido;
Donkey Kong Country Gameboy Color Solo Manual. sin juego/Caja. Manual Original;5,86 EUR;+ 32,29 EUR de envío estimado;desde Reino Unido;
Gameboy Color Modelo CGB-001 amarillo con Donkey Kong Country Mickey * Trabajo * &;70,26 EUR;+ 31,71 EUR de envío estimado;desde Reino Unido;
Nintendo Gameboy Color-Donkey Kong Country;14,00 EUR;+ 16,69 EUR de envío estimado;desde Reino Unido;
Donkey Kong Country Auténtico Juego Boy Color;17,56 EUR;+ 18,52 EUR de envío estimado;desde Reino Unido;
Nintendo Gameboy Color Donkey Kong Country Original Carro;23,41 EUR;+ 11,71 EUR de envío;desde Reino Unido;
Donkey Kong Country GameBoy Color Con Caja Y Manual Nintendo. MBC +;45,67 EUR;+ 21,36 EUR de envío estimado;desde Reino Unido;
Nintendo Gameboy Color juego-Donkey Kong Country (módulo);24,98 EUR;+ 67,99 EUR de envío;desde Alemania;
Nintendo Gameboy Color En Caja-Donkey Kong Country-Protector Incluido;58,55 EUR;+ 20,95 EUR de envío estimado;desde Reino Unido;
Gameboy Color juego-Donkey Kong Country (módulo);24,98 EUR;+ 67,99 EUR de envío;desde Alemania;
1561N-Donkey Kong Country Nintendo GameBoy Color;13,00 EUR;+ 9,05 EUR de envío;desde Italia;
Donkey Kong Country ** Oficial Nintendo Gameboy Colour Cartucho ** Pal Version;17,86 EUR;+ 16,76 EUR de envío estimado;desde Reino Unido;
GBC-Donkey Kong Country para Nintendo Gameboy Color;29,95 EUR;+ 6,50 EUR de envío;desde Alemania;
2000 Nintendo Donkey Kong Country Raro Cartel 56x40cm SNES GAME BOY COLOR GBC;46,84 EUR;+ 11,70 EUR de envío;desde Alemania;
2000 Nintendo Donkey Kong Country Raro Cartel 56x40cm SNES GAME BOY COLOR GBC;58,55 EUR;+ 11,70 EUR de envío;desde Alemania;
Donkey Kong Country de Nintendo Gameboy Color Solo Manual De Instrucciones;4,67 EUR;+ 16,53 EUR de envío estimado;desde Reino Unido;
Donkey Kong Country Manual de juego de Nintendo Game Boy Color;5,27 EUR;+ 8,20 EUR de envío;desde Reino Unido;
Instrucciones-Nintendo Gameboy Color-Donkey Kong Country (alemán);11,49 EUR;+ 67,99 EUR de envío;desde Alemania;
Solo Manual Donkey Kong Country-Game Boy Color Gbc instrucciones solo;4,67 EUR;+ 11,65 EUR de envío;desde Reino Unido;
Donkey Kong Country gameboy color juego nintendo Kawaii japón | estado bien;11,00 EUR;Envío no especificado;desde Alemania;
Donkey Kong Country, Wario Land 3, Yugioh, Wacky Races-Nintendo Gameboy Color;46,85 EUR;Envío no especificado;desde Reino Unido;
Donkey Kong Country en OVP para el Nintendo Gameboy Color-probado-completamente;49,99 EUR;Envío no especificado;desde Alemania;
