Pipe Dream--Nintendo Game Boy--NTSC JAP--C-Ware;5,46 EUR;+ 1,09 EUR de envío;Vendidos  11 ago 2021Artículo vendido;desde Austria;
Pipe Dream-Nintendo Gameboy Classic juego-completamente OVP-cib con carteles! EE. UU.;39,00 EUR;Envío no especificado;Vendidos  4 jul 2021Artículo vendido;desde Alemania;
Pipe Dream (Nintendo Game Boy) cartucho, manual y estuche de plástico Probado;12,74 EUR;+ 8,43 EUR de envío;Vendidos  15 sep 2021Artículo vendido;desde Estados Unidos;
Pipe Dream (Nintendo Game Boy) cartucho, manual y estuche de plástico Probado;12,69 EUR;Envío gratis;Vendidos  9 sep 2021Artículo vendido;desde Estados Unidos;
Pipe Dream (Nintendo Game Boy) solo carro;6,81 EUR;+ 2,97 EUR de envío;Vendidos  9 sep 2021Artículo vendido;desde Estados Unidos;
Pipe Dream (Nintendo Game Boy);8,52 EUR;Envío gratis;Vendidos  3 sep 2021Artículo vendido;desde Estados Unidos;
Nintendo Game Boy Pipe Dream Solo Carro Probado;3,40 EUR;+ 3,28 EUR de envío;Vendidos  14 ago 2021Artículo vendido;desde Estados Unidos;
Pipe Dream (Nintendo Game Boy) cartucho, manual y estuche de plástico;12,74 EUR;Envío gratis;Vendidos  8 ago 2021Artículo vendido;desde Estados Unidos;
Lote de 3 Juegos Nintendo Gameboy-Pipe Dream, Tetris, Rueda De La Fortuna;12,37 EUR;+ 4,43 EUR de envío;Vendidos  7 ago 2021Artículo vendido;desde Estados Unidos;
Pipe Dream Nintendo Game Boy;4,66 EUR;+ 3,37 EUR de envío;Vendidos  4 ago 2021Artículo vendido;desde Estados Unidos;
Nintendo Game Boy Pipe Dream;8,51 EUR;Envío gratis;Vendidos  4 ago 2021Artículo vendido;desde Estados Unidos;
Pipe Dream Japón Nintendo Gameboy GB Muy Buen Estado;4,09 EUR;+ 6,39 EUR de envío;Vendidos  1 ago 2021Artículo vendido;desde Japón;
Pipe Manía/Pipe Dream Nintendo Gameboy GB Japón importación vendedor de EE. UU. MC787;7,66 EUR;Envío gratis;Vendidos  22 jul 2021Artículo vendido;desde Estados Unidos;
Pipe Dream (Nintendo Game Boy) Auténtico Probado;8,51 EUR;+ 3,66 EUR de envío;Vendidos  20 jul 2021Artículo vendido;desde Estados Unidos;
Pipe Dream Nintendo Game Boy Gameboy Originales Auténticos Video Juego!;6,79 EUR;Envío gratis;Vendidos  16 jul 2021Artículo vendido;desde Estados Unidos;
Pipe Dream (Nintendo Game Boy) 1989 auténtica probado y trabajo por favor leer;6,81 EUR;Envío gratis;Vendidos  14 jul 2021Artículo vendido;desde Estados Unidos;
Pipe Dream de vídeo juego para Original Gameboy Probado;10,22 EUR;Envío gratis;Vendidos  9 jul 2021Artículo vendido;desde Estados Unidos;
Pipe Dream (Nintendo Game Boy) Auténtico Probado;6,81 EUR;Envío gratis;Vendidos  7 jul 2021Artículo vendido;desde Estados Unidos;
Pipe Dream con manual juego Boy Probado;9,19 EUR;Envío gratis;Vendidos  2 jul 2021Artículo vendido;desde Estados Unidos;
