Zoop (Nintendo Gameboy) PAL módulo;5,36 EUR;+ 9,00 EUR de envío;Vendidos  2 sep 2021Artículo vendido;desde Alemania;
Vintage Nintendo Game Boy Juego. Zoop;5,81 EUR;+ 17,72 EUR de envío estimado;Vendidos  2 jul 2021Artículo vendido;desde Reino Unido;
Dandelion (Amarillo) Nintendo Gameboy Color (GBC) con cartucho de juego Zoop;50,33 EUR;+ 6,82 EUR de envío;Vendidos  20 sep 2021Artículo vendido;desde Estados Unidos;
Zoop (Nintendo Game boy) Authentic/Cleaned/Tested - Puzzle Game;10,61 EUR;+ 9,95 EUR de envío;Vendidos  12 sep 2021Artículo vendido;desde Canadá;
Zoop Nintendo Game Boy;2,53 EUR;+ 3,37 EUR de envío;Vendidos  31 ago 2021Artículo vendido;desde Estados Unidos;
Zoop (Nintendo Game Boy, 1995) probado y de trabajo;9,37 EUR;Envío gratis;Vendidos  22 ago 2021Artículo vendido;desde Estados Unidos;
E690 Nintendo Gameboy Zoop Japón GB Con Caja;4,69 EUR;+ 16,21 EUR de envío;Vendidos  31 jul 2021Artículo vendido;desde Japón;
7 Nintendo Gameboy Juegos Tetris Pacman 1-2 Wordtris Zoop 4in1 FUNPAK volumen 1-2;17,06 EUR;+ 7,04 EUR de envío;Vendidos  29 jul 2021Artículo vendido;desde Estados Unidos;
