Nintendo Game Boy jpn Japón "Monster Race" solo módulo;6,95 EUR;+ 5,99 EUR de envío;desde Alemania;
Jeu Game Boy Monster Race version japonaise Nintendo GB Cartouche seule;4,99 EUR;+ 3,00 EUR de envío;desde Francia;
Jeu Monster Race Nintendo Game boy Japan DMG-AMRJ-JPN  testé 054;4,00 EUR;+ 5,50 EUR de envío;desde Francia;
Monster Race DMG-AMRJ cartucho Gameboy NTSC Jap leer;5,95 EUR;+ 8,95 EUR de envío;desde España;
Monster Race, Game Boy Nintendo. Koei. Ntsc-Jap ;11,95 EUR;Envío no especificado;desde España;
Monster Race 2, Monsutaa Race 2, Game Boy Color, Ntsc-Jap. Con Mapa.;59,95 EUR;Envío no especificado;desde España;
Monster Race 2 | Nintendo Gameboy Color | módulo | ** como nuevo! **;17,99 EUR;Envío no especificado;desde Alemania;
