Crystalis Rpg Nintendo Game Boy Color GBC Sellado con lágrima grande sin precio de reserva;43,98 EUR;+ 4,31 EUR de envío;desde Estados Unidos;
Crystalis Nintendo Game Boy Color * Auténtico y ahorra *;34,47 EUR;Envío gratis;desde Estados Unidos;
Crystalis (Nintendo Game Boy Color probado-RPG, 2000);22,42 EUR;+ 4,48 EUR de envío;desde Estados Unidos;
Nuevo anuncio💥 Crystalis Nintendo Game Boy Gameboy Color Auténtico probado Envío Gratis;0,85 EUR;Envío gratis;desde Estados Unidos;
Crystalis (Nintendo Game Boy Color) * Auténtico * Probado Funcionando;30,18 EUR;+ 4,10 EUR de envío;desde Estados Unidos;
Crystalis-Game Boy Color-Probado Y Funcionando! -!! envío Gratuito Rápido;30,14 EUR;Envío gratis;desde Estados Unidos;
Crystalis para Game Boy Color GBC -- probado-Guarda -!!! auténtico!!!;30,14 EUR;+ 3,84 EUR de envío;desde Estados Unidos;
Crystalis Nintendo Game Boy Color GBC GameBoy Cartucho solo carro Auténtico;30,61 EUR;Envío gratis;desde Estados Unidos;
Crystalis RPG JRPG Nintendo Game Boy Color, 2000 completa probada Caja Manual Completo En Caja;112,08 EUR;+ 7,93 EUR de envío;desde Estados Unidos;
Crystalis (Nintendo Game Boy Color, 2000) liberado, Batería Nueva Y Probado-RPG;24,14 EUR;+ 4,48 EUR de envío;desde Estados Unidos;
Crystalis Nintendo Game Boy Color GBC auténtico juego limpiado funciona Envío rápido;34,48 EUR;+ 4,10 EUR de envío;desde Estados Unidos;
Crystalis-Game Boy Color;30,18 EUR;+ 4,10 EUR de envío;desde Estados Unidos;
Crystalis Nintendo Game Boy Color Solo Manual Auténtico Original condición en muy buena condición;18,97 EUR;Envío gratis;desde Estados Unidos;
Crystalis-auténtico-NINTENDO GAME BOY COLOR GBC-Solo Manual!;18,36 EUR;Envío gratis;desde Estados Unidos;
Crystalis (Nintendo Game Boy Color, 2000) Auténtico probado-RPG;41,38 EUR;+ 5,39 EUR de envío;desde Estados Unidos;
Crystalis Nintendo Game Boy Color Auténtico Probado Funcionando GBC Cartucho;48,25 EUR;Envío gratis;desde Estados Unidos;
Crystalis (Nintendo Game Boy Color) Auténtico CARTUCHO-PROBADO Y FUNCIONA;47,42 EUR;+ 3,71 EUR de envío;desde Estados Unidos;
Crystalis Nintendo Gameboy Color Auténtico Ahorra;25,86 EUR;+ 8,62 EUR de envío;desde Canadá;
Crystalis para Game Boy Color GBC!!! auténtico!!!!! buenas condiciones!!!;25,87 EUR;+ 4,74 EUR de envío;desde Estados Unidos;
Crystalis Nintendo Game Boy Color Solo Manual ~ Folleto de instrucciones;19,83 EUR;Envío gratis;desde Estados Unidos;
Crystalis Nintendo Game Boy Color RPG Aventura SNK 2000 anuncio impreso de colección arte;12,89 EUR;Envío gratis;desde Estados Unidos;
Crystalis 2000 Game Boy Color 11x14 Enmarcado anuncio Original;30,17 EUR;+ 13,79 EUR de envío;desde Estados Unidos;
Nintendo GAME BOY COLOR GBC Crystalis videojuego revista Print Ad;8,58 EUR;+ 3,15 EUR de envío;desde Estados Unidos;
Crystalis Gameboy Color 2000 impresión de anuncio Cartel Vintage arte oficial de Promo Rpg Raro;12,93 EUR;Envío gratis;desde Estados Unidos;
Nintendo Gameboy Color Solo Manual Crystalis;19,83 EUR;Envío gratis;desde Estados Unidos;
Crystalis GBA Gameboy Color | 2000 Vintage Juego anuncio impreso arte cartel Rpg Raro;12,89 EUR;Envío gratis;desde Estados Unidos;
Crystalis Gameboy Color Manual;21,52 EUR;+ 2,75 EUR de envío;desde Estados Unidos;
