Crystalis (Nintendo Game Boy Color, 2000) liberado, Batería Nueva Y Probado-RPG;23,90 EUR;+ 4,18 EUR de envío;desde Estados Unidos;
Crystalis (Nintendo Game Boy Color) * Auténtico * Probado Funcionando;29,88 EUR;+ 3,80 EUR de envío;desde Estados Unidos;
Crystalis RPG JRPG Nintendo Game Boy Color, 2000 completa probada Caja Manual Completo En Caja;110,96 EUR;+ 7,21 EUR de envío;desde Estados Unidos;
Crystalis Nintendo Game Boy Color GBC GameBoy Cartucho solo carro Auténtico;30,31 EUR;Envío gratis;desde Estados Unidos;
Crystalis para Game Boy Color GBC -- probado-Guarda -!!! auténtico!!!;29,84 EUR;+ 3,54 EUR de envío;desde Estados Unidos;
Crystalis Nintendo Game Boy Color GBC auténtico juego limpiado funciona Envío rápido;29,70 EUR;+ 3,80 EUR de envío;desde Estados Unidos;
Crystalis-Game Boy Color-Probado Y Funcionando! -!! envío Gratuito Rápido;29,84 EUR;Envío gratis;desde Estados Unidos;
Crystalis-auténtico-NINTENDO GAME BOY COLOR GBC-Solo Manual!;18,54 EUR;Envío gratis;desde Estados Unidos;
Crystalis Nintendo Game Boy Color Solo Manual Auténtico Original condición en muy buena condición;18,78 EUR;Envío gratis;desde Estados Unidos;
Crystalis Nintendo Game Boy Color Auténtico Probado Funcionando GBC Cartucho;47,77 EUR;Envío gratis;desde Estados Unidos;
Crystalis-Game Boy Color;29,88 EUR;+ 3,80 EUR de envío;desde Estados Unidos;
Crystalis para Game Boy Color GBC!!! auténtico!!!!! buenas condiciones!!!;25,61 EUR;+ 4,44 EUR de envío;desde Estados Unidos;
Crystalis (Nintendo Game Boy Color, 2000) Auténtico probado-RPG;40,97 EUR;+ 5,08 EUR de envío;desde Estados Unidos;
Crystalis Nintendo Gameboy Color Auténtico Ahorra;25,60 EUR;+ 8,54 EUR de envío;desde Canadá;
Crystalis Nintendo Game Boy Color Solo Manual ~ Folleto de instrucciones;19,64 EUR;Envío gratis;desde Estados Unidos;
Crystalis Nintendo Game Boy Color RPG Aventura SNK 2000 anuncio impreso de colección arte;12,76 EUR;Envío gratis;desde Estados Unidos;
Crystalis 2000 Game Boy Color 11x14 Enmarcado anuncio Original;29,87 EUR;+ 13,65 EUR de envío;desde Estados Unidos;
Nintendo GAME BOY COLOR GBC Crystalis videojuego revista Print Ad;8,49 EUR;+ 3,12 EUR de envío;desde Estados Unidos;
Crystalis Gameboy Color 2000 impresión de anuncio Cartel Vintage arte oficial de Promo Rpg Raro;12,80 EUR;Envío gratis;desde Estados Unidos;
Crystalis GBA Gameboy Color | 2000 Vintage Juego anuncio impreso arte cartel Rpg Raro;12,76 EUR;Envío gratis;desde Estados Unidos;
Nintendo Gameboy Color Solo Manual Crystalis;19,64 EUR;Envío gratis;desde Estados Unidos;
