Asteroids Para Nintendo Gameboy Color en Caja en muy buena condición;23,29 EUR;+ 16,81 EUR de envío estimado;desde Reino Unido;
Nintendo Game Boy Color Asteroids Notice / Instruction Manual;4,99 EUR;+ 2,75 EUR de envío;desde Francia;
Asteroids-GAMEBOY COLOR-perfecto Estado-en caja, inserte y las instrucciones;58,36 EUR;+ 29,19 EUR de envío;desde Reino Unido;
Asteroids - Nintendo Game Boy Color;24,00 EUR;Envío no especificado;desde Francia;
Asteroids Folleto De Instrucciones Manual De Nintendo Gameboy Color de la versión de Reino Unido sólo GBC;5,83 EUR;Envío no especificado;desde Reino Unido;
Asteroids (Nintendo Game Boy Color, 1999);4,31 EUR;+ 3,97 EUR de envío;desde Estados Unidos;
Asteroids Para Nintendo Game Boy Color Incluye Folleto Gameboy limpio Probado;18,96 EUR;Envío gratis;desde Estados Unidos;
Asteroids, Nintendo Game Boy Color, de 1999, Probado;3,88 EUR;+ 4,31 EUR de envío;desde Estados Unidos;
Asteroids (Nintendo Game Boy Color, 1999) Nuevo Sellado-H-costura-auténtica;25,87 EUR;Envío gratis;desde Estados Unidos;
Asteroids (Nintendo Game Boy Color, 1999) Completo En Caja;21,55 EUR;+ 5,00 EUR de envío;desde Estados Unidos;
Asteroids Juego BOY COLOR Gratis Envío Rápido!!! Sellado De Fábrica!!!;30,17 EUR;Envío gratis;desde Estados Unidos;
Asteroids, Nintendo Game Boy Color, 1999;4,31 EUR;+ 4,10 EUR de envío;desde Estados Unidos;
Gameboy Asteroids Juego (auténtico) Nintendo Game Boy Color 1999-Regalo De Navidad;3,85 EUR;+ 10,29 EUR de envío;desde Estados Unidos;
Asteroids (Nintendo Game Boy Color, 1999);9,05 EUR;+ 3,45 EUR de envío;desde Estados Unidos;
Game Boy Color Asteroids Juego Activision 1999;12,93 EUR;+ 4,10 EUR de envío;desde Estados Unidos;
Asteroids Game Boy Color Nintendo solo manual de instrucciones;3,70 EUR;Envío gratis;desde Estados Unidos;
Asteroids Nintendo Game Boy Color * limpiado & Probado *;17,25 EUR;+ 5,17 EUR de envío;desde Estados Unidos;
Asteroids, Nintendo Game Boy Color, de 1999, Probado;7,67 EUR;Envío gratis;desde Estados Unidos;
Asteroids (Nintendo Game Boy Color) Game Boy Color Auténtico Probado;7,58 EUR;+ 3,97 EUR de envío;desde Estados Unidos;
Asteroids (Nintendo Game Boy Color, 1999) envío rápido de Estados Unidos;6,90 EUR;+ 4,31 EUR de envío;desde Estados Unidos;
Asteroids Nintendo Game Boy Color Video Juego Carro Auténtico;14,65 EUR;+ 4,74 EUR de envío;desde Estados Unidos;
Lote 2 Juegos Atari Arcade Nintendo Game Boy Color Asteroids + SPACE INVADERS;25,84 EUR;Envío gratis;desde Estados Unidos;
Asteroids-GBC Manual/game boy color folleto de instrucciones;6,03 EUR;+ 3,06 EUR de envío;desde Estados Unidos;
Asteroids NINTENDO GAME BOY COLOR video juego "sueltas" Sin Caja Negra;7,75 EUR;+ 3,44 EUR de envío;desde Estados Unidos;
Asteroids (Nintendo Game Boy Color, 1999) sólo juego;6,03 EUR;+ 4,48 EUR de envío;desde Estados Unidos;
Asteroids (Nintendo Game Boy Color, 1999) suelto teseted y de trabajo;12,93 EUR;+ 4,31 EUR de envío;desde Estados Unidos;
Asteroids Nintendo Game Boy Color 1999 casi nuevo y sin usar Caja Cartucho cartel Postal;27,16 EUR;+ 5,39 EUR de envío;desde Estados Unidos;
Asteroids (Gameboy Color Juego) con manual de instrucciones;9,91 EUR;+ 3,02 EUR de envío;desde Estados Unidos;
Asteroids Nintendo Game Boy Color Video Juego Carro;6,81 EUR;+ 3,27 EUR de envío;desde Estados Unidos;
Asteroids (Nintendo Game Boy Color, 1999) Auténtico CARTUCHO-PROBADO Y FUNCIONA;6,89 EUR;+ 3,71 EUR de envío;desde Estados Unidos;
Asteroids Nintendo Game Boy Color Usado 1999 Probado Funcionando Cartucho sólo;12,93 EUR;+ 2,59 EUR de envío;desde Estados Unidos;
Asteroids (Nintendo Game Boy Color, 1999) Disco Solamente Manual no disponible;7,67 EUR;+ 2,75 EUR de envío;desde Estados Unidos;
Asteroids (Nintendo Game Boy Color, 1999) gran forma limpiado + probado!;5,33 EUR;+ 3,02 EUR de envío;desde Estados Unidos;
Asteroids (Nintendo Game Boy Color, 1999) sólo juego de trabajo;17,25 EUR;+ 4,31 EUR de envío;desde Estados Unidos;
Nintendo Gameboy Color Asteroids;11,17 EUR;Envío gratis;desde Estados Unidos;
Asteroids (GD) Pre-owned GameBoy Color;10,30 EUR;Envío gratis;desde Estados Unidos;
Asteroids Nintendo Gameboy Color GBC limpiado probado Auténtico Juego Boy;6,89 EUR;+ 5,39 EUR de envío;desde Estados Unidos;
Asteroids (Game Boy Color) un certificado de conformidad de Game Boy Printer;2,16 EUR;+ 0,47 EUR de envío;desde Estados Unidos;
Asteroids-auténtico-Nintendo Game Boy Color-Solo Manual!;4,18 EUR;Envío gratis;desde Estados Unidos;
Asteroids video juego Nintendo Game Boy Color Solo Manual;1,13 EUR;+ 3,27 EUR de envío;desde Estados Unidos;
Solo Manual Asteroids Nintendo Gameboy color folleto de instrucciones;4,73 EUR;Envío gratis;desde Estados Unidos;
Asteroids Para Nintendo Gameboy Color ** ** Solo Caja;17,25 EUR;Envío gratis;desde Estados Unidos;
Asteroids Gameboy Color manual de instrucciones;5,78 EUR;Envío gratis;desde Estados Unidos;
Asteroids Nintendo Gameboy Game Boy Color GBC;11,53 EUR;+ 6,55 EUR de envío;desde Francia;
Asteroids Nintendo GameBoy Color GBC * Solo Manual * Sin Juego;5,17 EUR;Envío gratis;desde Estados Unidos;
Arcade Classic 1 2 Asteroids Missile Command Centipede Millipede Game Boy nuovo;99,00 EUR;+ 35,00 EUR de envío;desde Italia;
New Game Boy GIG arcade Classic 1 Asteroids Missile Command ;49,00 EUR;+ 8,00 EUR de envío;desde Italia;
