Asteroids Nintendo Game Boy Color Advance Juego Solo Carro Genuino;15,07 EUR;+ 6,98 EUR de envío;desde Reino Unido;
Asteroids Para Nintendo Gameboy Color en Caja en muy buena condición;23,21 EUR;+ 16,76 EUR de envío estimado;desde Reino Unido;
Nintendo Game Boy Color Asteroids Notice / Instruction Manual;4,99 EUR;+ 2,75 EUR de envío;desde Francia;
Asteroids-GAMEBOY COLOR-perfecto Estado-en caja, inserte y las instrucciones;58,17 EUR;+ 29,09 EUR de envío;desde Reino Unido;
Asteroids - Nintendo Game Boy Color;24,00 EUR;Envío no especificado;desde Francia;
Asteroids Folleto De Instrucciones Manual De Nintendo Gameboy Color de la versión de Reino Unido sólo GBC;5,81 EUR;Envío no especificado;desde Reino Unido;
Asteroids (Nintendo Game Boy Color, 1999);4,26 EUR;+ 3,67 EUR de envío;desde Estados Unidos;
Asteroids (Nintendo Game Boy Color, 1999) Nuevo Sellado-H-costura-auténtica;25,59 EUR;Envío gratis;desde Estados Unidos;
Asteroids Para Nintendo Game Boy Color Incluye Folleto Gameboy limpio Probado;18,76 EUR;desde Estados Unidos;
Asteroids, Nintendo Game Boy Color, de 1999, Probado;3,84 EUR;+ 4,26 EUR de envío;desde Estados Unidos;
Asteroids Juego BOY COLOR Gratis Envío Rápido!!! Sellado De Fábrica!!!;29,84 EUR;Envío gratis;desde Estados Unidos;
Asteroids, Nintendo Game Boy Color, 1999;4,26 EUR;+ 3,80 EUR de envío;desde Estados Unidos;
Lote 2 Juegos Atari Arcade Nintendo Game Boy Color Asteroids + SPACE INVADERS;25,56 EUR;Envío gratis;desde Estados Unidos;
Game Boy Color Asteroids Juego Activision 1999;12,79 EUR;+ 3,80 EUR de envío;desde Estados Unidos;
Asteroids Nintendo Game Boy Color * limpiado & Probado *;21,32 EUR;+ 4,44 EUR de envío;desde Estados Unidos;
Asteroids-GBC Manual/game boy color folleto de instrucciones;5,96 EUR;+ 3,03 EUR de envío;desde Estados Unidos;
Asteroids (Nintendo Game Boy Color, 1999);8,96 EUR;+ 3,41 EUR de envío;desde Estados Unidos;
Asteroids (Nintendo Game Boy Color) Game Boy Color Auténtico Probado;9,37 EUR;+ 3,67 EUR de envío;desde Estados Unidos;
Asteroids (Nintendo Game Boy Color, 1999) envío rápido de Estados Unidos;6,82 EUR;+ 4,26 EUR de envío;desde Estados Unidos;
Asteroids Nintendo Game Boy Color Video Juego Carro Auténtico;14,49 EUR;+ 4,44 EUR de envío;desde Estados Unidos;
Asteroids (Nintendo Game Boy Color, 1999) sólo juego;5,96 EUR;+ 4,18 EUR de envío;desde Estados Unidos;
Asteroids (Nintendo Game Boy Color, 1999) suelto teseted y de trabajo;12,79 EUR;+ 4,26 EUR de envío;desde Estados Unidos;
Asteroids Nintendo Game Boy Color Video Juego Carro;6,74 EUR;+ 2,98 EUR de envío;desde Estados Unidos;
Asteroids Nintendo Game Boy Color 1999 casi nuevo y sin usar Caja Cartucho cartel Postal;29,85 EUR;+ 5,07 EUR de envío;desde Estados Unidos;
Asteroids (Nintendo Game Boy Color, 1999) Auténtico CARTUCHO-PROBADO Y FUNCIONA;6,81 EUR;+ 3,41 EUR de envío;desde Estados Unidos;
Asteroids (Nintendo Game Boy Color, 1999) Completo En Caja;21,31 EUR;+ 4,69 EUR de envío;desde Estados Unidos;
Asteroids Nintendo Gameboy Color GBC limpiado probado Auténtico Juego Boy;6,81 EUR;+ 5,07 EUR de envío;desde Estados Unidos;
Asteroids (Gameboy Color Juego) con manual de instrucciones;9,80 EUR;+ 2,99 EUR de envío;desde Estados Unidos;
Asteroids (Nintendo Game Boy Color, 1999) Disco Solamente Manual no disponible;7,59 EUR;+ 2,72 EUR de envío;desde Estados Unidos;
Asteroids (Nintendo Game Boy Color, 1999) gran forma limpiado + probado!;5,27 EUR;+ 2,99 EUR de envío;desde Estados Unidos;
Asteroids Nintendo Game Boy Color Usado 1999 Probado Funcionando Cartucho sólo;12,79 EUR;+ 2,56 EUR de envío;desde Estados Unidos;
Asteroids (Nintendo Game Boy Color, 1999) sólo juego de trabajo;17,06 EUR;+ 4,26 EUR de envío;desde Estados Unidos;
Asteroids Juego Boy Color;26,51 EUR;Envío gratis;desde Estados Unidos;
Asteroids (GD) Pre-owned GameBoy Color;10,19 EUR;Envío gratis;desde Estados Unidos;
Nintendo Gameboy Color Asteroids;9,39 EUR;Envío gratis;desde Estados Unidos;
Asteroids (Game Boy Color) un certificado de conformidad de Game Boy Printer;2,13 EUR;+ 0,47 EUR de envío;desde Estados Unidos;
Asteroids-auténtico-Nintendo Game Boy Color-Solo Manual!;4,35 EUR;Envío gratis;desde Estados Unidos;
Asteroids video juego Nintendo Game Boy Color Solo Manual;1,12 EUR;+ 3,23 EUR de envío;desde Estados Unidos;
Solo Manual Asteroids Nintendo Gameboy color folleto de instrucciones;4,68 EUR;Envío gratis;desde Estados Unidos;
Asteroids Para Nintendo Gameboy Color ** ** Solo Caja;17,06 EUR;Envío gratis;desde Estados Unidos;
Asteroids Gameboy Color manual de instrucciones;5,71 EUR;desde Estados Unidos;
Asteroids Gameboy Color manual de instrucciones;3,41 EUR;+ 2,39 EUR de envío;desde Estados Unidos;
Asteroids, Nintendo Game Boy Color, de 1999, Probado;7,59 EUR;Envío gratis;desde Estados Unidos;
Pong Asteroids Yars Revenge-Nintendo GameBoy Game Boy Color GBC Nueva;13,62 EUR;+ 4,26 EUR de envío;desde Canadá;
Asteroids Nintendo GameBoy Color GBC * Solo Manual * Sin Juego;5,12 EUR;Envío gratis;desde Estados Unidos;
Asteroids (Nintendo Game Boy Color, 1999);5,97 EUR;+ 3,80 EUR de envío;desde Estados Unidos;
Asteroids Nintendo Gameboy Game Boy Color GBC;11,62 EUR;+ 6,48 EUR de envío;desde Francia;
