Commander Keen, Gameboy Color solo carro;15,11 EUR;+ 16,60 EUR de envío estimado;Vendidos  2 jul 2021Artículo vendido;desde Reino Unido;
Commander Keen y Lemony Snicket's NUEVA FÁBRICA SELLADA EL JUEGO Boy Color/Advance;75,85 EUR;Envío gratis;Vendidos  19 sep 2021Artículo vendido;desde Estados Unidos;
Commander Keen Game Boy Color 1998 Manual + insertar sólo-Sin Juego O Caja Excelente.;10,39 EUR;+ 3,38 EUR de envío;Vendidos  15 sep 2021Artículo vendido;desde Estados Unidos;
Commander Keen (Game Boy Color, Game Boy Color 2001) Nuevo Sellado De Fábrica! -! Raro! - ex!;84,37 EUR;+ 3,79 EUR de envío;Vendidos  4 sep 2021Artículo vendido;desde Estados Unidos;
Commander Keen, Nuevo En Caja Sellada (Nintendo Game Boy Color, 2001);67,13 EUR;+ 3,79 EUR de envío;Vendidos  4 sep 2021Artículo vendido;desde Estados Unidos;
Commander Keen-Game Boy Color Probado;12,78 EUR;+ 4,18 EUR de envío;Vendidos  30 ago 2021Artículo vendido;desde Estados Unidos;
Commander Keen-Game Boy Color-auténtica;10,06 EUR;+ 4,43 EUR de envío;Vendidos  24 ago 2021Artículo vendido;desde Estados Unidos;
Commander Keen (Nintendo Game Boy Color, 2001) suelto;13,38 EUR;+ 3,79 EUR de envío;Vendidos  16 ago 2021Artículo vendido;desde Estados Unidos;
Commander Keen (Nintendo Game Boy Color, 2001) Rare CIB (NTSC);33,41 EUR;+ 11,36 EUR de envío;Vendidos  13 ago 2021Artículo vendido;desde Canadá;
Commander Keen (Nintendo Game Boy Color, 2001) Auténtico-Probado-Cartucho;17,05 EUR;Envío gratis;Vendidos  6 ago 2021Artículo vendido;desde Estados Unidos;
(Gameboy Color-Sellado Nuevo) --- Commander Keen --- (Gameboy Color-Nuevo Sellado);69,03 EUR;+ 4,25 EUR de envío;Vendidos  3 ago 2021Artículo vendido;desde Estados Unidos;
Commander Keen Juego Boy Color;27,25 EUR;+ 3,37 EUR de envío;Vendidos  3 ago 2021Artículo vendido;desde Estados Unidos;
Commander Keen Nintendo Game Boy Color-Juego sólo se envía Gratis-Vendedor de Estados Unidos;17,05 EUR;Envío gratis;Vendidos  1 ago 2021Artículo vendido;desde Estados Unidos;
GAMEBOY COLOR Commander Keen con estuche de plástico original GAMEBOY Cartucho;18,74 EUR;Envío gratis;Vendidos  24 jul 2021Artículo vendido;desde Estados Unidos;
Commander Keen (Nintendo Game Boy Color, 2001) Auténtico-Probado;17,90 EUR;Envío gratis;Vendidos  20 jul 2021Artículo vendido;desde Estados Unidos;
Commander Keen (Nintendo Game Boy Color, 2001) - Sellado;51,14 EUR;+ 7,20 EUR de envío;Vendidos  17 jul 2021Artículo vendido;desde Estados Unidos;
GAMEBOY COLOR Commander Keen con estuche de plástico original GAMEBOY Cartucho;12,78 EUR;+ 3,79 EUR de envío;Vendidos  12 jul 2021Artículo vendido;desde Estados Unidos;
Commander Keen (Game Boy Color) juego + Manual + Envío Gratis;38,35 EUR;Envío gratis;Vendidos  5 jul 2021Artículo vendido;desde Estados Unidos;
Commander Keen: aliens Ate My baybysitter rare box 1992 Classic PC-game MS-DOS;831,00 EUR;+ 35,00 EUR de envío;Vendidos  31 ago 2021Artículo vendido;desde Alemania;
