🌺* Alfred Chicken " UKV  Nintendo Game Boy - RARE ;39,99 EUR;+ 17,00 EUR de envío;desde Francia;
Nintendo Game Boy juego módulo-Alfred Chicken-en funda-original Top;12,50 EUR;+ 45,99 EUR de envío;desde Alemania;
Alfred Chicken | Nintendo Gameboy | solo módulo | estado bien;6,90 EUR;+ 35,00 EUR de envío;desde Alemania;
Alfred Chicken Nintendo Gameboy OVP cib Boxed;33,90 EUR;+ 4,50 EUR de envío;desde Alemania;
Alfred Chicken para Nintendo GameBoy;6,99 EUR;+ 9,99 EUR de envío;desde Alemania;
Gb-Alfred Chicken para Nintendo GameBoy;6,95 EUR;+ 6,50 EUR de envío;desde Alemania;
Alfred Chicken Nintendo Game Boy;5,90 EUR;Envío no especificado;desde Alemania;
Alfred Chicken Nintendo Gameboy OVP cib Boxed;38,90 EUR;Envío no especificado;desde Alemania;
Alfred Chicken Nintendo Gameboy OVP cib Boxed;38,90 EUR;Envío no especificado;desde Alemania;
Nintendo Gameboy Classic Alfred Chicken OVP-Top estado-Nintendo GBC;50,00 EUR;Envío no especificado;desde Alemania;
Alfred Chicken cómo jugar instrucciones Nintendo Gameboy classic game boy PAL;6,79 EUR;Envío no especificado;desde Alemania;
Alfred Chicken-instrucciones-Game Boy/Gameboy Classic;14,99 EUR;Envío no especificado;desde Alemania;
Vintage Alfred Chicken auténtico Nintendo Gameboy Juego Probado Funcionando Envío Gratis;12,99 EUR;Envío gratis;desde Estados Unidos;
Jeu Game boy / GB Game Alfred Chicken original Nintendo. retrogaming*;12,99 EUR;+ 7,90 EUR de envío;desde Bélgica;
Gameboy Alfred Chicken Juego Y Manual Excelente Muy Raro;59,63 EUR;Envío gratis;desde Estados Unidos;
Alfred Chicken (Nintendo Game Boy) Authentic/Cleaned/Tested Original Gameboy;16,01 EUR;+ 10,00 EUR de envío;desde Canadá;
Gameboy Alfred Chicken Sin Caja Solo Cartucho;2.015,47 EUR;+ 17,04 EUR de envío;desde Japón;
Super Nintendo Snes/game Boy Alfred Chicken video juego revista Print Ad;8,48 EUR;+ 3,11 EUR de envío;desde Estados Unidos;
Nintendo Gameboy Manual Authentic Alfred Chicken;23,38 EUR;+ 3,34 EUR de envío;desde Canadá;
