Kung Fu Master + instrucciones-Nintendo Game Boy juego;19,99 EUR;Envío no especificado;Vendidos  30 ago 2021Artículo vendido;desde Alemania;
Notice / Booklet - Kung Fu Master - FAH - Game Boy - No Annotation;6,00 EUR;Envío no especificado;Vendidos  20 ago 2021Artículo vendido;desde Francia;
Gb-Kung Fu Master para Nintendo GameBoy;8,95 EUR;+ 6,50 EUR de envío;Vendidos  13 jul 2021Artículo vendido;desde Alemania;
Kung Fu Master-Game Boy-módulo-Nintendo-Game Boy-Pal;6,99 EUR;Envío no especificado;Vendidos  12 jul 2021Artículo vendido;desde Alemania;
Kung Fu Master cómo jugar Game Boy;4,49 EUR;Envío no especificado;Vendidos  25 jun 2021Artículo vendido;desde Alemania;
Kung Fu Master-cómo jugar-Nintendo GameBoy;4,70 EUR;Envío no especificado;Vendidos  21 jun 2021Artículo vendido;desde Alemania;
Kung Fu Master Game Boy GC PAL;21,38 EUR;+ 12,39 EUR de envío;Vendidos  3 sep 2021Artículo vendido;desde Australia;
