Nintendo Game Boy Color Catwoman EUR Excellent état;8,90 EUR;+ 11,98 EUR de envío;desde Francia;
Catwoman (Nintendo Game Boy Color, 1999) Cartucho instrucciones en muy buena condición;15,21 EUR;+ 16,71 EUR de envío estimado;desde Reino Unido;
Catwoman, GameBoy Color, 80+ VGA, no Wata;1.070,00 EUR;+ 30,00 EUR de envío;desde Alemania;
Catwoman - EUR - Nintendo Gameboy Color - GBC;6,00 EUR;+ 25,00 EUR de envío;desde Países Bajos;
GBC-Catwoman para Nintendo Gameboy Color;14,95 EUR;+ 9,95 EUR de envío;desde Alemania;
Nintendo Gameboy Color juegos super mario los pitufos X-Men Catwoman, etc. va!;5,39 EUR a 7,55 EUR;+ 6,50 EUR de envío;desde Alemania;
Gameboy sealed Catwoman 2004 Wata VGA color Nintendo Batman;74,00 EUR;Envío no especificado;desde Alemania;
Catwoman para Game Boy Color. solo carro.;9,37 EUR;Envío no especificado;desde Reino Unido;
Nintendo Game Boy Color Catwoman GBC Vers. EUR;6,00 EUR;Envío no especificado;desde Francia;
Gameboy Color Catwoman en Caja Con Manual;35,13 EUR;Envío no especificado;desde Reino Unido;
Caja orig. Catwoman Nintendo Game Boy Color nueva en caja;69,95 EUR;Envío no especificado;desde Alemania;
Catwoman (Nintendo Game Boy Color, 1999)! Sellado en Fábrica! Nueva CIB;127,79 EUR;+ 7,03 EUR de envío;desde Estados Unidos;
Catwoman Nintendo Game Boy Color acción aventura juego por Nintendo 1999;7,66 EUR;Envío gratis;desde Estados Unidos;
Catwoman-Nintendo Game Boy Color-limpiado & probado-Envío Gratuito;9,71 EUR;Envío gratis;desde Estados Unidos;
Catwoman (Nintendo Game Boy Color, 1999);7,66 EUR;Envío gratis;desde Estados Unidos;
Catwoman (Nintendo Game Boy Color probado, 1999);6,82 EUR;+ 2,46 EUR de envío;desde Estados Unidos;
Catwoman (Game Boy Color) [GAME ONLY];16,70 EUR;+ 6,67 EUR de envío;desde Canadá;
Catwoman (Nintendo Game Boy Color) Cartridge Only - Gameboy Colour Cat Woman;14,69 EUR;+ 8,28 EUR de envío;desde Canadá;
Catwoman (Nintendo Game Boy Color, 1999);46,85 EUR;Envío gratis;desde Estados Unidos;
Catwoman Nintendo Gameboy Color/Colour Game oz368;37,15 EUR;+ 16,73 EUR de envío;desde Australia;
Catwoman Nintendo Gameboy Game Boy Color GBC GBA;28,64 EUR;Envío internacional gratis;desde Francia;
Catwoman Vintage 1999 Game Boy Color Gbc anuncio impreso arte;12,74 EUR;Envío gratis;desde Estados Unidos;
Catwoman-auténtico-Nintendo Game Boy Color-Solo Manual!;19,17 EUR;Envío gratis;desde Estados Unidos;
Lote de 2 Rugrats: tiempo viajeros & Catwoman Cartucho Nintendo Gameboy Color;38,34 EUR;+ 4,26 EUR de envío;desde Estados Unidos;
Catwoman Gameboy Color 1999 impresión de anuncio Cartel Vintage Arte Batman Oficial Raro GBC;11,49 EUR;Envío gratis;desde Estados Unidos;
Catwoman Gameboy Color 1999 impresión de anuncio Cartel Vintage Arte Batman Oficial Raro GBC;10,21 EUR;Envío gratis;desde Estados Unidos;
Catwoman Gameboy Color | 1999 Vintage Juego print ad Poster Oficial Dc Batman;11,49 EUR;Envío gratis;desde Estados Unidos;
Catwoman Gameboy Color, sólo Manual;10,33 EUR;Envío gratis;desde Estados Unidos;
Catwoman Gameboy Color | 1999 Vintage Juego print ad Poster Oficial Dc Batman;8,51 EUR;+ 3,37 EUR de envío;desde Estados Unidos;
