Nintendo Game Boy Classic juego Sneaky Snakes con embalaje original y guía SCN;279,90 EUR;+ 36,99 EUR de envío;desde Alemania;
Nintendo Game Boy Sneaky Snakes FAH Très Bon état;7,90 EUR;+ 11,98 EUR de envío;desde Francia;
Nuevo anuncioNintendo Gameboy Sneaky Snakes Juego Con Manual.;5,83 EUR;+ 34,28 EUR de envío estimado;desde Reino Unido;
Nintendo Gameboy Juego-Sneaky Snakes;9,31 EUR;+ 16,61 EUR de envío estimado;desde Reino Unido;
Nintendo Game Boy Sneaky Snakes USA Très Bon état;9,90 EUR;+ 11,98 EUR de envío;desde Francia;
Nintendo Game Boy - Sneaky Snakes - PAL - FAH;12,99 EUR;+ 4,60 EUR de envío;desde Francia;
Sneaky Snakes | Nintendo Game Boy UKV | Sin Caja;7,73 EUR;+ 16,58 EUR de envío estimado;desde Reino Unido;
Gameboy juego-Sneaky Snakes-Top estado;249,99 EUR;+ 7,50 EUR de envío;desde Alemania;
Nintendo Gameboy-Sneaky Snakes-Top-Embalaje original-pal alemán;159,90 EUR;Envío no especificado;desde Alemania;
Sneaky Snakes (Game Boy GB 1991) Solo Cartucho;17,51 EUR;+ 9,90 EUR de envío;desde España;
Nintendo Gameboy Juego-Sneaky Snakes;9,44 EUR;+ 16,61 EUR de envío estimado;desde Reino Unido;
Sneaky Snakes Nintendo Gameboy Juego;9,37 EUR;+ 18,40 EUR de envío estimado;desde Reino Unido;
Nintendo Game Boy - Sneaky Snakes - Notice / Instruction Manual - FAH;12,99 EUR;+ 3,80 EUR de envío;desde Francia;
Sneaky Snakes-GameBoy Classic-embalaje original/cib/boxed-pal/noe-Top;189,99 EUR;Envío no especificado;desde Alemania;
Sneaky Snakes ( Nintendo Gameboy Clasica) (1);13,95 EUR;Envío no especificado;desde España;
Game Boy Sneaky Snakes Completa;170,39 EUR;+ 7,03 EUR de envío;desde Estados Unidos;
Game Boy Sneaky Snakes;298,20 EUR;+ 17,04 EUR de envío;desde México;
Nuevo anuncioSneaky Snakes (Nintendo Gameboy) Auténtico solo carro Probado;17,00 EUR;+ 3,66 EUR de envío;desde Estados Unidos;
Sneaky Snakes en Gameboy juego sólo 9E;19,04 EUR;Envío gratis;desde Estados Unidos;
Sneaky Snakes (Game Boy GB 1991) Solo Cartucho;28,32 EUR;Envío internacional gratis;desde España;
Sneaky Snakes (Game Boy GB 1991) Solo Cartridge;17,80 EUR;+ 9,90 EUR de envío;desde España;
Sneaky Snakes Gameboy;170,84 EUR;+ 10,22 EUR de envío;desde Estados Unidos;
Sneaky Snakes ( Game Boy GB 1991) Solo Cartuccia;28,44 EUR;Envío internacional gratis;desde España;
Sneaky Snakes (Game Boy GB 1991) Solo Cartridge;28,25 EUR;+ 0,48 EUR de envío;desde España;
