Gb-Batman para Nintendo GameBoy;14,95 EUR;+6,50 EUR de env칤o;Vendidos  10 sep 2021Art칤culo vendido;desde Alemania;
Batman Forever Game Boy EUR ;10,00 EUR;Env칤o internacional gratis;Vendidos  9 sep 2021Art칤culo vendido;desde Francia;
Nuevo Y Sellado-Batman Inicia-Nintendo Gameboy Advance-PAL;76,08 EUR;+ 22,53 EUR de env칤o estimado;Vendidos  9 sep 2021Art칤culo vendido;desde Reino Unido;
Lego Batman 1 el video juego ps2 Juego Ni침os Chicos Chicas Marron;4,67 EUR;+ 18,81 EUR de env칤o estimado;Vendidos  8 sep 2021Art칤culo vendido;desde Reino Unido;
Nintendo Gameboy Paquete De Juegos Super Mario Land Chase HQ Batman Tetris;23,35 EUR;+15,22 EUR de env칤o;Vendidos  7 sep 2021Art칤culo vendido;desde Reino Unido;
Batman Forever Nintendo Gameboy Advance GBA SP 游눮% Genuino probado Raro Juego;14,04 EUR;+ 16,68 EUR de env칤o estimado;Vendidos  3 sep 2021Art칤culo vendido;desde Reino Unido;
Batman The Video Game Nintendo Gameboy Game Boy Boite Cale Notice USA;79,00 EUR;+19,00 EUR de env칤o;Vendidos  2 sep 2021Art칤culo vendido;desde Francia;
Gameboy/Batman Animated S. m칩dulo, Nintendo Gameboy juego usado & probado;19,99 EUR;Env칤o no especificado;Vendidos  2 sep 2021Art칤culo vendido;desde Alemania;
Batman-The Video Game para Gameboy con funda;25,99 EUR;+8,00 EUR de env칤o;Vendidos  1 sep 2021Art칤culo vendido;desde Alemania;
Batman The Animated Series / Game Boy / Original;39,90 EUR;Env칤o no especificado;Vendidos  1 sep 2021Art칤culo vendido;desde Francia;
81 en 1 Mortal Kombat meta Batman Nintendo Gameboy multicart Cartucho De Juego;16,38 EUR;+ 16,73 EUR de env칤o estimado;Vendidos  30 ago 2021Art칤culo vendido;desde Reino Unido;
Batman the animated series Nintendo Gameboy juego/m칩dulo. original Nintendo juego;20,00 EUR;+5,90 EUR de env칤o;Vendidos  29 ago 2021Art칤culo vendido;desde Alemania;
Nintendo Game Boy Color Batman Beyond/Future: Joker return beat 'em up scroller;7,90 EUR;+5,00 EUR de env칤o;Vendidos  24 ago 2021Art칤culo vendido;desde Alemania;
Batman Inicia ps2 juego 12+ Ni침os Ni침as Murci칠lago-Man-en gran condici칩n;3,50 EUR;+ 18,79 EUR de env칤o estimado;Vendidos  24 ago 2021Art칤culo vendido;desde Reino Unido;
Batman: The Video Game 1990s Juego Boy Cartucho s칩lo probado en muy buena condici칩n gastos de env칤o gratis;11,53 EUR;+ 16,63 EUR de env칤o estimado;Vendidos  22 ago 2021Art칤culo vendido;desde Reino Unido;
Nintendo Gameboy-Batman-Embalaje original-Top-pal-Ocean;129,90 EUR;Env칤o no especificado;Vendidos  20 ago 2021Art칤culo vendido;desde Alemania;
GAME BOY Nintendo,1989 dmg-01,giochi Tetris,Batman,DuckTales -PANG-Wrestling;89,99 EUR;+15,00 EUR de env칤o;Vendidos  18 ago 2021Art칤culo vendido;desde Italia;
Batman of the future return of the Joker para Gameboy Color/GBC;8,99 EUR;Env칤o no especificado;Vendidos  18 ago 2021Art칤culo vendido;desde Alemania;
Gameboy Advance juego Batman Vengeance Nintendo GBA m칩dulo;11,99 EUR;+19,99 EUR de env칤o;Vendidos  17 ago 2021Art칤culo vendido;desde Alemania;
Nintendo Game Boy Classic juego Batman return of the Joker m칩dulo Noe;24,90 EUR;+8,99 EUR de env칤o;Vendidos  16 ago 2021Art칤culo vendido;desde Alemania;
Nintendo Game Boy Classic juego Batman m칩dulo jap칩n importaci칩n;19,90 EUR;+8,99 EUR de env칤o;Vendidos  14 ago 2021Art칤culo vendido;desde Alemania;
Batman caos en Gotham + embalaje original-Nintendo Game Boy Color;45,00 EUR;+9,99 EUR de env칤o;Vendidos  7 ago 2021Art칤culo vendido;desde Alemania;
Lego Batman 1 & Pure Xbox 360 juego 2 Juegos Motocross Motos Ni침os Ni침as Ni침os;4,09 EUR;+ 18,80 EUR de env칤o estimado;Vendidos  6 ago 2021Art칤culo vendido;desde Reino Unido;
Batman-El juego de video (Nintendo Gameboy);9,35 EUR a 11,69 EUR;+ 18,39 EUR de env칤o estimado;Vendidos  6 ago 2021Art칤culo vendido;desde Reino Unido;
Nintendo Game Boy Batman Return Of the Joker FAH Tr칟s Bon 칠tat;29,90 EUR;+11,98 EUR de env칤o;Vendidos  4 ago 2021Art칤culo vendido;desde Francia;
Batman-The Video Game para Gameboy con funda;21,99 EUR;+4,99 EUR de env칤o;Vendidos  3 ago 2021Art칤culo vendido;desde Alemania;
Batman : The Video Game - Game Boy FAH ;15,00 EUR;Env칤o internacional gratis;Vendidos  2 ago 2021Art칤culo vendido;desde Francia;
Batman Forever  Gameboy  officiel test ok envoi suivi;6,00 EUR;Env칤o no especificado;Vendidos  24 jul 2021Art칤culo vendido;desde Francia;
Batman : The Video Game - Game Boy FAH ;15,00 EUR;Env칤o internacional gratis;Vendidos  21 jul 2021Art칤culo vendido;desde Francia;
Nintendo Gameboy Juego-Batman El Videojuego;11,69 EUR;+ 21,36 EUR de env칤o estimado;Vendidos  18 jul 2021Art칤culo vendido;desde Reino Unido;
Batman: The Video Game (1990, Nintendo Gameboy) PAL;23,41 EUR;+ 20,95 EUR de env칤o estimado;Vendidos  15 jul 2021Art칤culo vendido;desde Reino Unido;
Batman jeu game boy avec boitier de protection;15,00 EUR;Env칤o no especificado;Vendidos  13 jul 2021Art칤culo vendido;desde Francia;
Nintendo Game Boy-Batman The Animated Series-Embalaje original-pal-Top;249,90 EUR;Env칤o no especificado;Vendidos  12 jul 2021Art칤culo vendido;desde Alemania;
Lego Batman 2 Dc Super Heroes Xbox 360 Juego Ni침os Ni침as Ni침os Marron;5,84 EUR;+ 18,83 EUR de env칤o estimado;Vendidos  12 jul 2021Art칤culo vendido;desde Reino Unido;
Batman-El juego de video (Nintendo Gameboy) cartucho s칩lo probado & trabajo;11,68 EUR;+ 16,65 EUR de env칤o estimado;Vendidos  8 jul 2021Art칤culo vendido;desde Reino Unido;
Nintendo Gameboy Color-Batman caos en Gotham;21,02 EUR;+ 16,81 EUR de env칤o estimado;Vendidos  6 jul 2021Art칤culo vendido;desde Reino Unido;
Batman Beyond: Return de los Joker Para Nintendo Game Boy Color Probado en Caja;46,81 EUR;+ 17,28 EUR de env칤o estimado;Vendidos  6 jul 2021Art칤culo vendido;desde Reino Unido;
Batman Return of the Joker, GB, GAME BOY;150,00 EUR;+20,00 EUR de env칤o;Vendidos  5 jul 2021Art칤culo vendido;desde Espa침a;
Manuel Notice de jeu Nintendo game boy advance FR originale Batman vengeance;8,08 EUR;Env칤o no especificado;Vendidos  3 jul 2021Art칤culo vendido;desde Francia;
Batman: caos en Gotham (Nintendo Game Boy Color, 2001);12,95 EUR;Env칤o no especificado;Vendidos  28 jun 2021Art칤culo vendido;desde Alemania;
