Nintendo GameBoy Color jeu - Top Gear Pocket 2 cartouche utilisé;22,99 EUR;Envío internacional gratis;desde Alemania;
Nintendo GameBoy Color gioco - Top Gear Pocket 2 cartuccia usato;24,99 EUR;Envío internacional gratis;desde Alemania;
Nintendo GameBoy Color game - Top Gear Pocket 2 cartridge;18,82 EUR;Envío internacional gratis;desde Alemania;
Nintendo GameBoy Color juego - Top Gear Pocket 2 cartucho usado;24,99 EUR;Envío internacional gratis;desde Alemania;
(LUP)Top Gear Pocket 2 (Nintendo Game Boy Color, 1999) CART ONLY ;8,07 EUR;+ 13,45 EUR de envío;desde Canadá;
Top Gear Pocket 2 (Nintendo Game Boy Color, 1999) GBC Free shipping tested ;15,12 EUR;+ 3,36 EUR de envío;desde Canadá;
