Genuine Judge Dredd NINTENDO GAMEBOY Carro De Juego Original * * probado y funciona;15,21 EUR;+ 16,70 EUR de envío estimado;Vendidos  15 sep 2021Artículo vendido;desde Reino Unido;
Nintendo Gameboy juego-Judge Dredd (módulo) 10822678;10,69 EUR;+ 67,99 EUR de envío;Vendidos  8 sep 2021Artículo vendido;desde Alemania;
Judge Dredd Cartucho De Juego-NINTENDO GAME Chico + Color o ADVANCE;12,62 EUR;Envío gratis;Vendidos  15 sep 2021Artículo vendido;desde Estados Unidos;
Judge Dredd 1995 Nintendo Game Boy;7,65 EUR;+ 4,42 EUR de envío;Vendidos  13 sep 2021Artículo vendido;desde Estados Unidos;
Pre-owned Judge Dredd Para Nintendo Game Boy Envío rápido;12,74 EUR;Envío gratis;Vendidos  2 ago 2021Artículo vendido;desde Estados Unidos;
Nintendo Game Boy Judge Dredd Juego Caja Y Manual, CIB Completo Raro Difícil De Encontrar;87,13 EUR;+ 4,34 EUR de envío;Vendidos  23 jul 2021Artículo vendido;desde Estados Unidos;
Judge Dredd Para Original GameBoy + Color | auténtico probado juego solo carro;8,49 EUR;+ 3,14 EUR de envío;Vendidos  15 jul 2021Artículo vendido;desde Estados Unidos;
Judge Dredd guía de estrategia de los jugadores de Brady Games Snes, Sega, Gameboy & GAMEGEAR;12,75 EUR;+ 2,71 EUR de envío;Vendidos  6 jul 2021Artículo vendido;desde Estados Unidos;
Acclaim Nintendo Game Boy Cartel Promo sólo insertar NBA Jam Te Batman Judge Dredd;5,53 EUR;Envío gratis;Vendidos  28 jun 2021Artículo vendido;desde Estados Unidos;
Judge Dredd Juego (Nintendo Game Boy, 1995);7,60 EUR;Envío gratis;Vendidos  23 jun 2021Artículo vendido;desde Estados Unidos;
SEGA Megadrive Judge Dredd Juego (PAL) * COMPLETO *;29,26 EUR;+ 34,64 EUR de envío estimado;Vendidos  1 ago 2021Artículo vendido;desde Reino Unido;
Judge Dredd Playstation Juego;5,85 EUR;+ 7,61 EUR de envío;Vendidos  5 ago 2021Artículo vendido;desde Reino Unido;
Games Workshop Judge Dredd rol en Caja Juego De Mesa;18,97 EUR;+ 33,33 EUR de envío estimado;Vendidos  17 ago 2021Artículo vendido;desde Reino Unido;
Judge Dredd Sega Game Gear;22,23 EUR;+ 33,20 EUR de envío estimado;Vendidos  9 jul 2021Artículo vendido;desde Reino Unido;
Nuevo anuncioPS1-Judge Dredd COMPLETO PAL UK Juego en Caja;6,43 EUR;+ 14,05 EUR de envío;Vendidos  16 sep 2021Artículo vendido;desde Reino Unido;
Judge Dredd En Caja Y Completo Sega Mega Drive juego Megadrive, probado y de trabajo;19,90 EUR;+ 20,23 EUR de envío estimado;Vendidos  3 jul 2021Artículo vendido;desde Reino Unido;
Judge Dredd (Mega Drive juego) cartucho sólo probado;14,04 EUR;+ 16,68 EUR de envío estimado;Vendidos  15 sep 2021Artículo vendido;desde Reino Unido;
Judge Dredd-PLAYSTATION 1 juego 1997 Perfecto Estado + instrucciones;28,09 EUR;+ 35,26 EUR de envío estimado;Vendidos  13 jul 2021Artículo vendido;desde Reino Unido;
Nintendo Game Cube Judge Dredd - Dredd vs Death FRA Excellent état;29,90 EUR;+ 14,98 EUR de envío;Vendidos  27 ago 2021Artículo vendido;desde Francia;
Judge Dredd PS1 juego probado completo y manual Black Label Sony PlayStation PAL;15,21 EUR;+ 16,70 EUR de envío estimado;Vendidos  24 jun 2021Artículo vendido;desde Reino Unido;
Judge Dredd: DREDD VS DEATH PC CD-ROM Juego Nuevo Y Sellado Raro original de Reino Unido;14,05 EUR;+ 16,68 EUR de envío estimado;Vendidos  2 jul 2021Artículo vendido;desde Reino Unido;
Judge Dredd Juego PS1 Playstation 1 USADO PAL Reino Unido;5,84 EUR;+ 14,05 EUR de envío;Vendidos  25 jun 2021Artículo vendido;desde Reino Unido;
Raro Nuevo Y Sellado XBOX Juego Original-Judge Dredd temible Vs La Muerte-EE. UU.;23,41 EUR;+ 19,19 EUR de envío estimado;Vendidos  20 jul 2021Artículo vendido;desde Reino Unido;
Judge Dredd PlayStation 1 PS1 juego de acción J16;9,35 EUR;+ 18,35 EUR de envío estimado;Vendidos  31 ago 2021Artículo vendido;desde Reino Unido;
Judge Dredd Sega Mega Drive Juego UK PAL Euro En Caja Manual Completo * Coleccionistas;29,25 EUR;+ 4,67 EUR de envío;Vendidos  26 ago 2021Artículo vendido;desde Reino Unido;
Judge Dredd: Dredd vs Death-PS2 juego/+60GB PS3 rápido post Original y Completo;6,96 EUR;+ 6,96 EUR de envío;Vendidos  27 jul 2021Artículo vendido;desde Reino Unido;
Sega Mega Drive Juego-Judge Dredd;17,50 EUR;+ 16,75 EUR de envío estimado;Vendidos  6 sep 2021Artículo vendido;desde Reino Unido;
Judge Dredd Juego De Mesa-Conjunto de expansión de jueces de calle;26,33 EUR;+ 35,97 EUR de envío estimado;Vendidos  5 ago 2021Artículo vendido;desde Reino Unido;
Judge Dredd: PC Juego de Pinball * * completo * 2000AD;2,87 EUR;+ 8,18 EUR de envío;Vendidos  4 jul 2021Artículo vendido;desde Reino Unido;
Judge Dredd El Rol Playing Game & Citi-Blok Games Workshop;35,11 EUR;+ 37,14 EUR de envío estimado;Vendidos  29 ago 2021Artículo vendido;desde Reino Unido;
Warlord Games Perro de Estroncio 2000AD Judge Dredd Juego 25mm base de labio Redondo;2,91 EUR;+ 27,75 EUR de envío estimado;Vendidos  25 jul 2021Artículo vendido;desde Reino Unido;
Judge Dredd-lucha contra el crimen en la ciudad de Mega-un juego de mesa (1982);29,26 EUR;+ 32,69 EUR de envío estimado;Vendidos  4 jul 2021Artículo vendido;desde Reino Unido;
25mm base de labio Redondo Warlord Games Perro de Estroncio 2000AD juego Judge Dredd;1,74 EUR;+ 27,73 EUR de envío estimado;Vendidos  25 jul 2021Artículo vendido;desde Reino Unido;
25mm base de labio Redondo Warlord Games Perro de Estroncio 2000AD juego Judge Dredd;2,91 EUR;+ 27,75 EUR de envío estimado;Vendidos  25 jul 2021Artículo vendido;desde Reino Unido;
Judge Dredd Juego de Miniaturas-bloque Gang-Nuevo Y En Caja;21,07 EUR;+ 25,04 EUR de envío estimado;Vendidos  31 ago 2021Artículo vendido;desde Reino Unido;
1985 juego de juego de rol Judge Dredd la games workshop 2000 ad Sci Fi RPG libro GW;84,28 EUR;+ 22,24 EUR de envío;Vendidos  28 jul 2021Artículo vendido;desde Reino Unido;
Judge Dredd Juego de rol juego 1985. además juicio día libro de aventuras.;18,73 EUR;+ 34,74 EUR de envío estimado;Vendidos  22 ago 2021Artículo vendido;desde Reino Unido;
Judge Dredd The Role-playing Game, Games Workshop 1989, Hardback.;32,00 EUR;+ 30,00 EUR de envío;Vendidos  16 jul 2021Artículo vendido;desde Italia;
Warlord Games Perro de Estroncio 2000AD Judge Dredd Juego el Gronk;3,50 EUR;+ 28,35 EUR de envío estimado;Vendidos  16 jul 2021Artículo vendido;desde Reino Unido;
Games Workshop Judge Dredd bloque manía Vintage 80s Juego De Mesa;23,40 EUR;+ 25,67 EUR de envío estimado;Vendidos  28 jun 2021Artículo vendido;desde Reino Unido;
Warlord Games Perro de Estroncio 2000AD Judge Dredd Juego contadores & Marcadores;4,67 EUR;+ 28,37 EUR de envío estimado;Vendidos  1 jul 2021Artículo vendido;desde Reino Unido;
Vintage 1985 Juegos taller Judge Dredd Juego de Rol granada de cohete propulsado;17,55 EUR;+ 35,60 EUR de envío estimado;Vendidos  27 ago 2021Artículo vendido;desde Reino Unido;
Judge Dredd el papel jugando juego 1985 sin cortar Box Set Games Workshop 2000AD RPG;52,68 EUR;+ 31,01 EUR de envío estimado;Vendidos  11 sep 2021Artículo vendido;desde Reino Unido;
Warlord Games Perro de Estroncio 2000AD Judge Dredd Juego Max Bubba y Gang;9,35 EUR;+ 28,46 EUR de envío estimado;Vendidos  16 jul 2021Artículo vendido;desde Reino Unido;
Warlord Games Perro de Estroncio 2000AD Judge Dredd Juego contadores & Marcadores Negro;2,33 EUR;+ 28,33 EUR de envío estimado;Vendidos  16 jul 2021Artículo vendido;desde Reino Unido;
Judge Dredd Juego de Miniaturas Joblot;40,96 EUR;+ 21,89 EUR de envío estimado;Vendidos  30 jun 2021Artículo vendido;desde Reino Unido;
Judge Dredd & Los mundos de 2000 juego de juego de rol RPG ad Rogue Trooper;43,30 EUR;+ 26,75 EUR de envío estimado;Vendidos  19 jul 2021Artículo vendido;desde Reino Unido;
Judge Dredd Paquete de Juego de Rol - 200AD Original 1980s Games Workshop;76,09 EUR;+ 58,53 EUR de envío;Vendidos  24 ago 2021Artículo vendido;desde Reino Unido;
Judge Dredd & Los mundos de juego de rol RPG de Perro de Estroncio de 2000 ad Juego;40,96 EUR;+ 27,73 EUR de envío estimado;Vendidos  8 sep 2021Artículo vendido;desde Reino Unido;
Warlord Games Perro de Estroncio 2000AD Judge Dredd Juego dice Set Rojo Lote;9,35 EUR;+ 26,13 EUR de envío estimado;Vendidos  1 jul 2021Artículo vendido;desde Reino Unido;
