Genuine Judge Dredd NINTENDO GAMEBOY Carro De Juego Original * * probado y funciona;15,11 EUR;+ 16,60 EUR de envío estimado;Vendidos  15 sep 2021Artículo vendido;desde Reino Unido;
Nintendo Gameboy juego-Judge Dredd (módulo) 10822678;10,69 EUR;+ 67,99 EUR de envío;Vendidos  8 sep 2021Artículo vendido;desde Alemania;
Judge Dredd Cartucho De Juego-NINTENDO GAME Chico + Color o ADVANCE;12,65 EUR;Envío gratis;Vendidos  15 sep 2021Artículo vendido;desde Estados Unidos;
Judge Dredd 1995 Nintendo Game Boy;7,67 EUR;+ 4,13 EUR de envío;Vendidos  13 sep 2021Artículo vendido;desde Estados Unidos;
Pre-owned Judge Dredd Para Nintendo Game Boy Envío rápido;12,78 EUR;Envío gratis;Vendidos  2 ago 2021Artículo vendido;desde Estados Unidos;
Nintendo Game Boy Judge Dredd Juego Caja Y Manual, CIB Completo Raro Difícil De Encontrar;87,36 EUR;+ 4,26 EUR de envío;Vendidos  23 jul 2021Artículo vendido;desde Estados Unidos;
Judge Dredd Para Original GameBoy + Color | auténtico probado juego solo carro;8,51 EUR;+ 3,14 EUR de envío;Vendidos  15 jul 2021Artículo vendido;desde Estados Unidos;
Judge Dredd guía de estrategia de los jugadores de Brady Games Snes, Sega, Gameboy & GAMEGEAR;12,78 EUR;+ 2,72 EUR de envío;Vendidos  6 jul 2021Artículo vendido;desde Estados Unidos;
Acclaim Nintendo Game Boy Cartel Promo sólo insertar NBA Jam Te Batman Judge Dredd;5,54 EUR;Envío gratis;Vendidos  28 jun 2021Artículo vendido;desde Estados Unidos;
SEGA Megadrive Judge Dredd Juego (PAL) * COMPLETO *;29,07 EUR;+ 34,41 EUR de envío estimado;Vendidos  1 ago 2021Artículo vendido;desde Reino Unido;
Games Workshop Judge Dredd rol en Caja Juego De Mesa;18,85 EUR;+ 33,11 EUR de envío estimado;Vendidos  17 ago 2021Artículo vendido;desde Reino Unido;
Judge Dredd Playstation Juego;5,81 EUR;+ 7,56 EUR de envío;Vendidos  5 ago 2021Artículo vendido;desde Reino Unido;
Judge Dredd: DREDD VS DEATH, PAL, Completa, NINTENDO GAMECUBE Juego;15,04 EUR;+ 11,63 EUR de envío;Vendidos  17 sep 2021Artículo vendido;desde Reino Unido;
Judge Dredd Sega Game Gear;22,08 EUR;+ 32,98 EUR de envío estimado;Vendidos  9 jul 2021Artículo vendido;desde Reino Unido;
Judge Dredd En Caja Y Completo Sega Mega Drive juego Megadrive, probado y de trabajo;19,77 EUR;+ 20,10 EUR de envío estimado;Vendidos  3 jul 2021Artículo vendido;desde Reino Unido;
PS1-Judge Dredd COMPLETO PAL UK Juego en Caja;6,38 EUR;+ 13,96 EUR de envío;Vendidos  16 sep 2021Artículo vendido;desde Reino Unido;
Judge Dredd (Mega Drive juego) cartucho sólo probado;13,94 EUR;+ 16,57 EUR de envío estimado;Vendidos  15 sep 2021Artículo vendido;desde Reino Unido;
Judge Dredd Sega Game Gear Juego-en muy buena condición;26,17 EUR;+ 16,79 EUR de envío estimado;Vendidos  17 sep 2021Artículo vendido;desde Reino Unido;
Judge Dredd: Dredd vs la muerte de Vídeo Juego Para Sony PlayStation PS2 Pal probado;9,29 EUR;+ 16,49 EUR de envío estimado;Vendidos  19 sep 2021Artículo vendido;desde Reino Unido;
Judge Dredd-PLAYSTATION 1 juego 1997 Perfecto Estado + instrucciones;27,91 EUR;+ 35,03 EUR de envío estimado;Vendidos  13 jul 2021Artículo vendido;desde Reino Unido;
Nintendo Game Cube Judge Dredd - Dredd vs Death FRA Excellent état;29,90 EUR;+ 14,98 EUR de envío;Vendidos  27 ago 2021Artículo vendido;desde Francia;
Judge Dredd: DREDD VS DEATH PC CD-ROM Juego Nuevo Y Sellado Raro original de Reino Unido;13,96 EUR;+ 16,57 EUR de envío estimado;Vendidos  2 jul 2021Artículo vendido;desde Reino Unido;
Judge Dredd Juego PS1 Playstation 1 USADO PAL Reino Unido;5,80 EUR;+ 13,96 EUR de envío;Vendidos  25 jun 2021Artículo vendido;desde Reino Unido;
Judge Dredd: Dredd vs Death-PS2 juego/+60GB PS3 rápido post Original y Completo;6,92 EUR;+ 6,92 EUR de envío;Vendidos  27 jul 2021Artículo vendido;desde Reino Unido;
Judge Dredd Sega Mega Drive Juego UK PAL Euro En Caja Manual Completo * Coleccionistas;29,06 EUR;+ 4,64 EUR de envío;Vendidos  26 ago 2021Artículo vendido;desde Reino Unido;
Raro Nuevo Y Sellado XBOX Juego Original-Judge Dredd temible Vs La Muerte-EE. UU.;23,26 EUR;+ 19,06 EUR de envío estimado;Vendidos  20 jul 2021Artículo vendido;desde Reino Unido;
Sega Mega Drive Juego-Judge Dredd;17,39 EUR;+ 16,64 EUR de envío estimado;Vendidos  6 sep 2021Artículo vendido;desde Reino Unido;
Judge Dredd PlayStation 1 PS1 juego de acción J16;9,29 EUR;+ 18,24 EUR de envío estimado;Vendidos  31 ago 2021Artículo vendido;desde Reino Unido;
Judge Dredd Juego De Mesa-Conjunto de expansión de jueces de calle;26,15 EUR;+ 35,74 EUR de envío estimado;Vendidos  5 ago 2021Artículo vendido;desde Reino Unido;
Judge Dredd: PC Juego de Pinball * * completo * 2000AD;2,85 EUR;+ 8,13 EUR de envío;Vendidos  4 jul 2021Artículo vendido;desde Reino Unido;
Judge Dredd-El juego de lucha contra el crimen en la ciudad de Mega uno-Games Workshop RPG;34,89 EUR;+ 32,24 EUR de envío estimado;Vendidos  17 sep 2021Artículo vendido;desde Reino Unido;
Judge Dredd Juego de Miniaturas Colección Regla Libro más 4 conjuntos de miniaturas Nuevo;58,14 EUR;+ 31,32 EUR de envío estimado;Vendidos  19 sep 2021Artículo vendido;desde Reino Unido;
Judge Dredd El Rol Playing Game & Citi-Blok Games Workshop;34,88 EUR;+ 36,90 EUR de envío estimado;Vendidos  29 ago 2021Artículo vendido;desde Reino Unido;
Judge Dredd-lucha contra el crimen en la ciudad de Mega-un juego de mesa (1982);29,07 EUR;+ 32,48 EUR de envío estimado;Vendidos  4 jul 2021Artículo vendido;desde Reino Unido;
Warlord Games Perro de Estroncio 2000AD Judge Dredd Juego 25mm base de labio Redondo;2,90 EUR;+ 27,57 EUR de envío estimado;Vendidos  25 jul 2021Artículo vendido;desde Reino Unido;
25mm base de labio Redondo Warlord Games Perro de Estroncio 2000AD juego Judge Dredd;1,73 EUR;+ 27,55 EUR de envío estimado;Vendidos  25 jul 2021Artículo vendido;desde Reino Unido;
Games Workshop Judge Dredd bloque manía Vintage 80s Juego De Mesa;23,25 EUR;+ 25,50 EUR de envío estimado;Vendidos  28 jun 2021Artículo vendido;desde Reino Unido;
25mm base de labio Redondo Warlord Games Perro de Estroncio 2000AD juego Judge Dredd;2,90 EUR;+ 27,57 EUR de envío estimado;Vendidos  25 jul 2021Artículo vendido;desde Reino Unido;
Judge Dredd Juego de Miniaturas-bloque Gang-Nuevo Y En Caja;20,93 EUR;+ 24,88 EUR de envío estimado;Vendidos  31 ago 2021Artículo vendido;desde Reino Unido;
Warlord Games Perro de Estroncio 2000AD Judge Dredd Juego el Gronk;3,48 EUR;+ 28,17 EUR de envío estimado;Vendidos  16 jul 2021Artículo vendido;desde Reino Unido;
Judge Dredd The Role-playing Game, Games Workshop 1989, Hardback.;32,00 EUR;+ 30,00 EUR de envío;Vendidos  16 jul 2021Artículo vendido;desde Italia;
Warlord Games Perro de Estroncio 2000AD Judge Dredd Juego contadores & Marcadores;4,64 EUR;+ 28,19 EUR de envío estimado;Vendidos  1 jul 2021Artículo vendido;desde Reino Unido;
Judge Dredd Juego de rol juego 1985. además juicio día libro de aventuras.;18,61 EUR;+ 34,52 EUR de envío estimado;Vendidos  22 ago 2021Artículo vendido;desde Reino Unido;
1985 juego de juego de rol Judge Dredd la games workshop 2000 ad Sci Fi RPG libro GW;83,73 EUR;+ 22,10 EUR de envío;Vendidos  28 jul 2021Artículo vendido;desde Reino Unido;
Judge Dredd Paquete de Juego de Rol - 200AD Original 1980s Games Workshop;75,59 EUR;+ 58,15 EUR de envío;Vendidos  24 ago 2021Artículo vendido;desde Reino Unido;
Warlord Games Perro de Estroncio 2000AD Judge Dredd Juego Max Bubba y Gang;9,29 EUR;+ 28,27 EUR de envío estimado;Vendidos  16 jul 2021Artículo vendido;desde Reino Unido;
Vintage 1985 Juegos taller Judge Dredd Juego de Rol granada de cohete propulsado;17,43 EUR;+ 35,37 EUR de envío estimado;Vendidos  27 ago 2021Artículo vendido;desde Reino Unido;
Warlord Games Perro de Estroncio 2000AD Judge Dredd Juego contadores & Marcadores Negro;2,31 EUR;+ 28,14 EUR de envío estimado;Vendidos  16 jul 2021Artículo vendido;desde Reino Unido;
Judge Dredd el papel jugando juego 1985 sin cortar Box Set Games Workshop 2000AD RPG;52,33 EUR;+ 30,81 EUR de envío estimado;Vendidos  11 sep 2021Artículo vendido;desde Reino Unido;
Judge Dredd Juego de Miniaturas Joblot;40,69 EUR;+ 21,75 EUR de envío estimado;Vendidos  30 jun 2021Artículo vendido;desde Reino Unido;
Judge Dredd & Los mundos de 2000 juego de juego de rol RPG ad Rogue Trooper;43,02 EUR;+ 26,57 EUR de envío estimado;Vendidos  19 jul 2021Artículo vendido;desde Reino Unido;
Warlord Games Perro de Estroncio 2000AD Judge Dredd Juego dice Set Rojo Lote;9,29 EUR;+ 25,96 EUR de envío estimado;Vendidos  1 jul 2021Artículo vendido;desde Reino Unido;
Warlord Games Perro de Estroncio 2000AD Judge Dredd Juego Wulf Sternhammer;3,48 EUR;+ 28,17 EUR de envío estimado;Vendidos  6 jul 2021Artículo vendido;desde Reino Unido;
Warlord Games Perro de Estroncio 2000AD Judge Dredd Juego Johnny Alfa;2,31 EUR;+ 28,14 EUR de envío estimado;Vendidos  6 jul 2021Artículo vendido;desde Reino Unido;
