Aerostar Gameboy * Original * Aero Star Game Boy Probado;35,83 EUR;+ 12,47 EUR de envío;Vendidos  25 jul 2021Artículo vendido;desde Reino Unido;
Aerostar cartuccia gameboy;80,00 EUR;Envío no especificado;Vendidos  6 jul 2021Artículo vendido;desde Italia;
Aero Star Aerostar Genuino Nintendo japonés Gameboy dmg Cartucho De Juego-AEA;35,13 EUR;+ 17,08 EUR de envío estimado;Vendidos  29 jun 2021Artículo vendido;desde Reino Unido;
Aerostar Nintendo Game Boy 1991 Completo en Caja Completo en Caja Insertos;212,99 EUR;Envío gratis;Vendidos  12 sep 2021Artículo vendido;desde Estados Unidos;
Nintendo Gameboy Aerostar auténtico de juego probadas;51,11 EUR;Envío gratis;Vendidos  24 jul 2021Artículo vendido;desde Estados Unidos;
Aerostar Nintendo Game Boy 1991 Completo en Caja Completo en Caja Insertos;149,10 EUR;+ 3,49 EUR de envío;Vendidos  11 jul 2021Artículo vendido;desde Estados Unidos;
