Bubble Bobble-NINTENDO Game Boy Usa NSTC-Gameboy-raro usado genuino;15,21 EUR;+ 11,71 EUR de envío;Vendidos  14 sep 2021Artículo vendido;desde Reino Unido;
Bubble Bobble viejos y nuevos Gameboy Advance Juego! busque en la tienda!;14,05 EUR;+ 19,02 EUR de envío estimado;Vendidos  9 sep 2021Artículo vendido;desde Reino Unido;
Nintendo Gameboy Advance juego-Bubble Bobble old & NEW (módulo);29,99 EUR;+ 67,99 EUR de envío;Vendidos  2 sep 2021Artículo vendido;desde Alemania;
Nintendo Game Boy Classic juego Bubble Bobble módulo Noe;19,90 EUR;+ 8,99 EUR de envío;Vendidos  28 ago 2021Artículo vendido;desde Alemania;
Bubble Bobble DMG-B2A cartucho Gameboy GB Japan leer;14,95 EUR;+ 8,95 EUR de envío;Vendidos  11 ago 2021Artículo vendido;desde España;
Bubble Bobble Part 2 Game Boy PAL EUR (no Usa);45,97 EUR;Envío no especificado;Vendidos  5 ago 2021Artículo vendido;desde Italia;
Bubble Bobble viejos y nuevos Taito Para Nintendo Gameboy Advance Gba Reino Unido original;15,21 EUR;+ 16,70 EUR de envío estimado;Vendidos  3 ago 2021Artículo vendido;desde Reino Unido;
Bubble Bobble Manuel - Instruction Booklet Game Boy SCN ;10,00 EUR;Envío internacional gratis;Vendidos  30 jul 2021Artículo vendido;desde Francia;
NINTENDO GAMEBOY ADVANCE-Bubble Bobble VIEJO & NUEVO-Free UK Post;14,04 EUR;+ 16,68 EUR de envío estimado;Vendidos  28 jul 2021Artículo vendido;desde Reino Unido;
Genuine NINTENDO GAME BOY ADVANCE GBA Juego Bubble Bobble con caja y manual en muy buena condición;40,91 EUR;+ 17,17 EUR de envío estimado;Vendidos  28 jul 2021Artículo vendido;desde Reino Unido;
Bubble Bobble Nintendo Gameboy Genuino;17,56 EUR;+ 16,75 EUR de envío estimado;Vendidos  28 jul 2021Artículo vendido;desde Reino Unido;
NINTENDO GAMEBOY COLOR: Clásico Bubble Bobble videojuego-UK;11,65 EUR;+ 16,65 EUR de envío estimado;Vendidos  22 jul 2021Artículo vendido;desde Reino Unido;
Bubble Bobble viejos y nuevos Taito Para Nintendo Gameboy Advance;11,69 EUR;+ 17,56 EUR de envío;Vendidos  6 jul 2021Artículo vendido;desde Reino Unido;
Clásico Bubble Bobble (Nintendo Game Boy Color) * Auténtico * Juego Carro Y Estuche;16,96 EUR;+ 2,98 EUR de envío;Vendidos  17 sep 2021Artículo vendido;desde Estados Unidos;
Bubble Bobble juego solamente-NINTENDO Gameboy Advance 719a;15,34 EUR;Envío gratis;Vendidos  6 sep 2021Artículo vendido;desde Estados Unidos;
Bubble Bobble parte 2 (Nintendo Game Boy, 1993);38,25 EUR;Envío gratis;Vendidos  2 sep 2021Artículo vendido;desde Estados Unidos;
Bubble Bobble VIEJO & NUEVO Nintendo Game Boy Advance * Auténtico y ahorra *;28,88 EUR;Envío gratis;Vendidos  1 sep 2021Artículo vendido;desde Estados Unidos;
Bubble Bobble Nintendo Game Boy Color GBC auténtico y probado! buen ESTADO!;24,65 EUR;+ 4,97 EUR de envío;Vendidos  31 ago 2021Artículo vendido;desde Estados Unidos;
Bubble Bobble: VIEJO & NUEVO Nintendo Game Boy Advance GBA auténtico Probado Usado;26,74 EUR;Envío gratis;Vendidos  20 ago 2021Artículo vendido;desde Estados Unidos;
Bubble Bobble VIEJO & NUEVO-auténtico-Nintendo Game Boy Advance-Manual Solamente!;10,83 EUR;Envío gratis;Vendidos  17 ago 2021Artículo vendido;desde Estados Unidos;
Nintendo Gameboy Manual Authentic Bubble Bobble Classic;11,38 EUR;+ 3,35 EUR de envío;Vendidos  15 ago 2021Artículo vendido;desde Canadá;
Bubble Bobble parte 2-Nintendo Game Boy-Excelente Estado-Probado Y Funcionando;42,50 EUR;Envío gratis;Vendidos  15 ago 2021Artículo vendido;desde Estados Unidos;
Bubble Bobble Nintendo Game Boy Gameboy auténtico, Cartucho Envío Gratis Probado;15,73 EUR;Envío gratis;Vendidos  14 ago 2021Artículo vendido;desde Estados Unidos;
Bubble Bobble Nintendo Gameboy. 1991. Original Authentic. Tested. ;17,41 EUR;+ 5,02 EUR de envío;Vendidos  13 ago 2021Artículo vendido;desde Canadá;
Solo Manual Bubble Bobble Gameboy 100% Originales Auténticos 1991 libro de instrucciones;11,80 EUR;Envío gratis;Vendidos  12 ago 2021Artículo vendido;desde Estados Unidos;
Bubble Bobble (Nintendo Game Boy, 1991);23,80 EUR;+ 3,78 EUR de envío;Vendidos  10 ago 2021Artículo vendido;desde Estados Unidos;
Bubble Bobble Nintendo Game Boy limpiado & probado Auténtico;21,24 EUR;Envío gratis;Vendidos  10 ago 2021Artículo vendido;desde Estados Unidos;
Bubble Bobble 2 Nintendo Gameboy Publicidad Promo Auténtico Original 1993;8,49 EUR;Envío gratis;Vendidos  2 ago 2021Artículo vendido;desde Estados Unidos;
Bubble Bobble VIEJO & NUEVO Japón Nintendo Game Boy GBA Japón importación región libre;25,49 EUR;Envío gratis;Vendidos  29 jul 2021Artículo vendido;desde Estados Unidos;
Bubble Bobble nuevos y viejos Nintendo Game Boy Advance Video Juego Carro;22,24 EUR;Envío gratis;Vendidos  28 jul 2021Artículo vendido;desde Estados Unidos;
⭐⭐ ⭐⭐ auténtico Bubble Bobble parte 2-NINTENDO GAMEBOY GB Juego ⭐⭐⭐⭐⭐⭐⭐⭐⭐⭐⭐⭐⭐⭐⭐⭐;28,88 EUR;Envío gratis;Vendidos  26 jul 2021Artículo vendido;desde Estados Unidos;
Bubble Bobble Nintendo GameBoy auténtico Probado Funciona Gameboy 1991 Con Estuche;17,84 EUR;+ 3,78 EUR de envío;Vendidos  26 jul 2021Artículo vendido;desde Estados Unidos;
Clásico Bubble Bobble (Nintendo Game Boy Color, 1999) solo carro, Probado;12,75 EUR;+ 3,78 EUR de envío;Vendidos  26 jul 2021Artículo vendido;desde Estados Unidos;
Bubble Bobble parte 2 (1993), Nintendo Game Boy probado Auténtico;29,74 EUR;+ 3,40 EUR de envío;Vendidos  21 jul 2021Artículo vendido;desde Estados Unidos;
Bubble Bobble (Nintendo Game Boy, 1991) Auténtico Probado Funcionando;16,99 EUR;Envío gratis;Vendidos  21 jul 2021Artículo vendido;desde Estados Unidos;
Clásico Bubble Bobble (Nintendo Game Boy Color) * Auténtico * Cartucho de juego solamente;28,04 EUR;Envío gratis;Vendidos  21 jul 2021Artículo vendido;desde Estados Unidos;
Bubble Bobble (Nintendo Game Boy, Gameboy) Auténtico, sólo cartucho, envío gratuito;15,30 EUR;Envío gratis;Vendidos  13 jul 2021Artículo vendido;desde Estados Unidos;
NINTENDO GAMEBOY-Bubble Bobble 2 Juego Nuevo Sellado Vga 85+ Casi Nuevo +;2.210,23 EUR;Envío gratis;Vendidos  13 jul 2021Artículo vendido;desde Estados Unidos;
Clásico Bubble Bobble Nintendo Game Boy Color * Auténtico * gran condtion!;9,54 EUR;Envío gratis;Vendidos  9 jul 2021Artículo vendido;desde Estados Unidos;
Bubble Bobble (Nintendo Game Boy, 1990);21,25 EUR;+ 4,17 EUR de envío;Vendidos  9 jul 2021Artículo vendido;desde Estados Unidos;
Bubble Bobble (Nintendo Game Boy, 1991) Auténtico Probado Funciona;12,74 EUR;Envío gratis;Vendidos  4 jul 2021Artículo vendido;desde Estados Unidos;
Bubble Bobble: VIEJO & NUEVO-GameBoy Advance GBA-auténtico-solo Carro!;13,74 EUR;Envío gratis;Vendidos  30 jun 2021Artículo vendido;desde Estados Unidos;
Bubble Bobble parte 2 Nintendo Game Boy Folleto De Instrucciones Manual Solamente;16,99 EUR;Envío gratis;Vendidos  29 jun 2021Artículo vendido;desde Estados Unidos;
Bubble Bobble parte 2 (Japanese title: Bubble Bobble Junior) GameBoy boxed-d0628;110,51 EUR;+ 12,75 EUR de envío;Vendidos  28 jun 2021Artículo vendido;desde Japón;
Cartucho De Juego Bubble Bobble NES (sólo) probado;14,04 EUR;+ 16,68 EUR de envío estimado;Vendidos  29 jun 2021Artículo vendido;desde Reino Unido;
Bubble Bobble Hit Squad Amiga Caja Grande Juego Completo Raro Retro Gaming ￼;11,69 EUR;+ 20,39 EUR de envío estimado;Vendidos  23 jul 2021Artículo vendido;desde Reino Unido;
Taito Bubble Bobble IBM-PC XT en Tandy 1000 1989 juego de video, 5.25";117,00 EUR;+ 5,85 EUR de envío;Vendidos  7 sep 2021Artículo vendido;desde Reino Unido;
Bubble Bobble Revolución Nintendo ds juego;8,18 EUR;+ 18,33 EUR de envío estimado;Vendidos  18 jul 2021Artículo vendido;desde Reino Unido;
Sega Master Sistema Juego-Bubble Bobble-Raro en Caja sin boxart;15,22 EUR;+ 20,45 EUR de envío estimado;Vendidos  9 ago 2021Artículo vendido;desde Reino Unido;
Bubble Bobble 4 Amigos Nintendo Switch Juego Nuevo Sellado Ganga post rápido;35,12 EUR;+ 19,41 EUR de envío estimado;Vendidos  26 jun 2021Artículo vendido;desde Reino Unido;
Bubble Bobble Revolución-Nintendo DS Juego-Completo con Manual;8,78 EUR;+ 16,59 EUR de envío estimado;Vendidos  5 sep 2021Artículo vendido;desde Reino Unido;
Bubble Bobble NES Nintendo Entertainment Sistema Juego Carro PAL UKV un;25,74 EUR;+ 19,19 EUR de envío estimado;Vendidos  27 ago 2021Artículo vendido;desde Reino Unido;
Bubble Bobble 4 amigos tbib el barón está de vuelta Nintendo Switch Juego;31,20 EUR;+ 17,00 EUR de envío estimado;Vendidos  1 sep 2021Artículo vendido;desde Reino Unido;
Bubble Bobble también con arco iris Islas-PlayStation 1-PS1 Juego de Lectura;20,83 EUR;+ 4,24 EUR de envío;Vendidos  11 sep 2021Artículo vendido;desde Lituania;
Bubble Bobble 4 amigos-Edición Especial (Nintendo Switch Juego, 2019) en muy buena condición UK;58,52 EUR;+ 21,59 EUR de envío estimado;Vendidos  25 jun 2021Artículo vendido;desde Reino Unido;
Bubble Bobble PS1 Playstation 1 video juego Nr Perfecto estado UK release;23,35 EUR;+ 16,86 EUR de envío estimado;Vendidos  11 jul 2021Artículo vendido;desde Reino Unido;
Commodore 64 Juego Bubble Bobble probado en muy buena condición el hit Squad;5,84 EUR;+ 18,41 EUR de envío estimado;Vendidos  2 sep 2021Artículo vendido;desde Reino Unido;
Nintendo NES en Caja Juego-Arco iris Islas Bubble Bobble 2;76,03 EUR;+ 22,53 EUR de envío estimado;Vendidos  18 ago 2021Artículo vendido;desde Reino Unido;
Bubble Bobble Revolución Nintendo DS Video Juego + Manual;10,52 EUR;+ 18,41 EUR de envío estimado;Vendidos  16 sep 2021Artículo vendido;desde Reino Unido;
Bubble Bobble Sinclair ZX Spectrum Cassette Tape Firebird Big Case Taito Game;29,99 EUR;+ 19,00 EUR de envío;Vendidos  7 jul 2021Artículo vendido;desde Italia;
Bubble Bobble Double Shot Ds juego/cartucho de juego solamente;8,95 EUR;+ 4,68 EUR de envío;Vendidos  6 sep 2021Artículo vendido;desde Reino Unido;
Bubble Bobble Sega Saturn Juegos De Consola De Video Juego Completo con Manual;29,25 EUR;+ 19,29 EUR de envío estimado;Vendidos  13 sep 2021Artículo vendido;desde Reino Unido;
Bubble Bobble también con arco iris Islas-PlayStation 1-PS1 Juego;26,86 EUR;+ 9,36 EUR de envío;Vendidos  29 jul 2021Artículo vendido;desde Reino Unido;
Bubble Bobble Revolución NINTENDO DS Juego UK PAL funciona todo DS DSI XL 2DS 3DS;11,40 EUR;+ 20,50 EUR de envío estimado;Vendidos  12 sep 2021Artículo vendido;desde Reino Unido;
PSP juego, Bubble Bobble evolución, Sony Playstation Portable, Con Manual;7,01 EUR;+ 16,55 EUR de envío estimado;Vendidos  21 ago 2021Artículo vendido;desde Reino Unido;
Taito Bubble Bobble Promo Cassette COMMODORE 64/ZX SPECTRUM juego;3,50 EUR;+ 17,84 EUR de envío estimado;Vendidos  6 jul 2021Artículo vendido;desde Reino Unido;
Nintendo DS Juego Bubble Bobble Double Shot-Completo con manual en muy buena condición Gratis Reino Unido Pp;15,16 EUR;+ 16,70 EUR de envío estimado;Vendidos  14 jul 2021Artículo vendido;desde Reino Unido;
Super Nintendo NES Juego en Caja-arco iris Islas Bubble Bobble 2-completa;54,96 EUR;+ 22,18 EUR de envío;Vendidos  14 jul 2021Artículo vendido;desde Reino Unido;
En Caja con Manual Sega Saturn Bubble Bobble con arco iris Islas Juego (PAL);23,40 EUR;+ 20,60 EUR de envío estimado;Vendidos  16 jul 2021Artículo vendido;desde Reino Unido;
Bubble Bobble Double Shot-Nintendo DS Juego-probado y trabajo LIBRE P&P!;9,35 EUR;+ 16,60 EUR de envío estimado;Vendidos  7 jul 2021Artículo vendido;desde Reino Unido;
Nintendo NES Juego-Bubble Bobble;29,26 EUR;+ 16,96 EUR de envío estimado;Vendidos  24 jul 2021Artículo vendido;desde Reino Unido;
