Bubble Bobble, Nintendo Game Boy, Pal-Esp;19,95 EUR;Envío no especificado;desde España;
Bubble Bobble VIEJO & NUEVO-Gameboy Advance 💯% original juego probado;14,05 EUR;+ 16,68 EUR de envío estimado;desde Reino Unido;
Bubble Bobble VIEJO & NUEVO Nintendo Game Boy Advance GBA Juego en Caja Original Taito;46,76 EUR;+ 21,37 EUR de envío estimado;desde Reino Unido;
Bubble Bobble Old & New Game Boy Advance Japan Game New Sealed Ex RARE GBA;999,99 EUR;Envío internacional gratis;desde Italia;
Zelda vínculos despertar, Bubble Bobble, Metroid. Genuino Gameboy. GB. juego Boy;70,23 EUR;+ 26,17 EUR de envío estimado;desde Reino Unido;
Bubble Bobble VIEJO & NUEVO Nintendo Game Boy Advance GBA Juego en Caja Original Taito;39,79 EUR;+ 17,15 EUR de envío estimado;desde Reino Unido;
Nintendo Game Boy Bubble Bobble USA Très Bon état;24,90 EUR;+ 11,98 EUR de envío;desde Francia;
Bubble Bobble Nintendo Gameboy Suelto Cartucho sólo nos liberación Taito;14,04 EUR;+ 19,55 EUR de envío estimado;desde Reino Unido;
Classic Bubble Bobble Nintendo Game Boy Color Console Complete Good Condition;79,99 EUR;+ 26,00 EUR de envío;desde Italia;
Bubble Bobble Gameboy;21,06 EUR;+ 17,97 EUR de envío estimado;desde Reino Unido;
Bubble Bobble Nintendo Game Boy Suelto Cartucho sólo japonés JPN Raro Taito;23,40 EUR;+ 19,67 EUR de envío estimado;desde Reino Unido;
Bubble Bobble Gameboy Juego Original;23,41 EUR;+ 11,71 EUR de envío;desde Reino Unido;
Bubble Bobble VIEJO & NUEVO Nintendo Gameboy Advance GBA SP * 497;35,11 EUR;+ 11,71 EUR de envío;desde Reino Unido;
Rarissimo gioco per Nintendo game boy Bubble Bobble con custodia da collezione;39,99 EUR;+ 12,00 EUR de envío;desde Italia;
Bubble Bobble Nintendo GAMEBOY Juego Original Genuino UKV Excelente Estado;23,41 EUR;+ 19,00 EUR de envío estimado;desde Reino Unido;
Japonés Nintendo Gameboy Juego-DMG-B2A - Bubble Bobble;35,06 EUR;+ 17,07 EUR de envío estimado;desde Reino Unido;
Bubble Bobble Nintendo Gameboy Juego en Caja Con Manual;93,65 EUR;+ 26,95 EUR de envío estimado;desde Reino Unido;
Bubble Bobble viejos y nuevos-Gameboy Advance-GBA-Completo En Caja-Completo;52,66 EUR;+ 11,47 EUR de envío;desde Reino Unido;
Nintendo Gameboy DMG-B2A - Bubble Bobble MADE IN JAPAN;25,00 EUR;+ 12,00 EUR de envío;desde España;
Bubble Bobble Game boy PAL España Cartucho Envio Combinado ;35,06 EUR;Envío no especificado;desde España;
Bubble Bobble Nintendo Game Boy Versione Ita Perfetto Raro;39,90 EUR;Envío no especificado;desde Italia;
Gameboy Advance Bubble Bobble viejos y nuevos Solo Manual;10,48 EUR;Envío no especificado;desde Reino Unido;
Gameboy Bubble Bobble Solo Manual;11,69 EUR;Envío no especificado;desde Reino Unido;
Gameboy Color Clásico Bubble Bobble Solo Manual;8,18 EUR;Envío no especificado;desde Reino Unido;
