Kwirk Nintendo Gameboy juego bien Game Boy gb bien;8,90 EUR;Envío no especificado;Vendidos  26 ago 2021Artículo vendido;desde Alemania;
Kwirk-Game Boy-Módulo de juego-Nintendo-Game Boy-buen estado;10,29 EUR;Envío no especificado;Vendidos  26 ago 2021Artículo vendido;desde Alemania;
Nintendo Game Boy Kwirk ESP Bon état;7,90 EUR;+ 11,98 EUR de envío;Vendidos  25 ago 2021Artículo vendido;desde Francia;
Kwirk GameBoy Original Nintendo Cartucho PAL;18,73 EUR;+ 16,78 EUR de envío estimado;Vendidos  5 ago 2021Artículo vendido;desde Reino Unido;
Kwirk-Nintendo Gameboy módulo-DMG-ap-noe - inglés;2,99 EUR;Envío no especificado;Vendidos  24 jul 2021Artículo vendido;desde Alemania;
Kwirk-Game Boy-Módulo de juego-Nintendo-Game Boy-muy buen estado;10,69 EUR;Envío no especificado;Vendidos  3 jul 2021Artículo vendido;desde Alemania;
Nintendo Game Boy Kwirk ✨ Rare FAH Version ✨;69,95 EUR;+ 32,30 EUR de envío;Vendidos  10 jul 2021Artículo vendido;desde Países Bajos;
Nintendo Game Boy Game Manual: Kwirk  He's A-Maze-Ing!;6,67 EUR;+ 9,35 EUR de envío;Vendidos  30 jun 2021Artículo vendido;desde Canadá;
