Metal Gear Solid 2000 Nintendo Game Boy Color PAL NUEVO PRECINTADO UKG no Vga 85% casi como nuevo!;409,95 EUR;+ 41,00 EUR de envío;desde Reino Unido;
Metal Gear Solid (Game Boy Color) Pal probado;58,51 EUR;+ 17,50 EUR de envío estimado;desde Reino Unido;
Metal Gear Solid Nintendo Gameboy Color Advance Cartucho De Juego! Original!;52,70 EUR;+ 18,57 EUR de envío estimado;desde Reino Unido;
★ Game Boy Color Metal Gear Solid  ★ PAL;49,99 EUR;Envío no especificado;desde España;
Game Boy Color Metal Gear Solid: Ghost Babel (Inglés) (English);240,00 EUR;Envío no especificado;desde España;
Metal Gear Solid-Game Boy Color-módulo-Nintendo-GameBoy GBC impecable;94,99 EUR;Envío no especificado;desde Alemania;
Metal Gear Solid Juego Boy Color (bloqueo-BMGE-EE. UU.);210,84 EUR;+ 34,51 EUR de envío estimado;desde Reino Unido;
Metal Gear Solid 2000 Nintendo Game Boy Color PAL NUEVO PRECINTADO UKG no Vga 85% casi como nuevo!;409,95 EUR;+ 41,00 EUR de envío;desde Reino Unido;
Nintendo Gameboy Color ~ Metal Gear Solid ~ cartucho sólo;58,55 EUR;+ 23,43 EUR de envío;desde Reino Unido;
Nintendo 64 Game Boy Color Big n soluciones podréis Metal Gear Solid GBC Bomberman;24,99 EUR;+ 16,99 EUR de envío;desde Alemania;
Metal Gear Solid Game Boy Color GBC;99,95 EUR;Envío no especificado;desde España;
Metal Gear Solid, Nintendo Game Boy Color, Pal-Eur;149,95 EUR;Envío no especificado;desde España;
Metal Gear Solid Nintendo Game Boy Color Complete w/ Box and Manual Konami;202,88 EUR;+ 17,33 EUR de envío;desde Canadá;
Nuevo anuncioMetal Gear Solid (Nintendo Game Boy Color, 2000) Caja Y Manual Solamente!;170,92 EUR;+ 6,83 EUR de envío;desde Estados Unidos;
Metal Gear Solid Juego Boy Color P 1 clasificación 85 * SIN PRECIO DE RESERVA * Ver. BR Raro;149,14 EUR;Envío gratis;desde Estados Unidos;
Nuevo anuncioMetal Gear Solid Nintendo Gameboy Color MGS Game Boy Color Game Boy Kojima Raro solo carro;123,93 EUR;+ 3,68 EUR de envío;desde Estados Unidos;
Metal Gear Solid (Nintendo Game Boy Color, 2000) Con Caja!;128,20 EUR;Envío gratis;desde Estados Unidos;
Metal Gear Solid (Game Boy Color, 2000) - Probado Y Ahorra;70,89 EUR;+ 3,37 EUR de envío;desde Estados Unidos;
Metal Gear Solid Nintendo Game Boy Color * Auténtico y ahorra *;119,63 EUR;Envío gratis;desde Estados Unidos;
Metal Gear Solid Colección * Sellado * NES IBM Game Boy Color PS2 PS3 HD 1 2 3 4;25.639,93 EUR;Envío gratis;desde Estados Unidos;
Metal Gear Solid Nintendo Game Boy Color. viene Con Estuche Y Manuales;235,03 EUR;+ 4,27 EUR de envío;desde Estados Unidos;
Metal Gear Solid Nintendo Game Boy Color GBC 2000 Nuevo Sellado apnea clasificados 8.0 A +;1.281,99 EUR;+ 6,84 EUR de envío;desde Estados Unidos;
Metal Gear Solid (Nintendo Game Boy Color, 2000) Completo En Caja!!!;213,67 EUR;+ 4,19 EUR de envío;desde Estados Unidos;
Metal Gear Solid (Nintendo Game Boy Color, 2000) auténtico y completo!;286,31 EUR;+ 7,26 EUR de envío;desde Estados Unidos;
Metal Gear Solid (Nintendo Game Boy Color, 2000) Raro KONAMI Clásico, Completa!;427,32 EUR;Envío gratis;desde Estados Unidos;
Metal Gear Solid (Game Boy Color GBC, 2000) * Carro Y Manual * Auténtico probado!;168,36 EUR;Envío gratis;desde Estados Unidos;
Metal Gear Solid Juego Boy Color Nintendo Sellado Brasil brasileño * reproduce Inglés *;205,11 EUR;+ 3,80 EUR de envío;desde Estados Unidos;
Sellado de fábrica Metal Gear Solid (Nintendo Game Boy Color, 2000) Muy raras;662,36 EUR;+ 3,80 EUR de envío;desde Estados Unidos;
Metal Gear Solid (Game Boy Color) with box, manual.;270,51 EUR;+ 12,63 EUR de envío;desde Canadá;
Metal Gear Solid Nintendo Game Boy Color;94,68 EUR;+ 13,53 EUR de envío;desde Canadá;
Game Boy Color Metal Gear Solid Folleto de instrucciones/manual;38,46 EUR;Envío gratis;desde Estados Unidos;
Metal Gear Solid Game Boy Color Gbc 2000 Vintage Poster Promo ad Art Print;11,92 EUR;Envío gratis;desde Estados Unidos;
Nuevo anuncio* versión previa * 1 Game Boy Color Metal Gear Solid Carro ** ** solo Etiqueta de-BMGE-USA;15,18 EUR;Envío gratis;desde Estados Unidos;
Metal Gear Solid Print Ad/Game Boy Color de arte cartel;12,81 EUR;Envío gratis;desde Estados Unidos;
Metal Gear Solid-Original Nintendo GameBoy Color Juego;169,21 EUR;+ 2,52 EUR de envío;desde Estados Unidos;
Metal Gear Solid-auténtico-Nintendo Game Boy Color-Solo Manual!;105,23 EUR;Envío gratis;desde Estados Unidos;
Metal Gear Solid 2000 Nintendo Game Boy Color PAL NUEVO PRECINTADO Brasil;299,13 EUR;+ 17,09 EUR de envío;desde Brasil;
Metal Gear Solid (Game Boy Color, 2000) Raro Folleto De Instrucciones!;85,46 EUR;Envío gratis;desde Estados Unidos;
Metal Gear Solid (Nintendo Game Boy Color, 2000) sólo juego;68,37 EUR;+ 4,06 EUR de envío;desde Estados Unidos;
Metal Gear Solid-NINTENDO GAME BOY COLOR GBC-Solo Manual;76,91 EUR;+ 7,67 EUR de envío;desde Estados Unidos;
Metal Gear Solid Gameboy Color Complete CIB GBC Authentic;405,76 EUR;+ 12,85 EUR de envío;desde Canadá;
Metal Gear Solid Ghost Babel Gameboy Color Soft Konami Caja con Instrucciones;127,17 EUR;+ 11,03 EUR de envío;desde Japón;
Game Boy Color: Metal Gear Solid Brazilian versión nuevo selead;427,33 EUR;+ 42,73 EUR de envío;desde Brasil;
Metal Gear Solid (Gameboy Color) - Sin Caja;41,02 EUR;+ 4,19 EUR de envío;desde Estados Unidos;
Metal Gear Solid GAMEBOY Color versión japonesa;147,35 EUR;+ 17,09 EUR de envío;desde Japón;
Metal Gear Solid Nintendo Gameboy Color/Colour game oz386;87,11 EUR;+ 16,81 EUR de envío;desde Australia;
Metal Gear Solid Nintendo GameBoy Color Gbc Nueva apnea no Vga Konami Raro;1.025,59 EUR;Envío internacional gratis;desde Kuwait;
Metal Gear Solid Nintendo Gameboy Color/Colour game oz385;87,11 EUR;+ 16,81 EUR de envío;desde Australia;
Metal Gear Solid Gameboy Color Edición Coleccionista;102,56 EUR;+ 3,42 EUR de envío;desde Estados Unidos;
Metal Gear Solid Nintendo Gameboy Color/coulor game Oz117;80,88 EUR;+ 16,81 EUR de envío;desde Australia;
GameBoy Color - Metal Gear: Ghost Babel / Metal Gear Solid Japan;57,26 EUR;+ 18,67 EUR de envío;desde Australia;
Game Boy Color GBC Game CASE ONLY - Metal Gear Solid;8,68 EUR;+ 17,12 EUR de envío;desde Australia;
Metal Gear Solid Game Boy Pal;13,50 EUR;+ 13,00 EUR de envío;desde España;
Metal Gear Solid 2: sustancia de vídeo juego para Microsoft Xbox Pal probado;5,84 EUR;+ 16,55 EUR de envío estimado;desde Reino Unido;
Metal Gear Solid 2 hijos de la libertad Platinum Edition Playstation 2, 2001 Juego;10,52 EUR;+ 16,63 EUR de envío estimado;desde Reino Unido;
Nuevo anuncioMetal Gear Solid-The Twin Snakes (Nintendo GameCube Juego) PAL con manual (L2);46,84 EUR;+ 31,52 EUR de envío estimado;desde Reino Unido;
PS2 Metal Gear Solid 2 hijos de la libertad, Reino Unido PAL, Sony Sellado de fábrica, imagen Temp;105,41 EUR;+ 23,07 EUR de envío estimado;desde Reino Unido;
Raro/RETRO NINTENDO GAMECUBE, Metal Gear Solid-The Twin Snakes juego/Gaming 99P;42,17 EUR;+ 23,37 EUR de envío;