Nintendo Gameboy Color Mario Tennis Original Carro;29,14 EUR;+ 11,66 EUR de envío;Vendidos  20 sep 2021Artículo vendido;desde Reino Unido;
Nintendo Gameboy Color-Mario Tennis;17,43 EUR;+ 16,68 EUR de envío estimado;Vendidos  18 sep 2021Artículo vendido;desde Reino Unido;
Gb-Tennis para Nintendo GameBoy;7,95 EUR;+ 6,50 EUR de envío;Vendidos  12 sep 2021Artículo vendido;desde Alemania;
Cartucho De Juego Mario Tennis Nintendo Game Boy Color Colour Gbc versión japonesa;9,32 EUR;+ 18,67 EUR de envío estimado;Vendidos  10 sep 2021Artículo vendido;desde Reino Unido;
Mario Power Tennis - Nintendo game boy advance;17,90 EUR;Envío no especificado;Vendidos  8 sep 2021Artículo vendido;desde Francia;
The Prince of Tennis : Aim at the Victory Game Boy Advance GBA JAP Japan complet;9,90 EUR;Envío no especificado;Vendidos  4 sep 2021Artículo vendido;desde Francia;
Nintendo Game Boy Tennis GameBoy  Vers. FAH;5,00 EUR;Envío no especificado;Vendidos  2 sep 2021Artículo vendido;desde Francia;
