Mario Power Tennis GBA Game Boy Advance PAL ESPAÑOL NUEVO PRECINTADO;149,95 EUR;+ 19,95 EUR de envío;desde España;
Nintendo Game Boy avanzada GBA Mario Power Tennis Juego en Caja Y Manual;32,52 EUR;+ 16,92 EUR de envío estimado;desde Reino Unido;
Mario Tennis Nintendo Game Boy Color Version EUR en Boite;39,99 EUR;+ 12,95 EUR de envío;desde Francia;
Nintendo Game Boy Color juego Mario Tennis con embalaje original y guía EUR;64,90 EUR;+ 8,99 EUR de envío;desde Alemania;
Nintendo Game Boy Advance, Mario Power Tennis VGA oro 85+ nm +;549,00 EUR;+ 55,00 EUR de envío;desde Alemania;
Jimmy Connors Tennis Nintendo Game Boy Ubisoft Gameboy Videogioco Sport 90s raro;62,00 EUR;+ 15,00 EUR de envío;desde Italia;
✨ Tennis 1st Version Game Boy 1989 Nintendo Japan Complet Boxed GB DMG-TNA ✨;24,90 EUR;+ 28,10 EUR de envío;desde Francia;
Mario Tennis En Caja-Nintendo Gameboy Color;37,22 EUR;+ 17,01 EUR de envío estimado;desde Reino Unido;
✨ Mario Tennis GB  New Game Boy Color 2001 Nintendo Boxed CGB-BM8J-JPN ✨;23,90 EUR;+ 28,10 EUR de envío;desde Francia;
Jeu Nintendo Game Boy Color - Snoopy Tennis  - FAH - Loose;6,90 EUR;+ 6,70 EUR de envío;desde Francia;
Nintendo Game Boy Tennis EUR Très Bon état;9,90 EUR;+ 14,98 EUR de envío;desde Francia;
Mario Power Tennis-solo Carro-Original-Juego Boy Advance-GBA;19,77 EUR;+ 16,69 EUR de envío estimado;desde Reino Unido;
Nintendo Game Boy Color Mario Smash Tennis JAP Très Bon état;6,90 EUR;+ 11,98 EUR de envío;desde Francia;
Mario Tennis-Nintendo Virtual Chico-con Caja-Japón;34,90 EUR;+ 19,78 EUR de envío;desde Japón;
Nintendo Game Boy Tennis UKV Très Bon état;4,90 EUR;+ 11,98 EUR de envío;desde Francia;
Mario Power Tennis GBA Game Boy Advance juego nuevo New Sealed;149,99 EUR;+ 8,00 EUR de envío;desde Alemania;
Nuevo anuncioNintendo Gameboy Color - Mario Tennis - Complet - Version Japonaise ;29,90 EUR;+ 5,00 EUR de envío;desde Francia;
Tennis Masters Series (Nintendo Game Boy Advance GBA 2003) ~ ~ En Caja;20,89 EUR;+ 16,71 EUR de envío estimado;desde Reino Unido;
Nintendo Game Boy Advance GBA - Mario Power Tennis - PAL - EUR;19,99 EUR;+ 5,00 EUR de envío;desde Francia;
Mario Power Tennis para Nintendo Gameboy Advance GBA-Nuevo/Sellado;116,30 EUR;+ 12,80 EUR de envío;desde Reino Unido;
Nintendo Game Boy Advance GBA - Droopy's Tennis Open - PAL - EUR;5,99 EUR;+ 5,00 EUR de envío;desde Francia;
Nintendo Game Boy Advance Droopy's Tennis Open EUR Très Bon état #1;6,90 EUR;+ 11,98 EUR de envío;desde Francia;
AllStar Tennis 2000 Nintendo Game Boy;9,30 EUR;+ 16,50 EUR de envío estimado;desde Reino Unido;
