Nintendo Gameboy Color Heroes of Might and Magic II RPG en caja con instrucciones;81,40 EUR;+ 22,49 EUR de envío estimado;desde Reino Unido;
Heroes of Might and Magic II 2 Gameboy Colour Cartucho gwo;23,25 EUR;Envío no especificado;desde Reino Unido;
Heroes of Might and Magic II 2 Nintendo Game Boy Color Auténtico Carro GBA;38,34 EUR;+ 3,79 EUR de envío;desde Estados Unidos;
Heroes of Might and Magic II 2 (Nintendo Gameboy Color) probadas Ahorra;44,27 EUR;+ 3,37 EUR de envío;desde Estados Unidos;
Heroes of Might and Magic II-New World Computing-PC Big Box;79,00 EUR;+ 37,00 EUR de envío;desde Alemania;
Heroes of Might and Magic II Caja Grande sólo manual y actualización Gráfico;34,88 EUR;+ 16,27 EUR de envío;desde Reino Unido;
Heroes of Might and Magic III-Complete [Ubisoft Exclusive] [video game];68,90 EUR;+ 7,50 EUR de envío;desde Alemania;
Heroes of Might and Magic III Homam 3 Pc Juego en muy buena condición;11,57 EUR;+ 9,30 EUR de envío;desde Reino Unido;
Heroes of Might and Magic III Juego de Pc, Perfecto Estado;13,94 EUR;+ 16,57 EUR de envío estimado;desde Reino Unido;
Heroes of Might and Magic II, Juego PC, Versión Española, Estrategia por turnos.;7,95 EUR;+ 14,00 EUR de envío;desde España;
Heroes of Might and Magic II y IV;34,88 EUR;+ 18,61 EUR de envío;desde Reino Unido;
