Heroes of Might and Magic II 2 Gameboy Colour Cartucho gwo;23,41 EUR;+ 16,87 EUR de envío estimado;desde Reino Unido;
Nintendo Gameboy Color Heroes of Might and Magic II RPG en caja con instrucciones;81,98 EUR;+ 22,65 EUR de envío estimado;desde Reino Unido;
Heroes of Might and Magic II 2 Nintendo Game Boy Color Auténtico Carro GBA;38,45 EUR;+ 3,55 EUR de envío;desde Estados Unidos;
Heroes of Might and Magic II 2 (Nintendo Gameboy Color) probadas Ahorra;44,40 EUR;+ 3,38 EUR de envío;desde Estados Unidos;
Heroes of Might and Magic II-New World Computing-PC Big Box;79,00 EUR;+ 37,00 EUR de envío;desde Alemania;
Heroes of Might and Magic II Caja Grande sólo manual y actualización Gráfico;35,13 EUR;+ 16,39 EUR de envío;desde Reino Unido;
Heroes of Might and Magic III Homam 3 Pc Juego en muy buena condición;11,65 EUR;+ 9,37 EUR de envío;desde Reino Unido;
Heroes of Might and Magic III-Complete [Ubisoft Exclusive] [video game];68,90 EUR;+ 7,50 EUR de envío;desde Alemania;
Heroes of Might and Magic III Juego de Pc, Perfecto Estado;14,04 EUR;+ 16,69 EUR de envío estimado;desde Reino Unido;
Heroes of Might and Magic II, Juego PC, Versión Española, Estrategia por turnos.;7,95 EUR;+ 14,00 EUR de envío;desde España;
Heroes of Might and Magic II y IV;35,13 EUR;+ 18,74 EUR de envío;desde Reino Unido;
