Pinball Dreams Notice - Manuel - Instruction Booklet Game Boy UKV ;4,00 EUR;Envío internacional gratis;Vendidos  15 sep 2021Artículo vendido;desde Francia;
Pinball Dreams Cartucho sólo PAL (Nintendo Game Boy, Color Y Advance 1993);4,57 EUR;+ 18,86 EUR de envío estimado;Vendidos  6 sep 2021Artículo vendido;desde Reino Unido;
Pinball Dreams Game Boy UKV ;5,00 EUR;Envío internacional gratis;Vendidos  6 jul 2021Artículo vendido;desde Francia;
Pinball Dreams (Nintendo Game Boy) juego y caso de fabricante de equipos Originales Envíos Gratis;10,65 EUR;Envío gratis;Vendidos  27 ago 2021Artículo vendido;desde Estados Unidos;
Pinball Dreams (Sólo juego Nintendo Game Boy);11,07 EUR;Envío gratis;Vendidos  16 ago 2021Artículo vendido;desde Estados Unidos;
Juego de Pinball Dreams Nintendo Original Boy-limpiado & probado-Envío Gratuito;10,18 EUR;Envío gratis;Vendidos  29 jul 2021Artículo vendido;desde Estados Unidos;
Juego de Pinball Dreams, con Funda Protectora, Nintendo Gameboy;11,07 EUR;Envío gratis;Vendidos  12 jul 2021Artículo vendido;desde Estados Unidos;
Pre-owned Nintendo Game Boy Lote de 5 Juegos: Tetris, peligro!, Pinball Dreams;17,03 EUR;Envío gratis;Vendidos  7 jul 2021Artículo vendido;desde Estados Unidos;
Pinball Dreams (Nintendo Game Boy);5,10 EUR;+ 4,35 EUR de envío;Vendidos  28 jun 2021Artículo vendido;desde Estados Unidos;
Pinball Dreams (Nintendo Game Boy) cartucho sólo-Envío Gratuito;11,07 EUR;Envío gratis;Vendidos  27 jun 2021Artículo vendido;desde Estados Unidos;
Juego de Pinball Dreams para Commodore Amiga Computer;15,33 EUR;+ 17,04 EUR de envío;Vendidos  1 ago 2021Artículo vendido;desde Grecia;
