Elevator Action - NOE - Nintendo Gameboy;13,00 EUR;+ 25,00 EUR de envío;Vendidos  19 sep 2021Artículo vendido;desde Países Bajos;
Elevator Action Gameboy OVP;90,00 EUR;Envío no especificado;Vendidos  26 ago 2021Artículo vendido;desde Alemania;
Nintendo Game Boy Color Elevator Action EUR Très Bon état;12,90 EUR;+ 11,98 EUR de envío;Vendidos  26 ago 2021Artículo vendido;desde Francia;
Elevator Action Game Boy GB cartuccia Nintendo PAL ITA Testato GameBoy;12,90 EUR;+ 25,00 EUR de envío;Vendidos  2 ago 2021Artículo vendido;desde Italia;
Game Boy Gameboy Elevator Action cib Boxed;82,12 EUR;+ 19,30 EUR de envío;Vendidos  22 jul 2021Artículo vendido;desde Países Bajos;
Elevator Action Nintendo Gameboy módulo instrucciones Taito estado de coleccionista;22,70 EUR;Envío no especificado;Vendidos  15 jul 2021Artículo vendido;desde Alemania;
Elevator Action (Nintendo Game Boy). CIB GB NICE;39,92 EUR;+ 8,64 EUR de envío;Vendidos  11 ago 2021Artículo vendido;desde Canadá;
