** Elevator Action ** GBC Game Boy Color-Nintendo-Arcade hit-cib pal OVP;139,00 EUR;+ 25,00 EUR de envío;desde Alemania;
Elevator Action old & New GBA Nintendo Game Boy Advance jp New!!!;1.450,00 EUR;+ 33,00 EUR de envío;desde Suiza;
Nintendo Gameboy juego-Elevator Action-Embalaje original-Top-Pal;259,90 EUR;Envío no especificado;desde Alemania;
Elevator Action Nintendo Gameboy juego Game Boy ascensor bien;22,90 EUR;Envío no especificado;desde Alemania;
Elevator Action, japón Import (Nintendo Gameboy) GB juego;55,45 EUR;Envío no especificado;desde Alemania;
Elevator Action Gameboy Classic cómo jugar instruction cuadernillo Noe;6,90 EUR;Envío no especificado;desde Alemania;
Elevator Action (Nintendo Original GameBoy) [Brand New & Factory Sealed];146,15 EUR;+ 7,94 EUR de envío;desde Canadá;
Elevator Action (Nintendo Game Boy, 1983 Gameboy) -Cart Only;15,94 EUR;+ 3,99 EUR de envío;desde Canadá;
Elevator Action Nintendo Gameboy *No Manual* Boxed;123,17 EUR;+ 11,10 EUR de envío;desde Australia;
Elevator Action - NOE - Nintendo Gameboy;109,00 EUR;+ 25,00 EUR de envío;desde Países Bajos;
Elevator Action Game Boy AC GC PAL;21,99 EUR a 25,72 EUR;+ 12,32 EUR de envío;desde Australia;
Elevator Action - Nintendo GameBoy Color - GBC;55,96 EUR;+ 19,95 EUR de envío;desde Países Bajos;
Elevator Action Gameboy + Free Shipping!;26,55 EUR;Envío internacional gratis;desde Canadá;
Elevator Action (Nintendo Game Boy) Authentic, Excellent Video Game RARE;25,24 EUR;+ 13,29 EUR de envío;desde Canadá;
