Juego Jordan vs Bird Gameboy;11,71 EUR;+ 16,66 EUR de envío estimado;Vendidos  13 sep 2021Artículo vendido;desde Reino Unido;
Jordan vs Bird Para El Nintendo Game Boy cartucho sólo;4,67 EUR;+ 16,53 EUR de envío estimado;Vendidos  28 ago 2021Artículo vendido;desde Reino Unido;
Nintendo Game Boy Jordan vs Bird ITA Très Bon état;7,90 EUR;+ 11,98 EUR de envío;Vendidos  27 jun 2021Artículo vendido;desde Francia;
Jordan vs Bird uno a uno (Nintendo NES 1989) Completo Caja Manual Completo En Caja Auténtica;38,30 EUR;Envío gratis;Vendidos  13 sep 2021Artículo vendido;desde Estados Unidos;
Jordan vs Bird (Nintendo NES) solo carro justo;5,61 EUR;Envío gratis;Vendidos  31 ago 2021Artículo vendido;desde Estados Unidos;
Lote de 4 juegos de juego Boy, Caesars Palace, rueda de la fortuna, Jordan vs Bird & Si;15,34 EUR;+ 2,72 EUR de envío;Vendidos  20 ago 2021Artículo vendido;desde Estados Unidos;
Jordan vs Bird para NES (Nintendo Entertainment System) (ST7041683);8,51 EUR;Envío gratis;Vendidos  15 ago 2021Artículo vendido;desde Estados Unidos;
Jordan vs Bird (Nintendo NES) Completo en Caja Buen Estado Abierto;85,19 EUR;+ 8,52 EUR de envío;Vendidos  13 ago 2021Artículo vendido;desde Estados Unidos;
.01 puja inicial Jordan vs Bird uno en NINTENDO sistema Auténtico Juego NES HQ;4,26 EUR;+ 3,20 EUR de envío;Vendidos  29 jul 2021Artículo vendido;desde Estados Unidos;
GB -- uno a uno Jordan vs Bird -- GAME BOY, Japón Juego Nintendo. 13534;3,83 EUR;+ 2,13 EUR de envío;Vendidos  26 jul 2021Artículo vendido;desde Japón;
Michael Jordan vs Bird NES 1989 uno en Cartucho MB Probado Funcionando One Nintendo;5,09 EUR;+ 4,17 EUR de envío;Vendidos  25 jul 2021Artículo vendido;desde Estados Unidos;
Jordan vs Bird Gameboy manual;6,77 EUR;Envío gratis;Vendidos  21 jul 2021Artículo vendido;desde Estados Unidos;
Jordan vs Bird uno a uno NINTENDO GAMEBOY Juego Solamente;8,51 EUR;+ 2,72 EUR de envío;Vendidos  21 jul 2021Artículo vendido;desde Estados Unidos;
Lote 1988 Portátil Tiger Electronics Paper Boy y Jordan vs Bird;21,29 EUR;+ 6,56 EUR de envío;Vendidos  17 jul 2021Artículo vendido;desde Estados Unidos;
.01 puja inicial Jordan vs Bird uno en NINTENDO sistema Auténtico Juego NES HQ;7,24 EUR;+ 3,20 EUR de envío;Vendidos  13 jul 2021Artículo vendido;desde Estados Unidos;
Jordan vs Bird: uno contra One Nintendo Gameboy Cartucho en Caja 🔥 🔥;68,16 EUR;+ 4,43 EUR de envío;Vendidos  12 jul 2021Artículo vendido;desde Estados Unidos;
.01 puja inicial Jordan vs Bird uno en NINTENDO sistema Auténtico Juego NES HQ;12,35 EUR;+ 3,20 EUR de envío;Vendidos  5 jul 2021Artículo vendido;desde Estados Unidos;
Jordan vs Bird Completo en Caja Completo En Caja Manual NES auténticas (Nintendo) probadas Raro;51,12 EUR;+ 4,35 EUR de envío;Vendidos  29 jun 2021Artículo vendido;desde Estados Unidos;
Jordan vs Bird uno a uno (Nintendo, NES) Completo en Caja-Cartucho de condición de menta en caja;95,85 EUR;+ 8,51 EUR de envío;Vendidos  28 jun 2021Artículo vendido;desde Estados Unidos;
SEGA Mega Drive Jordan vs Bird Completa;4,92 EUR;+ 34,86 EUR de envío estimado;Vendidos  11 sep 2021Artículo vendido;desde Reino Unido;
