Spud's Adventure artbox for game boy USA ,art box only.NO GAME,no manual;26,90 EUR;Envío no especificado;desde Italia;
Cartucho Genuino Spud's Adventure Nintendo Gameboy Original 1991 GB Atlus;304,35 EUR;+ 10,54 EUR de envío;desde Reino Unido;
Nintendo Gameboy Spud's Adventure GB Repro De Carro;11,69 EUR;+ 16,65 EUR de envío estimado;desde Reino Unido;
Spud's Adventure Nintendo Game Boy;69,00 EUR;Envío no especificado;desde Alemania;
Spud's Adventure Nintendo Game Boy Gameboy vgdb homebrew Nuevo Sellado/Menta! casi Nuevo +++;102,00 EUR;Envío gratis;desde Estados Unidos;
Spud's Adventure - Nintendo Game Boy - Original Game - Atlus;361,56 EUR;+ 8,70 EUR de envío;desde Canadá;
Spud's Adventure (Nintendo Game Boy) Gameboy solo carro Spuds auténtica;425,04 EUR;Envío gratis;desde Estados Unidos;
TOTSUGEKI bareishons/Spud's Adventure GB Game Boy Cartucho probado Manual F/sdhl;72,26 EUR;Envío internacional gratis;desde Japón;
Nintendo GameBoy totesugeki bareishons Spud's Adventure Japón importación Vendedor de Estados Unidos;21,67 EUR;+ 3,39 EUR de envío;desde Estados Unidos;
Nintendo GameBoy totesugeki bareishons GB Spud's Adventure Cartucho Gb Japón;33,99 EUR;Envío gratis;desde Estados Unidos;
Vendedor de Estados Unidos Nintendo GameBoy totesugeki bareishons Spud's Adventure Japón Importación;29,75 EUR;+ 3,53 EUR de envío;desde Estados Unidos;
Nintendo Gameboy Juego Spud's Adventure;467,55 EUR;+ 8,50 EUR de envío;desde Estados Unidos;
TOTSUGEKI bareishons/Spud's Adventure GB Game Boy Solo Cartucho probado F/S DHL;63,76 EUR;Envío internacional gratis;desde Japón;
TOTSUGEKI bareishons/Spud's Adventure GB Game Boy Solo Cartucho probado F/S DHL;63,76 EUR;Envío internacional gratis;desde Japón;
