Lot 6 cartouches Game Boy Japonaises Tamagotchi Pokemon Dragon Quest Yu Gi Oh;15,00 EUR;+ 6,00 EUR de envío;desde Francia;
Lot 3 cartouches Game Boy Japonaises Trilogie Tamagotchi;9,00 EUR;+ 6,00 EUR de envío;desde Francia;
Tamagotchi Video Juego Para Nintendo Game Boy NTSC-J Japonés Probado;5,84 EUR;+ 16,54 EUR de envío estimado;desde Reino Unido;
GAME BOY GB NINTENDO - GAME DE HAKKEN!! Tamagotchi - JAPAN VERSION ;24,90 EUR;+ 19,90 EUR de envío;desde España;
Nintendo Game Boy juego gb-Tamagotchi con instrucciones y embalaje original;39,99 EUR;+ 15,99 EUR de envío;desde Alemania;
Tamagotchi Osucchi to Mesucchi-Nintendo Game Boy-NTSC JAP-B-Ware;13,93 EUR;+ 0,99 EUR de envío;desde Austria;
Tamagotchi Osucchi to Mesucchi-Nintendo Game Boy-NTSC JAP-C-Ware;13,06 EUR;+ 0,99 EUR de envío;desde Austria;
Game de Hakken Tamagotchi 2-Nintendo Game Boy-NTSC JAP-C-Ware;4,89 EUR;+ 1,09 EUR de envío;desde Austria;
Tamagotchi osutchi a Mesutchi Nintendo Gameboy dmg Cartucho De Juego-AOMJ-JPN #2;15,21 EUR;+ 16,70 EUR de envío estimado;desde Reino Unido;
Tamagotchi 2 video juego para Nintendo Game Boy NTSC-J Japonés Probado;5,84 EUR;+ 16,54 EUR de envío estimado;desde Reino Unido;
NINTENDO GAME BOY GB - Game de Hakken - Tamagotchi Osucchi to Mesucchi Japón;27,90 EUR;+ 19,90 EUR de envío;desde España;
Nintendo Game Boy jpn Japón "game de Hakken Tamagotchi 2" sólo módulo;5,95 EUR;+ 5,99 EUR de envío;desde Alemania;
Nintendo Game Boy jpn Japón "game de Hakken Tamagotchi" solo módulo;5,95 EUR;+ 5,99 EUR de envío;desde Alemania;
Tamagotchi-Nintendo Game Boy-NTSC JAP-B-Ware;7,69 EUR;+ 1,09 EUR de envío;desde Austria;
Game de Hakken Tamagotchi 2--Nintendo Game Boy--NTSC JAP--B-Ware;5,89 EUR;+ 1,09 EUR de envío;desde Austria;
Tamagotchi Game Boy Japan;5,00 EUR;+ 10,00 EUR de envío;desde Italia;
Nintendo Game Boy-Tamagotchi-Embalaje original-Top-alemán;49,90 EUR;Envío no especificado;desde Alemania;
Tamagotchi japonés Nintendo Game Boy - 2 - 1997-Bandai-Cartucho únicamente;10,52 EUR;+ 16,62 EUR de envío estimado;desde Reino Unido;
Nintendo Gameboy-game de Hakken!!! Tamagotchi 2 juego japón OVP Neuw St 1 azúcar;29,90 EUR;+ 9,00 EUR de envío;desde Alemania;
Tamagotchi GBC Game Boy Color Nintendo JAP;6,00 EUR;Envío no especificado;desde Francia;
Game Boy - Tamagotchi 2, 1997, (Japon).  100% Original;4,50 EUR;+ 9,75 EUR de envío;desde España;
Tamagotchi-Nintendo Game Boy-NTSC JAP-C-Ware;7,29 EUR;+ 1,09 EUR de envío;desde Austria;
Nintendo Game Boy - Tamagotchi - PAL - FRA;14,99 EUR;+ 5,00 EUR de envío;desde Francia;
Japonés Nintendo Gameboy-DMG-ataj-Juego de Hakken!!! Tamagotchi + Manual;11,65 EUR;+ 16,65 EUR de envío estimado;desde Reino Unido;
Game De Hakken Tamagotchi 2 Game Boy Nintendo JP Import;4,99 EUR;+ 18,50 EUR de envío;desde España;
Tamagotchi osutchi a Mesutchi Nintendo Gameboy dmg Cartucho De Juego-AOMJ-JPN;21,06 EUR;+ 16,81 EUR de envío estimado;desde Reino Unido;
Tamagotchi 2 Nintendo Gameboy En Caja falta instrucciones JAP;17,55 EUR;+ 16,75 EUR de envío estimado;desde Reino Unido;
Game De Hakken Tamagotchi 2 Game Boy Japan;5,00 EUR;+ 10,00 EUR de envío;desde Italia;
Tamagotchi GB Nintendo Gameboy Juego Original;17,56 EUR;+ 19,62 EUR de envío estimado;desde Reino Unido;
Juego de Hakken!!! Tamagotchi Life 2 Nintendo Game Boy GB NTSC-J DMG-AT3J-JPN;11,65 EUR;+ 16,65 EUR de envío estimado;desde Reino Unido;
Game de Hakken!! Tamagotchi DMG-ATAJ cartucho Gameboy GB Japan leer;5,95 EUR;+ 8,95 EUR de envío;desde España;
Tamagotchi osutchi a Mesutchi Nintendo Gameboy dmg Cartucho De Juego-AOMJ-JPN #1;15,21 EUR;+ 16,70 EUR de envío estimado;desde Reino Unido;
Tamagotchi Nintendo Game Boy DMG-ATAP-NOE Made in Japan 1997;12,68 EUR;+ 6,00 EUR de envío;desde Italia;
Tamagotchi para Gameboy y color y Advance;9,75 EUR;+ 7,00 EUR de envío;desde Alemania;
Juego GameBoy Juego de Hakken Tamagotchi Osucchi a Mesucchi Japón Cartucho;8,18 EUR;Envío internacional gratis;desde Alemania;
Tamagotchi 2 Nintendo Game Boy japonesa en caja con Pegatinas 🇬 🇧 vendedor del Reino Unido;33,95 EUR;+ 17,56 EUR de envío;desde Reino Unido;
Tamagotchi 2 Nintendo Game Boy Jap 🇬 🇧 Stock;35,00 EUR;+ 15,10 EUR de envío;desde Reino Unido;
Juego de Hakken!!! Tamagotchi GAMEBOY JP importación de trabajo sucio;9,31 EUR;+ 16,60 EUR de envío estimado;desde Reino Unido;
Japonés Nintendo Gameboy-DMG-AT3J - tamagocchi 2 Tamagotchi;7,33 EUR;+ 16,56 EUR de envío estimado;desde Reino Unido;
Tamagotchi Life 2-Juego de Hakken!!! - Nintendo Game Boy-GB-Japonés Importado;8,08 EUR;+ 4,68 EUR de envío;desde Reino Unido;
Game Boy-Tamagotchi-módulo #;8,00 EUR;+ 10,00 EUR de envío;desde Alemania;
