Nintendo Game Boy Color Uva Con MadCatz Speakers Army Men Joust Rampart Pac-Man;54,58 EUR;+ 13,82 EUR de envío;Vendidos  19 sep 2021Artículo vendido;desde Estados Unidos;
Rampart (Nintendo Game Boy Gameboy, 1992) - Nuevo/Sellado!;682,29 EUR;+ 17,05 EUR de envío;Vendidos  13 sep 2021Artículo vendido;desde Estados Unidos;
Gameboy - Rampart - Jaleco 1992 - Deutsch - Getestet! (A166);21,00 EUR;+ 16,00 EUR de envío;Vendidos  13 sep 2021Artículo vendido;desde Austria;
Rampart juego Boy Color Nueva Sellado;22,99 EUR;Envío gratis;Vendidos  5 sep 2021Artículo vendido;desde Estados Unidos;
Rampart Gameboy Nintendo GB CIB;4,69 EUR;+ 4,35 EUR de envío;Vendidos  4 sep 2021Artículo vendido;desde Estados Unidos;
Rampart-Game Boy Color;8,08 EUR;+ 3,37 EUR de envío;Vendidos  3 sep 2021Artículo vendido;desde Estados Unidos;
Rampart Nintendo Gameboy Cartucho en Caja Completo en Caja Jaleco cerca de nuevo, sin usar;115,13 EUR;+ 5,07 EUR de envío;Vendidos  1 sep 2021Artículo vendido;desde Estados Unidos;
Gauntlet/Rampart-Nintendo Game Boy Advance (sellado);8,96 EUR;+ 3,54 EUR de envío;Vendidos  30 ago 2021Artículo vendido;desde Estados Unidos;
Rampart (Nintendo Game Boy Color, 1999);4,26 EUR;+ 3,80 EUR de envío;Vendidos  25 ago 2021Artículo vendido;desde Estados Unidos;
Rampart GBC Game Boy Color ~ con caja y las instrucciones: sin probar ~ Nintendo GameBoy;11,08 EUR;+ 3,41 EUR de envío;Vendidos  23 ago 2021Artículo vendido;desde Estados Unidos;
Nintendo Game Boy Color Auténtico con Pokémon Verde And Rampart;55,44 EUR;+ 4,43 EUR de envío;Vendidos  21 ago 2021Artículo vendido;desde Estados Unidos;
Rampart Para Nintendo Game Boy Color, Advance & SP probado y de trabajo;3,40 EUR;+ 3,80 EUR de envío;Vendidos  20 ago 2021Artículo vendido;desde Estados Unidos;
Gauntlet/Rampart-Nintendo Game Boy Advance;0,85 EUR;+ 3,40 EUR de envío;Vendidos  16 ago 2021Artículo vendido;desde Estados Unidos;
Gauntlet/Rampart (Nintendo Game Boy Advance, 2005) Nuevo Sellado-auténtica;11,93 EUR;Envío gratis;Vendidos  7 ago 2021Artículo vendido;desde Estados Unidos;
