Game Boy Penta Dragon;143,80 EUR;Envío internacional gratis;desde Japón;
Nintendo Gameboy GB Penta Dragon versión japonesa Vendedor de Estados Unidos;275,48 EUR;desde Estados Unidos;
Penta Dragon Juego BOY versión japonesa;368,48 EUR;+ 17,06 EUR de envío;desde Japón;
Gameboy Penta Dragon Sin Caja Solo Cartucho;319,70 EUR;+ 17,06 EUR de envío;desde Japón;
Raro Penta Dragon Nintendo Gameboy región libre JAP;425,60 EUR;+ 17,06 EUR de envío;desde Países Bajos;
Gameboy Penta Dragon;421,39 EUR;Envío internacional gratis;desde Japón;
Game Boy GB Penta Dragon (sólo suave) Boy aceptable #1FEF;129,63 EUR;Envío internacional gratis;desde Japón;
