Nintendo Game Boy Color - Caesars Palace II 2 - PAL - EUR;4,99 EUR;+ 5,00 EUR de envío;desde Francia;
Nintendo Game Boy Color Caesars Palace II EUR Très Bon état;4,90 EUR;+ 11,98 EUR de envío;desde Francia;
Nintendo Game Boy Color Caesars Palace II Juego Cartucho Solo;2,04 EUR;+ 7,00 EUR de envío;desde Reino Unido;
Nintendo GameBoy Color juego - Caesars Palace II en el embalaje usado COMO NUEVO;28,99 EUR;Envío internacional gratis;desde Alemania;
Nintendo GameBoy Color juego - Caesars Palace II / 2 cartucho usado;16,99 EUR;Envío internacional gratis;desde Alemania;
Jeu Gameboy Color Caesars Palace II;9,09 EUR;+ 39,00 EUR de envío;desde Francia;
Caesars Palace II Retro Nintendo GameBoy Color Video Juego Cartucho 1999 GBC GBA;6,76 EUR;Envío no especificado;desde Reino Unido;
Caesars Palace II - Gameboy Color;6,00 EUR;Envío no especificado;desde Alemania;
Caesars Palace II-Nintendo Game Boy Color, auténtico Cartucho, probado, Funciona;5,29 EUR;Envío gratis;desde Estados Unidos;
Caesars Palace II (Nintendo Game Boy Color probado auténtico, 1999);8,54 EUR;Envío gratis;desde Estados Unidos;
Caesars Palace II (Nintendo Game Boy Color) CB;8,53 EUR;Envío gratis;desde Estados Unidos;
Caesars Palace II-Nintendo Game Boy Color;6,39 EUR;Envío gratis;desde Estados Unidos;
Caesars Palace II (Nintendo Game Boy Color, 1999);6,82 EUR;Envío gratis;desde Estados Unidos;
Game Boy Color Caesars Palace II Probado;5,97 EUR;Envío gratis;desde Estados Unidos;
Caesars Palace II (Nintendo Game Boy Color, 1999) GBC Cartucho en Caja Completo Buen Estado;32,43 EUR;Envío gratis;desde Estados Unidos;
Caesars Palace II-Juego Original Nintendo GameBoy Color;6,57 EUR;+ 2,52 EUR de envío;desde Estados Unidos;
Caesars Palace II (Nintendo Game Boy Color, 1999) GBC ***Tested;8,71 EUR;+ 7,39 EUR de envío;desde Canadá;
Caesars Palace II-Nintendo Game Boy Color Y Manuel;5,11 EUR;+ 6,11 EUR de envío;desde Estados Unidos;
Caesars Palace II Con Manual (Gameboy Color);8,53 EUR;+ 3,41 EUR de envío;desde Estados Unidos;
Caesars Palace II (Nintendo Game Boy Color, 1999);2,66 EUR;+ 4,70 EUR de envío;desde Canadá;
Caesars Palace II 2-auténtico-Nintendo Game Boy Color-Caja/Manual Solamente!;7,90 EUR;Envío gratis;desde Estados Unidos;
Gameboy Color Game: Caesars Palace II [PAL] (Complete) [EUR];14,95 EUR;+ 17,50 EUR de envío;desde Países Bajos;
Gameboy Color Caesars Palace II, que quiere ser un millonario;4,70 EUR;+ 3,54 EUR de envío;desde Estados Unidos;
Nintendo GameBoy Color Caesars Palace II 2 Cartucho De Juego;10,50 EUR;Envío internacional gratis;desde Alemania;
Nintendo GameBoy Color jeu - Caesars Palace II / 2 cartouche utilisé;14,99 EUR;Envío internacional gratis;desde Alemania;
Solo Manual Nintendo Game Boy Color Caesars Palace II Folleto Instrucciones FR;5,15 EUR;Envío internacional gratis;desde Francia;
Nintendo GameBoy Color - Caesars Palace II dans l'emballage utilisé COMME NEUF;26,99 EUR;Envío internacional gratis;desde Alemania;
Nintendo GameBoy Color - Caesars Palace II nell'imballaggio usato COME NUOVO;28,99 EUR;Envío internacional gratis;desde Alemania;
Nintendo GameBoy Color gioco - Caesars Palace II / 2 cartuccia usato;16,99 EUR;Envío internacional gratis;desde Alemania;
Jeu Gameboy Color Caesars Palace II;9,32 EUR;+ 39,00 EUR de envío;desde Francia;
Caesars Palace II 2 Nintendo Gameboy Game Boy Color GBC GBA;28,57 EUR;Envío internacional gratis;desde Francia;
Nintendo GameBoy Color game - Caesars Palace II / 2 cartridge;10,75 EUR;Envío internacional gratis;desde Alemania;
