Gameboy/Ultraman Club de módulo Nintendo Gameboy juego probado;5,99 EUR;Envío no especificado;Vendidos  2 ago 2021Artículo vendido;desde Alemania;
Vintage Nintendo GameBoy Ultraman Cho Toshi gekiden * Importado Japonés *;7,50 EUR;+ 11,13 EUR de envío;Vendidos  29 jul 2021Artículo vendido;desde Reino Unido;
Ultraman ball + Seiya Saint Paradise + Oira jajamaru Daiboken Game Boy Japan;49,99 EUR;+ 19,99 EUR de envío;Vendidos  5 sep 2021Artículo vendido;desde Japón;
Ultraman-Japón (interbec Juego Boy, 1991);7,66 EUR;Envío gratis;Vendidos  22 ago 2021Artículo vendido;desde Estados Unidos;
Ultraman Club Nintendo Game Boy GB;8,52 EUR;Envío gratis;Vendidos  17 ago 2021Artículo vendido;desde Estados Unidos;
Ultraman Nintendo Game Boy GB auténtico probado funciona limpio;11,93 EUR;Envío gratis;Vendidos  17 ago 2021Artículo vendido;desde Estados Unidos;
Ultraman Club encontrar el enemigo Monstruo Con Manual Japón Nintendo Gameboy GB en muy buena condición!;4,94 EUR;+ 7,50 EUR de envío;Vendidos  25 jul 2021Artículo vendido;desde Japón;
