Nintendo Game Boy Color Caesar's Palace ll 2 en caja de color;29,25 EUR;+ 16,96 EUR de envío estimado;Vendidos  16 jul 2021Artículo vendido;desde Reino Unido;
Lote De Gameboy CAJA E INSTRUCCIONES NBA Jam Te & Caesar's Palace aceptable;12,74 EUR;+ 5,09 EUR de envío;Vendidos  8 sep 2021Artículo vendido;desde Estados Unidos;
Caesar's Palace Advance-Game Boy Advance (auténtico 2001);0,84 EUR;+ 3,49 EUR de envío;Vendidos  8 ago 2021Artículo vendido;desde Estados Unidos;
Caesar's Palace Virgen Juegos versión Nintendo Game Boy Video Juego Carro;5,50 EUR;Envío gratis;Vendidos  6 ago 2021Artículo vendido;desde Estados Unidos;
3 Gameboy Advance Juegos Ultimate tarjeta Cerebro Juegos Caesar's Palace probado/trabajo;21,25 EUR;+ 3,40 EUR de envío;Vendidos  4 ago 2021Artículo vendido;desde Estados Unidos;
Caesar's Palace-Nintendo Gameboy-Completo En Caja-Pn-6821b;7,64 EUR;+ 3,40 EUR de envío;Vendidos  24 jul 2021Artículo vendido;desde Estados Unidos;
Caesar's Palace con Caja Y Manual Nintendo Game Boy Gameboy;6,79 EUR;Envío gratis;Vendidos  14 jul 2021Artículo vendido;desde Estados Unidos;
