Game Boy-Donkey Kong & Donkey Kong Land-Embalaje original-pal-Big value Twin Pack;899,90 EUR;Envío no especificado;desde Alemania;
Donkey Kong Land 2 Nintendo Game Boy;32,80 EUR;+ 16,63 EUR de envío;desde Reino Unido;
Nintendo Gameboy ☆ Donkey Kong Land 3 ☆ sealed ☆ VGA Wata ready ☆ Game Boy ☆;750,00 EUR;+ 13,99 EUR de envío;desde Alemania;
Nuevo anuncioDonkey Kong Land 2-Nintendo GAME BOY JUEGO ~ GBC Color ~ GBA Advance SP Genuino;9,36 EUR;+ 11,70 EUR de envío;desde Reino Unido;
Donkey Kong Land - Game Boy ;79,00 EUR;+ 19,99 EUR de envío;desde España;
NINTENDO GAME BOY-Donkey Kong Land (en Caja);64,36 EUR;Envío internacional gratis;desde Reino Unido;
Original Juego De Nintendo Gameboy, Donkey Kong Land 3;46,84 EUR;+ 17,29 EUR de envío estimado;desde Reino Unido;
Game Boy juego Donkey Kong Land 3 III Factory sealed | Wata/VGA neu&ovp + Case;799,00 EUR;+ 9,99 EUR de envío;desde Alemania;
Donkey Kong Land 2 Notice - Instruction Booklet Game Boy NEU6 ;6,00 EUR;Envío internacional gratis;desde Francia;
Nintendo Game Boy Classic juego Donkey Kong Land III con embalaje original y guía fah;89,90 EUR;+ 8,99 EUR de envío;desde Alemania;
✅ Donkey Kong Land 3 Wata 9.8 a + + MINT (vga95+) Nintendo Game Boy EE. UU. ✅ artículo 1;3.099,00 EUR;Envío no especificado;desde Alemania;
Donkey Kong Land Vídeo Juego Para Nintendo Game Boy NTSC-J Japonés Probado;5,84 EUR;+ 16,55 EUR de envío estimado;desde Reino Unido;
Donkey Kong Land 🍌 Nintendo Game Boy Classic, color, advance;14,99 EUR;Envío no especificado;desde Alemania;
Nintendo Game Boy jpn Japón "Donkey Kong Land" sólo módulo;9,95 EUR;+ 5,99 EUR de envío;desde Alemania;
Nintendo Game Boy Classic juego Donkey Kong Land 2 con embalaje original y guía fah;109,90 EUR;+ 36,99 EUR de envío;desde Alemania;
Nintendo Game Boy Classic juego Donkey Kong Land III 3 módulo EUR;21,90 EUR;+ 8,99 EUR de envío;desde Alemania;
Nintendo Game Boy, Donkey Kong Land III VGA oro 90 nm +/MT, nuevo;1.249,00 EUR;+ 55,00 EUR de envío;desde Alemania;
✨ Donkey Kong Land Game Boy 1992 Nintendo Japan Boxed Copmlet GB DMG-ADDJ ✨;19,90 EUR;+ 28,10 EUR de envío;desde Francia;
Notice du jeu Donkey Kong Land FAH-1 Nintendo Game Boy;4,00 EUR;+ 3,50 EUR de envío;desde Países Bajos;
Donkey Kong Land 3 (Nintendo Game Boy, 1997) Cartucho Gratis Reino Unido P&p;11,70 EUR;+ 16,66 EUR de envío estimado;desde Reino Unido;
Vintage Video Juego Nintendo GameBoy Donkey Kong Land * Importado Japonés *;9,37 EUR;+ 11,13 EUR de envío;desde Reino Unido;
Nintendo Game Boy Donkey Kong Land 2 EUR Bon état;19,90 EUR;+ 11,98 EUR de envío;desde Francia;
Jeu Nintendo Game Boy - Donkey Kong Land 3 - EUR - Loose;27,90 EUR;+ 7,90 EUR de envío;desde Francia;
Nintendo Game Boy-Donkey Kong Land 2-Top-Embalaje original-pal alemán;219,90 EUR;Envío no especificado;desde Alemania;
Nuevo anuncioDonkey Kong Land 2 + Game & Watch Gallery 2 + Razmoket : 3 jeux Game Boy Color;22,90 EUR;+ 19,90 EUR de envío;