Darkman (Gameboy, DMG-DN-EE. UU.) - Cartucho únicamente con Estuche, probado y funcionando;231,56 EUR;+ 30,02 EUR de envío estimado;desde Reino Unido;
Nintendo GameBoy juego - Darkman en el embalaje muy buen estado usado;340,99 EUR;+ 69,99 EUR de envío;desde Alemania;
Libretto Darkman USA NINTENDO GAMEBOY GB;98,79 EUR;Envío no especificado;desde Italia;
Darkman (Nintendo Game Boy);179,00 EUR;+ 3,58 EUR de envío;desde Estados Unidos;
Darkman (Nintendo Game Boy) Auténtico CARTUCHO-PROBADO Y FUNCIONA dañado;127,93 EUR;Envío gratis;desde Estados Unidos;
Darkman (Nintendo Game Boy);213,22 EUR;+ 3,80 EUR de envío;desde Estados Unidos;
Darkman (Nintendo Entertainment sistema, 1991) Completo En Caja Casi Nuevo Probado;152,67 EUR;+ 8,44 EUR de envío;desde Estados Unidos;
Darkman (Nintendo, 1991) Auténtico NES cartucho sólo probado y de trabajo;36,57 EUR;Envío gratis;desde Estados Unidos;
Darkman (Nintendo Entertainment sistema, NES, 1991). auténtico cartucho sólo.;35,82 EUR;Envío gratis;desde Estados Unidos;
Darkman (Nintendo NES, 1991 Manual) ☆ ☆ ☆ Auténtico;13,43 EUR;Envío gratis;desde Estados Unidos;
Darkman (Nintendo Game Boy) Auténtico CARTUCHO-PROBADO Y FUNCIONA;191,90 EUR;+ 4,09 EUR de envío;desde Estados Unidos;
Darkman - cib - Nintendo GameBoy GB;398,68 EUR;+ 9,96 EUR de envío;desde Canadá;
Darkman (Nintendo Game Boy) Auténtico CARTUCHO-PROBADO Y FUNCIONA;191,89 EUR;Envío gratis;desde Estados Unidos;
Darkman (Nintendo Entertainment sistema, 1991) Carro Y Manual;85,25 EUR;Envío gratis;desde Estados Unidos;
Darkman (Nintendo NES) reacondicionadas Auténtico;36,67 EUR;+ 0,84 EUR de envío;desde Estados Unidos;
Nintendo GameBoy Juego Darkman CIB en Caja Muy Buen Estado;344,42 EUR;Envío internacional gratis;desde Alemania;
Darkman (Nintendo Entertainment sistema, 1991) Carro Y Manual;42,64 EUR;+ 4,82 EUR de envío;desde Estados Unidos;
Nintendo GameBoy Juego-Darkman Cartucho en Caja, En Caja Muy Buen Estado;358,22 EUR;Envío internacional gratis;desde Alemania;
Darkman (Nintendo-NES, 1991) excelentes condiciones, limpio, auténtico;34,11 EUR;+ 4,44 EUR de envío;desde Estados Unidos;
Nintendo GameBoy gioco - Darkman nell'imballaggio ottimo stato usato;338,99 EUR;+ 69,99 EUR de envío;desde Alemania;
Nintendo GameBoy jeu - Darkman dans l'emballage trÃ¨s bonne condition utilisÃ©;338,99 EUR;+ 69,99 EUR de envío;desde Alemania;
Darkman Nintendo NES con Caja;58,85 EUR;+ 17,06 EUR de envío;desde México;
Darkman Nintendo Game Boy Fridge Magnet Aimant Frigo;2,18 EUR;+ 2,50 EUR de envío;desde España;
Darkman Game Boy Nintendo Llavero;2,16 EUR;+ 2,49 EUR de envío;desde España;
Darkman (Nintendo Entertainment sistema, 1991);51,17 EUR;Envío gratis;desde Estados Unidos;
Nintendo GameBoy game - Darkman CIB, boxed very good condition;352,83 EUR;+ 53,15 EUR de envío;desde Alemania;
Darkman NINTENDO GAME BOY FRIDGE MAGNET;2,16 EUR;+ 2,49 EUR de envío;desde España;
Darkman Nintendo Game Boy Fridge Magnet Magnete Frigorifero;2,22 EUR;+ 2,50 EUR de envío;desde España;
