Mario Tennis GB (Nintendo Game Boy Color GBC, 2000) Japan Import;4,70 EUR;+ 3,87 EUR de envío;Vendidos  24 sep 2021Artículo vendido;desde Canadá;
Mario Tennis GB (Nintendo Game Boy Color GBC, 2000) Japan Import;4,70 EUR;+ 3,87 EUR de envío;Vendidos  20 sep 2021Artículo vendido;desde Canadá;
Lote de 3 Nintendo Game Boy Color Mario Tennis GB Zoids Duel Monsters de Japón;8,96 EUR;Envío internacional gratis;Vendidos  13 sep 2021Artículo vendido;desde Japón;
Mario Tennis GB Game Boy Color GBC Japón importación Vendedor de Estados Unidos (etiqueta descolorido);6,39 EUR;Envío gratis;Vendidos  11 sep 2021Artículo vendido;desde Estados Unidos;
Mario Tennis GB Game Boy Color NINTENDO GBC Japón;0,85 EUR;+ 8,54 EUR de envío;Vendidos  31 ago 2021Artículo vendido;desde Japón;
Mario Tennis GB-Japón - (Nintendo Game Boy Color, 2000) - Nuevo ahorrar batería;10,24 EUR;Envío gratis;Vendidos  19 ago 2021Artículo vendido;desde Estados Unidos;
Mario Tennis GB Nintendo Game Boy Color GB GBC 200;0,85 EUR;+ 3,41 EUR de envío;Vendidos  1 ago 2021Artículo vendido;desde Japón;
Mario Tennis GB Nintendo Game Boy Color GB GBC 200;0,85 EUR;+ 3,41 EUR de envío;Vendidos  21 jul 2021Artículo vendido;desde Japón;
 Mario Tennis GB (Nintendo Game Boy Color GBC, 2000) Japan Import;4,70 EUR;+ 3,87 EUR de envío;Vendidos  12 jul 2021Artículo vendido;desde Canadá;
U1176 Nintendo Gameboy Color Mario Tennis GB Japón GB GBC;4,25 EUR;+ 12,81 EUR de envío;Vendidos  6 jul 2021Artículo vendido;desde Japón;
GAMEBOY COLOR Mario Tennis GB Usado & Golf GB 2 Juegos Set GB GBC Nintendo Japón;19,63 EUR;+ 17,07 EUR de envío;Vendidos  6 jul 2021Artículo vendido;desde Japón;
