Nintendo Game Boy Batman Forever EUR Très Bon état;11,90 EUR;+ 11,98 EUR de envío;desde Francia;
GB: Batman Forever   GAME BOY   MOLTO BELLO!! TOP!!!;13,99 EUR;+ 8,50 EUR de envío;desde Italia;
Batman Forever (Nintendo Game Boy, 1995) cartucho sólo. Blast en Gotham City!;9,95 EUR;+ 16,61 EUR de envío estimado;desde Reino Unido;
Nintendo Gameboy Batman Forever;6,56 EUR;+ 32,92 EUR de envío estimado;desde Reino Unido;
Nintendo Game Boy - Batman Forever - PAL - EUR;12,99 EUR;+ 5,00 EUR de envío;desde Francia;
jeu game boy Batman - Batman Forever;10,90 EUR;+ 9,00 EUR de envío;desde Francia;
1995 Batman Forever Snes Sega Genesis Game Boy Vintage Promo Poster Enmarcado/ad;32,76 EUR;+ 15,21 EUR de envío;desde Alemania;
Gb-Batman Forever: the Real Game begins para Nintendo GameBoy;49,95 EUR;+ 9,95 EUR de envío;desde Alemania;
Jeu Gameboy Batman Forever;10,24 EUR;+ 39,00 EUR de envío;desde Francia;
Batman Forever Game Boy Folleto De Instrucciones Manual;8,19 EUR;+ 16,58 EUR de envío estimado;desde Reino Unido;
Batman Forever | Nintendo Game Boy juego | Gameboy Classic módulo | bien;11,90 EUR;Envío no especificado;desde Alemania;
Juego Game Boy Advance 108 En 1 - Batman Forever+Batman The Animated Series+The ;6,00 EUR;Envío no especificado;desde España;
Gameboy Batman Forever Solo Manual;9,35 EUR;Envío no especificado;desde Reino Unido;
Batman Forever-auténtico Nintendo Game Boy Juego;11,21 EUR;+ 2,51 EUR de envío;desde Estados Unidos;
Batman Forever (Nintendo Game Boy, 1995). sólo juego probadas! Funcionando! auténtico!;8,50 EUR;+ 3,61 EUR de envío;desde Estados Unidos;
Batman Forever Nintendo Game Boy;8,48 EUR;+ 2,51 EUR de envío;desde Estados Unidos;
Batman Forever (Nintendo Game Boy, 1995) probado y muy agradable;6,80 EUR;+ 3,61 EUR de envío;desde Estados Unidos;
Batman Forever (Nintendo Game Boy, 1995);8,49 EUR;Envío gratis;desde Estados Unidos;
Nintendo Game Boy NBA Jam-Batman Forever-GEX3 3 Juegos De Gameboy;14,44 EUR;+ 4,25 EUR de envío;desde Estados Unidos;
Batman Forever Nintendo Game Boy probado 1995 En Caja;54,16 EUR;+ 2,98 EUR de envío;desde Estados Unidos;
Batman Forever Nintendo Game Boy Original * forma agradable *;16,98 EUR;Envío gratis;desde Estados Unidos;
Batman Forever (Nintendo Game Boy Gameboy, 1995) probado y funciona;5,35 EUR;+ 3,57 EUR de envío;desde Estados Unidos;
Batman Forever (Nintendo Game Boy, 1995);7,64 EUR;Envío gratis;desde Estados Unidos;
Batman Forever En Caja Nintendo Game Boy GB Muy Raro;270,32 EUR;Envío internacional gratis;desde Japón;
Batman Forever (Nintendo Game Boy, 1995) juego sólo Probado Funciona -! envío Gratis!;11,82 EUR;Envío gratis;desde Estados Unidos;
Batman Forever (Nintendo Game Boy) cartucho sólo!;6,79 EUR;+ 0,84 EUR de envío;desde Estados Unidos;
Batman Forever Nintendo Gameboy;6,79 EUR;Envío gratis;desde Estados Unidos;
Batman Forever Nintendo Gameboy Auténtico Original Caja Manual Completo;91,94 EUR;+ 5,65 EUR de envío;desde Estados Unidos;
Batman Forever Nintendo Gameboy Cartucho sólo ver condiciones;6,79 EUR;Envío gratis;desde Estados Unidos;
Batman Forever GBO Gameboy Original limpiado & G52 Probado;12,71 EUR;Envío gratis;desde Estados Unidos;
Nintendo Game boy cartucho de juego Batman Forever, funciona R13532;10,17 EUR;Envío gratis;desde Estados Unidos;
Gameboy Batman Forever Solo Cartucho Sin Caja;208,98 EUR;+ 17,00 EUR de envío;desde Japón;
Batman Forever Nintendo Gameboy;12,75 EUR;+ 2,71 EUR de envío;desde Estados Unidos;
Batman Forever (Nintendo Game Boy, 1995);16,73 EUR;+ 10,04 EUR de envío;desde Canadá;
Jeu Gameboy Batman Forever;10,51 EUR;+ 39,00 EUR de envío;desde Francia;
GB -- Batman Forever -- en Caja. juego Boy, Japón. Acclaim.!! rara!!! 15522;238,02 EUR;+ 17,00 EUR de envío;desde Japón;
GAMEBOY Batman Forever + lo Mejor de los mejores del campeonato Karate auténtico + probado;24,23 EUR;+ 3,61 EUR de envío;desde Estados Unidos;
Batman The Video Game And Batman Forever Nintendo Gameboy;30,13 EUR;+ 3,35 EUR de envío;desde Canadá;
Batman Forever Solo Manual Nintendo Game Boy ~ Video Juego Folleto de instrucciones;16,15 EUR;Envío gratis;desde Estados Unidos;
Cartel De Batman Forever Print Ad/Arte Snes Sega Genesis Game Gear game boy;12,74 EUR;Envío gratis;desde Estados Unidos;
1995 Batman Forever Sega Genesis Game Boy SNES Vintage Promo Poster / Ad Framed;36,75 EUR;+ 14,72 EUR de envío;desde Alemania;
Batman Forever (Nintendo Gameboy, 1995) Cartridge Only;5,00 EUR;+ 12,00 EUR de envío;desde Irlanda;
Game Boy GB Game CASE ONLY - Batman Forever;8,63 EUR;+ 17,01 EUR de envío;desde Australia;
Nuevo anuncioBatman Forever (Gameboy) Gb * Solo Manual *;5,95 EUR;+ 1,70 EUR de envío;desde Estados Unidos;
Batman Forever Nintendo Gameboy Classic;14,95 EUR;+ 2,95 EUR de envío;desde Países Bajos;
Electronic Gaming Monthly 1995 Batman Forever Super NES Gameboy Sega MK3;6,70 EUR;+ 9,34 EUR de envío;desde Canadá;
Batman Forever - Nintendo Game Boy GB - manual only;8,73 EUR;+ 10,04 EUR de envío;desde Canadá;
Batman Forever (Nintendo Game Boy, 1995) Envío Gratis Excelente Estado;11,90 EUR;Envío gratis;desde Estados Unidos;
Batman Forever el juego arcade PS1 PlayStation 1 COMPLETO PAL;117,05 EUR;+ 23,27 EUR de envío estimado;desde Reino Unido;
Batman Forever Sega Mega Drive juego GENESIS con manual pal CIB oficiales del Reino Unido;99,50 EUR;+ 22,95 EUR de envío estimado;desde Reino Unido;
Batman Forever - SEGA Game Gear Acclaim - PAL - Complet - Très Bon Etat;149,90 EUR;+ 24,90 EUR de envío;desde Francia;
SEGA SATURN Batman Forever Juego Arcade Súper Súper Rara Japonesa;163,88 EUR;+ 28,22 EUR de envío estimado;desde Reino Unido;
Batman Forever Sega Mega Drive juego GENESIS con manual pal oficiales del Reino Unido;35,11 EUR;+ 17,07 EUR de envío estimado;desde Reino Unido;
Juego Batman Forever Super NINTENDO SNES EUR REINO UNIDO PAL * solo Carro *;23,40 EUR;+ 16,86 EUR de envío estimado;desde Reino Unido;
Batman Forever Sega Mega Drive Juego en Caja No manual Pal Libre P&P;21,06 EUR;+ 16,81 EUR de envío estimado;desde Reino Unido;
Batman Forever Sega Mega Drive Juego PAL Beat 'em up solo carro;12,82 EUR;+ 9,36 EUR de envío;desde Reino Unido;
Juego Batman Forever Super NINTENDO SNES EUR REINO UNIDO PAL * solo carro * probado y de trabajo;21,06 EUR;+ 16,81 EUR de envío estimado;desde Reino Unido;
Paquete de devoluciones de Batman Batman Forever & SEGA GAME GEAR-Probado-cartuchos sólo;23,40 EUR;+ 12,82 EUR de envío;desde Reino Unido;
SEGA Game Gear Batman Forever EUR Très Bon état;12,90 EUR;+ 11,98 EUR de envío;desde Francia;
Batman Forever-Sega Mega Drive Juego (probado, Genesis variante pero funciona en PAL);9,31 EUR;+ 18,00 EUR de envío estimado;desde Reino Unido;
Batman Forever El Juego Arcade. PS1 Juego. completa (PlayStation One. PAL);128,47 EUR;+ 17,50 EUR de envío;desde Reino Unido;
Super Nintendo SNES Juego-Batman Forever;17,50 EUR;+ 16,75 EUR de envío estimado;desde Reino Unido;
Genesis (Megadrive) juego Batman Forever NTSC USA caso naranja;11,69 EUR;+ 12,29 EUR de envío;desde Reino Unido;
Batman Forever The Arcade Game PC Caja Grande Pal;160,00 EUR;Envío no especificado;desde España;
