Batman Forever Game Boy EUR ;10,00 EUR;Envío internacional gratis;Vendidos  9 sep 2021Artículo vendido;desde Francia;
Batman Forever Nintendo Gameboy Advance GBA SP 💯% Genuino probado Raro Juego;14,04 EUR;+ 16,69 EUR de envío estimado;Vendidos  3 sep 2021Artículo vendido;desde Reino Unido;
Batman Forever  Gameboy  officiel test ok envoi suivi;6,00 EUR;Envío no especificado;Vendidos  24 jul 2021Artículo vendido;desde Francia;
Batman Forever (Nintendo Game Boy, 1995) probado y muy agradable;6,82 EUR;+ 3,79 EUR de envío;Vendidos  18 sep 2021Artículo vendido;desde Estados Unidos;
Batman Forever (Nintendo Game Boy, 1995) Sólo Cartucho y Manual Envío Rápido!!!;12,77 EUR;Envío gratis;Vendidos  12 sep 2021Artículo vendido;desde Estados Unidos;
Batman Forever (Nintendo Game Boy, 1995) juego solamente envío gratuito;10,22 EUR;Envío gratis;Vendidos  10 sep 2021Artículo vendido;desde Estados Unidos;
Batman Forever Nintendo Game Boy;6,79 EUR;+ 2,51 EUR de envío;Vendidos  25 ago 2021Artículo vendido;desde Estados Unidos;
Batman Forever 1991 Usa Guía De Estrategia Oficial Nintendo Génesis Game Boy;8,50 EUR;+ 2,72 EUR de envío;Vendidos  22 ago 2021Artículo vendido;desde Estados Unidos;
Batman Forever, Nintendo Game Boy, Con Estuche;8,51 EUR;Envío gratis;Vendidos  16 ago 2021Artículo vendido;desde Estados Unidos;
Batman Forever (Nintendo Game Boy, 1995);9,37 EUR;Envío gratis;Vendidos  29 jul 2021Artículo vendido;desde Estados Unidos;
Batman Forever auténtico Nintendo Game Boy, 1995 Original;8,51 EUR;Envío gratis;Vendidos  28 jul 2021Artículo vendido;desde Estados Unidos;
Batman Forever (Nintendo Game Boy, 1995) liberado & Probado;8,48 EUR;Envío gratis;Vendidos  28 jul 2021Artículo vendido;desde Estados Unidos;
Batman Forever (Nintendo Game Boy Excelente Estado, 1995).;9,36 EUR;+ 2,12 EUR de envío;Vendidos  26 jul 2021Artículo vendido;desde Estados Unidos;
Batman Forever (Nintendo Game Boy) -- Nueva/Sellado de fábrica --;221,48 EUR;Envío gratis;Vendidos  25 jul 2021Artículo vendido;desde Estados Unidos;
Juego Batman Forever en Gameboy sólo 0E;5,40 EUR;Envío gratis;Vendidos  16 jul 2021Artículo vendido;desde Estados Unidos;
Auténtico Batman Forever Nintendo Gameboy Video Juego Y Manual Game Boy;20,44 EUR;+ 4,17 EUR de envío;Vendidos  22 jun 2021Artículo vendido;desde Estados Unidos;
Juego Batman Forever Para Sega Genesis;5,27 EUR;+ 20,05 EUR de envío estimado;Vendidos  2 sep 2021Artículo vendido;desde Reino Unido;
Batman Forever El Juego Arcade-Entrega Rápida y gratis PS1 -;56,21 EUR;+ 17,46 EUR de envío estimado;Vendidos  10 jul 2021Artículo vendido;desde Reino Unido;
Batman Forever-Super Nintendo SNES Juego - [EUR PAL] En Caja Con Manual;51,48 EUR;+ 17,51 EUR de envío;Vendidos  20 jul 2021Artículo vendido;desde Reino Unido;
Batman Forever el juego arcade Sony Playstation 1 PS1;93,69 EUR;+ 22,86 EUR de envío estimado;Vendidos  18 ago 2021Artículo vendido;desde Reino Unido;
Sega Megadrive Consola Juego-Batman Forever-GENESIS Edición Usa;9,36 EUR;+ 16,61 EUR de envío estimado;Vendidos  30 ago 2021Artículo vendido;desde Reino Unido;
Batman Forever Sega Genesis Mega Drive Juego;7,02 EUR;+ 14,06 EUR de envío;Vendidos  27 jun 2021Artículo vendido;desde Reino Unido;
Batman Forever Sega Mega Drive Juego Con Manual Pal probado;10,54 EUR;+ 22,24 EUR de envío;Vendidos  5 ago 2021Artículo vendido;desde Reino Unido;
Batman Forever Super NINTENDO/SNES Juego;24,00 EUR;+ 19,21 EUR de envío estimado;Vendidos  5 ago 2021Artículo vendido;desde Reino Unido;
Batman Forever, SEGA Mega Drive Juego,;40,99 EUR;+ 21,26 EUR de envío estimado;Vendidos  8 ago 2021Artículo vendido;desde Reino Unido;
Juego Batman Forever PS1 en muy buena condición el juego arcade RARO PAL;87,83 EUR;Envío no especificado;Vendidos  7 sep 2021Artículo vendido;desde Reino Unido;
Batman Forever el juego arcade PS1 PlayStation 1 Juego UK PAL USADO;93,69 EUR;Envío no especificado;Vendidos  21 ago 2021Artículo vendido;desde Reino Unido;
Batman Forever DVD (1999) Val Kilmer;2,51 EUR;Envío no especificado;Vendidos  3 sep 2021Artículo vendido;desde Reino Unido;
