Deadly Skies - Nintendo Gameboy Color Spiel Modul (AV5-S7BQ);6,99 EUR;Envío no especificado;desde Alemania;
Deadly Skies (Nintendo Game Boy Color) nur Spielmodul;9,99 EUR;+ 6,19 EUR de envío;desde Alemania;
Nintendo Game Boy Color Deadly Skies (Afterburner) Konami Alemana Pal;9,90 EUR;+ 5,00 EUR de envío;desde Alemania;
Deadly Skies, Nintendo Game Boy Color, Pal-Eur;5,95 EUR;Envío no especificado;desde España;
Game Boy Color ★ Deadly Skies ★ PAL;4,99 EUR;Envío no especificado;desde España;
Deadly Skies _für Gameboy Color Modul/OVP/Anleitung Top Zustand ongeles-shop;70,00 EUR;Envío no especificado;desde Alemania;
Deadly Skies Nintendo Game Boy Color GBC Pal Multi ITA;107,23 EUR;+ 7,98 EUR de envío;desde Italia;
Deadly Skies(Nintendo Game Boy Color,EUR)AUTHENTIC CARTRIDGE-TESTED;25,58 EUR;+ 3,41 EUR de envío;desde Estados Unidos;
Nintendo Game Boy Color Deadly Skies (Afterburner) Konami Dt. Pal;10,85 EUR;+ 4,03 EUR de envío;desde Alemania;
Nintendo Game Boy Color Deadly Skies (Postcombustore) Konami Tedesco Pal;9,90 EUR;+ 5,00 EUR de envío;desde Alemania;
Deadly Skies Nintendo Juego Boy Color GBC Pal Multi ITA;99,99 EUR;+ 16,00 EUR de envío;desde Italia;
