Nintendo Game Boy Color Deadly Skies (Afterburner) Konami Alemana Pal;9,90 EUR;+ 5,00 EUR de envío;desde Alemania;
Deadly Skies, Nintendo Game Boy Color, Pal-Eur;5,95 EUR;Envío no especificado;desde España;
Game Boy Color ★ Deadly Skies ★ PAL;4,99 EUR;Envío no especificado;desde España;
Deadly Skies Nintendo Game Boy Color GBC PAL MULTI Ita;107,94 EUR;+ 8,04 EUR de envío;desde Italia;
Nintendo Game Boy Color Deadly Skies (Postcombustore) Konami Tedesco Pal;9,90 EUR;+ 5,00 EUR de envío;desde Alemania;
Deadly Skies Nintendo Juego Boy Color GBC Pal Multi ITA;99,99 EUR;+ 16,00 EUR de envío;desde Italia;
