Nintendo-Game Boy Classic-juego-Urban Strike-nuevo sellado & - rareza;299,99 EUR;+ 75,00 EUR de envío;desde Alemania;
Urban Strike Nintendo Game Boy Muy Buen Estado;8,52 EUR;+ 3,49 EUR de envío;desde Estados Unidos;
Urban Strike Nintendo Game Boy Cartrage sólo buenas condiciones;8,51 EUR;+ 3,49 EUR de envío;desde Estados Unidos;
Urban Strike la secuela huelga de la selva (Nintendo Gameboy) Juego Boy;6,60 EUR;Envío gratis;desde Estados Unidos;
Urban Strike Nintendo Game Boy probado y funciona solo carro;8,51 EUR;+ 3,49 EUR de envío;desde Estados Unidos;
Urban Strike-Nintendo Game Boy;22,13 EUR;+ 2,51 EUR de envío;desde Estados Unidos;
Urban Strike-Nintendo Game Boy Video Juego-solo carro;8,48 EUR;+ 2,51 EUR de envío;desde Estados Unidos;
Urban Strike Nintendo Gameboy limpio probado Auténtico Original;9,70 EUR;+ 3,54 EUR de envío;desde Estados Unidos;
Nintendo Game Boy Urban Strike guía de folleto de instrucciones Manual Solamente;10,22 EUR;Envío gratis;desde Estados Unidos;
Sega Mega Drive Urban Strike pal OVP módulo Video Game;20,00 EUR;+ 20,00 EUR de envío;desde Alemania;
Urban Strike Sega Mega Drive juego GRATIS UK FRANQUEO;19,90 EUR;+ 16,80 EUR de envío estimado;desde Reino Unido;
Sega Mega Drive Juego-Urban Strike falta el manual Raro;16,40 EUR;+ 20,49 EUR de envío estimado;desde Reino Unido;
Urban Strike video juego cartucho para Sega Mega Drive;12,78 EUR;+ 10,22 EUR de envío;desde Rusia;
Urban Strike Sega juego de Mega Drive;18,14 EUR;+ 25,77 EUR de envío;desde Reino Unido;
Nintendo SNES juego Urban Strike En Caja;52,69 EUR;Envío internacional gratis;desde Alemania;
Sega Megadrive juego Urban Strike Con Manual.;24,30 EUR;+ 20,98 EUR de envío estimado;desde Reino Unido;
Sega Megadrive Game: Urban Strike The Sequel to Jungle Strike (Complete);14,95 EUR;+ 7,00 EUR de envío;desde Países Bajos;
Sega Megadrive Game: Urban Strike The Sequel to Jungle Strike;4,95 EUR;+ 7,00 EUR de envío;desde Países Bajos;
