Ishido: el camino de piedras-Nintendo Juego Original Cartucho sólo juego Japón Boy;6,81 EUR;Envío gratis;Vendidos  13 sep 2021Artículo vendido;desde Estados Unidos;
Ishido: el camino de piedras (Nintendo Game Boy) liberado & probado!;8,38 EUR;Envío gratis;Vendidos  29 ago 2021Artículo vendido;desde Estados Unidos;
GB Gameboy Ishido manera de las piedras Casi Nuevo Nuevo Sellado Juego Boy Nintendo;76,67 EUR;Envío gratis;Vendidos  29 ago 2021Artículo vendido;desde Estados Unidos;
Ishido el camino de piedras (Nintendo Game Boy, 1990) Nueva Sellado de fábrica;80,90 EUR;Envío gratis;Vendidos  26 ago 2021Artículo vendido;desde Estados Unidos;
Minero 2049er, Ishido, y Qix Gameboy Cartuchos;12,78 EUR;Envío gratis;Vendidos  17 ago 2021Artículo vendido;desde Estados Unidos;
Ishido the Way of Stones Nintendo Gameboy Color Advance SP Modul AUTHENTIC ;8,01 EUR;+ 2,00 EUR de envío;Vendidos  30 jul 2021Artículo vendido;desde Canadá;
Ishido el camino de piedras (Nintendo Game Boy) Nueva, Sellado de fábrica casi nuevo y sin usar;127,76 EUR;Envío gratis;Vendidos  21 jul 2021Artículo vendido;desde Estados Unidos;
Ishido: el camino de piedras (Nintendo Game Boy) liberado & probado!;7,69 EUR;Envío gratis;Vendidos  11 jul 2021Artículo vendido;desde Estados Unidos;
Ishido: el camino de piedras-Nintendo Juego Original Boy-limpiado & Probado;6,35 EUR;Envío gratis;Vendidos  9 jul 2021Artículo vendido;desde Estados Unidos;
GB Gameboy Ishido manera de las piedras nuevo como nuevo sellado de fábrica juego Boy Nintendo;76,67 EUR;Envío gratis;Vendidos  23 jun 2021Artículo vendido;desde Estados Unidos;
