GAME BOY GB NINTENDO - Ishido: the Way of stones JAPAN VERSION Completo;36,90 EUR;+19,90 EUR shipping;from Spain;
Ishido: The Way of Stones jeu Nintendo Game Boy Classic Import Japon;6,99 EUR;+3,00 EUR shipping;from France;
Ishido The Way Of Stones - Rare Nintendo Gameboy Original Puzzle Game ;16,28 EUR;+11,64 EUR shipping;from United Kingdom;
Ishido - Game Boy GB Nintendo Gameboy - JAP;9,90 EUR;+12,00 EUR shipping;from Italy;
Ishido Way Of The Stones Gameboy Game! Look At My Other Games!;20,95 EUR;+19,04 EUR shipping estimate;from United Kingdom;
Ishido The Way Of Stones - Rare Nintendo Gameboy Original Puzzle Game + Case;20,36 EUR;+5,82 EUR shipping;from United Kingdom;
GameBoy juego - Ishido: The Way of Stones JAPAN en el embalaje usado COMO NUEVO;48,99 EUR;+69,99 EUR shipping;from Germany;
Game Boy Ishido: The Way of Stones USA Boxed With Instructions;34,90 EUR;Shipping not specified;from United Kingdom;
Ishido: The Way of the Stones - Game Boy Japonés - Nuevo a Estrenar - New;34,59 EUR;Shipping not specified;from Spain;
Ishido: The Way of Stones (Nintendo Game Boy) Cartridge Tested ;8,53 EUR;Free shipping;from United States;
Ishido: The Way of Stones (Nintendo Game Boy) Japanese Version Tested And Works!;8,53 EUR;Free shipping;from United States;
Ishido The Way of Stones ORIGINAL Nintendo GameBoy Game Tested WORKING Authentic;12,79 EUR;from United States;
Ishido: The Way of Stones **Authentic** (Nintendo Game Boy) With Manual Tested!;8,52 EUR;+3,58 EUR shipping;from United States;
1990 Ishido The Way of the Stones Nintendo Gameboy New Sealed WATA 8.5 Seal A+;255,87 EUR;+17,05 EUR shipping;from United States;
Ishido: The Way of Stones (Nintendo Game Boy) Good Used Condition;10,23 EUR;Free shipping;from United States;
Ishido: The Way of Stones (Nintendo Game Boy);8,52 EUR;Free shipping;from United States;
Nintendo Gameboy Game Ishido The Way Of Stones Complete In Box CIB;34,12 EUR;from United States;
Ishido: The Way of Stones (Nintendo Game Boy) Cartridge Only - Tested Working;14,50 EUR;+4,18 EUR shipping;from United States;
Ishido The Way of Stones Game Boy MANUAL ONLY Authentic Spine Crease;4,26 EUR;Free shipping;from United States;
Ishido: The Way of the Stones (Nintendo Game Boy) Cartridge Only!;5,11 EUR;+0,84 EUR shipping;from United States;
Ishido the way of Stones Game Boy Spiel #1594;27,63 EUR;+15,43 EUR shipping;from Switzerland;
Ishido: The Way of Stones (Original Nintendo Gameboy) Authentic - Tested;8,52 EUR;+3,23 EUR shipping;from United States;
Ishido The Way of Stones (Nintendo Game Boy) Brand New, Factory Sealed;93,78 EUR;from United States;
Ishido: The Way of Stones (Nintendo Game Boy) Authentic/Cleaned - Puzzle Gameboy;7,95 EUR;+9,95 EUR shipping;from Canada;
Ishido The Way of Stones Gameboy Nintendo 136 gb;10,23 EUR;+14,50 EUR shipping;from Japan;
Ishido: The Way of Stones JAPAN GameBoy;3,48 EUR;+5,55 EUR shipping;from Canada;
Ishido Nintendo Gameboy Japanese Import Cartridge Only 1989 90 DMG-STJ Japan;7,77 EUR;Free International Shipping;from Canada;
Ishido : The Way Of The Stones - GB ( Nintendo Gameboy ) Cart Only**;5,96 EUR;+3,40 EUR shipping;from United States;
Ishido The Way of Stones - Authentic Game Boy Manual;2,81 EUR;+2,52 EUR shipping;from United States;
Ishido The Way Of The Stones - Nintendo Game Boy Gameboy *Complete In Box CIB*;68,22 EUR;Free shipping;from United States;
Ishido : The Way Of The Stones - GB ( Nintendo Gameboy ) Game Only !;14,61 EUR;+1,99 EUR shipping;from Canada;
Nintendo Game Boy Game, Ishido, the Way of Stones, Cartridge Only R5712;12,76 EUR;Free shipping;from United States;
Ishido: The Way of Stones JPN - Nintendo GameBoy - NGB;7,95 EUR;+19,95 EUR shipping;from Netherlands;
GB -- Ishido -- Game Boy, JAPAN Game Nintendo. Clean & Work fully!! 11747;4,26 EUR;+2,13 EUR shipping;from Japan;
GB -- The Way of Stones. Ishido -- Box. Game Boy, JAPAN Nintendo.  11747;15,35 EUR;+4,26 EUR shipping;from Japan;
Ishido The Way of Stones Nintendo Game Boy Instruction MANUAL ONLY;4,24 EUR;Free shipping;from United States;
Ishido: The Way of Stones (Nintendo Game Boy) Instruction Booklet ONLY;5,11 EUR;Free shipping;from United States;
Ishido The Way fo the Stones Gameboy Great Condition;5,06 EUR;+3,40 EUR shipping;from United States;
Ishido The Way of Stones ORIGINAL Nintendo GameBoy Game Tested WORKING Authentic;8,52 EUR;+4,18 EUR shipping;from United States;
Nintendo GameBoy game Ishido: The Way of Stones JAPAN boxed MINT CONDITION;43,04 EUR;Free International Shipping;from Germany;
Nintendo GameBoy game - Ishido: The Way of Stones JAPAN boxed  MINT CONDITION;39,23 EUR;Free International Shipping;from Germany;
Nintendo GameBoy game - Ishido: The Way of Stones JAPAN boxed  MINT CONDITION;43,18 EUR;+53,15 EUR shipping;from Germany;
GameBoy - Ishido: The Way of Stones JAPAN dans l'emballage utilisé COMME NEUF;46,99 EUR;+69,99 EUR shipping;from Germany;
GameBoy - Ishido: The Way of Stones JAPAN nell'imballaggio usato COME NUOVO;48,99 EUR;+69,99 EUR shipping;from Germany;
Ishido: The Way of Stones (Nintendo Gameboy) manual only, no game;8,73 EUR;Free shipping;from United States;
Ishido Way of Stones Original Nintendo Gameboy Instruction Manual Only;4,68 EUR;+1,70 EUR shipping;from United States;
Ninja Ra Hoi! Ishido Famicom FC Game Boy GB 1990 GAME MAGAZINE PROMO CLIPPING;10,99 EUR;+21,32 EUR shipping;from Japan;
Shiten Myouou Ishido Mega Drive MD Game Boy GB 1990 GAME MAGAZINE PROMO CLIPPING;9,28 EUR;+21,32 EUR shipping;from Japan;
Ishido Way of the Stones Nintendo Gameboy Instruction Manual Only ;4,37 EUR;Free shipping;from United States;
Ishido The Way Of The Stones Nintendo Game Boy Gameboy Authentic Cartridge CIB;127,93 EUR;+8,44 EUR shipping;from United States;
Ishido The Way Of The Stones Nintendo Gameboy Manual;13,65 EUR;+3,41 EUR shipping;from United States;
