Nintendo Gameboy "Robocop vs Terminator";9,80 EUR;+ 3,58 EUR de envío;Vendidos  25 ago 2021Artículo vendido;desde Estados Unidos;
Gameboy Robocop vs Terminator Probado!!!!!! auténtico!!!;25,56 EUR;Envío gratis;Vendidos  22 ago 2021Artículo vendido;desde Estados Unidos;
Nintendo Gameboy "Robocop vs Terminator" - auténtica y probado;15,34 EUR;+ 1,70 EUR de envío;Vendidos  13 jul 2021Artículo vendido;desde Estados Unidos;
Sega Mega Drive Robocop vs Terminator Cartucho De Juego Completo;32,80 EUR;+ 35,36 EUR de envío estimado;Vendidos  21 jun 2021Artículo vendido;desde Reino Unido;
Robocop vs Terminator Sega Game Gear Cartucho De Juego;15,34 EUR;+ 33,09 EUR de envío estimado;Vendidos  8 sep 2021Artículo vendido;desde Reino Unido;
Sega Megadrive Robocop vs Terminator juego solo carro;14,64 EUR;+ 32,40 EUR de envío estimado;Vendidos  28 ago 2021Artículo vendido;desde Reino Unido;
Robocop vs Terminator Sega Megadrive Juego. en caja con instrucciones. V. Buenas Cond;24,54 EUR;Envío no especificado;Vendidos  23 jun 2021Artículo vendido;desde Reino Unido;
Robocop vs Terminator (SEGA MEGA DRIVE - PAL);38,00 EUR;+ 7,00 EUR de envío;Vendidos  7 jul 2021Artículo vendido;desde Portugal;
Robocop vs Terminator Mega Drive Megadrive De Trabajo Manual Caja De Cartucho De Juego;35,14 EUR;+ 17,08 EUR de envío estimado;Vendidos  31 jul 2021Artículo vendido;desde Reino Unido;
Robocop vs Terminator-PAL-Sega Master Sistema-Completo con Manual! frente a;24,58 EUR;+ 23,43 EUR de envío;Vendidos  1 sep 2021Artículo vendido;desde Reino Unido;
Sega Megadrive Robocop vs Terminator;35,13 EUR;+ 17,08 EUR de envío estimado;Vendidos  28 jun 2021Artículo vendido;desde Reino Unido;
Instrucciones de * SOLAMENTE * Robocop vs Terminator MANUAL SEGA Master sistema.;6,91 EUR;+ 16,56 EUR de envío estimado;Vendidos  8 ago 2021Artículo vendido;desde Reino Unido;
Robocop vs Terminator-SEGA Mega Drive Completo con Manual;35,14 EUR;+ 5,86 EUR de envío;Vendidos  7 sep 2021Artículo vendido;desde Reino Unido;
Robocop vs Terminator Mega Drive CIB;29,28 EUR;+ 20,72 EUR de envío estimado;Vendidos  1 ago 2021Artículo vendido;desde Reino Unido;
Sega Megadrive Robocop vs Terminator Completo con Manual Mega Drive Genesis;38,30 EUR;+ 35,47 EUR de envío estimado;Vendidos  4 jul 2021Artículo vendido;desde Reino Unido;
Robocop vs Terminator, Xenón 2, sombra de la bestia 2-Sega Mega Drive-Probado;61,49 EUR;+ 17,56 EUR de envío estimado;Vendidos  24 jun 2021Artículo vendido;desde Reino Unido;
Sega Megadrive Robocop vs Terminator Completo con Manual Mega Drive Genesis;38,64 EUR;+ 17,15 EUR de envío estimado;Vendidos  9 jul 2021Artículo vendido;desde Reino Unido;
