Chicken Run Para Nintendo Gameboy Color Game Boy Colour GBC;3,51 EUR;+ 31,89 EUR de envío estimado;Vendidos  25 ago 2021Artículo vendido;desde Reino Unido;
GBC-Chicken Run para Nintendo Gameboy Color;4,95 EUR;+ 6,50 EUR de envío;Vendidos  7 ago 2021Artículo vendido;desde Alemania;
Chicken Run-Nintendo Game Boy Color Cartucho-EUR;3,22 EUR;+ 17,66 EUR de envío estimado;Vendidos  19 jul 2021Artículo vendido;desde Reino Unido;
Chicken Run-Nintendo Game Boy Color-limpiado & Probado;8,50 EUR;Envío gratis;Vendidos  25 sep 2021Artículo vendido;desde Estados Unidos;
Chicken Run-Game Boy Color-flojo-solo Carro-limpiado & probado-Usado;2,54 EUR;+ 3,42 EUR de envío;Vendidos  23 sep 2021Artículo vendido;desde Estados Unidos;
Chicken Run-Nintendo Game Boy Color;6,83 EUR;Envío gratis;Vendidos  12 sep 2021Artículo vendido;desde Estados Unidos;
Chicken Run Nintendo Game Boy Color * limpiado & Probado *;5,96 EUR;Envío gratis;Vendidos  3 sep 2021Artículo vendido;desde Estados Unidos;
Chicken Run (Nintendo GameBoy Color, 2000) - solo Carro-limpiado & probado, authe;6,79 EUR;Envío gratis;Vendidos  28 jul 2021Artículo vendido;desde Estados Unidos;
Consola De Color Game Chico y 16 Juegos Army Men Prince of Chicken Run Persia Fifa;87,85 EUR;+ 32,27 EUR de envío estimado;Vendidos  8 jul 2021Artículo vendido;desde Reino Unido;
