Nintendo GameBoy Color juego - Boarder Zone cartucho usado;21,99 EUR;Envío internacional gratis;desde Alemania;
Boarder Zone (Nintendo Gameboy Color, 1998) Cartridge Only - Authentic - Works;5,78 EUR;+ 6,12 EUR de envío;desde Canadá;
Boarder Zone Freeride (Nintendo Game Boy Color) GBC Authentic/Cleaned - Gameboy;6,78 EUR;+ 10,18 EUR de envío;desde Canadá;
Boarder Zone Freeride - Snowboarding - Game Cart - Tested - GameBoy Color;6,05 EUR;+ 11,09 EUR de envío;desde Canadá;
Nintendo GameBoy Color jeu - Boarder Zone cartouche utilisé;19,99 EUR;Envío internacional gratis;desde Alemania;
Nintendo GameBoy Color gioco - Boarder Zone cartuccia usato;21,99 EUR;Envío internacional gratis;desde Alemania;
Nintendo GameBoy Color game - Boarder Zone cartridge;15,64 EUR;Envío internacional gratis;desde Alemania;
