Game Boy Monopoly Game Boy Color Nintendo Japan Import;25,99 EUR;+ 19,50 EUR de envío;desde España;
Nintendo Game Boy Color portátil de consola-Atomic Púrpura/Monopoly Pac-Man;84,81 EUR;+ 8,65 EUR de envío;desde Estados Unidos;
Game Boy Monopoly (Nintendo Game Boy Color GBC, 1998) Japan Import;6,74 EUR;+ 3,88 EUR de envío;desde Canadá;
Nintendo Gameboy Color Video Juego Monopoly;4,99 EUR;+ 3,64 EUR de envío;desde Estados Unidos;
Monopoly (Nintendo Game Boy Color, 1999);20,23 EUR;+ 10,11 EUR de envío;desde Canadá;
Monopoly (Nintendo Game Boy Color, 1999) GBC Japan Import;15,51 EUR;+ 32,37 EUR de envío;desde Canadá;
GameBoy Color - Monopoly Cartridge + Booklet Japan;18,60 EUR;+ 18,60 EUR de envío;desde Australia;
Monopoly Game Boy juego completo con embalaje original y guía;39,99 EUR;+ 30,00 EUR de envío;desde Alemania;
Notice NIntendo Game Boy  Monopoly EUR Très Bon état;6,90 EUR;+ 11,98 EUR de envío;desde Francia;
