Space Invaders Nintendo Game Boy Gameboy juego oficial versión UK/euro GB;19,89 EUR;+ 4,45 EUR de envío;Vendidos  14 sep 2021Artículo vendido;desde Reino Unido;
Retro Games Space Invaders individual Duvet del lecho Pac-Man Reversible Niños Chicos;23,35 EUR;+ 26,38 EUR de envío estimado;Vendidos  2 sep 2021Artículo vendido;desde Reino Unido;
Space Invaders GameBoy Advance juego rápido y Entrega Gratis;11,68 EUR;+ 16,65 EUR de envío estimado;Vendidos  26 ago 2021Artículo vendido;desde Reino Unido;
Nintendo GAME BOY COLOR Juego-Space Invaders-solo carro GBA DS;14,04 EUR;+ 16,68 EUR de envío estimado;Vendidos  21 ago 2021Artículo vendido;desde Reino Unido;
NINTENDO GAMEBOY COLOR: Space Invaders ** solo Carro-Videojuego-UK;12,82 EUR;+ 16,66 EUR de envío estimado;Vendidos  20 ago 2021Artículo vendido;desde Reino Unido;
Space Invaders Nintendo Gameboy Color Advance Juego;11,69 EUR;+ 16,65 EUR de envío estimado;Vendidos  19 ago 2021Artículo vendido;desde Reino Unido;
Nintendo Game Boy Color Space Invaders;13,99 EUR;+ 16,68 EUR de envío estimado;Vendidos  18 ago 2021Artículo vendido;desde Reino Unido;
Space Invaders Gameboy;10,52 EUR;+ 16,39 EUR de envío;Vendidos  6 ago 2021Artículo vendido;desde Reino Unido;
Nintendo Gameboy Paquete De Juegos Donkey Kong Wave Race Space Invaders;23,35 EUR;+ 16,86 EUR de envío estimado;Vendidos  4 ago 2021Artículo vendido;desde Reino Unido;
Clásico Retro Juego Space Invaders Inspirada Niños Niños Camiseta Talla 7-8yrs;3,51 EUR;+ 23,00 EUR de envío estimado;Vendidos  31 jul 2021Artículo vendido;desde Reino Unido;
Retro Games Space Invaders individual Duvet del lecho Pac-Man Reversible Niños Chicos;23,35 EUR;+ 26,38 EUR de envío estimado;Vendidos  28 jul 2021Artículo vendido;desde Reino Unido;
Space Invaders Retro Computadora Acade Juego Feliz Cumpleaños Tarjeta De Saludos niño hijo;3,22 EUR;+ 5,27 EUR de envío;Vendidos  27 jul 2021Artículo vendido;desde Reino Unido;
Gioco Space Invaders Sono Tornati! Nintendo Game Boy Gig ;129,00 EUR;+ 39,00 EUR de envío;Vendidos  16 jul 2021Artículo vendido;desde Italia;
Space Invaders para Nintendo Game Boy Con Estuche Oficial;12,86 EUR;+ 16,67 EUR de envío estimado;Vendidos  10 jul 2021Artículo vendido;desde Reino Unido;
Space Invaders (Nintendo Game Boy Color, 1999) solo carro GBC;12,86 EUR;+ 16,67 EUR de envío estimado;Vendidos  8 jul 2021Artículo vendido;desde Reino Unido;
Nintendo Gameboy-Space Invaders;17,50 EUR;+ 16,75 EUR de envío estimado;Vendidos  6 jul 2021Artículo vendido;desde Reino Unido;
Lote de 7 Juegos Gameboy En Caja Con Manuales Space Invaders Galaga WWF Gremlins..;128,76 EUR;+ 23,49 EUR de envío estimado;Vendidos  28 jun 2021Artículo vendido;desde Reino Unido;
Marvel para Hombres Niños de manga corta camiseta medio M Space Invaders Juego Azul Marino;8,18 EUR;+ 20,08 EUR de envío estimado;Vendidos  21 jun 2021Artículo vendido;desde Reino Unido;
Space Invaders Nintendo Game Boy Gameboy Auténtico Original;12,74 EUR;Envío gratis;Vendidos  17 sep 2021Artículo vendido;desde Estados Unidos;
Nuevo anuncioSpace Invaders (Nintendo Game Boy Advance, 2002) Carro Y Manual, auténtico;16,15 EUR;Envío gratis;Vendidos  16 sep 2021Artículo vendido;desde Estados Unidos;
Space Invaders (Nintendo Game Boy, 1994) sólo cartucho de juego Boy!;5,77 EUR;+ 3,78 EUR de envío;Vendidos  15 sep 2021Artículo vendido;desde Estados Unidos;
Space Invaders Nintendo GAME BOY Video Juego;6,80 EUR;+ 3,83 EUR de envío;Vendidos  15 sep 2021Artículo vendido;desde Estados Unidos;
Space Invaders Nintendo Gameboy - Instruction Manual Included - Tested & Working;27,83 EUR;+ 18,56 EUR de envío;Vendidos  15 sep 2021Artículo vendido;desde Australia;
Nintendo Game Boy Space Invaders Juego, probado, Rápido, Envío Gratis;8,49 EUR;Envío gratis;Vendidos  11 sep 2021Artículo vendido;desde Estados Unidos;
💖 NINTENDO GAMEBOY ADVANCE Space Invaders 2001 nuevo sin abrir/Sellado Vintage;21,25 EUR;+ 4,25 EUR de envío;Vendidos  11 sep 2021Artículo vendido;desde Estados Unidos;
💖 NINTENDO GAMEBOY ADVANCE Space Invaders 2001 nuevo sin abrir/Sellado Vintage B;21,25 EUR;+ 4,25 EUR de envío;Vendidos  10 sep 2021Artículo vendido;desde Estados Unidos;
Nintendo Gameboy Original Space Invaders con folleto Probado Funciona;11,90 EUR;+ 3,49 EUR de envío;Vendidos  10 sep 2021Artículo vendido;desde Estados Unidos;
Space Invaders Original Nintendo Gameboy Color Libro Folleto De Instrucciones Manual;5,94 EUR;Envío gratis;Vendidos  10 sep 2021Artículo vendido;desde Estados Unidos;
Space Invaders Nueva (Nintendo Game Boy Color) GBC Gameboy Nuevo En Caja Sellada Retro;152,97 EUR;Envío gratis;Vendidos  10 sep 2021Artículo vendido;desde Estados Unidos;
Space Invaders, Nintendo Game Boy Color, 1999, carro De Juego Solamente, pre-owned;5,06 EUR;+ 4,25 EUR de envío;Vendidos  7 sep 2021Artículo vendido;desde Estados Unidos;
Space Invaders (Nintendo Gameboy video juego) Auténtico;7,64 EUR;+ 3,39 EUR de envío;Vendidos  7 sep 2021Artículo vendido;desde Estados Unidos;
Lote de 2 Cartuchos Nintendo Game Boy-Pac-Man & Space Invaders no probado;6,38 EUR;+ 3,78 EUR de envío;Vendidos  4 sep 2021Artículo vendido;desde Estados Unidos;
Space Invaders-Nintendo Game Boy, auténtico Cartucho sólo, probado y funcionando;10,20 EUR;Envío gratis;Vendidos  2 sep 2021Artículo vendido;desde Estados Unidos;
Space Invaders (Nintendo Game Boy, 1994) Con Caja Original;30,59 EUR;+ 9,34 EUR de envío;Vendidos  1 sep 2021Artículo vendido;desde Estados Unidos;
Space Invaders Nintendo Game Boy;11,45 EUR;+ 2,51 EUR de envío;Vendidos  1 sep 2021Artículo vendido;desde Estados Unidos;
Original Space Invaders GB Nintendo Game Boy Japón importación Taito Shooter Completa;20,39 EUR;+ 16,16 EUR de envío;Vendidos  1 sep 2021Artículo vendido;desde Japón;
Space Invaders Juego Boy Cartucho en Caja Juego, Caja Y Manual Incluido!;42,50 EUR;+ 4,12 EUR de envío;Vendidos  30 ago 2021Artículo vendido;desde Estados Unidos;
Space Invaders Para Gameboy;15,29 EUR;Envío gratis;Vendidos  29 ago 2021Artículo vendido;desde Estados Unidos;
Nintendo GameBoy Pocket Black - Handheld Console MGB-001 With Space Invaders;42,69 EUR;+ 13,39 EUR de envío;Vendidos  27 ago 2021Artículo vendido;desde Canadá;
Space Invaders ORIGINAL NINTENDO Gameboy juego probado + trabajo & Auténtico!;20,34 EUR;Envío gratis;Vendidos  27 ago 2021Artículo vendido;desde Estados Unidos;
Space Invaders Nintendo Game Boy;46,75 EUR;Envío gratis;Vendidos  27 ago 2021Artículo vendido;desde Estados Unidos;
Space Invaders ORIGINAL NINTENDO Gameboy juego probado + trabajo & Auténtico!;12,74 EUR;+ 3,61 EUR de envío;Vendidos  27 ago 2021Artículo vendido;desde Estados Unidos;
Space Invaders Juego Boy Color;10,18 EUR;+ 2,51 EUR de envío;Vendidos  27 ago 2021Artículo vendido;desde Estados Unidos;
Space Invaders Nintendo Gameboy ADVANCE GBA probado auténtico Funciona Con Estuche Intec;21,24 EUR;Envío gratis;Vendidos  25 ago 2021Artículo vendido;desde Estados Unidos;
Space Invaders (Nintendo Game Boy, 1994) * Probado Con Manual;12,74 EUR;+ 3,61 EUR de envío;Vendidos  25 ago 2021Artículo vendido;desde Estados Unidos;
Space Invaders Nintendo Game Boy Color Gameboy Auténtico Original!;5,94 EUR;+ 3,53 EUR de envío;Vendidos  24 ago 2021Artículo vendido;desde Estados Unidos;
Space Invaders Nintendo Game Boy Color Gameboy Auténtico Original!;11,03 EUR;Envío gratis;Vendidos  23 ago 2021Artículo vendido;desde Estados Unidos;
Nintendo Game Boy Color Space Invaders Solo Carro Probado;4,75 EUR;+ 3,16 EUR de envío;Vendidos  23 ago 2021Artículo vendido;desde Estados Unidos;
Space Invaders GBA auténtico Game Boy GameBoy Advance Nintendo Genuino invasor;21,24 EUR;Envío gratis;Vendidos  22 ago 2021Artículo vendido;desde Estados Unidos;
Space Invaders (Nintendo Game Boy, 1994) Folleto De Instrucciones Solo Manual;1,70 EUR;Envío gratis;Vendidos  21 ago 2021Artículo vendido;desde Estados Unidos;
Super Gameboy Space Invaders G-DMG Inserto de instrucción-SP-Manual de Estados Unidos solamente;4,23 EUR;Envío gratis;Vendidos  21 ago 2021Artículo vendido;desde Estados Unidos;
Space Invaders (Nintendo Game Boy, 1994) Sólo Cartucho;7,65 EUR;+ 3,53 EUR de envío;Vendidos  17 ago 2021Artículo vendido;desde Estados Unidos;
Space Invaders Nintendo Game Boy Gameboy Auténtico Original!;12,28 EUR;Envío gratis;Vendidos  16 ago 2021Artículo vendido;desde Estados Unidos;
Space Invaders Nintendo Gameboy ADVANCE GBA probado Auténtico;19,54 EUR;Envío gratis;Vendidos  12 ago 2021Artículo vendido;desde Estados Unidos;
Space Invaders (Nintendo Game Boy Color, 1999) en caso con Samus Cartel;8,49 EUR;+ 4,17 EUR de envío;Vendidos  11 ago 2021Artículo vendido;desde Estados Unidos;
Space Invaders Atari 2600 juego solo carro;5,84 EUR;+ 18,33 EUR de envío estimado;Vendidos  1 ago 2021Artículo vendido;desde Reino Unido;
Space Invaders ATARI 2600 Video Juego Cartucho (probado y funcionando) PAL;8,50 EUR;+ 18,34 EUR de envío estimado;Vendidos  19 jul 2021Artículo vendido;desde Reino Unido;
Space Invaders: invasión día de Vídeo Juego Para Sony PlayStation PS2 Pal probado;5,84 EUR;+ 16,54 EUR de envío estimado;Vendidos  29 ago 2021Artículo vendido;desde Reino Unido;
Space Invaders Revolución-Nintendo DS Juego - 2DS 3DS DSi-Gratis, Rápido P&P!;17,55 EUR;+ 6,85 EUR de envío;Vendidos  8 ago 2021Artículo vendido;desde Reino Unido;
Space Invaders 91 Genuino Sega Genesis Mega Drive cartucho de juego solamente.;23,24 EUR;+ 14,05 EUR de envío;Vendidos  28 jul 2021Artículo vendido;desde Reino Unido;
Space Invaders PS1 Juego;10,42 EUR;+ 8,18 EUR de envío;Vendidos  30 ago 2021Artículo vendido;desde Reino Unido;
Sony Playstation 1 PS1 Consola Juego-Space Invaders;6,15 EUR;+ 18,87 EUR de envío estimado;Vendidos  18 jul 2021Artículo vendido;desde Reino Unido;
Space Invaders PS1 Juego UK PAL USADO;6,73 EUR;+ 16,55 EUR de envío estimado;Vendidos  28 jul 2021Artículo vendido;desde Reino Unido;
Space Invaders ATARI 2600 video juego #1 En Caja Completa (probado y funcionando) PAL;21,37 EUR;+ 20,92 EUR de envío estimado;Vendidos  30 jul 2021Artículo vendido;desde Reino Unido;
Asteroids/Space Invaders ATARI 2600 Video Juego Cartucho bundle Pal;17,86 EUR;+ 17,56 EUR de envío;Vendidos  23 jun 2021Artículo vendido;desde Reino Unido;
Space Invaders aniversario (PC CD),, usada; Buen Juego;2,90 EUR;+ 2,15 EUR de envío;Vendidos  14 jul 2021Artículo vendido;desde Reino Unido;
Space Invaders para Atari 2600 (Atari, 1978) juego solamente, no manual;8,18 EUR;+ 16,58 EUR de envío estimado;Vendidos  13 ago 2021Artículo vendido;desde Reino Unido;
Super Space Invaders Sega Game Gear CIB RAROS COLECCIONISTAS #0063;87,73 EUR;+ 26,84 EUR de envío estimado;Vendidos  16 sep 2021Artículo vendido;desde Reino Unido;
Space Invaders invasión día PS2 Juego;4,57 EUR;+ 8,18 EUR de envío;Vendidos  11 jul 2021Artículo vendido;desde Reino Unido;
Space Invaders Extreme (Nintendo DS),, usada; Buen Juego;12,51 EUR;+ 2,15 EUR de envío;Vendidos  5 ago 2021Artículo vendido;desde Reino Unido;
Space Invaders-Atari 2600 Juego en caja con instrucciones, trabajando;15,21 EUR;+ 18,85 EUR de envío estimado;Vendidos  29 ago 2021Artículo vendido;desde Reino Unido;
Super Space Invaders Sega Game Gear;11,65 EUR;+ 16,65 EUR de envío estimado;Vendidos  27 ago 2021Artículo vendido;desde Reino Unido;
Game gear juego, Super Space Invaders;5,84 EUR;+ 18,30 EUR de envío estimado;Vendidos  7 ago 2021Artículo vendido;desde Reino Unido;
SEGA Game Gear Super Space Invaders EUR Très Bon état;14,90 EUR;+ 11,98 EUR de envío;Vendidos  8 sep 2021Artículo vendido;desde Francia;
DS Juego-Space Invaders Extreme-Nuevo y Sellado;35,06 EUR;+ 17,07 EUR de envío estimado;Vendidos  30 jul 2021Artículo vendido;desde Reino Unido;
PSP juego, Space Invaders evolución, Sony Playstation Portable, Con Manual;11,69 EUR;+ 16,65 EUR de envío estimado;Vendidos  10 jul 2021Artículo vendido;desde Reino Unido;
Space Invaders Revolución (Nintendo DS),, usada; Buen Juego;9,28 EUR;+ 2,15 EUR de envío;Vendidos  15 jul 2021Artículo vendido;desde Reino Unido;
Space Invaders (Sony PlayStation 1, 1999) - PAL PS1 Juego-Activision -;8,91 EUR;+ 16,59 EUR de envío estimado;Vendidos  22 jul 2021Artículo vendido;desde Reino Unido;
Space Invaders aniversario-PC CD ROM Juego-Space Invaders Juego Rápido Despacho;5,84 EUR;+ 16,54 EUR de envío estimado;Vendidos  18 ago 2021Artículo vendido;desde Reino Unido;
Space Invaders CV-2632-P Atari 2600 Equipo Juego CARTUCHO solo Probado Funcionando;9,35 EUR;+ 17,55 EUR de envío;Vendidos  23 jul 2021Artículo vendido;desde Reino Unido;
