Nintendo Game Boy Amazing Penguin-Top-Embalaje original-NTSC;499,90 EUR;Envío no especificado;desde Alemania;
Nintendo Game Boy Amazing Penguin-Top-Embalaje original-NTSC;279,90 EUR;Envío no especificado;desde Alemania;
Amazing Penguin FRG - Nintendo GameBoy - NGB;18,36 EUR;+ 19,95 EUR de envío;desde Países Bajos;
Gb-Amazing Penguin para Nintendo GameBoy;24,95 EUR;+ 9,95 EUR de envío;desde Alemania;
Amazing Penguin, Nintendo Game Boy, Authentic, Cart Only, Tested;12,61 EUR;+ 5,98 EUR de envío;desde Canadá;
Amazing Penguin - Nintendo Game Boy;23,25 EUR;+ 1,99 EUR de envío;desde Canadá;
Nintendo GameBoy Osawagase! Penguin Boy / Amazing Penguin Japan Cartridge;18,48 EUR;+ 9,24 EUR de envío;desde Australia;
