Vintage Video Juego Nintendo GameBoy Penguin Land * Importado Japonés *;23,43 EUR;+ 9,96 EUR de envío;desde Reino Unido;
Penguin Land DMG-PLJ cartucho Gameboy GB Japan leer;9,95 EUR;+ 8,95 EUR de envío;desde España;
Penguin Land Japón importación Nintendo Gameboy Cartucho Original En Caja Juego Completo Vendedor de Estados Unidos;29,81 EUR;+ 1,70 EUR de envío;desde Estados Unidos;
Penguin Land GB Pony Canyon Nintendo Gameboy de Japón;17,47 EUR;+ 16,70 EUR de envío;desde Japón;
Penguin Land GB Pony Canyon Nintendo Gameboy de Japón;6,90 EUR;+ 17,04 EUR de envío;desde Japón;
Penguin Land GB Pony Canyon Nintendo Gameboy de Japón;8,02 EUR;+ 12,35 EUR de envío;desde Japón;
