Gameboy juego-The Incredible Crash Dummies (PAL) (módulo) 11131267;4,89 EUR;+ 67,99 EUR de envío;Vendidos  23 ago 2021Artículo vendido;desde Alemania;
The Incredible Crash Dummies-para Nintendo Game Boy en OVP cib/pal sin usar;119,90 EUR;+ 29,90 EUR de envío;Vendidos  30 jun 2021Artículo vendido;desde Alemania;
The Incredible Crash Dummies - Nintendo NES;89,00 EUR;+ 25,00 EUR de envío;Vendidos  8 sep 2021Artículo vendido;desde Países Bajos;
Tyco The Incredible Crash Dummies Bash n bombarderos Crash car Mint Sealed;199,00 EUR;+ 15,99 EUR de envío;Vendidos  3 sep 2021Artículo vendido;desde Alemania;
The Incredible Crash Dummies-Sega Mega Drive-pal-OVP + Manual-cib;15,95 EUR;Envío no especificado;Vendidos  16 jul 2021Artículo vendido;desde Alemania;
The Incredible Crash Dummies Nintendo NES instrucciones cómo jugar manual fra;9,80 EUR;Envío no especificado;Vendidos  20 ago 2021Artículo vendido;desde Alemania;
