Godzilla dominaci칩n Gameboy Advance GBA 游눮% original juego probado + Caja Protector;40,72 EUR;+ 17,07 EUR de env칤o estimado;desde Reino Unido;
Godzilla la serie Monster guerras Nintendo Game Boy Color Advance Carro Genuino;18,56 EUR;+6,98 EUR de env칤o;desde Reino Unido;
NINTENDO GAME BOY-Godzilla (en Caja);319,94 EUR;Env칤o internacional gratis;desde Reino Unido;
Nintendo Game Boy Color Godzilla EUR Tr칟s Bon 칠tat;9,90 EUR;+11,98 EUR de env칤o;desde Francia;
Godzilla (Nintendo Game Boy, 1990) RARE ReD Version;229,95 EUR;+24,95 EUR de env칤o;desde Francia;
Godzilla Nintendo Game Boy Juego Completo Con Caja Y Manual;298,51 EUR;+17,06 EUR de env칤o;desde Alemania;
NINTENDO GAME BOY Godzilla juego de la serie;7,55 EUR;+18,61 EUR de env칤o;desde Reino Unido;
Godzilla Mattel 1St Edition per Nintendo Game boy  GBC-GBA-SP-GBPK;22,90 EUR;+11,90 EUR de env칤o;desde Italia;
Nintendo Game Boy Advance Juego: Godzilla dominaci칩n Nuevo y en caja sin abrir..;87,27 EUR;+ 22,61 EUR de env칤o estimado;desde Reino Unido;
Nintendo Game Boy Color GBC Godzilla MONSTRUO Wars PAL EUR GC cartucho s칩lo;17,34 EUR;+13,96 EUR de env칤o;desde Reino Unido;
Nintendo Console Play Gioco Game Boy Cartuccia GameBoy DMG-GZ-ITA  Godzilla;29,00 EUR;+12,00 EUR de env칤o;desde Italia;
Godzilla dominaci칩n Gba;20,95 EUR;+ 16,71 EUR de env칤o estimado;desde Reino Unido;
Godzilla The Series game boy color completo con embalaje original y gu칤a;39,99 EUR;+8,00 EUR de env칤o;desde Alemania;
Nintendo Gameboy Juego-Godzilla la serie;12,52 EUR;+ 16,56 EUR de env칤o estimado;desde Reino Unido;
Godzilla Nintendo Game Boy-La Serie Color;9,89 EUR;+5,82 EUR de env칤o;desde Reino Unido;
Godzilla Gameboy juego! busque en la tienda!;40,73 EUR;+ 19,98 EUR de env칤o estimado;desde Reino Unido;
Nintendo Game Boy Godzilla MONSTRUO guerras;10,09 EUR;+8,52 EUR de env칤o;desde Bulgaria;
Godzilla - The Series - EUR - Nintendo Gameboy Color - GBC;40,00 EUR;+25,00 EUR de env칤o;desde Pa칤ses Bajos;
Nintendo Gameboy Color - Godzilla Monster Wars - GAME ONLY;5,00 EUR;+11,00 EUR de env칤o;desde Pa칤ses Bajos;
Nintendo Game Boy Godzilla la versi칩n de juego serie euros;5,81 EUR;+ 19,93 EUR de env칤o estimado;desde Reino Unido;
Godzilla - Monster Wars f칲r Gameboy Color / GBC;13,99 EUR;+15,10 EUR de env칤o;desde Austria;
Godzilla - The Series - Monster Wars - EUR - Nintendo Gameboy Color - GBC;59,00 EUR;+25,00 EUR de env칤o;desde Pa칤ses Bajos;
Godzilla MONSTRUO guerras Nintendo Gameboy (REPRO);6,39 EUR;+ 16,44 EUR de env칤o estimado;desde Reino Unido;
Genuine Godzilla Gameboy Juego-solo carro;9,88 EUR;+ 16,51 EUR de env칤o estimado;desde Reino Unido;
Nintendo Game Boy - Godzilla - PAL - EUR;12,99 EUR;+5,00 EUR de env칤o;desde Francia;
Godzilla the Series: Monster Wars EUR - Nintendo GameBoy Color - GBC;14,95 EUR;+19,95 EUR de env칤o;desde Pa칤ses Bajos;
Godzilla the Series: Monster Wars EUR - Nintendo GameBoy Color - GBC;18,95 EUR;+19,95 EUR de env칤o;desde Pa칤ses Bajos;
Godzilla la serie Gameboy Color;34,90 EUR;+ 16,97 EUR de env칤o estimado;desde Reino Unido;
Godzilla la serie + 5 en 1 juego Galer칤a Nintendo Gameboy PAL Paquete De Carro;10,46 EUR;+7,56 EUR de env칤o;desde Reino Unido;
Godzilla-Monster guerras ** Oficial Nintendo Gameboy Colour Carro;16,58 EUR;+ 16,63 EUR de env칤o estimado;desde Reino Unido;
Nintendo Gameboy Game: Godzilla [PAL] (Complete) [UKV];69,95 EUR;+25,00 EUR de env칤o;desde Pa칤ses Bajos;
Godzilla dominaci칩n Gameboy Advance Raro GBA Nintendo Video Juego Caja Completa;219,93 EUR;+20,95 EUR de env칤o;desde Reino Unido;
Nintendo GameBoy Color Juego-Godzilla la serie: Cartucho de las guerras de las Monster;16,20 EUR;Env칤o internacional gratis;desde Alemania;
Godzilla-La Serie-Gameboy Color-Cartucho y Manual (J78);23,27 EUR;+ 16,76 EUR de env칤o estimado;desde Reino Unido;
Gameboy Color juego-Godzilla The Series MONSTER Wars (US import) (m칩dulo);8,98 EUR;+67,99 EUR de env칤o;desde Alemania;
