(NE6) Tetris (Nintendo Game Boy);7,02 EUR;+ 18,89 EUR de env칤o estimado;Vendidos  20 sep 2021Art칤culo vendido;desde Reino Unido;
Nuevo anuncioTetris 游끵 Nintendo Game Boy Classic, color, advance;7,99 EUR;Env칤o no especificado;Vendidos  20 sep 2021Art칤culo vendido;desde Alemania;
Tetris Game Boy nintendo gameboy;8,50 EUR;+9,00 EUR de env칤o;Vendidos  18 sep 2021Art칤culo vendido;desde Francia;
Tetris Blast En Caja Como Nuevo Nintendo Gameboy;40,98 EUR;+ 17,18 EUR de env칤o estimado;Vendidos  18 sep 2021Art칤culo vendido;desde Reino Unido;
Tetris Nintendo Gameboy Classic;14,99 EUR;Env칤o no especificado;Vendidos  18 sep 2021Art칤culo vendido;desde Alemania;
Tetris Dx En Caja Original Nintendo Gameboy Juego Completo;23,41 EUR;+ 19,79 EUR de env칤o estimado;Vendidos  18 sep 2021Art칤culo vendido;desde Reino Unido;
Genuine Tetris NINTENDO GAMEBOY Carro De Juego Original * * Probado Funcionando;17,56 EUR;+ 16,76 EUR de env칤o estimado;Vendidos  18 sep 2021Art칤culo vendido;desde Reino Unido;
Nintendo Game Boy Classic juego Tetris m칩dulo Noe;11,90 EUR;+8,99 EUR de env칤o;Vendidos  17 sep 2021Art칤culo vendido;desde Alemania;
Tetris-Game Boy-M칩dulo de juego-Nintendo-Game Boy-muy buen estado;16,49 EUR;Env칤o no especificado;Vendidos  17 sep 2021Art칤culo vendido;desde Alemania;
Tetris Nintendo Game Boy Gameboy juego muy bien probado;9,99 EUR;+14,99 EUR de env칤o;Vendidos  17 sep 2021Art칤culo vendido;desde Alemania;
Gb-Tetris Plus para Nintendo GameBoy;12,95 EUR;+9,95 EUR de env칤o;Vendidos  16 sep 2021Art칤culo vendido;desde Alemania;
Tetris 2 Nintendo Gameboy;11,70 EUR;+ 16,66 EUR de env칤o estimado;Vendidos  15 sep 2021Art칤culo vendido;desde Reino Unido;
Rare Game Boy Tetris version 1.0 - Alternate A-TYPE song, "Minuet" (DMG-TRA-0) ;45,00 EUR;+7,55 EUR de env칤o;Vendidos  14 sep 2021Art칤culo vendido;desde Espa침a;
Jeu Game Boy Tetris DMG-TR-NOE Pour Nintendo Cartouche Disquette;9,00 EUR;+5,60 EUR de env칤o;Vendidos  14 sep 2021Art칤culo vendido;desde Francia;
Tetris-Game Boy-M칩dulo de juego-Nintendo-Game Boy-buen estado;14,79 EUR;Env칤o no especificado;Vendidos  14 sep 2021Art칤culo vendido;desde Alemania;
Nintendo Gameboy Bolsillo Mario Tetris y funda de transporte;70,28 EUR;+ 26,19 EUR de env칤o estimado;Vendidos  13 sep 2021Art칤culo vendido;desde Reino Unido;
Tetris Nintendo Game Boy juego;9,99 EUR;Env칤o no especificado;Vendidos  13 sep 2021Art칤culo vendido;desde Alemania;
Tetris 2 Genuino Gameboy Cartucho De Juego Excelente Estado;7,55 EUR;+4,92 EUR de env칤o;Vendidos  12 sep 2021Art칤culo vendido;desde Reino Unido;
Tetris Nintendo GameBoy carro y libro juego Boy Probado;8,20 EUR;+ 20,33 EUR de env칤o estimado;Vendidos  12 sep 2021Art칤culo vendido;desde Reino Unido;
Tetris Dx Nintendo Gameboy Cartucho De Juego Vintage Hecho en Jap칩n;11,13 EUR;+ 18,97 EUR de env칤o estimado;Vendidos  12 sep 2021Art칤culo vendido;desde Reino Unido;
Nintendo Game Boy Tetris OVP;79,99 EUR;+8,50 EUR de env칤o;Vendidos  12 sep 2021Art칤culo vendido;desde Alemania;
Tetris Nintendo Game Boy Color Advance Juego Solo Carro Genuino Rompecabezas;15,17 EUR;+7,03 EUR de env칤o;Vendidos  11 sep 2021Art칤culo vendido;desde Reino Unido;
Nintendo Gameboy Tetris Juego Cartucho (s칩lo) DMG-TR-UKV-Juego Port치til ic칩nico;8,19 EUR;+ 19,45 EUR de env칤o estimado;Vendidos  11 sep 2021Art칤culo vendido;desde Reino Unido;
Tetris Nintendo Game Boy solo carro regi칩n libre Gameboy;10,48 EUR;+ 16,63 EUR de env칤o estimado;Vendidos  11 sep 2021Art칤culo vendido;desde Reino Unido;
Tetris (Nintendo GameBoy, 1989) ** solo carro ** ** ** Retro de condici칩n aceptable.;9,36 EUR;+ 17,77 EUR de env칤o estimado;Vendidos  11 sep 2021Art칤culo vendido;desde Reino Unido;
Nintendo Game Boy Advance GBA - Tetris Worlds - PAL - EUR;14,99 EUR;+5,00 EUR de env칤o;Vendidos  10 sep 2021Art칤culo vendido;desde Francia;
Flash (Nintendo Game Boy Tetris Juego) Jap칩n Importaci칩n;7,02 EUR;+ 16,56 EUR de env칤o estimado;Vendidos  10 sep 2021Art칤culo vendido;desde Reino Unido;
Tetris Dx Game Boy EUR ;12,00 EUR;Env칤o internacional gratis;Vendidos  9 sep 2021Art칤culo vendido;desde Francia;
Tetris Nintendo Gameboy-PAL;10,25 EUR;Env칤o no especificado;Vendidos  9 sep 2021Art칤culo vendido;desde Reino Unido;
Tetris Dx Nintendo Gameboy solo carro;14,04 EUR;+ 16,69 EUR de env칤o estimado;Vendidos  9 sep 2021Art칤culo vendido;desde Reino Unido;
Tetris Nintendo Game Boy Color Advance Juego Solo Carro Genuino Rompecabezas;15,17 EUR;+7,03 EUR de env칤o;Vendidos  8 sep 2021Art칤culo vendido;desde Reino Unido;
Tetris - NINTENDO GAME BOY ;11,90 EUR;+5,48 EUR de env칤o;Vendidos  8 sep 2021Art칤culo vendido;desde Francia;
Tetris 2-Game Boy-M칩dulo de juego-Nintendo-Game Boy-buen estado;11,99 EUR;Env칤o no especificado;Vendidos  7 sep 2021Art칤culo vendido;desde Alemania;
Nintendo Gameboy Paquete De Juegos Super Mario Land Chase HQ Batman Tetris;23,37 EUR;+15,23 EUR de env칤o;Vendidos  7 sep 2021Art칤culo vendido;desde Reino Unido;
