Daedalian Opus Nintendo Game Boy Cartucho en Caja Gameboy Excelente;50,27 EUR;+ 2,98 EUR de envío;Vendidos  10 sep 2021Artículo vendido;desde Estados Unidos;
Nintendo Gameboy Juego Daedalian Opus Cartucho en Caja Completo en Caja de sol se desvaneció;21,30 EUR;Envío gratis;Vendidos  10 sep 2021Artículo vendido;desde Estados Unidos;
Daedalian Opus, Nintendo Game Boy Juego, 1990, Probado;3,83 EUR;+ 3,41 EUR de envío;Vendidos  13 ago 2021Artículo vendido;desde Estados Unidos;
Daedalian Opus ORIGINAL NINTENDO GAMEBOY Juego Probado Funcionando auténtico!;8,48 EUR;Envío gratis;Vendidos  6 ago 2021Artículo vendido;desde Estados Unidos;
Daedalian Opus Nintendo Juego Original Boy * limpiado & Probado *;11,05 EUR;Envío gratis;Vendidos  15 jul 2021Artículo vendido;desde Estados Unidos;
GB Gameboy Daedalian Opus & flipull Nueva Juego Sellado de fábrica Boy Nintendo;242,81 EUR;Envío gratis;Vendidos  9 jul 2021Artículo vendido;desde Estados Unidos;
GB Gameboy Daedalian Opus Nueva Juego Sellado de fábrica Boy Nintendo;85,19 EUR;Envío gratis;Vendidos  9 jul 2021Artículo vendido;desde Estados Unidos;
Daedalian Opus ORIGINAL NINTENDO GAMEBOY Juego Probado Funcionando auténtico!;3,40 EUR;+ 3,66 EUR de envío;Vendidos  8 jul 2021Artículo vendido;desde Estados Unidos;
