Game Boy ★ Daedalian Opus ★ NTSC;5,99 EUR;Envío no especificado;desde España;
Daedalian Opus Nintendo Game Boy Juego Original (solo carro) ** GRATIS UK FRANQUEO **;16,28 EUR;+ 2,91 EUR de envío;desde Reino Unido;
Notice Nintendo Game Boy Daedalian Opus USA Très Bon état;9,90 EUR;+ 11,98 EUR de envío;desde Francia;
Daedalian Opus Nintendo Game Boy Juego Genuino (Solo Tarjeta);20,99 EUR;Envío internacional gratis;desde Reino Unido;
Nintendo Game Boy Daedalian Opus USA Très Bon état;9,90 EUR;+ 11,98 EUR de envío;desde Francia;
Nintendo Game Boy Daedalian Opus USA Excellent état;9,90 EUR;+ 11,98 EUR de envío;desde Francia;
Bouken! Rompecabezas Road (Daedalian Opus) para Nintendo Gameboy Japonés;5,35 EUR;+ 16,43 EUR de envío estimado;desde Reino Unido;
Daedalian Opus (Game Boy GB 1990) Solo Cartucho;13,11 EUR;+ 9,90 EUR de envío;desde España;
Daedalian Opus En Caja Nintendo Gameboy CIB;75,64 EUR;+ 23,27 EUR de envío;desde Reino Unido;
Daedalian Opus-Raro Nintendo Gameboy Juego con Estuche oficial-Juego de Puzzle;24,44 EUR;+ 5,82 EUR de envío;desde Reino Unido;
Daedalian Opus Vintage video juego (Nintendo Game Boy) ESN;8,52 EUR;Envío gratis;desde Estados Unidos;
GB-Daedalian Opus Nintendo Game Boy solo carro;8,44 EUR;Envío gratis;desde Estados Unidos;
Daedalian Opus-Nintendo Game Boy Gameboy * Completo En Caja Completo En Caja *;42,64 EUR;Envío gratis;desde Estados Unidos;
Daedalian Opus Gameboy;5,54 EUR;+ 4,44 EUR de envío;desde Estados Unidos;
Original Daedalian Opus-NINTENDO GAME BOY COLOR GBC;8,52 EUR;Envío gratis;desde Estados Unidos;
Daedalian Opus ORIGINAL NINTENDO GAMEBOY Juego Probado Funcionando auténtico!;12,44 EUR;desde Estados Unidos;
Daedalian Opus Nintendo Game Boy Jeu Véritable ( Cart Seulement);16,41 EUR;+ 2,91 EUR de envío;desde Reino Unido;
Daedalian Opus Nintendo Game Boy Game Genuine (Cart Only);16,68 EUR;+ 2,91 EUR de envío;desde Reino Unido;
Daedalian Opus Nintendo Gameboy no book or box;12,01 EUR;+ 15,40 EUR de envío;desde Australia;
Dos Nintendo GAME BOY Juegos Daedalian Opus, & Wave Race, hecha en Japón con casos;32,41 EUR;Envío gratis;desde Estados Unidos;
Daedalian Opus (Nintendo Game Boy Gameboy, 1990) -Cart Only ;9,80 EUR;+ 3,99 EUR de envío;desde Canadá;
Daedalian Opus (Nintendo Game Boy);7,97 EUR;+ 3,99 EUR de envío;desde Canadá;
Nintendo GameBoy cartucho de juego probadas! Daedalian Opus;8,52 EUR;+ 3,80 EUR de envío;desde Estados Unidos;
Daedalian Opus ORIGINAL NINTENDO GAMEBOY Juego Probado Funcionando auténtico!;9,37 EUR;Envío gratis;desde Estados Unidos;
Daedalian Opus (Nintendo Game Boy) Cart Only! ;8,60 EUR;+ 9,97 EUR de envío;desde Canadá;
Daedalian Opus Nintendo Gameboy limpio probado Auténtico Original;6,81 EUR;+ 3,80 EUR de envío;desde Estados Unidos;
Daedalian Opus (Nintendo Game Boy);5,28 EUR;+ 6,64 EUR de envío;desde Canadá;
Daedalian Opus - Jeu Nintendo Game Boy;9,99 EUR;+ 14,99 EUR de envío;desde Francia;
Daedalian Opus (Game Boy GB 1990) Solo Cartridge;23,74 EUR;+ 0,25 EUR de envío;desde España;
Daedalian Opus (Game Boy GB 1990) Solo Cartridge;13,33 EUR;+ 9,90 EUR de envío;desde España;
Daedalian Opus GameBoy Manual Incluido;21,32 EUR;Envío gratis;desde Estados Unidos;
Daedalian Opus Manual Gameboy Gameboy Nintendo GB;5,93 EUR;Envío gratis;desde Estados Unidos;
Daedalian Opus ORIGINAL NINTENDO GAMEBOY Juego Probado Funcionando auténtico!;9,81 EUR;Envío gratis;desde Estados Unidos;
Daedalian Opus ORIGINAL NINTENDO GAMEBOY Juego Probado Funcionando auténtico!;9,37 EUR;Envío gratis;desde Estados Unidos;
Daedalian Opus Nintendo Game Boy cartucho sólo;11,05 EUR;desde Estados Unidos;
Daedalian Opus - Jeu Nintendo Game Boy;5,00 EUR;+ 9,00 EUR de envío;desde Bélgica;
Daedalian Opus-Nintendo GAMEBOY;15,34 EUR;Envío gratis;desde Estados Unidos;
Daedalian Opus ORIGINAL NINTENDO GAMEBOY Juego + Antz Bugs Spiderman 7 Pc Mix Lote;42,64 EUR;+ 5,11 EUR de envío;desde Estados Unidos;
Nintendo Game Boy Daedalian Opus Instruction Booklet Manual Only Very Good;6,64 EUR;+ 3,32 EUR de envío;desde Canadá;
