Tetris DX - Nintendo Game boy / Game boy color - NTSC-J JAP;8,99 EUR;+ 3,00 EUR de envío;Vendidos  31 ago 2021Artículo vendido;desde Francia;
Nintendo Gameboy Color juego módulo Tetris DX con instrucciones y funda EUR;18,00 EUR;Envío no especificado;Vendidos  31 ago 2021Artículo vendido;desde Alemania;
Nintendo Game Boy Color juego Tetris DX con embalaje original y guía EUR;34,90 EUR;+ 8,99 EUR de envío;Vendidos  27 ago 2021Artículo vendido;desde Alemania;
Gameboy colores (verde azulado) con Tetris DX-Nintendo-Totalmente Funcional;46,79 EUR;+ 33,22 EUR de envío estimado;Vendidos  13 ago 2021Artículo vendido;desde Reino Unido;
Nintendo Gameboy Color y Tetris DX Color. en Caja. buenas condiciones de trabajo.;54,71 EUR;+ 59,12 EUR de envío estimado;Vendidos  11 jul 2021Artículo vendido;desde Reino Unido;
Nintendo Game Boy Color Berry Rojo CGB-001 con Mario Deluxe y Tetris DX en muy buena condición;70,18 EUR;+ 31,91 EUR de envío estimado;Vendidos  3 jul 2021Artículo vendido;desde Reino Unido;
GBC-Tetris DX para Nintendo Gameboy Color;14,95 EUR;+ 17,50 EUR de envío;Vendidos  2 jul 2021Artículo vendido;desde Alemania;
Nintendo Tetris DX game boy color Caja vacía e inserte y papeles;5,84 EUR;+ 17,55 EUR de envío;Vendidos  29 jun 2021Artículo vendido;desde Reino Unido;
