Nintendo Game Boy Color juego Tetris DX con embalaje original y guía EUR;39,90 EUR;+ 8,99 EUR de envío;desde Alemania;
Tetris DX - Nintendo Game boy / Game boy color - NTSC-J JAP;8,99 EUR;+ 3,00 EUR de envío;desde Francia;
Game Boy Color-Tetris DX-Top-Embalaje original-Pal;49,90 EUR;Envío no especificado;desde Alemania;
GBC Tetris DX JPN Japan Game Boy Color Nintendo;13,95 EUR;+ 2,50 EUR de envío;desde España;
Tetris DX Nintendo Gameboy Color NTSC Original Cartucho Cartridge;12,00 EUR;+ 37,00 EUR de envío;desde España;
Nintendo Game Boy Color ** Tetris DX ** Oficial Nintendo Folleto De Instrucciones Solamente;6,13 EUR;+ 16,50 EUR de envío estimado;desde Reino Unido;
Tetris DX-Game Boy Color-embalaje original/cib-pal/EUR-Top;31,99 EUR;Envío no especificado;desde Alemania;
Tetris DX gameboy color OVP;30,00 EUR;Envío no especificado;desde Alemania;
Game Boy Color GBC Tetris DX Nuovo nintendo;39,90 EUR;Envío no especificado;desde Italia;
Tetris DX gameboy color OVP cib Boxed #2;43,90 EUR;Envío no especificado;desde Alemania;
Game Boy Color GBC Tetris DX Nintendo – Completo;39,95 EUR;Envío no especificado;desde Italia;
Tetris DX cómo jugar instrucciones-gameboy color GBC Game Boy;4,49 EUR;Envío no especificado;desde Alemania;
Tetris DX Gameboy Game Boy Color cómo jugar instruction cuadernillo n UE;6,90 EUR;Envío no especificado;desde Alemania;
Notice de Tetris DX pour Nintendo Game Boy Color GBC FR - Floto Games;9,90 EUR;Envío no especificado;desde Francia;
Tetris DX gameboy color OVP cib Boxed;52,90 EUR;Envío no especificado;desde Alemania;
