Evel Knievel (Nintendo Game Boy Color, 1999, incl. OVP? Manual);69,95 EUR;+ 7,00 EUR de envío;desde Alemania;
Evel Knievel para gameboy color y Advance;14,99 EUR;Envío no especificado;desde Alemania;
Evel Knievel (buena) para el avance de juego Boy Pocket color SP;10,79 EUR;Envío no especificado;desde Alemania;
Evel Knievel-Nintendo Game Boy Color, auténtico Cartucho, probado y de trabajo;7,67 EUR;Envío gratis;desde Estados Unidos;
Evel Knievel (Nintendo Game Boy Color) GBC GB;11,07 EUR;+ 3,83 EUR de envío;desde Estados Unidos;
Evel Knievel (Nintendo Game Boy Color) Game Boy Color Auténtico Probado;29,82 EUR;+ 4,35 EUR de envío;desde Estados Unidos;
3 Game Boy Color Juegos Evel Knievel Sergy 3 Bolsillo profundo Gecko F-1 de carrera de trabajo;12,78 EUR;+ 5,07 EUR de envío;desde Estados Unidos;
Evel Knievel für Gameboy Color / GBC;19,99 EUR;+ 15,10 EUR de envío;desde Austria;
Nintendo Gameboy Color GBC - Evel Knievel + Manual;19,95 EUR;+ 4,50 EUR de envío;desde Países Bajos;
Evel Knievel Game Boy EUR ;10,00 EUR;Envío internacional gratis;desde Francia;
