Evel Knievel (Nintendo Game Boy Color, 1999, incl. OVP? Manual);69,95 EUR;+ 7,00 EUR de envío;desde Alemania;
Evel Knievel für Gameboy Color / GBC;19,99 EUR;+ 15,10 EUR de envío;desde Austria;
Nintendo Gameboy Color GBC - Evel Knievel + Manual;19,95 EUR;+ 4,50 EUR de envío;desde Países Bajos;
Evel Knievel para gameboy color y Advance;14,99 EUR;Envío no especificado;desde Alemania;
Evel Knievel (buena) para el avance de juego Boy Pocket color SP;10,79 EUR;Envío no especificado;desde Alemania;
Evel Knievel (Good) For Gameboy Pocket Color Advance Sp;11,44 EUR;Envío no especificado;desde Alemania;
Evel Knievel ( Bene) Per Gameboy Pocket Color Advance;11,62 EUR;Envío no especificado;desde Alemania;
Evel Knievel ( gut) für Gameboy Pocket Color Advance SP;11,16 EUR;Envío no especificado;desde Alemania;
Evel Knievel-Nintendo Game Boy Color, auténtico Cartucho, probado y de trabajo;7,68 EUR;Envío gratis;desde Estados Unidos;
Evel Knievel (Nintendo Game Boy Color, 1999) juego funciona!;7,68 EUR;+ 3,59 EUR de envío;desde Estados Unidos;
Evel Knievel (Nintendo Game Boy Color) GBC GB;11,09 EUR;+ 3,83 EUR de envío;desde Estados Unidos;
Evel Knievel (Nintendo Game Boy Color) Game Boy Color Auténtico Probado;26,88 EUR;+ 4,27 EUR de envío;desde Estados Unidos;
3 Game Boy Color Juegos Evel Knievel Sergy 3 Bolsillo profundo Gecko F-1 de carrera de trabajo;12,81 EUR;+ 4,74 EUR de envío;desde Estados Unidos;
Evel Knievel Game Boy EUR ;10,00 EUR;Envío internacional gratis;desde Francia;
