Go! Go! Tank Nintendo Juego Original Boy * limpiado & Probado *;10,21 EUR;Envío gratis;Vendidos  10 sep 2021Artículo vendido;desde Estados Unidos;
Go! Go! Tank Nintendo Gameboy Caja/Insertos/Bandeja/Bolsa con sólo!! Excelente Cond!;76,76 EUR;+ 7,04 EUR de envío;Vendidos  10 ago 2021Artículo vendido;desde Estados Unidos;
Go! Go! Tank Nintendo Juego Original Boy-Probado-Envío Gratuito;11,04 EUR;Envío gratis;Vendidos  9 ago 2021Artículo vendido;desde Estados Unidos;
Go! Go! Tank Nintendo Gameboy probado obras de juego copia de alquiler;17,05 EUR;Envío gratis;Vendidos  4 ago 2021Artículo vendido;desde Estados Unidos;
Original Nintendo Gameboy-Go! Go! Tank, probado y de trabajo;6,99 EUR;Envío gratis;Vendidos  18 jul 2021Artículo vendido;desde Estados Unidos;
1991 Go! Go! Tank Carro de juego Auténtico Original y Manual Para Nintendo Game Boy GB;4,26 EUR;+ 3,40 EUR de envío;Vendidos  7 jul 2021Artículo vendido;desde Estados Unidos;
