Street Fighter II Nintendo Game Boy Japan Ver. Fighting Capcom CGB13 DMG-P-ASFJ ;68,39 EUR;+ 7,00 EUR de envío;desde Francia;
Super Street Fighter II 2 X Revival Game Boy Advance Jap;45,00 EUR;+ 10,00 EUR de envío;desde Francia;
Super Street Fighter II X Revival Nintendo Game Boy Advance GBA Japan NTSC;62,00 EUR;+ 36,00 EUR de envío;desde Francia;
Super Street Fighter II Turbo Revival - PAL - Game Boy Advance / GBA;45,00 EUR;+ 16,00 EUR de envío;desde España;
Street Fighter II/2-Game Boy-módulo-Nintendo-GameBoy muy buen estado;19,99 EUR;Envío no especificado;desde Alemania;
Nintendo gb Game Boy juego Street Fighter II-plenamente aceptar/buen estado;11,49 EUR;+ 9,60 EUR de envío;desde Alemania;
Street Fighter II 2 para Gameboy y color y Advance;19,90 EUR;+ 7,00 EUR de envío;desde Alemania;
Nintendo Game Boy Advance Street Fighter II Turbo revival con embalaje original y guía;59,90 EUR;+ 8,99 EUR de envío;desde Alemania;
Super Street Fighter II Turbo Revival Nintendo Game Boy Advance En Caja Original;45,62 EUR;+ 14,06 EUR de envío;desde Reino Unido;
Nintendo Game Boy Street Fighter II USA Très Bon état;22,90 EUR;+ 11,98 EUR de envío;desde Francia;
Super Street Fighter II 2 Revival NINTENDO GAMEBOY ADVANCE JUEGO GBA SP Carro * *;17,56 EUR;+ 16,76 EUR de envío estimado;desde Reino Unido;
Game Boy Advance Street Fighter II Revival Cartucho Japonés Original;11,70 EUR;Envío no especificado;desde Reino Unido;
Super Street Fighter II GameBoy Advance;21,00 EUR;+ 9,50 EUR de envío;desde Eslovaquia;
Nintendo Game Boy Advance GBA - Street Fighter II 2 Revival - PAL - EUR;24,99 EUR;+ 4,80 EUR de envío;desde Francia;
Street Fighter II 2 para Nintendo GameBoy;12,99 EUR;+ 9,99 EUR de envío;desde Alemania;
Nintendo Gameboy Juego-Street Fighter II 2;24,54 EUR;+ 16,89 EUR de envío estimado;desde Reino Unido;
Japonés Nintendo Gameboy Juego-DMG-asfj-Street Fighter II 2;26,31 EUR;+ 16,91 EUR de envío estimado;desde Reino Unido;
GBA Gameboy Advance Juego-Street Fighter II 2 Revival;15,17 EUR;+ 16,71 EUR de envío estimado;desde Reino Unido;
Super Street Fighter II 2 Revival NINTENDO GAMEBOY ADVANCE JUEGO GBA SP DS LITE;15,17 EUR;+ 16,71 EUR de envío estimado;desde Reino Unido;
Juego En Caja japonés Nintendo Gameboy Advance GBA: Street Fighter II 2 X Revival;58,50 EUR;+ 17,50 EUR de envío estimado;desde Reino Unido;
Street Fighter II-Nintendo Gam Boy Advance-Cartucho únicamente;13,94 EUR;+ 11,60 EUR de envío;desde Portugal;
Street Fighter II 2 Nintendo Gameboy dmg Genuino Carro;35,13 EUR;+ 17,08 EUR de envío estimado;desde Reino Unido;
Street Fighter II game boy juego completo con embalaje original y guía;49,99 EUR;+ 8,00 EUR de envío;desde Alemania;
Nintendo GameBoy loose jeu Street Fighter II;18,00 EUR;+ 5,00 EUR de envío;desde Francia;
Street Fighter II (2) Revival-Nintendo GameBoy Advance GBA Genuino Carro;23,41 EUR;+ 11,71 EUR de envío;desde Reino Unido;
Street Fighter II Nintendo Gameboy PAL Original Cartucho Cartridge;17,00 EUR;+ 37,00 EUR de envío;desde España;
Super Street Fighter II Revival Nintendo Gameboy Advance Juego;15,21 EUR;+ 21,08 EUR de envío;desde Reino Unido;
Notice Manuel Instruction Booklet Nintendo Gameboy Street Fighter II (2) FAH;9,90 EUR;+ 3,90 EUR de envío;desde Francia;
Japonés Nintendo Gameboy Juego-DMG-asfj-Street Fighter II 2 + Manual;26,88 EUR;+ 17,57 EUR de envío;desde Reino Unido;
1992 Street Fighter II 2 Super Nes Game Boy Pequeño Antiguo Raro página de anuncio Póster Enmarcado;38,64 EUR;+ 15,21 EUR de envío;desde Alemania;
1992 Street Fighter II 2 super nes Game Boy consistente enmarcado póster ad framed;39,99 EUR;+ 16,99 EUR de envío;desde Alemania;
