Retro NINTENDO GAMEBOY Super Mario Land Game Japan Probado Funcionando;5,82 EUR;+ 20,50 EUR de envío estimado;Vendidos  22 sep 2021Artículo vendido;desde Reino Unido;
Nintendo Game Boy-Super Mario Land-Top-Embalaje original-pal-alemán;165,00 EUR;Envío no especificado;Vendidos  22 sep 2021Artículo vendido;desde Alemania;
Super Mario Land-cartucho para Game Boy-Original Juego de 1989;9,31 EUR;+ 5,82 EUR de envío;Vendidos  22 sep 2021Artículo vendido;desde Reino Unido;
Super Mario Land y Nintendo Gameboy Advance Juego Race F1-Envío Gratis;6,40 EUR;+ 19,35 EUR de envío estimado;Vendidos  21 sep 2021Artículo vendido;desde Reino Unido;
Super Mario Land Nintendo Gameboy juego muy buen estado probado;16,99 EUR;+ 9,99 EUR de envío;Vendidos  21 sep 2021Artículo vendido;desde Alemania;
Super Mario Land 1-Game Boy-módulo-Nintendo-Game Boy-muy buen estado;21,99 EUR;Envío no especificado;Vendidos  21 sep 2021Artículo vendido;desde Alemania;
☼ GBC - Super Mario Land 2 DX ¡EN COLOR! - GameBoy Color ☼;12,95 EUR;Envío no especificado;Vendidos  20 sep 2021Artículo vendido;desde España;
Super Mario Land 2 🍄 Nintendo Game Boy Classic, color, advance;7,99 EUR;Envío no especificado;Vendidos  20 sep 2021Artículo vendido;desde Alemania;
Super Mario Land 2 🍄 Nintendo Game Boy Classic, color, advance;8,99 EUR;Envío no especificado;Vendidos  20 sep 2021Artículo vendido;desde Alemania;
Nintendo Gameboy dmg Wario Land Super Mario Land 3 Genuino Carro;25,33 EUR a 28,15 EUR;+ 11,64 EUR de envío;Vendidos  20 sep 2021Artículo vendido;desde Reino Unido;
Nintendo Gameboy Vintage Super Mario Land & Super Mario Bros Deluxe;12,22 EUR;+ 34,77 EUR de envío estimado;Vendidos  19 sep 2021Artículo vendido;desde Reino Unido;
Super Mario Land sealed nuevo New Red Stripe Nintendo Game Boy vintage 90s SNES;800,00 EUR;+ 16,99 EUR de envío;Vendidos  19 sep 2021Artículo vendido;desde Alemania;
Nintendo Gameboy Juego-Super Mario Land & 2 6 monedas de oro;23,21 EUR;+ 16,76 EUR de envío estimado;Vendidos  19 sep 2021Artículo vendido;desde Reino Unido;
Nintendo Gameboy Color (GBC) // Super Mario Land 1 DX // PAL;9,99 EUR;+ 5,99 EUR de envío;Vendidos  19 sep 2021Artículo vendido;desde Alemania;
Super Mario Land Gameboy juego! busque en la tienda!;11,64 EUR;+ 18,87 EUR de envío estimado;Vendidos  18 sep 2021Artículo vendido;desde Reino Unido;
Super Mario Land 3 Wario Land-Nintendo Game Boy videojuego Juego en Caja Gameboy;34,90 EUR;+ 16,97 EUR de envío estimado;Vendidos  18 sep 2021Artículo vendido;desde Reino Unido;
Nintendo Gameboy Super Mario Land 2;10,46 EUR;+ 16,52 EUR de envío estimado;Vendidos  18 sep 2021Artículo vendido;desde Reino Unido;
Super Mario Land Gameboy;8,50 EUR;+ 2,50 EUR de envío;Vendidos  18 sep 2021Artículo vendido;desde Alemania;
Gameboy Wario Land-Super Mario Land 3;14,00 EUR;+ 3,70 EUR de envío;Vendidos  18 sep 2021Artículo vendido;desde Alemania;
Gameboy Super Mario Land 2;13,50 EUR;+ 3,70 EUR de envío;Vendidos  18 sep 2021Artículo vendido;desde Alemania;
Gameboy Super Mario Land;15,50 EUR;+ 3,70 EUR de envío;Vendidos  18 sep 2021Artículo vendido;desde Alemania;
Wario Land-Super Mario Land 3;1,92 EUR;+ 8,53 EUR de envío;Vendidos  18 sep 2021Artículo vendido;desde Portugal;
Super Mario Land 2: 6 Golden Coins DX Nintendo Game Boy Color;9,00 EUR;+ 2,00 EUR de envío;Vendidos  18 sep 2021Artículo vendido;desde España;
Genuine Super Mario Land 3: Wario Land Para Nintendo Game Boy NTSC-J Japonés;9,30 EUR;+ 16,50 EUR de envío estimado;Vendidos  18 sep 2021Artículo vendido;desde Reino Unido;
Nintendo Gameboy-Super Mario Land 2 (6 monedas de oro) [DMG] * en Caja Completa *;94,84 EUR;+ 22,13 EUR de envío estimado;Vendidos  18 sep 2021Artículo vendido;desde Reino Unido;
Super Mario Land 2 | 6 monedas de oro (Nintendo Game Boy) - Cartucho únicamente;18,61 EUR;+ 16,67 EUR de envío estimado;Vendidos  18 sep 2021Artículo vendido;desde Reino Unido;
Nintendo Game Boy Classic juego Super Mario Land módulo ukv;19,90 EUR;+ 8,99 EUR de envío;Vendidos  17 sep 2021Artículo vendido;desde Alemania;
⭐ Super Mario Land 2 DX - Remastered - Game Boy FULL COLOUR now luigi playable ⭐;8,99 EUR;+ 8,00 EUR de envío;Vendidos  17 sep 2021Artículo vendido;desde España;
Super Mario Land 6 Golden Coins Nintendo Gameboy juego muy buen estado;23,99 EUR;+ 9,99 EUR de envío;Vendidos  17 sep 2021Artículo vendido;desde Alemania;
Super Mario Land 2-Game Boy-módulo-Nintendo-GameBoy muy buen estado 2;21,99 EUR;Envío no especificado;Vendidos  17 sep 2021Artículo vendido;desde Alemania;
NINTENDO game boy lotto Super Mario Land 2 + Indiana Jones and the last crusade;39,00 EUR;Envío no especificado;Vendidos  17 sep 2021Artículo vendido;desde Italia;
Nintendo Game Boy Classic juego Wario Land Super Mario Land 3 módulo Noe;21,90 EUR;+ 8,99 EUR de envío;Vendidos  17 sep 2021Artículo vendido;desde Alemania;
Super Mario Land Gameboy CIB gran condición;93,03 EUR;+ 26,79 EUR de envío estimado;Vendidos  17 sep 2021Artículo vendido;desde Reino Unido;
Super Mario Land-Dr. Willy's Revenge para Nintendo GameBoy;16,90 EUR;+ 6,50 EUR de envío;Vendidos  17 sep 2021Artículo vendido;desde Alemania;
Super Mario Land 2 6 Golden Coins Nintendo Gameboy Game Boy GB NTSC-J JAP JAPAN;54,90 EUR;+ 24,90 EUR de envío;Vendidos  17 sep 2021Artículo vendido;desde Francia;
Super Mario Land | Nintendo Game Boy | Sin Caja;9,30 EUR;+ 16,50 EUR de envío estimado;Vendidos  17 sep 2021Artículo vendido;desde Reino Unido;
Super Mario Land Gameboy Carro #0098;3,72 EUR;+ 33,68 EUR de envío estimado;Vendidos  17 sep 2021Artículo vendido;desde Reino Unido;
Wario Land : Super Mario Land 3 | GameBoy🕹Excellent Condition! Near Mint 🌍;19,00 EUR;+ 3,50 EUR de envío;Vendidos  16 sep 2021Artículo vendido;desde Países Bajos;
Nintendo Game Boy Super Mario Land original de descuento juego Gameboy;11,61 EUR;+ 15,99 EUR de envío;Vendidos  16 sep 2021Artículo vendido;desde Alemania;
Wario Land (Super Mario Land 3) Game Boy FAH TBE ! ;96,00 EUR;Envío internacional gratis;Vendidos  16 sep 2021Artículo vendido;desde Francia;
Super Mario Land 3 Wario Land Nintendo Game Boy Warioland Gameboy EUR limpio PAL;19,52 EUR;Envío internacional gratis;Vendidos  16 sep 2021Artículo vendido;desde España;
