Vintage 1991 NINTENDO GAME BOY COMPACT Video Juego Sistema Robocop Pal En Caja;58,52 EUR;+ 14,04 EUR de envío;Vendidos  16 sep 2021Artículo vendido;desde Reino Unido;
Robocop GAMEBOY MEGA RARO CIB COLECCIONISTAS DE MENTA #0064;117,00 EUR;+ 27,37 EUR de envío estimado;Vendidos  26 ago 2021Artículo vendido;desde Reino Unido;
Robocop (étiquette reprint mais jeu original) Jeu Nintendo Game Boy PAL ;3,00 EUR;+ 4,00 EUR de envío;Vendidos  25 ago 2021Artículo vendido;desde Francia;
Robocop. Nintendo Gameboy Genuino De Colección Cartucho PAL UK;15,21 EUR;+ 19,05 EUR de envío estimado;Vendidos  24 ago 2021Artículo vendido;desde Reino Unido;
Robocop Nintendo Game Boy Color Advance Juego Solo Carro Genuino;22,18 EUR;+ 7,02 EUR de envío;Vendidos  19 ago 2021Artículo vendido;desde Reino Unido;
Robocop Game Boy FAH ;15,00 EUR;Envío internacional gratis;Vendidos  12 ago 2021Artículo vendido;desde Francia;
Nintendo Gameboy Robocop solo carro;15,21 EUR;+ 16,70 EUR de envío estimado;Vendidos  18 jul 2021Artículo vendido;desde Reino Unido;
Robocop Nintendo Gameboy Juego-en Caja-Sin Manual;23,40 EUR;+ 31,59 EUR de envío estimado;Vendidos  11 jul 2021Artículo vendido;desde Reino Unido;
Robocop Nintendo Gameboy;11,69 EUR;+ 16,65 EUR de envío estimado;Vendidos  1 jul 2021Artículo vendido;desde Reino Unido;
Robocop-Nintendo Gameboy-PAL-COMPLETO;52,66 EUR;+ 17,38 EUR de envío estimado;Vendidos  27 jun 2021Artículo vendido;desde Reino Unido;
Robocop-Nintendo Game Boy (solo Cartucho);10,48 EUR;+ 4,68 EUR de envío;Vendidos  25 jun 2021Artículo vendido;desde Reino Unido;
Robocop NINTENDO GB GAME BOY Original Solo Manual De Instrucciones;4,89 EUR;Envío gratis;Vendidos  15 sep 2021Artículo vendido;desde Estados Unidos;
Robocop, (GameBoy Original);28,89 EUR;Envío gratis;Vendidos  10 sep 2021Artículo vendido;desde Estados Unidos;
Robocop 2 Original Nintendo Gameboy Juego Cartucho Solo;14,20 EUR;Envío gratis;Vendidos  9 sep 2021Artículo vendido;desde Estados Unidos;
Robocop vs el terminador Nintendo Game Boy NRMT COND Carro Auténtico Original;28,89 EUR;Envío gratis;Vendidos  9 sep 2021Artículo vendido;desde Estados Unidos;
Robocop para Nintendo Game Boy;15,29 EUR;+ 3,53 EUR de envío;Vendidos  9 sep 2021Artículo vendido;desde Estados Unidos;
Robocop (Nintendo Game Boy) Japón video juego de NTSC-J Probado;15,63 EUR;+ 4,34 EUR de envío;Vendidos  4 sep 2021Artículo vendido;desde Estados Unidos;
Robocop (Nintendo Game Boy, 1990) Auténtico Cartucho sólo probado y funciona;17,00 EUR;Envío gratis;Vendidos  3 sep 2021Artículo vendido;desde Estados Unidos;
Nintendo GAME BOY - Robocop - GAME ONLY;10,00 EUR;+ 11,00 EUR de envío;Vendidos  1 sep 2021Artículo vendido;desde Países Bajos;
Robocop 2 GB manual de instrucciones;8,50 EUR;+ 2,55 EUR de envío;Vendidos  26 ago 2021Artículo vendido;desde Estados Unidos;
Robocop (Nintendo Game Boy, 1990) Raro | probado | auténtico | GB | GameBoy;16,96 EUR;Envío gratis;Vendidos  23 ago 2021Artículo vendido;desde Estados Unidos;
Gameboy Robocop vs Terminator Probado!!!!!! auténtico!!!;25,50 EUR;Envío gratis;Vendidos  22 ago 2021Artículo vendido;desde Estados Unidos;
Robocop para Nintendo Game Boy;17,00 EUR;Envío gratis;Vendidos  11 ago 2021Artículo vendido;desde Estados Unidos;
Nintendo Game Boy Cartucho sólo probado Robocop 1990 Etiqueta agradable;16,99 EUR;Envío gratis;Vendidos  9 ago 2021Artículo vendido;desde Estados Unidos;
Robocop para Nintendo Game Boy;12,74 EUR;+ 4,42 EUR de envío;Vendidos  1 ago 2021Artículo vendido;desde Estados Unidos;
Nintendo Game Boy Robocop solo carro Probado;16,14 EUR;Envío gratis;Vendidos  1 ago 2021Artículo vendido;desde Estados Unidos;
Nintendo Game Boy Robocop solo carro Probado;11,89 EUR;+ 3,95 EUR de envío;Vendidos  28 jul 2021Artículo vendido;desde Estados Unidos;
Robocop (Nintendo Game Boy, 1990) sólo juego auténtico F4 Probado Funciona;12,74 EUR;+ 3,66 EUR de envío;Vendidos  25 jul 2021Artículo vendido;desde Estados Unidos;
Nintendo Gameboy "Robocop vs Terminator" - auténtica y probado;15,30 EUR;+ 1,70 EUR de envío;Vendidos  13 jul 2021Artículo vendido;desde Estados Unidos;
Robocop para Nintendo Game Boy ** ** solo Cartucho;13,59 EUR;+ 3,78 EUR de envío;Vendidos  13 jul 2021Artículo vendido;desde Estados Unidos;
Se envía el mismo día Robocop 2 (Nintendo Game Boy) GB Gameboy Probado;21,24 EUR;Envío gratis;Vendidos  12 jul 2021Artículo vendido;desde Estados Unidos;
Robocop Nintendo Game Boy Solo Manual;8,46 EUR;+ 3,36 EUR de envío;Vendidos  12 jul 2021Artículo vendido;desde Estados Unidos;
Robocop (Nintendo Game Boy, 1990) sólo juego auténtico Probado Funciona;14,44 EUR;+ 3,78 EUR de envío;Vendidos  3 jul 2021Artículo vendido;desde Estados Unidos;
Robocop (Nintendo Game Boy, 1990);13,59 EUR;+ 3,78 EUR de envío;Vendidos  3 jul 2021Artículo vendido;desde Estados Unidos;
Robocop (Nintendo Game Boy, 1990) incluye Manual Y Caja;16,99 EUR;+ 3,66 EUR de envío;Vendidos  27 jun 2021Artículo vendido;desde Estados Unidos;
Robocop Original Nintendo Gameboy Juego Cartucho Solo;14,53 EUR;Envío gratis;Vendidos  24 jun 2021Artículo vendido;desde Estados Unidos;
Robo Cop Nintendo Gameboy Game Boy Cartucho completo en caja Rare! Robocop;109,66 EUR;+ 6,80 EUR de envío;Vendidos  24 jun 2021Artículo vendido;desde Estados Unidos;
Robocop-Nintendo Game Boy;14,44 EUR;+ 4,17 EUR de envío;Vendidos  23 jun 2021Artículo vendido;desde Estados Unidos;
Robocop 2 GB Nintendo Game Boy GAMEBOY JAPAN IMPORT COMPLETO look algo Usado;85,00 EUR;+ 16,16 EUR de envío;Vendidos  22 jun 2021Artículo vendido;desde Japón;
Robocop (Nintendo Game Boy, 1990);16,99 EUR;Envío gratis;Vendidos  22 jun 2021Artículo vendido;desde Estados Unidos;
Robocop vs Terminator Mega Drive Megadrive De Trabajo Manual Caja De Cartucho De Juego;35,12 EUR;+ 17,07 EUR de envío estimado;Vendidos  31 jul 2021Artículo vendido;desde Reino Unido;
