Darkwing Duck Nintendo Gameboy Juego;19,30 EUR;+ 21,07 EUR de envío;Vendidos  17 sep 2021Artículo vendido;desde Reino Unido;
Darkwing Duck (Game Boy GB 1993) Solo Cartucho;19,90 EUR;+ 12,90 EUR de envío;Vendidos  12 sep 2021Artículo vendido;desde España;
Nintendo Game Boy - Disney's Darkwing Duck - PAL - FAH;19,99 EUR;+ 5,00 EUR de envío;Vendidos  9 sep 2021Artículo vendido;desde Francia;
Disney's Darkwing Duck Game Boy USA ;10,00 EUR;Envío internacional gratis;Vendidos  3 ago 2021Artículo vendido;desde Francia;
Darkwing Duck ( Nintendo Gameboy Clasica) (1);19,95 EUR;Envío no especificado;Vendidos  18 jul 2021Artículo vendido;desde España;
Gb-Darkwing Duck para Nintendo GameBoy;24,95 EUR;+ 9,95 EUR de envío;Vendidos  22 jun 2021Artículo vendido;desde Alemania;
Nintendo Gameboy DISNEYS Darkwing Duck (PAL) En Caja No Manual;64,38 EUR;+ 22,32 EUR de envío estimado;Vendidos  20 jun 2021Artículo vendido;desde Reino Unido;
Disney's Darkwing Duck Nintendo Game Boy 1993 raro y auténtico;26,34 EUR;Envío gratis;Vendidos  16 sep 2021Artículo vendido;desde Estados Unidos;
Disney's Darkwing Duck (Nintendo Game Boy, 1993);17,00 EUR;Envío gratis;Vendidos  12 sep 2021Artículo vendido;desde Estados Unidos;
Darkwing Duck - FAH - Nintendo Gameboy;13,00 EUR;+ 25,00 EUR de envío;Vendidos  2 sep 2021Artículo vendido;desde Países Bajos;
Nintendo Gameboy - 7 Manual Lot - Darkwing Duck - Tetris - Revenge Of Gator ;33,48 EUR;Envío internacional gratis;Vendidos  28 ago 2021Artículo vendido;desde Canadá;
Disney's Darkwing Duck Nintendo Game Boy 1993 raro y auténtico;25,49 EUR;Envío gratis;Vendidos  28 ago 2021Artículo vendido;desde Estados Unidos;
Disney's Darkwing Duck (Nintendo Game Boy, 1993);23,79 EUR;+ 3,78 EUR de envío;Vendidos  24 ago 2021Artículo vendido;desde Estados Unidos;
Darkwing Duck - Nintendo Game Boy (100% Original);13,90 EUR;+ 5,50 EUR de envío;Vendidos  5 ago 2021Artículo vendido;desde Francia;
Darkwing Duck (Nintendo Game Boy). auténtico, probado!;19,54 EUR;Envío gratis;Vendidos  30 jul 2021Artículo vendido;desde Estados Unidos;
Disney's Darkwing Duck (Nintendo Game Boy, 1993) Auténtico solo carro Probado;21,23 EUR;Envío gratis;Vendidos  26 jul 2021Artículo vendido;desde Estados Unidos;
Sólo instrucciones gameboy Darkwing Duck;21,21 EUR;Envío gratis;Vendidos  1 jul 2021Artículo vendido;desde Estados Unidos;
Darkwing Duck Juego Boy Nintendo Cartucho Completo en Caja Caja Excelente Estado GB;169,94 EUR;Envío gratis;Vendidos  29 jun 2021Artículo vendido;desde Estados Unidos;
Auténtico Disney's Darkwing Duck (Nintendo Game Boy, 1993) Raro -- probado;28,05 EUR;+ 2,55 EUR de envío;Vendidos  24 jun 2021Artículo vendido;desde Estados Unidos;
Nintendo GAME BOY DISNEY Darkwing Duck Manual/Folleto artículo #4002-15;16,99 EUR;+ 3,39 EUR de envío;Vendidos  24 jun 2021Artículo vendido;desde Estados Unidos;
Funko funkoverse Disney Darkwing Duck ECCC 2021 Juego de expansión 100;16,97 EUR;+ 40,49 EUR de envío estimado;Vendidos  5 ago 2021Artículo vendido;desde Reino Unido;
Funko funkoverse Disney Darkwing Duck ECCC 2021 Juego de expansión 100;14,63 EUR;+ 40,44 EUR de envío estimado;Vendidos  26 ago 2021Artículo vendido;desde Reino Unido;
