 Burger Time Deluxe Nintendo Game Boy - Gameboy GB;9,90 EUR;Shipping not specified;Sold  Jul 24, 2021Sold Item;from France;
Burger Time Deluxe (Nintendo Gameboy) Tested Authentic Burgertime Game Boy;15,29 EUR;+3,79 EUR shipping;Sold  Sep 16, 2021Sold Item;from United States;
Burger Time Deluxe. (Nintendo Game Boy);23,00 EUR;Free shipping;Sold  Aug 22, 2021Sold Item;from United States;
Burger Time Deluxe. (Nintendo Game Boy);25,55 EUR;+3,79 EUR shipping;Sold  Jul 31, 2021Sold Item;from United States;
Burger Time Deluxe. (Nintendo Game Boy);25,55 EUR;Free shipping;Sold  Jul 16, 2021Sold Item;from United States;
Burger Time Deluxe Instruction Booklet (Nintendo Game Boy);8,51 EUR;+3,49 EUR shipping;Sold  Jul 14, 2021Sold Item;from United States;
