Loopz Nintendo Game Boy juego muy buen estado probado;6,99 EUR;+ 9,99 EUR de envío;Vendidos  14 sep 2021Artículo vendido;desde Alemania;
Loopz Gameboy Game Boy gb Classic OVP Noe;29,90 EUR;Envío no especificado;Vendidos  8 ago 2021Artículo vendido;desde Alemania;
Nintendo Gameboy juego Loopz Cartridge;9,31 EUR;+ 19,74 EUR de envío estimado;Vendidos  26 jul 2021Artículo vendido;desde Reino Unido;
Original Nintendo GameBoy DMG-01 Portátil Cargador probado y de trabajo y Loopz;51,17 EUR;+ 12,96 EUR de envío;Vendidos  16 sep 2021Artículo vendido;desde Estados Unidos;
Gameboy Loopz;5,89 EUR;+ 4,44 EUR de envío;Vendidos  13 sep 2021Artículo vendido;desde Estados Unidos;
Loopz, juego con funda protectora, Nintendo Game Boy;10,23 EUR;Envío gratis;Vendidos  8 jul 2021Artículo vendido;desde Estados Unidos;
Gameboy Loopz-Cartucho únicamente;8,52 EUR;Envío gratis;Vendidos  1 jul 2021Artículo vendido;desde Estados Unidos;
