Battleship gameboy color OVP cib Boxed;19,90 EUR;+ 4,50 EUR de envío;Vendidos  20 ago 2021Artículo vendido;desde Alemania;
Battleship-Nintendo Game Boy Color-limpiado & Probado;8,49 EUR;Envío gratis;Vendidos  27 ago 2021Artículo vendido;desde Estados Unidos;
Battleship (Nintendo Game Boy Color, 1999);4,27 EUR;+ 2,56 EUR de envío;Vendidos  8 ago 2021Artículo vendido;desde Estados Unidos;
Battleship Juego Boy Color Gameboy juego probado Funcionando Auténtico;8,53 EUR;Envío gratis;Vendidos  8 jul 2021Artículo vendido;desde Estados Unidos;
Battleship (Nintendo Game Boy Color, 1999) Game Boy Color Auténtico Probado Con Estuche;4,26 EUR;+ 4,26 EUR de envío;Vendidos  6 jul 2021Artículo vendido;desde Estados Unidos;
Battleship (Gameboy Color GBC) solo manual de instrucciones.. Sin Juego;2,13 EUR;+ 2,77 EUR de envío;Vendidos  6 jul 2021Artículo vendido;desde Estados Unidos;
