Nintendo Game Boy Gameboy Advance GBA SP Millipede Super Breakout Lunar Lander;8,13 EUR;+ 16,48 EUR de envío estimado;Vendidos  12 ago 2021Artículo vendido;desde Reino Unido;
Millipede/Super Breakout/Lunar Lander (Nintendo Game Boy Advance, 2005);11,05 EUR;+ 5,96 EUR de envío;Vendidos  18 sep 2021Artículo vendido;desde Estados Unidos;
GB -- Lunar Lander -- juego Boy, Japón Juego Nintendo. Work fully!!! 11765;29,85 EUR;+ 6,40 EUR de envío;Vendidos  17 sep 2021Artículo vendido;desde Japón;
Millipede/Super Breakout/Lunar Lander-Juego Boy Advance GBA Juego;5,09 EUR;+ 3,37 EUR de envío;Vendidos  15 sep 2021Artículo vendido;desde Estados Unidos;
GB -- Lunar Lander -- Caja. juego Boy, Japón Juego. Work fully!!! 11765;57,15 EUR;+ 11,09 EUR de envío;Vendidos  7 sep 2021Artículo vendido;desde Japón;
Millipede Super Breakout Lunar Lander Nintendo Gameboy Advance (G026);2,55 EUR;+ 2,99 EUR de envío;Vendidos  5 ago 2021Artículo vendido;desde Estados Unidos;
Gameboy Advance-Millipede/Super Breakout/Lunar Lander;5,54 EUR;Envío gratis;Vendidos  17 jul 2021Artículo vendido;desde Estados Unidos;
Super Breakout/Lunar Lander/Millipede-Nintendo Game Boy Advance Nueva;16,16 EUR;+ 3,41 EUR de envío;Vendidos  7 jul 2021Artículo vendido;desde Estados Unidos;
Super Breakout/Lunar Lander/Millipede-Nintendo Game Boy Advance;0,84 EUR;+ 3,80 EUR de envío;Vendidos  29 jun 2021Artículo vendido;desde Estados Unidos;
Millipede/Super Breakout/Lunar Lander (Nintendo Game Boy Advance, 2005 GBA)-Cart;5,97 EUR;+ 3,99 EUR de envío;Vendidos  25 jun 2021Artículo vendido;desde Canadá;
