Consola Game Boy Classic Play It Loud Yellow + Dick Tracy;150,00 EUR;Envío no especificado;desde España;
Nintendo Gameboy Dick Tracy EE. UU. versión rara Genuino & gran condición;524,64 EUR;Envío no especificado;desde Reino Unido;
Gameboy juegos nintendo Castlevania (jap), Dick Tracy, Navy Seals, All Star 2, R;100,00 EUR;Envío no especificado;desde España;
GB-Dick Tracy Nintendo Gameboy Game Boy solo carro;85,19 EUR;Envío gratis;desde Estados Unidos;
Dick Tracy Gameboy Nintendo Completo En Caja Difícil de encontrar rara Cartucho en Caja Juego Boy;255,86 EUR;Envío gratis;desde Estados Unidos;
Dick Tracy Nintendo Gameboy Auténtico Original Caja Manual COMPLETO ULTRA RARO;1.066,09 EUR;+ 5,46 EUR de envío;desde Estados Unidos;
1990 Dick Tracy Movie magnético Disguise Game Al Boy Caprice nuevo en tarjeta Big!;5,96 EUR;+ 2,52 EUR de envío;desde Estados Unidos;
Gameboy Dick Tracy Juego Rara Vintage Excelente Estado Y Probado;85,28 EUR;Envío gratis;desde Estados Unidos;
Dick Tracy Original Nintendo Gameboy Clean Tested Authentic Cart RARE Video Game;56,55 EUR;+ 16,64 EUR de envío;desde Canadá;
Dick Tracy Nintendo Game Boy Fridge Magnet Aimant Frigo;2,18 EUR;+ 2,50 EUR de envío;desde España;
Dick Tracy Game Boy Nintendo Llavero;2,17 EUR;+ 2,49 EUR de envío;desde España;
Dick Tracy Nintendo Game Boy Fridge Magnet Magnete Frigorifero;2,22 EUR;+ 2,50 EUR de envío;desde España;
Dick Tracy Nintendo Game Boy FRIDGE MAGNET;2,17 EUR;+ 2,49 EUR de envío;desde España;
Dick Tracy Sega Mega Drive Juego Usado En Caja Gratis P&P;29,09 EUR;+ 16,89 EUR de envío estimado;desde Reino Unido;
Dick Tracy las más difíciles Dick alrededor de Sega Mega Drive juego de video en Caja Instrucciones;57,93 EUR;+ 25,64 EUR de envío;desde Reino Unido;
Dick Tracy Famiclone Famicom Dendy Pegasus NES viejo chip 8-Bit Cartucho De Juego;102,34 EUR;+ 14,50 EUR de envío;desde Rusia;
Sega Megadrive Juego Dick Tracy;17,48 EUR;+ 20,41 EUR de envío estimado;desde Reino Unido;
Dick Tracy Commodore Amiga juego;23,31 EUR;+ 16,79 EUR de envío estimado;desde Reino Unido;
SEGA MASTER sistema Dick Tracy Vintage juego de computadora completa 1990 PAL Touchstone;29,15 EUR;+ 17,49 EUR de envío;desde Reino Unido;
Dick Tracy: SEGA MASTER Sistema Juego (Gratis Reino Unido P&p);12,81 EUR;+ 16,60 EUR de envío estimado;desde Reino Unido;
Console Game Gioco CBM C64 Commodore 64 /128 Cassetta Play Titus - Dick Tracy - ;14,00 EUR;+ 14,00 EUR de envío;desde Italia;
Dick Tracy Sega Master Sistema Juego;7,87 EUR;+ 20,59 EUR de envío estimado;desde Reino Unido;
SEGA MASTER sistema Dick Tracy Juego Completo Caja Manual;17,49 EUR;+ 20,41 EUR de envío estimado;desde Reino Unido;
Dick Tracy: Movie Trading cards base set single cards by Topps 1990 ;1,15 EUR;+ 17,55 EUR de envío estimado;desde Reino Unido;
El juego de mesa vintage Dick Tracy En Excelente Estado De 2 a 6 jugadores;10,48 EUR;+ 29,78 EUR de envío estimado;desde Reino Unido;
Dick Tracy Trading Card Singles - Topps - 1990 - Various;1,55 EUR a 1,76 EUR;+ 2,27 EUR de envío;desde Reino Unido;
Al "Big Boy 'capricho-al Pacino-Dick Tracy Película Figura Playmates Bandai 1990;29,15 EUR;+ 39,97 EUR de envío estimado;desde Reino Unido;
Varios Dick Tracy 1990-Figuras de Acción Juguetes, elegir cuál;12,82 EUR a 17,49 EUR;+ 35,65 EUR de envío estimado;desde Reino Unido;
Al "Big Boy" Caprice #3 Dick Tracy Movie 1990 Topps Trading Card;1,15 EUR;+ 2,91 EUR de envío;desde Reino Unido;
Dick Tracy el juego Family juego de detective por juegos universitarios Walt Disney Co;17,48 EUR;+ 27,20 EUR de envío estimado;desde Reino Unido;
Dick Tracy Juego de mesa Universidad juegos 100% completo de la compañía de Walt Disney;6,94 EUR;+ 26,08 EUR de envío estimado;desde Reino Unido;
El Dick Tracy Juego de mesa Universidad juegos incompleta de Walt Disney Company;1,17 EUR;+ 30,07 EUR de envío estimado;desde Reino Unido;
Dick Tracy Película Juego De Mesa;15,14 EUR;+ 31,95 EUR de envío estimado;desde Reino Unido;
Vintage Dick Tracy Episode 1 Radioplay Comic & Tape Big Boy 1990 Walt Disney New;23,32 EUR;+ 23,82 EUR de envío estimado;desde Reino Unido;
El juego de Dick Tracy - 100% completo 1990 American Juego De Mesa Disney Productions;17,43 EUR;+ 29,90 EUR de envío estimado;desde Reino Unido;
El Dick Tracy Juego de mesa Universidad juegos de Walt Disney Company Rara Completa;11,66 EUR;+ 29,57 EUR de envío estimado;desde Reino Unido;
Dick Tracy un Titus juego para Commodore Amiga Computer probado y de trabajo;51,29 EUR;+ 5,83 EUR de envío;desde Reino Unido;
Al "Big Boy" Caprice #5 Dick Tracy Movie 1990 Topps Trading Card / Sticker;1,15 EUR;+ 2,91 EUR de envío;desde Reino Unido;
