Bishoujo Senshi Sailor Moon R DMG-QAJ cartucho Gameboy GB Japan leer;14,95 EUR;+ 8,95 EUR de envío;desde España;
Bishoujo Senshi Sailor Moon R Nintendo Game Boy GB NTSC-J Región FREE Rare;14,99 EUR;+ 19,99 EUR de envío;desde España;
Bishoujo Senshi Sailor Moon R completa del producto (Nintendo Game Boy, 1994 Japón);43,49 EUR;Envío internacional gratis;desde Japón;
Bishoujo Senshi Sailor Moon R Acción Aventura Juego Nintendo Game Boy Ch;30,55 EUR;+ 10,23 EUR de envío;desde Japón;
Nintendo GameBoy - Bishoujo Senshi Sailor Moon R Japan Cartridge;30,81 EUR;+ 6,16 EUR de envío;desde Australia;
GB -- Bishoujo Senshi Sailor Moon R -- juego Boy, Japón Juego. Work fully!!! 14129;11,09 EUR;+ 7,68 EUR de envío;desde Japón;
GB -- Bishoujo Senshi Sailor Moon R -- Caja. juego Boy, Japón Juego Nintendo. 14129;25,59 EUR;+ 11,09 EUR de envío;desde Japón;
Bishoujo Senshi Sailor Moon R-Open carriage-European (Bandai);69,99 EUR;Envío no especificado;desde Alemania;
