Gameboy Color (GBC) // GTA 2 (Grand Theft Auto) + embalaje original + instrucciones // dt. PAL cib;199,99 EUR;+ 5,99 EUR de envío;Vendidos  26 sep 2021Artículo vendido;desde Alemania;
Genuine Grand Theft Auto 2 GTA Gameboy Color Probado Funcionando Gameboy Juego-Reino Unido Pp;18,62 EUR;+ 19,05 EUR de envío estimado;Vendidos  17 sep 2021Artículo vendido;desde Reino Unido;
Grand Theft Auto Nintendo Gameboy Color Colour juego PAL solo carro;25,67 EUR;+ 7,59 EUR de envío;Vendidos  9 sep 2021Artículo vendido;desde Reino Unido;
Grand Theft Auto 2-Gameboy Colour Juego-Cartucho únicamente;15,18 EUR;+ 18,45 EUR de envío estimado;Vendidos  26 ago 2021Artículo vendido;desde Reino Unido;
Grand Theft Auto. NINTEDO GAMEBOY COLOR Juego. UK PAL. en Caja Completa;81,71 EUR;+ 22,58 EUR de envío estimado;Vendidos  13 ago 2021Artículo vendido;desde Reino Unido;
Grand Theft Auto (Nintendo Game Boy Color, 1999) - Versión UK PAL cartride solamente!;9,33 EUR;+ 26,84 EUR de envío;Vendidos  13 ago 2021Artículo vendido;desde Reino Unido;
Genuine Grand Theft Auto 2 GTA Gameboy Color Nintendo Gameboy Juego-UK;18,08 EUR;+ 18,50 EUR de envío estimado;Vendidos  6 ago 2021Artículo vendido;desde Reino Unido;
Gameboy Color Grand Theft Auto;29,18 EUR;+ 19,84 EUR de envío estimado;Vendidos  2 ago 2021Artículo vendido;desde Reino Unido;
Grand Theft Auto-Gameboy Colour-GBC-Completo-Completo En Caja-Buen Estado-Leer;29,19 EUR;Envío no especificado;Vendidos  31 jul 2021Artículo vendido;desde Reino Unido;
GTA 2 II-Grand Theft Auto 2 para Nintendo Game Boy Color GBC/Advance OVP cib;119,99 EUR;Envío no especificado;Vendidos  29 jul 2021Artículo vendido;desde Alemania;
Grand Theft Auto GTA-Nintendo Gameboy Color-completa-En muy buena condición;58,36 EUR;+ 17,44 EUR de envío estimado;Vendidos  7 jul 2021Artículo vendido;desde Reino Unido;
Game Boy Color Grand Theft Auto (Nintendo Game Boy Color, 1999) Auténtico Juego-GameBoy;15,37 EUR;+ 4,27 EUR de envío;Vendidos  18 sep 2021Artículo vendido;desde Estados Unidos;
GTA 2 Grand Theft Auto + Manual, auténtico, Nintendo Game Boy Color * Probado *;29,00 EUR;Envío gratis;Vendidos  15 sep 2021Artículo vendido;desde Estados Unidos;
Game Boy Color Grand Theft Auto (Nintendo Game Boy Color, 1999) Auténtico Juego-GameBoy;17,07 EUR;Envío gratis;Vendidos  11 sep 2021Artículo vendido;desde Estados Unidos;
Grand Theft Auto 2 para Nintendo Game Boy Color, Advance & SP ** ** Auténtico!;27,28 EUR;+ 4,23 EUR de envío;Vendidos  11 sep 2021Artículo vendido;desde Estados Unidos;
Grand Theft Auto Nintendo Game Boy Color * Auténtico y ahorra *;30,71 EUR;Envío gratis;Vendidos  7 sep 2021Artículo vendido;desde Estados Unidos;
GTA 2 Grand Theft Auto 2 Nintendo Game Boy Color, cartucho sólo, auténtico;21,34 EUR;+ 3,50 EUR de envío;Vendidos  4 sep 2021Artículo vendido;desde Estados Unidos;
Grand Theft Auto (Nintendo Game Boy Color, probado 1999) - Envío Gratuito;20,48 EUR;Envío gratis;Vendidos  31 ago 2021Artículo vendido;desde Estados Unidos;
Grand Theft Auto II! (2) Gta Ii! GTA 2! juego Boy Color! Game Boy Color! probado! funciona!;23,47 EUR;Envío gratis;Vendidos  27 ago 2021Artículo vendido;desde Estados Unidos;
Vintage Grand Theft Auto auténtico Nintendo Gameboy Color Juego probado FS;21,21 EUR;Envío gratis;Vendidos  24 ago 2021Artículo vendido;desde Estados Unidos;
Vintage NINTENDO GAMEBOY COLOR Grand Theft Auto 2 Video Juego Cartucho 1998;24,76 EUR;+ 2,72 EUR de envío;Vendidos  23 ago 2021Artículo vendido;desde Estados Unidos;
GTA 2 Grand Theft Auto-auténtico Nintendo Game Boy Color * Probado * Auténtico;25,61 EUR;Envío gratis;Vendidos  21 ago 2021Artículo vendido;desde Estados Unidos;
Nintendo Gameboy Color GTA2 Grand Theft Auto 2 * * SIN JUEGO sólo caja-Envío Gratuito;42,69 EUR;Envío gratis;Vendidos  20 ago 2021Artículo vendido;desde Estados Unidos;
GTA 2 Grand Theft Auto-Nintendo Game Boy Color * Probado * Auténtico-Con Folleto;25,61 EUR;+ 4,23 EUR de envío;Vendidos  19 ago 2021Artículo vendido;desde Estados Unidos;
Grand Theft Auto GTA-Nintendo Game Boy Color Nueva Sellado Rockstar Games;384,17 EUR;+ 3,50 EUR de envío;Vendidos  17 ago 2021Artículo vendido;desde Estados Unidos;
GTA 2 Grand Theft Auto 2-auténtico-GAME BOY COLOR GBC-Caja/Manual Solamente!;42,95 EUR;Envío gratis;Vendidos  13 ago 2021Artículo vendido;desde Estados Unidos;
Grand Theft Auto (Nintendo Game Boy Color, 1999) * Auténtico * probado y funciona;19,55 EUR;Envío gratis;Vendidos  11 ago 2021Artículo vendido;desde Estados Unidos;
GTA 2 Grand Theft Auto 2 Nintendo Game Boy Color probado Auténtico;23,04 EUR;Envío gratis;Vendidos  10 ago 2021Artículo vendido;desde Estados Unidos;
Grand Theft Auto GTA (Nintendo Game Boy Color, 1999) Auténtico cartucho de batería;21,34 EUR;Envío gratis;Vendidos  29 jul 2021Artículo vendido;desde Estados Unidos;
Grand Theft Auto (Nintendo Game Boy Color, 1999) * Auténtico * probado y funciona 🔥;21,33 EUR;Envío gratis;Vendidos  23 jul 2021Artículo vendido;desde Estados Unidos;
Grand Theft Auto 2 (Nintendo Game Boy Color, 2000);21,26 EUR;+ 3,59 EUR de envío;Vendidos  23 jul 2021Artículo vendido;desde Estados Unidos;
Grand Theft Auto 2 GTA 2 (Nintendo Game Boy Color, 2000) Probado Funcionando;17,93 EUR;+ 2,39 EUR de envío;Vendidos  19 jul 2021Artículo vendido;desde Estados Unidos;
GBC Gameboy Color GTA 2 Grand Theft Auto 2 Nuevo Sellado Menta Juego Boy;341,48 EUR;Envío gratis;Vendidos  16 jul 2021Artículo vendido;desde Estados Unidos;
Grand Theft Auto 2 (Game Boy Color, 2000) sellado NUEVO GTA 2 tiene 9.2+ Mint! Obo;512,23 EUR;Envío gratis;Vendidos  11 jul 2021Artículo vendido;desde Estados Unidos;
Grand Theft Auto 2 (Nintendo Game Boy Color, 2000) - Sellado;256,11 EUR;+ 7,21 EUR de envío;Vendidos  11 jul 2021Artículo vendido;desde Estados Unidos;
Grand Theft Auto-auténtico Nintendo Game Boy Color Con Manual Y caso claro;25,57 EUR;+ 3,41 EUR de envío;Vendidos  8 jul 2021Artículo vendido;desde Estados Unidos;
Grand Theft Auto GTA (Nintendo Game Boy Color Cartucho auténtico, 1999);19,63 EUR;Envío gratis;Vendidos  6 jul 2021Artículo vendido;desde Estados Unidos;
GTA 2 Gameboy Color-Grand Theft Auto 2 * * Sin Caja Original;19,21 EUR;+ 3,41 EUR de envío;Vendidos  5 jul 2021Artículo vendido;desde Estados Unidos;
Grand Theft Auto GTA (Nintendo Game Boy Color, 1999) Cartucho auténtico, Ahorra;12,81 EUR;+ 4,23 EUR de envío;Vendidos  4 jul 2021Artículo vendido;desde Estados Unidos;
Grand Theft Auto Nintendo Gameboy Color Auténtico GBC Gta;15,37 EUR;Envío gratis;Vendidos  4 jul 2021Artículo vendido;desde Estados Unidos;
Grand Theft Auto GTA (Nintendo Game Boy Color Cartucho auténtico, 1999);21,33 EUR;Envío gratis;Vendidos  1 jul 2021Artículo vendido;desde Estados Unidos;
Juego Grand Theft Auto Boy Color GBC Nintendo;18,78 EUR;Envío gratis;Vendidos  28 jun 2021Artículo vendido;desde Estados Unidos;
Grand Theft Auto - PAL - Game Boy Advance / GBA;55,00 EUR;+ 16,00 EUR de envío;Vendidos  13 sep 2021Artículo vendido;desde España;
Game Boy Advance GBA del juego Grand Theft Auto + ba/ok;22,69 EUR;+ 9,60 EUR de envío;Vendidos  5 ago 2021Artículo vendido;desde Alemania;
Grand Theft Auto IV 4 PlayStation 3 (PS3) Juego;3,49 EUR;+ 18,24 EUR de envío estimado;Vendidos  25 sep 2021Artículo vendido;desde Reino Unido;
Grand Theft Auto GTA Nintendo Game Boy Advance solo carro;23,29 EUR;+ 16,81 EUR de envío estimado;Vendidos  25 jul 2021Artículo vendido;desde Reino Unido;
Grand Theft Auto Vice City-Original XBOX JUEGO/+ XBOX 360 compatible Marron;15,17 EUR;+ 6,95 EUR de envío;Vendidos  15 sep 2021Artículo vendido;desde Reino Unido;
Grand Theft Auto 5 PS4 PlayStation 4 Video Juego;17,50 EUR;+ 16,71 EUR de envío estimado;Vendidos  19 sep 2021Artículo vendido;desde Reino Unido;
Grand Theft Auto Edición de Coleccionistas SONY PLAYSTATION 1 Juego * GRATIS UK FRANQUEO *;40,86 EUR;+ 12,84 EUR de envío;Vendidos  4 jul 2021Artículo vendido;desde Reino Unido;
Grand Theft Auto 5 V-Juego PC DVD ROM Nuevo y Sellado;46,69 EUR;+ 20,97 EUR de envío estimado;Vendidos  12 sep 2021Artículo vendido;desde Reino Unido;
Grand Theft Auto GTA - PAL - Game Boy Advance / GBA Gameboy Advance;13,50 EUR;+ 13,00 EUR de envío;Vendidos  3 ago 2021Artículo vendido;desde España;
Nuevo anuncioGTA V (Grand Theft Auto 5) Xbox Juego-con mapas One gastos de envío gratis;12,78 EUR;+ 16,61 EUR de envío estimado;Vendidos  25 sep 2021Artículo vendido;desde Reino Unido;
Grand Theft Auto 5 Sony Ps4 Juego;15,17 EUR;+ 18,80 EUR de envío estimado;Vendidos  21 jul 2021Artículo vendido;desde Reino Unido;
Grand Theft Auto PC CD-ROM juego 1997;9,34 EUR;+ 20,64 EUR de envío estimado;Vendidos  16 ago 2021Artículo vendido;desde Reino Unido;
Grand Theft Auto V 5 PS4 Juego Completo;16,29 EUR;+ 7,39 EUR de envío;Vendidos  3 sep 2021Artículo vendido;desde Reino Unido;
Grand Theft Auto Nintendo Game Boy Advance GBA Juego Solo Carro Genuino;30,30 EUR;+ 7,00 EUR de envío;Vendidos  20 jul 2021Artículo vendido;desde Reino Unido;
Grand Theft Auto Vice City Ps2 GTA juego Nuevo Sellado PAL PlayStation 2 del Reino Unido;149,43 EUR;+ 25,94 EUR de envío estimado;Vendidos  12 ago 2021Artículo vendido;desde Reino Unido;
Grand Theft Auto 5 Gta V PLAYSTATION 4 gran Juego Excelente Estado;15,17 EUR;+ 16,66 EUR de envío estimado;Vendidos  20 sep 2021Artículo vendido;desde Reino Unido;
GTA Grand Theft Auto San Andreas PS2 PLAYSTATION GAME Rockstar acción no mapa;6,95 EUR;+ 7,00 EUR de envío;Vendidos  23 sep 2021Artículo vendido;desde Reino Unido;
Grand Theft Auto San Andreas Xbox Juego Original Pal;16,33 EUR;+ 16,68 EUR de envío estimado;Vendidos  25 sep 2021Artículo vendido;desde Reino Unido;
Grand Theft Auto Nintendo Game Boy Advance GBA Juego Solo Carro Genuino Gta;32,63 EUR;+ 7,00 EUR de envío;Vendidos  15 jul 2021Artículo vendido;desde Reino Unido;
Grand Theft Auto GTA San Andreas Playstation PS2 juego de acción manual MAPA PAL;6,99 EUR;+ 16,51 EUR de envío estimado;Vendidos  20 sep 2021Artículo vendido;desde Reino Unido;
Grand Theft Auto Gta V 5-Xbox 360 juego-completo con instrucciones y mapa;6,95 EUR;+ 14,59 EUR de envío;Vendidos  18 sep 2021Artículo vendido;desde Reino Unido;
Grand Theft Auto 5 Premium Edition Sony PS4 juego sin usar códigos Totalmente Nuevo Sin Sellar;20,43 EUR;+ 16,75 EUR de envío estimado;Vendidos  19 jul 2021Artículo vendido;desde Reino Unido;
Grand Theft Auto: Liberty City Stories PLAYSTATION 2 PS2 PAL JUEGO COMPLETO;5,83 EUR;+ 16,50 EUR de envío estimado;Vendidos  21 sep 2021Artículo vendido;desde Reino Unido;
Grand Theft Auto Vice City-Juego De Pc-Original y Completo con Manual y mapa;11,66 EUR;+ 6,95 EUR de envío;Vendidos  26 sep 2021Artículo vendido;desde Reino Unido;
Grand Theft Auto Gta V 5-Sony Playstation 4 PS4 Juego-probado/trabajo;15,12 EUR;+ 16,66 EUR de envío estimado;Vendidos  9 sep 2021Artículo vendido;desde Reino Unido;
Grand Theft Auto Vice City Acción clásico juego PC CD-ROM 2003 mapa Rockstar Games;6,99 EUR;+ 4,68 EUR de envío;Vendidos  23 ago 2021Artículo vendido;desde Reino Unido;
Grand Theft Auto GTA 2 Sony Playstation 1 PS1 Juego Con Manual + Mapa;14,00 EUR;+ 16,64 EUR de envío estimado;Vendidos  22 jul 2021Artículo vendido;desde Reino Unido;
Sony PS2 Grand Theft Auto Vice City Stories Juego-con Manual y mapa;9,34 EUR;+ 6,99 EUR de envío;Vendidos  14 sep 2021Artículo vendido;desde Reino Unido;
Grand Theft Auto GTA 5 V PS3 PLAYSTATION GAME Rockstar aventura de acción completa;5,78 EUR;+ 11,67 EUR de envío;Vendidos  19 ago 2021Artículo vendido;desde Reino Unido;
Grand Theft Auto IV 4 juego GTA Xbox 360 Con Mapa Y Manual PAL GRATIS UK FRANQUEO;6,99 EUR;+ 16,51 EUR de envío estimado;Vendidos  30 jul 2021Artículo vendido;desde Reino Unido;
GTA V Grand Theft Auto cinco 5 PS3 Playstation 3 Juego UK PAL + manual y mapa en muy buena condición;6,99 EUR;+ 16,51 EUR de envío estimado;Vendidos  28 jul 2021Artículo vendido;desde Reino Unido;
Grand Theft Auto IV -- Classics Edition (Microsoft Xbox 360, 2009) - juego PAL;5,83 EUR;+ 16,50 EUR de envío estimado;Vendidos  27 ago 2021Artículo vendido;desde Reino Unido;
Grand Theft Auto IV PS3 PlayStation 3 Juego Nuevo Sellado GTA 4 Rockstar Raro;151,72 EUR;+ 23,85 EUR de envío estimado;Vendidos  28 ago 2021Artículo vendido;desde Reino Unido;
Grand Theft Auto San Andreas-XBOX JUEGO + XBOX 360 + XBOX ONE-Original nomap;22,17 EUR;+ 6,95 EUR de envío;Vendidos  22 jul 2021Artículo vendido;desde Reino Unido;
Grand Theft Auto Episodios De Liberty City XBOX 360 Video Juego UK release;16,33 EUR;+ 16,68 EUR de envío estimado;Vendidos  13 sep 2021Artículo vendido;desde Reino Unido;
Grand Theft Auto Vice City Gta PC CD ROM Juego en todo el mundo post! 100% Completo;11,66 EUR;+ 11,66 EUR de envío;Vendidos  15 jul 2021Artículo vendido;desde Reino Unido;
Grand Theft Auto V 5 + Mapa MICROSOFT XBOX 360 Gta Completa, Muy Buen Juego;6,99 EUR;+ 16,51 EUR de envío estimado;Vendidos  23 sep 2021Artículo vendido;desde Reino Unido;
Grand Theft Auto: V-GTA 5-Edición 7 Discos En Caja (Pc Juego);25,67 EUR;+ 20,59 EUR de envío estimado;Vendidos  10 ago 2021Artículo vendido;desde Reino Unido;
Grand Theft Auto Gta V 5 | PS3 Juego Completo con Manual Mapa &;5,83 EUR;+ 17,94 EUR de envío estimado;Vendidos  16 ago 2021Artículo vendido;desde Reino Unido;
Grand Theft Auto GTA-Sony PS1 Playstation Juego Completo Manual + mapas One PAL;17,50 EUR;+ 16,71 EUR de envío estimado;Vendidos  2 sep 2021Artículo vendido;desde Reino Unido;
