4x Game Boy Paquete Lot Donkey Kong Land 2 Pocahontas CIB GameBoy PAL ITA Gig PAL;74,62 EUR;+ 35,97 EUR de envío estimado;Vendidos  15 ago 2021Artículo vendido;desde Reino Unido;
Disney's Pocahontas NINTENDO GAMEBOY Carro De Juego Original * * Probado Funcionando;17,48 EUR;+ 16,68 EUR de envío estimado;Vendidos  3 ago 2021Artículo vendido;desde Reino Unido;
5 Nintendo Game Boy Boxed Games Mega Man 2 Bust A Move Aladdin Pocahontas Fifa ;95,00 EUR;Envío no especificado;Vendidos  13 jul 2021Artículo vendido;desde Italia;
Nintendo Game Boy Disney's Pocahontas con embalaje original y guía EE. UU.;89,90 EUR;+ 7,99 EUR de envío;Vendidos  30 jun 2021Artículo vendido;desde Alemania;
Gameboy Disney's Pocahontas;7,50 EUR;+ 3,70 EUR de envío;Vendidos  26 jun 2021Artículo vendido;desde Alemania;
Disney's Pocahontas Nintendo Game Boy;5,52 EUR;+ 3,37 EUR de envío;Vendidos  3 sep 2021Artículo vendido;desde Estados Unidos;
Vintage Nintendo Gameboy Disney Hércules, Pocahontas & Milán Juegos con plástico Hol;12,38 EUR;+ 5,12 EUR de envío;Vendidos  31 ago 2021Artículo vendido;desde Estados Unidos;
Disney's Pocahontas (Nintendo Game Boy NGB, 1996) Completo Buen Cartucho en Caja;29,80 EUR;Envío gratis;Vendidos  22 ago 2021Artículo vendido;desde Estados Unidos;
Disney's Pocahontas (Nintendo Game Boy, 1996);2,77 EUR;+ 3,80 EUR de envío;Vendidos  22 ago 2021Artículo vendido;desde Estados Unidos;
Disney's Pocahontas, Nintendo Game Boy, 1996, carro de juego solamente, Probado;5,07 EUR;+ 3,41 EUR de envío;Vendidos  16 ago 2021Artículo vendido;desde Estados Unidos;
Disney's Pocahontas NINTENDO GAMEBOY Juego Auténtico Original + + + trabajo probado;23,02 EUR;Envío gratis;Vendidos  14 ago 2021Artículo vendido;desde Estados Unidos;
Pocahontas Juego Boy Juego Disney;0,84 EUR;+ 3,80 EUR de envío;Vendidos  4 ago 2021Artículo vendido;desde Estados Unidos;
Pocahontas Disney's (Nintendo Gameboy GB) solo Carro Gran forma Juego Boy;8,09 EUR;Envío gratis;Vendidos  1 ago 2021Artículo vendido;desde Estados Unidos;
Disney's Pocahontas (Nintendo Game Boy, 1996);3,62 EUR;+ 3,41 EUR de envío;Vendidos  28 jul 2021Artículo vendido;desde Estados Unidos;
Nintendo Gameboy Pocahontas (CART ONLY);5,66 EUR;+ 11,31 EUR de envío;Vendidos  18 jul 2021Artículo vendido;desde Canadá;
Game Boy Juegos-Little Mermaid + Pocahontas + Tamagotchi + monopolio;11,09 EUR;+ 3,54 EUR de envío;Vendidos  13 jul 2021Artículo vendido;desde Estados Unidos;
Disney's Pocahontas Nintendo Juego Original Boy-limpiado & Probado;8,06 EUR;Envío gratis;Vendidos  9 jul 2021Artículo vendido;desde Estados Unidos;
Disney's Pocahontas (Nintendo Game Boy, 1996) Sólo Cartucho Probado;6,81 EUR;Envío gratis;Vendidos  1 jul 2021Artículo vendido;desde Estados Unidos;
Disney's Pocahontas (Nintendo Game Boy, 1996) Completo En Caja Excelente Estado Casi Nuevo;42,64 EUR;+ 7,68 EUR de envío;Vendidos  30 jun 2021Artículo vendido;desde Argentina;
Disney's Pocahontas-auténtico Nintendo Game Boy Color GBA;8,53 EUR;Envío gratis;Vendidos  25 jun 2021Artículo vendido;desde Estados Unidos;
