Scotland Yard - Nintendo Game Boy GB JAP Japan complet;11,92 EUR;Envío no especificado;desde Francia;
Scotland Yard (Nintendo Game Boy GB, 1990) Japan Import;3,33 EUR;+ 3,84 EUR de envío;desde Canadá;
Scotland Yard Menta Gameboy Nintendo 1623 GB;34,08 EUR;+ 14,48 EUR de envío;desde Japón;
Gameboy Nintendo Scotland Yard GB Cartucho gbc;6,82 EUR;+ 14,48 EUR de envío;desde Japón;
Scotland Yard (solo Cartucho) Nintendo Gameboy GB Japón;3,55 EUR;+ 16,19 EUR de envío;desde Japón;
GB -- Scotland Yard -- Caja. juego Boy, Japón Juego Nintendo. Clean & trabajar completamente!!!;38,34 EUR;+ 8,52 EUR de envío;desde Japón;
Gameboy Scotland Yard Sin Caja Solo Cartucho;27,94 EUR;+ 17,04 EUR de envío;desde Japón;
Nintendo GameBoy Scotland Yard Cartridge Japan;12,39 EUR;+ 6,20 EUR de envío;desde Australia;
Scotland Yard Palamedes GAME BOY GB 1990 juego japonés recorte de Revista Promo;9,27 EUR;+ 21,30 EUR de envío;desde Japón;
Scotland Yard CDI CD - Yo Philips En Caja Y Instrucciones;26,11 EUR;+ 12,00 EUR de envío;desde Francia;
Scotland Yard-Detective/Estrategia/crimen Juegos De Pc;1,16 EUR;+ 18,79 EUR de envío estimado;desde Reino Unido;
Scotland Yard-la caza del señor X Londres 2014 Juego de Mesa 100% Completo;8,19 EUR;+ 30,63 EUR de envío estimado;desde Reino Unido;
Juego De Mesa Scotland Yard por Ravensburger, Completa, Excelente Estado;15,11 EUR;+ 30,82 EUR de envío estimado;desde Reino Unido;
Ravensburger Scotland Yard juego edición limitada de 20 año En Estaño Raro Coleccionable;50,35 EUR;+ 31,57 EUR de envío estimado;desde Reino Unido;
21258 Ravensburger Scotland Yard Junior Juego De Mesa Para Niños Edad 6yrs+;23,30 EUR;+ 9,57 EUR de envío;desde Reino Unido;
Nuevo anuncioRavensburger Scotland Yard Juego De Mesa - 26646 100% COMPLETO, gran condición;15,21 EUR;+ 32,24 EUR de envío estimado;desde Reino Unido;
Un gran juego de la familia-Scotland Yard-un atractivo juego de detective para Funskool;35,57 EUR;Envío internacional gratis;desde India;
Multicolor Funskool Scotland Yard, una convincente detective juego de la familia para las edades de 10+;28,29 EUR;Envío internacional gratis;desde India;
Scotland Yard por Ravensburger Juego de Mesa Rara Completa Excelente Estado;15,21 EUR;+ 25,18 EUR de envío estimado;desde Reino Unido;
Vintage Scotland Yard Juego de Mesa repuesto piezas de repuesto 18 Tarjetas de inicio Fullset;4,09 EUR;+ 17,80 EUR de envío estimado;desde Reino Unido;
Vintage Scotland Yard Repuestos Token De Juego De Mesa;2,04 EUR;+ 16,48 EUR de envío estimado;desde Reino Unido;
Vintage Scotland Yard Juego de Mesa repuesto piezas de repuesto 2 Tarjetas Doble Movimiento;1,75 EUR;+ 17,76 EUR de envío estimado;desde Reino Unido;
Vintage Ravensburger Scotland Yard detective Juego de Mesa 1983 Completa;12,87 EUR;+ 25,15 EUR de envío estimado;desde Reino Unido;
Juego De Mesa Vintage Scotland Yard Todo Completo;15,21 EUR;+ 30,87 EUR de envío estimado;desde Reino Unido;
