Blades of Steel gameboy color cómo jugar instruction cuadernillo ukv;6,90 EUR;Envío no especificado;desde Alemania;
Marvel Blade Nintendo Game Boy Color GBC Juego CARTUCHO solo Probado!!!;21,55 EUR;+ 8,62 EUR de envío;desde Estados Unidos;
Blade (Nintendo Game Boy Color, 2000) - TESTED;28,57 EUR;+ 15,40 EUR de envío;desde Canadá;
Blade-Game Boy Color Gameboy;30,16 EUR;+ 2,54 EUR de envío;desde Estados Unidos;
Blade (Nintendo Game Boy Color, 2000) rare game GBC;37,42 EUR;+ 3,40 EUR de envío;desde Canadá;
Para ZTE Sequoia | ZTE Blade Z Max (2017) clara Flexible Delgado Estuche de TPU para juegos;7,89 EUR;Envío gratis;desde Estados Unidos;
Para ZTE Sequoia | ZTE Blade Z Max (2017) clara de TPU flexible delgado EE. UU. Calavera;7,89 EUR;Envío gratis;desde Estados Unidos;
Para ZTE Blade x max soporte Funda Clip Dual Layer Case Diseños Únicos;11,34 EUR;Envío gratis;desde Estados Unidos;
Nintendo Gameboy Color Bey Blade trabajando NTSC-J Japón 2004-232;25,86 EUR;+ 17,24 EUR de envío;desde Japón;
Blade PS1 Gameboy Color GBA Marvel | 2000 Vintage Juego anuncio impreso arte cartel;12,89 EUR;Envío gratis;desde Estados Unidos;
Solo Manual NHL Blades Of Steel Nintendo Gameboy color folleto de instrucciones;5,60 EUR;Envío gratis;desde Estados Unidos;
