Blades of Steel gameboy color cómo jugar instruction cuadernillo ukv;6,90 EUR;Envío no especificado;desde Alemania;
Blade-Game Boy Color Gameboy;29,79 EUR;+ 3,37 EUR de envío;desde Estados Unidos;
Marvel Blade Nintendo Game Boy Color GBC Juego CARTUCHO solo Probado!!!;21,29 EUR;+ 8,52 EUR de envío;desde Estados Unidos;
Blade (Nintendo Game Boy Color, 2000) - TESTED;28,06 EUR;+ 15,12 EUR de envío;desde Canadá;
Nintendo Game Boy Color Marvel Blade 2000 Gameboy Cartucho Probado;21,30 EUR;+ 3,62 EUR de envío;desde Estados Unidos;
Bey Blade Nintendo Game Boy Color dedicado software versión japonesa nuevo sin usar;32,17 EUR;+ 15,34 EUR de envío;desde Japón;
Blade (Nintendo Game Boy Color, 2000) GBC Free shipping tested & works;33,39 EUR;+ 3,33 EUR de envío;desde Canadá;
Para ZTE Sequoia | ZTE Blade Z Max (2017) clara Flexible Delgado Estuche de TPU para juegos;7,80 EUR;Envío gratis;desde Estados Unidos;
Para ZTE Sequoia | ZTE Blade Z Max (2017) clara de TPU flexible delgado EE. UU. Calavera;7,80 EUR;Envío gratis;desde Estados Unidos;
Para ZTE Blade x max soporte Funda Clip Dual Layer Case Diseños Únicos;11,20 EUR;Envío gratis;desde Estados Unidos;
Blade GBC Instruction Manual Booklet Nintendo Game Boy Color;16,03 EUR;+ 8,34 EUR de envío;desde Canadá;
Nintendo Gameboy Color Bey Blade trabajando NTSC-J Japón 2004-232;25,55 EUR;+ 17,03 EUR de envío;desde Japón;
Blade PS1 Gameboy Color GBA Marvel | 2000 Vintage Juego anuncio impreso arte cartel;12,74 EUR;Envío gratis;desde Estados Unidos;
Solo Manual NHL Blades Of Steel Nintendo Gameboy color folleto de instrucciones;5,53 EUR;Envío gratis;desde Estados Unidos;
Game Boy/Color GB explosión disparar Bay Blade (Soft single) Buenos #818;18,74 EUR;Envío internacional gratis;desde Japón;
Game BOY GBC Bay Blade torneo de lucha (Color privada/software solamente) Boy;26,40 EUR;Envío internacional gratis;desde Japón;
Fire Emblem: el atascamiento Blade para Nintendo Game Boy Advance GBA Consola * MBC *;12,83 EUR;+ 16,67 EUR de envío estimado;desde Reino Unido;
