Blade-EUR-Nintendo Gameboy Color-solo Carro-Funcionando-ukfreepost;11,57 EUR;+ 16,54 EUR de envío estimado;Vendidos  5 sep 2021Artículo vendido;desde Reino Unido;
Blade Game Boy Color GBC;65,00 EUR;Envío no especificado;Vendidos  17 ago 2021Artículo vendido;desde Alemania;
Blade (Nintendo Game Boy Color, 2000) GBC Free shipping tested & works;30,07 EUR;+ 3,33 EUR de envío;Vendidos  24 sep 2021Artículo vendido;desde Canadá;
Blade-Nintendo Gameboy Color-Marvel Raro;17,04 EUR;+ 3,62 EUR de envío;Vendidos  17 sep 2021Artículo vendido;desde Estados Unidos;
Juego Blade * SOLAMENTE * (Gameboy Color);17,04 EUR;Envío gratis;Vendidos  5 sep 2021Artículo vendido;desde Estados Unidos;
Blade-Nintendo GameBoy Color-rara MARVEL Juego-Etiqueta agradable-Funciona!;17,04 EUR;+ 3,66 EUR de envío;Vendidos  21 ago 2021Artículo vendido;desde Estados Unidos;
Blade-Nintendo GameBoy Color-rara MARVEL Juego-Etiqueta agradable-Funciona!;17,04 EUR;+ 3,66 EUR de envío;Vendidos  6 ago 2021Artículo vendido;desde Estados Unidos;
Blade-Nintendo Game Boy Color-auténtico-Probado-Folleto de instrucciones;27,27 EUR;Envío gratis;Vendidos  28 jul 2021Artículo vendido;desde Estados Unidos;
Blade Nintendo Gameboy Color. **Cartridge only**Game Tested*;16,71 EUR;+ 5,83 EUR de envío;Vendidos  16 jul 2021Artículo vendido;desde Canadá;
Para ZTE Blade x max soporte Funda Clip Dual Layer Case Diseños Únicos;11,21 EUR;Envío gratis;Vendidos  13 jul 2021Artículo vendido;desde Estados Unidos;
