Lego Racers-Nintendo Gameboy Color juego módulo (av8-s7bq);7,29 EUR;Envío no especificado;desde Alemania;
GBC Game Boy Color Lego Racers PAL EUU ORIGINAL Gameboy Genuine MINT;9,95 EUR;+ 2,50 EUR de envío;desde España;
Nintendo Gameboy Color-Lego Racers & Stunt Rally;18,62 EUR;+ 16,73 EUR de envío estimado;desde Reino Unido;
Nintendo Gameboy Color-Lego Racers;12,78 EUR;+ 16,61 EUR de envío estimado;desde Reino Unido;
Nintendo Gameboy Color-Lego Racers;12,78 EUR;+ 16,61 EUR de envío estimado;desde Reino Unido;
Lego Racers pour Game Boy Color, Advance, DS, DS LITE;9,49 EUR;+ 16,00 EUR de envío;desde Francia;
Lego Racers De Vídeo Juego Para Nintendo Game Boy Colour Pal En Caja;22,17 EUR;+ 20,52 EUR de envío estimado;desde Reino Unido;
Lego Racers gameboy color OVP;30,00 EUR;+ 29,99 EUR de envío;desde Alemania;
Lego Racers para gameboy color y Advance en OVP, rareza! con instrucciones, etc.;33,99 EUR;+ 17,00 EUR de envío;desde Alemania;
Lego Racers para gameboy color y Advance;7,99 EUR;Envío no especificado;desde Alemania;
Lego Racers cómo jugar instrucciones cuadernillo Nintendo Gameboy Color GBC Game Boy;2,49 EUR;Envío no especificado;desde Alemania;
Lego Racers-Game Boy Color Advance Sp Gameboy;5,10 EUR;+ 3,37 EUR de envío;desde Estados Unidos;
Lego Racers-Game Boy Color GBC con manual * Auténtico Y Probado *;14,50 EUR;Envío gratis;desde Estados Unidos;
Lego Racers-NINTENDO GAME BOY COLOR GBC;5,21 EUR;+ 3,80 EUR de envío;desde Estados Unidos;
Lego Racers (Nintendo Game Boy Color, 2001) * * Probado;6,83 EUR;+ 3,80 EUR de envío;desde Estados Unidos;
Lego Racers (Nintendo Game Boy Color, 2001);4,27 EUR;+ 3,41 EUR de envío;desde Estados Unidos;
Lego Racers Juego Boy Color GBC GBA SP GameBoy solo carro figuras auténtico Probado;10,11 EUR;Envío gratis;desde Estados Unidos;
Lego Racers (Nintendo Game Boy Color, 2001);7,25 EUR;+ 3,80 EUR de envío;desde Estados Unidos;
Lego Racers (Nintendo Game Boy Color, 1998) Ahorra;6,83 EUR;Envío gratis;desde Estados Unidos;
Lego Racers-NINTENDO GAME BOY COLOR GBC;7,67 EUR;Envío gratis;desde Estados Unidos;
Lego Racers Gameboy Color Nintendo solo Carro-auténticos limpia funciona;5,12 EUR;+ 3,29 EUR de envío;desde Estados Unidos;
2 Gameboy Color Juegos Lego Racers la máscara de zorro 1999;6,52 EUR;+ 3,80 EUR de envío;desde Estados Unidos;
Lego Racers (Nintendo Game Boy Color, 2001) Auténtico CARTUCHO-PROBADO Y FUNCIONA;6,82 EUR;+ 3,41 EUR de envío;desde Estados Unidos;
Lego Racers Nintendo GameBoy Color GBC ~ envío rápido! funciona muy bien! auténtico!;8,53 EUR;Envío gratis;desde Estados Unidos;
Lego Racers Gameboy Color/Colour game oz281;24,71 EUR;+ 16,70 EUR de envío;desde Australia;
⭐ Vintage Lego Racers Super Speedway Coche Carreras Juego de mesa (2001) 31314 ⭐ En Caja;11,66 EUR;+ 26,43 EUR de envío estimado;desde Reino Unido;
Lego Racers 2-Game Boy Advance juego 2001 vintage Gameboy Racing Game;8,90 EUR;+ 39,99 EUR de envío;desde Alemania;
Nintendo Game Boy Advance Lego Racers 2 EUU Très Bon état;6,90 EUR;+ 11,98 EUR de envío;desde Francia;
