Nintendo Game Boy International Superstar Soccer EUR Excellent état;9,90 EUR;+ 11,98 EUR de envío;desde Francia;
International Superstar Soccer 99 Vídeo Juego Para Nintendo Game Boy Probado;9,30 EUR;+ 16,50 EUR de envío estimado;desde Reino Unido;
International Superstar Soccer 2000 Nintendo Gameboy Color;23,27 EUR;+ 11,05 EUR de envío;desde Eslovaquia;
Game Boy Advance-iss-International Superstar Soccer con centajes. & OVP/Konami;16,99 EUR;+ 8,90 EUR de envío;desde Alemania;
International Superstar Soccer 99 Nintendo Game Boy Color Colour Suelto Cartucho;5,81 EUR;+ 19,23 EUR de envío estimado;desde Reino Unido;
Nintendo Game Boy Color International Superstar Soccer 2000 EUR Très Bon état;12,90 EUR;+ 11,98 EUR de envío;desde Francia;
Jeu International Superstar Soccer ISS pour Nintendo Game Boy EUR - Floto Games;7,90 EUR;+ 5,00 EUR de envío;desde Francia;
Nintendo Game Boy Color International Superstar Soccer 99 EUR Très Bon état;5,90 EUR;+ 11,98 EUR de envío;desde Francia;
Nintendo Gameboy juego-International Superstar Soccer-Embalaje original-pal-Top;99,90 EUR;Envío no especificado;desde Alemania;
Nintendo Gameboy International Superstar Soccer Iss game boy Nuovo SPESE GRATIS;99,90 EUR;+ 40,00 EUR de envío;desde Italia;
International Superstar Soccer Para Nintendo Game Boy * solo Cartucho *;15,12 EUR;+ 16,61 EUR de envío estimado;desde Reino Unido;
Nintendo Game Boy Advance FIFA Football ISS International Superstar Soccer PAL;9,99 EUR;+ 50,00 EUR de envío;desde Francia;
International Superstar Soccer-GAMEBOY Juego-PAL (EUR);16,29 EUR;+ 16,63 EUR de envío estimado;desde Reino Unido;
Nintendo Gameboy Juego-International Superstar Soccer 99;9,25 EUR;+ 16,50 EUR de envío estimado;desde Reino Unido;
International Superstar Soccer 2000 Nintendo Gameboy Color;29,00 EUR;+ 9,50 EUR de envío;desde Eslovaquia;
ISS International Superstar Soccer Nintendo Gameboy Advance Juego;5,81 EUR;+ 8,03 EUR de envío;desde Reino Unido;
ISS International Superstar Soccer Para El Gameboy Advance En Caja;8,73 EUR;+ 20,21 EUR de envío estimado;desde Reino Unido;
Nintendo Gameboy Color-International Superstar Soccer 2000;17,40 EUR;+ 16,65 EUR de envío estimado;desde Reino Unido;
Nintendo Gameboy Color-International Superstar Soccer 2000;17,40 EUR;+ 16,65 EUR de envío estimado;desde Reino Unido;
International Superstar Soccer 99 - Gameboy Color - Complete;19,90 EUR;+ 20,00 EUR de envío;desde Italia;
International Superstar Soccer Gameboy Advance Juego! busque en la tienda!;6,98 EUR;+ 20,53 EUR de envío estimado;desde Reino Unido;
Nintendo Gameboy International Superstar Soccer 99 Cartucho probado y de trabajo;8,13 EUR;+ 16,48 EUR de envío estimado;desde Reino Unido;
51802 manual de instrucciones-International Superstar Soccer-Nintendo Game Boy un;6,97 EUR;+ 5,81 EUR de envío;desde Reino Unido;
Nintendo Game Boy Advance GBA - International Superstar Soccer - ISS - PAL - EUR;7,99 EUR;+ 4,60 EUR de envío;desde Francia;
International Superstar Soccer 2000 Nintendo Game Boy OVP muy bien probado;5,99 EUR;+ 9,99 EUR de envío;desde Alemania;
ISS International Superstar Soccer Nintendo Gameboy Advance Juego;5,76 EUR;+ 16,44 EUR de envío estimado;desde Reino Unido;
International Superstar Soccer ISS Pro-Raro Nintendo Gameboy juego de fútbol;9,31 EUR;+ 5,82 EUR de envío;desde Reino Unido;
International Superstar Soccer-GAMEBOY ADVANCE JUEGO - 100% Auténtico;5,81 EUR;+ 16,44 EUR de envío estimado;desde Reino Unido;
Nintendo GameBoy Color - International Superstar Soccer 99 en el embalaje usado;31,99 EUR;Envío internacional gratis;desde Alemania;
Gameboy Advance | iss International Superstar Soccer juego;2,99 EUR;+ 10,00 EUR de envío;desde Alemania;
Nintendo GameBoy Color juego - International Superstar Soccer 99 cartucho usado;21,99 EUR;Envío internacional gratis;desde Alemania;
GBC-International Superstar Soccer 99 para Nintendo Gameboy Color;9,95 EUR;+ 9,95 EUR de envío;desde Alemania;
Gameboy Color juego-International Superstar Soccer 99 (módulo);6,39 EUR;+ 67,99 EUR de envío;desde Alemania;
Nintendo Game Boy Color International Superstar Soccer 99 en Caja Con Manual;20,93 EUR;Envío no especificado;desde Reino Unido;
International Superstar Soccer-Game Boy-Módulo de juego-Nintendo-Game Boy;6,49 EUR;Envío no especificado;desde Alemania;
International Superstar Soccer 99 Gameboy módulo Game Boy Color GBC;5,55 EUR;Envío no especificado;desde Alemania;
