NTSC Super Nintendo SNES 16bit ISS International Superstar Soccer Juego no Deluxe;118,46 EUR;+ 8,35 EUR de envío;Vendidos  18 sep 2021Artículo vendido;desde Bélgica;
International Superstar Soccer-Nintendo Game Boy;8,14 EUR;+ 16,47 EUR de envío estimado;Vendidos  5 sep 2021Artículo vendido;desde Reino Unido;
Nintendo Gameboy-International Superstar Soccer-en Caja;30,66 EUR;+ 8,52 EUR de envío;Vendidos  2 sep 2021Artículo vendido;desde Grecia;
Nintendo Gameboy International Superstar Soccer 99 Cartucho probado y de trabajo;6,98 EUR;+ 16,44 EUR de envío estimado;Vendidos  16 ago 2021Artículo vendido;desde Reino Unido;
Gb-International Superstar Soccer para Nintendo GameBoy;7,95 EUR;+ 6,50 EUR de envío;Vendidos  4 ago 2021Artículo vendido;desde Alemania;
International Superstar Soccer'99 Juego en Caja con Manual Boy Color;14,54 EUR;+ 18,56 EUR de envío estimado;Vendidos  1 ago 2021Artículo vendido;desde Reino Unido;
Iss International Superstar Soccer para Nintendo Gameboy Advance GBA-original;3,49 EUR;Envío no especificado;Vendidos  21 jul 2021Artículo vendido;desde Alemania;
International Superstar Soccer Complet sur Gameboy !!!!;16,99 EUR;+ 5,99 EUR de envío;Vendidos  20 jul 2021Artículo vendido;desde Francia;
International Superstar Soccer ISS NINTENDO GAMEBOY Carro De Juego Original * * En muy buena condición;6,97 EUR;+ 16,44 EUR de envío estimado;Vendidos  4 jul 2021Artículo vendido;desde Reino Unido;
Nueva marca International Superstar Soccer 2000 (Nintendo Game Boy Color) Gbc Gba;82,49 EUR;Envío gratis;Vendidos  2 sep 2021Artículo vendido;desde Estados Unidos;
International Superstar Soccer'99 Nintendo Game Boy Color Completo en Caja EUR;22,15 EUR;Envío gratis;Vendidos  2 sep 2021Artículo vendido;desde Estados Unidos;
International Superstar Soccer'99 ISS Nintendo Game Boy Color GBC carro de EE. UU.;32,38 EUR;Envío gratis;Vendidos  30 ago 2021Artículo vendido;desde Estados Unidos;
International Superstar Soccer 99 (Nintendo Game Boy Color) GBC nos Konami;25,56 EUR;Envío gratis;Vendidos  28 ago 2021Artículo vendido;desde Estados Unidos;
International Superstar Soccer Advance Nintendo Game Boy GBA completo En Caja Completo En Caja;38,34 EUR;Envío gratis;Vendidos  25 ago 2021Artículo vendido;desde Estados Unidos;
GameBoy Advance International Superstar Soccer Boxed Game Complete Like New PAL;24,71 EUR;+ 38,78 EUR de envío;Vendidos  21 ago 2021Artículo vendido;desde Australia;
International Superstar Soccer SNES SUPER NINTENDO 100% Original Funciona ISSS;72,44 EUR;+ 8,52 EUR de envío;Vendidos  21 ago 2021Artículo vendido;desde México;
International Superstar Soccer'99 ISS Nintendo Game Boy Color GBC carro de EE. UU.;25,56 EUR;Envío gratis;Vendidos  5 ago 2021Artículo vendido;desde Estados Unidos;
International Superstar Soccer 2000 GBC Nuevo Juego Boy Color;19,38 EUR;Envío gratis;Vendidos  3 ago 2021Artículo vendido;desde Estados Unidos;
International Superstar Soccer Nintendo Game Boy videojuego Con Manual Y Caja;17,04 EUR;Envío gratis;Vendidos  29 jul 2021Artículo vendido;desde Estados Unidos;
International Superstar Soccer 2000 GBC Nuevo Juego Boy Color;19,38 EUR;Envío gratis;Vendidos  26 jul 2021Artículo vendido;desde Estados Unidos;
International Superstar Soccer 2000 GBC Nuevo Juego Boy Color;19,38 EUR;Envío gratis;Vendidos  17 jul 2021Artículo vendido;desde Estados Unidos;
International Superstar Soccer 2000 ISS Nintendo Game Boy Color GBC Nuevo Sellado;32,38 EUR;Envío gratis;Vendidos  13 jul 2021Artículo vendido;desde Estados Unidos;
International Superstar Soccer 99 (Nintendo Game Boy Color, 2000) [solo carro];29,82 EUR;Envío gratis;Vendidos  12 jul 2021Artículo vendido;desde Estados Unidos;
International Superstar Soccer SNES SUPER NINTENDO 100% Original Funciona ISSS;68,18 EUR;+ 17,05 EUR de envío;Vendidos  9 jul 2021Artículo vendido;desde México;
International Superstar Soccer Deluxe & trabajo SNES Juego ~ En Caja;58,15 EUR;+ 21,44 EUR de envío estimado;Vendidos  10 jul 2021Artículo vendido;desde Reino Unido;
International Superstar Soccer Deluxe-Super Nintendo Complete Boxed SNES Juego;23,20 EUR;+ 16,75 EUR de envío estimado;Vendidos  7 ago 2021Artículo vendido;desde Reino Unido;
Snes super nintendo International Superstar Soccer Deluxe cib EUR;34,90 EUR;+ 8,99 EUR de envío;Vendidos  12 ago 2021Artículo vendido;desde Alemania;
Snes super nintendo International Superstar Soccer Deluxe cib EUR;34,90 EUR;+ 8,99 EUR de envío;Vendidos  21 ago 2021Artículo vendido;desde Alemania;
International Superstar Soccer Deluxe Juego Para Sony PlayStation PS1 Pal probado;46,51 EUR;+ 17,17 EUR de envío estimado;Vendidos  2 sep 2021Artículo vendido;desde Reino Unido;
Nintendo 64 n64 juego International Superstar Soccer 64 con embalaje original + instrucciones EUR;19,90 EUR;+ 8,99 EUR de envío;Vendidos  24 ago 2021Artículo vendido;desde Alemania;
International Superstar Soccer 2 Para Nintendo Gamecube juego de fútbol ISS 2-PAL;3,43 EUR;+ 18,65 EUR de envío estimado;Vendidos  15 jul 2021Artículo vendido;desde Reino Unido;
ISS 3 International Superstar Soccer 3, pal, completa, NINTENDO GAMECUBE Juego;15,04 EUR;+ 11,63 EUR de envío;Vendidos  14 sep 2021Artículo vendido;desde Reino Unido;
International Superstar Soccer 98 ISS 98 Nintendo 64 N64 Juego Cartucho Solo;6,97 EUR;+ 16,44 EUR de envío estimado;Vendidos  26 ago 2021Artículo vendido;desde Reino Unido;
International Superstar Soccer pro Evolution (PS),, usada; Buen Juego;4,26 EUR;+ 2,14 EUR de envío;Vendidos  7 ago 2021Artículo vendido;desde Reino Unido;
Snes super nintendo International Superstar Soccer con embalaje original y guía EUR;29,90 EUR;+ 8,99 EUR de envío;Vendidos  2 ago 2021Artículo vendido;desde Alemania;
International Superstar Soccer pro (SONY PLAYSTATION 1) PS1 Juego Completo;6,92 EUR;+ 16,44 EUR de envío estimado;Vendidos  23 jul 2021Artículo vendido;desde Reino Unido;
International Superstar Soccer Deluxe ,  Snes / Super Nintendo - PAL EUR ;35,50 EUR;Envío internacional gratis;Vendidos  9 sep 2021Artículo vendido;desde Francia;
International Superstar Soccer 64 Nintendo N64 PAL sólo cartucho de juego probadas;4,42 EUR;+ 19,83 EUR de envío estimado;Vendidos  19 ago 2021Artículo vendido;desde Reino Unido;
International Superstar Soccer 98-Nintendo 64 Juego-muy Bueno-Completa ISS;18,61 EUR;+ 20,74 EUR de envío estimado;Vendidos  24 jul 2021Artículo vendido;desde Reino Unido;
International Superstar Soccer Deluxe Super Nintendo SNES solo carro PAL;12,73 EUR;+ 16,55 EUR de envío estimado;Vendidos  6 sep 2021Artículo vendido;desde Reino Unido;
International Superstar Soccer Deluxe Sega Mega Drive Juego Raro Retro;31,39 EUR;+ 16,90 EUR de envío estimado;Vendidos  29 jul 2021Artículo vendido;desde Reino Unido;
N64 Nintendo 64 Pal En Caja Cartucho De Juego Pak International Superstar Soccer;11,62 EUR;+ 16,54 EUR de envío estimado;Vendidos  3 sep 2021Artículo vendido;desde Reino Unido;
International Superstar Soccer 2 (Sony PlayStation 2, 2002) PS2 completa ISS 2;4,47 EUR;+ 16,40 EUR de envío estimado;Vendidos  15 ago 2021Artículo vendido;desde Reino Unido;
International Superstar Soccer Super NES Nintendo SNES COMPLETO PAL KONAMI ISS;32,55 EUR;+ 20,98 EUR de envío estimado;Vendidos  1 ago 2021Artículo vendido;desde Reino Unido;
International Superstar Soccer pro Juego Para Sony PlayStation PS1 Pal probado;5,80 EUR;+ 16,43 EUR de envío estimado;Vendidos  8 jul 2021Artículo vendido;desde Reino Unido;
International Superstar Soccer pro 98 Para Sony Playstation 1 PS1 Completo + demostración;23,25 EUR;+ 23,25 EUR de envío;Vendidos  8 ago 2021Artículo vendido;desde Reino Unido;
Nintendo 64 N64 juego International Superstar Soccer ISS en Caja Con Manual (BS3);20,93 EUR;+ 16,70 EUR de envío estimado;Vendidos  20 ago 2021Artículo vendido;desde Reino Unido;
International Superstar Soccer '98/1998 🏆 ⚽ 🩳 Nintendo 64/n64 (PAL) en Box;7,99 EUR;+ 9,90 EUR de envío;Vendidos  15 jul 2021Artículo vendido;desde Alemania;
Nintendo 64 N64 Consola Juego-International Superstar Soccer-en Caja;10,45 EUR;+ 16,51 EUR de envío estimado;Vendidos  4 ago 2021Artículo vendido;desde Reino Unido;
ISS Pro 98 International Superstar Soccer Sony Playstation 1 juego PS1;18,60 EUR;+ 20,93 EUR de envío;Vendidos  2 ago 2021Artículo vendido;desde Reino Unido;
International Superstar Soccer Deluxe ,  Snes / Super Nintendo - PAL EUR ;30,00 EUR;+ 2,90 EUR de envío;Vendidos  2 sep 2021Artículo vendido;desde Bélgica;
Snes super nintendo International Superstar Soccer Deluxe + embalaje original y guía EUR;39,90 EUR;+ 7,99 EUR de envío;Vendidos  21 jul 2021Artículo vendido;desde Alemania;
International Superstar Soccer-PlayStation 1-PS1;4,94 EUR;+ 7,68 EUR de envío;Vendidos  29 jun 2021Artículo vendido;desde Reino Unido;
