Nintendo GameBoy Color game - Mahjong Quest JAPAN cartridge;7,43 EUR;Envío internacional gratis;desde Alemania;
Nintendo GameBoy Color jeu - Mahjong Quest JAPAN cartouche utilisé;11,99 EUR;Envío internacional gratis;desde Alemania;
Nintendo GameBoy Color gioco - Mahjong Quest JAPAN cartuccia usato;13,99 EUR;Envío internacional gratis;desde Alemania;
Nintendo GameBoy Color juego - Mahjong Quest JAPAN cartucho usado;13,99 EUR;Envío internacional gratis;desde Alemania;
Mahjong Quest (Nintendo Game Boy Color GBC, 1998) Japan Import;4,05 EUR;+ 3,89 EUR de envío;desde Canadá;
Mahjong Quest (Game Boy Color) Japón importación Vendedor de Estados Unidos;6,38 EUR;Envío gratis;desde Estados Unidos;
