Dexterity Jeu SNK Nintendo Game Boy NTSC-J Import JAP;11,99 EUR;+ 3,00 EUR de envío;desde Francia;
Gb-Dexterity para Nintendo GameBoy;19,95 EUR;+ 17,50 EUR de envío;desde Alemania;
Nintendo Game Boy, Dexterity incl. caja original y guía, DMG-Fu-noe;89,95 EUR;Envío no especificado;desde Alemania;
Dexterity für Nintendo Game Boy - GB - nur Modul;17,90 EUR;Envío no especificado;desde Austria;
Nintendo Game Boy Game Manual: Dexterity;6,67 EUR;+ 9,73 EUR de envío;desde Canadá;
Dexterity Gameboy Game **USED;18,59 EUR;+ 3,10 EUR de envío;desde Australia;
