Disneys Tarzan Nintendo Game Boy Color Juego en Caja;23,31 EUR;+ 16,79 EUR de envío estimado;Vendidos  11 sep 2021Artículo vendido;desde Reino Unido;
Tarzan Game Boy Color EUR ;5,00 EUR;Envío internacional gratis;Vendidos  5 sep 2021Artículo vendido;desde Francia;
Gameboy Colour, Disney Tarzan, manual de instrucciones,! Excelente Estado!;1,15 EUR;+ 31,32 EUR de envío estimado;Vendidos  28 ago 2021Artículo vendido;desde Reino Unido;
Juego Disney Tarzan Game Boy Color como nuevo ;6,00 EUR;Envío no especificado;Vendidos  22 ago 2021Artículo vendido;desde España;
Disneys Tarzan Freeride ps2 Juego Niños Chicos Chicas Marron;2,90 EUR;+ 18,70 EUR de envío estimado;Vendidos  15 ago 2021Artículo vendido;desde Reino Unido;
Nintendo Game Boy Advance  Disney Tarzan L'Appel de la Jungle  GBA  Vers. FRA;5,00 EUR;Envío no especificado;Vendidos  4 ago 2021Artículo vendido;desde Francia;
Tarzan pour Game Boy Color;1,00 EUR;+ 6,00 EUR de envío;Vendidos  2 ago 2021Artículo vendido;desde Francia;
Tarzan: Lord of the Jungle - Game Boy;6,52 EUR;Envío internacional gratis;Vendidos  22 jul 2021Artículo vendido;desde Francia;
Vintage GameBoy Color CGB-001 Teal Plus WWF Betrayal, Disney's Tarzan;64,11 EUR;+ 37,18 EUR de envío estimado;Vendidos  14 jul 2021Artículo vendido;desde Reino Unido;
Tarzan Boy Acorn Electrón Cassette por alligata probado y de trabajo;3,49 EUR;+ 32,38 EUR de envío estimado;Vendidos  10 jul 2021Artículo vendido;desde Reino Unido;
Lot Jeux Game Boy Color Rayman Mario Dracula Casper Addams Tarzan;64,00 EUR;Envío no especificado;Vendidos  4 jul 2021Artículo vendido;desde Francia;
