Boulder Dash - Nintendo Gameboy Game Cartridge Cart In Case;10,46 EUR;+11,65 EUR shipping;from United Kingdom;
Nintendo Game Boy Classic Game Boulder Dash With Original Box and Instructions NOE;79,90 EUR;+8,99 EUR shipping;from Germany;
Boulder Dash for Game Boy - Cartridge Only;11,65 EUR;+10,48 EUR shipping;from United Kingdom;
Alleyway, Boulder Dash, Bust A Move 2, Tetris. Genuine Gameboy. GB. Game Boy;46,64 EUR;+20,94 EUR shipping estimate;from United Kingdom;
Nintendo Game Boy Game Boulder Dash Boxed with Manual;52,46 EUR;+21,39 EUR shipping estimate;from United Kingdom;
Boulder Dash EX - Nintendo Gameboy Advance GBA - Complet - NTSC-J JAP JAPAN;69,90 EUR;+24,90 EUR shipping;from France;
Nintendo Gameboy Game - Boulder Dash;10,43 EUR;+16,56 EUR shipping estimate;from United Kingdom;
Nintendo Gameboy-Boulder Dash-Top-OVP-PAL;79,90 EUR;Shipping not specified;from Germany;
Boulder Dash for Nintendo Gameboy;10,90 EUR;+6,50 EUR shipping;from Germany;
Nintendo Game Boy Boulder Dash JAP Très Bon état;11,90 EUR;+11,98 EUR shipping;from France;
Nintendo Gameboy - Boulder Dash *COMPLETE*;54,21 EUR;+21,43 EUR shipping estimate;from United Kingdom;
Boulder Dash Game Boy Game Complete with original box and instructions;59,99 EUR;+8,00 EUR shipping;from Germany;
Nintendo Gameboy Game-Boulder Dash (Module) 11191490;11,99 EUR;+67,99 EUR shipping;from Germany;
Boulder Dash / Cartucho Gameboy / Solo Cartucho - PAL NOE;9,95 EUR;+7,95 EUR shipping;from Spain;
Boulder Dash (Game Boy GB 1990) Japan Import;8,71 EUR;+9,90 EUR shipping;from Spain;
GB-Boulder Dash for Nintendo Gameboy;9,95 EUR;+6,50 EUR shipping;from Germany;
Boulder Dash Nintendo Game Boy Game VGC TESTED;14,99 EUR;+9,99 EUR shipping;from Germany;
Nintendo GameBoy juego - Boulder Dash en el embalaje usado COMO NUEVO;110,99 EUR;+69,99 EUR shipping;from Germany;
New ListingGameboy Nintendo Boulder Dash OVP;69,00 EUR;Shipping not specified;from Germany;
Nintendo Game Boy Game Boulder Dash Boxed with Manual;52,45 EUR;Shipping not specified;from United Kingdom;
Boulder Dash - Nintendo Game Boy Import Jap;5,00 EUR;Shipping not specified;from France;
Boulder Dash Nintendo Gameboy OVP CIB Boxed;58,90 EUR;Shipping not specified;from Germany;
Juego Game Boy Advance 108 En 1 - Rockman 3+Twin Bee+Boulder Dash+Bomb Jack;6,00 EUR;Shipping not specified;from Spain;
