Harvest Moon GB de vídeo juego para Nintendo Game Boy NTSC-J Japonés Probado;11,69 EUR;+ 16,65 EUR de envío estimado;desde Reino Unido;
GAME BOY COLOR NINTENDO BOKUJOU Monogatari Harvest Moon GB 2 JAPÓN COMPLETO;24,90 EUR;+ 19,90 EUR de envío;desde España;
Harvest Moon GB Nintendo Game Boy Color Advance Juego Solo Carro Genuino;31,55 EUR;+ 9,36 EUR de envío;desde Reino Unido;
Harvest Moon GB--Nintendo Game Boy--NTSC JAP--A-Ware;8,15 EUR;+ 1,09 EUR de envío;desde Austria;
Nintendo Gameboy Color En Caja-Harvest Moon GB;52,62 EUR;+ 17,38 EUR de envío estimado;desde Reino Unido;
Harvest Moon GB ** Nueva Batería ** GameBoy Color con caja y libro Nintendo;52,08 EUR;+ 28,67 EUR de envío;desde Reino Unido;
Harvest Moon GB Nintendo Gameboy Juego PAL solo carro;23,40 EUR;+ 7,61 EUR de envío;desde Reino Unido;
Nintendo Gameboy Juego-Harvest Moon GB-Japón-DMG-aywj;10,49 EUR;+ 16,62 EUR de envío estimado;desde Reino Unido;
Nintendo Gameboy Juego-Harvest Moon GB;23,35 EUR;+ 16,86 EUR de envío estimado;desde Reino Unido;
Japonés Nintendo Gameboy-DMG-aywj-Harvest Moon GB;10,49 EUR;+ 16,62 EUR de envío estimado;desde Reino Unido;
Harvest Moon GB. juego Boy Colour. 1998. los procesadores. versión Europea.;46,81 EUR;+ 17,28 EUR de envío estimado;desde Reino Unido;
Nintendo Gameboy Color GBC - Harvest Moon GB;19,95 EUR;+ 3,00 EUR de envío;desde Países Bajos;
Harvest Moon GB Manual de juego de Nintendo Game Boy Color;12,88 EUR;+ 8,19 EUR de envío;desde Reino Unido;
Harvest Moon GB DMG-AYXP-EUR Game Boy Nintendo Cartridge Only;15,00 EUR;Envío no especificado;desde Países Bajos;
GAME BOY COLOR NINTENDO BOKUJOU Monogatari Harvest Moon GB 2 JAPÓN COMPLETO;15,90 EUR;+ 19,90 EUR de envío;desde España;
GAME BOY COLOR NINTENDO BOKUJOU Monogatari Harvest Moon GB 2 JAPÓN COMPLETO;21,90 EUR;+ 19,90 EUR de envío;desde España;
