McDonaldland-Raro Nintendo Gameboy Juego-Ronald McDonald Océano;22,20 EUR;+ 19,17 EUR de envío estimado;desde Reino Unido;
Nintendo Gameboy Juego-McDonaldland;23,37 EUR;+ 16,87 EUR de envío estimado;desde Reino Unido;
McDonaldland | GameBoy🕹Very Good Condition🌍Mc Donalds Mc Donaldland | Rare FRG;32,50 EUR;+ 3,50 EUR de envío;desde Países Bajos;
McDonaldland-Raro Nintendo Gameboy Juego Con Estuche-Ronald McDonald Océano;117,11 EUR;+ 27,38 EUR de envío estimado;desde Reino Unido;
Nintendo Gameboy McDonaldland Original Juego Cartucho En Estuche De Plástico;58,56 EUR;+ 17,50 EUR de envío estimado;desde Reino Unido;
Nuevo anuncioMcDonaldland Nintendo Gameboy Folleto De Instrucciones Manual/;1,64 EUR;+ 22,94 EUR de envío estimado;desde Reino Unido;
McDonaldland-Nintendo Gameboy Carro de cartucho de juego solamente;23,39 EUR;+ 11,70 EUR de envío;desde Reino Unido;
Gameboy McDonaldland en Caja con Manual Raro Free UK Post;163,96 EUR;Envío no especificado;desde Reino Unido;
