McDonaldland-Raro Nintendo Gameboy Juego-Ronald McDonald Océano;22,05 EUR;+ 19,05 EUR de envío estimado;desde Reino Unido;
Nintendo Gameboy Juego-McDonaldland;23,21 EUR;+ 16,76 EUR de envío estimado;desde Reino Unido;
McDonaldland-Raro Nintendo Gameboy Juego Con Estuche-Ronald McDonald Océano;116,35 EUR;+ 27,21 EUR de envío estimado;desde Reino Unido;
Nintendo Gameboy McDonaldland Original Juego Cartucho En Estuche De Plástico;58,18 EUR;+ 17,38 EUR de envío estimado;desde Reino Unido;
McDonaldland-Nintendo Gameboy Carro de cartucho de juego solamente;23,24 EUR;+ 11,62 EUR de envío;desde Reino Unido;
Gameboy McDonaldland en Caja con Manual Raro Free UK Post;162,90 EUR;Envío no especificado;desde Reino Unido;
McDonaldland | GameBoy🕹Very Good Condition🌍Mc Donalds Mc Donaldland | Rare FRG;32,50 EUR;+ 3,50 EUR de envío;desde Países Bajos;
