Frogger Nintendo Gameboy Color Juego;4,88 EUR;+ 31,31 EUR de envío estimado;Vendidos  23 ago 2021Artículo vendido;desde Reino Unido;
Konami gb Collection Vol. 2 gameboy color OVP cib Boxed Frogger Parodius Track;78,30 EUR;+ 4,50 EUR de envío;Vendidos  9 jul 2021Artículo vendido;desde Alemania;
Frogger 2-GBC Game Boy Color-Cartucho únicamente;6,39 EUR;Envío gratis;Vendidos  22 sep 2021Artículo vendido;desde Estados Unidos;
Gameboy Color Morado con 4 Juegos, Frogger 1 & 2. Mario Mini Golf. Mrs Pacman;62,22 EUR;Envío gratis;Vendidos  22 sep 2021Artículo vendido;desde Estados Unidos;
Lote de 3 Vintage Nintendo Game Boy Color Frogger, Dragon Ball Z & Simpsons Japón;21,20 EUR;+ 7,66 EUR de envío;Vendidos  21 sep 2021Artículo vendido;desde Estados Unidos;
Frogger (Nintendo Game Boy Color, 1998) Probado Funciona;6,39 EUR;+ 3,54 EUR de envío;Vendidos  21 sep 2021Artículo vendido;desde Estados Unidos;
Frogger 2 (Nintendo Game Boy Color) Carro. probado. con Caja Y Manual Look;10,65 EUR;+ 3,49 EUR de envío;Vendidos  19 sep 2021Artículo vendido;desde Estados Unidos;
Grinch, CATZ, Frogger, Sabrina, círculo ganador, Manual De Gameboy Color LOONEY TUNES;8,48 EUR;+ 2,97 EUR de envío;Vendidos  17 sep 2021Artículo vendido;desde Estados Unidos;
Frogger-Game Boy Color Gameboy Juego-Probado Y Funcionando;3,92 EUR;+ 3,58 EUR de envío;Vendidos  17 sep 2021Artículo vendido;desde Estados Unidos;
Frogger (Nintendo Game Boy Color, 1998) Probado Funciona;5,11 EUR;+ 2,55 EUR de envío;Vendidos  16 sep 2021Artículo vendido;desde Estados Unidos;
Lote de 3 Juegos Game Boy Color Frogger 2, M&ms Minis locura, Puzzle Collection +;6,14 EUR;+ 4,13 EUR de envío;Vendidos  15 sep 2021Artículo vendido;desde Estados Unidos;
Frogger Para Original Game Boy + Color | DMG-Afre-USA-3 versión probado GBC #3;4,25 EUR;+ 3,96 EUR de envío;Vendidos  13 sep 2021Artículo vendido;desde Estados Unidos;
Frogger 2 (Nintendo Game Boy Color, 2000);6,81 EUR;+ 3,41 EUR de envío;Vendidos  13 sep 2021Artículo vendido;desde Estados Unidos;
Frogger (Nintendo Game Boy Color, 1998);3,36 EUR;+ 3,54 EUR de envío;Vendidos  13 sep 2021Artículo vendido;desde Estados Unidos;
Frogger 2-Juego Boy Color;4,24 EUR;+ 2,51 EUR de envío;Vendidos  12 sep 2021Artículo vendido;desde Estados Unidos;
Frogger Para Original Game Boy + Color | DMG-Afre-USA-2 probado auténtico GBC #2;3,40 EUR;+ 3,96 EUR de envío;Vendidos  12 sep 2021Artículo vendido;desde Estados Unidos;
Frogger (Nintendo Game Boy Color, 1998) liberado & Probado;7,59 EUR;Envío gratis;Vendidos  10 sep 2021Artículo vendido;desde Estados Unidos;
Frogger 2 (Nintendo Game Boy Color) solo Carro. probadas. Excelente! envío Gratuito!;12,78 EUR;Envío gratis;Vendidos  10 sep 2021Artículo vendido;desde Estados Unidos;
Frogger 2 Nintendo Game Boy Color Solo Manual ~ Folleto de instrucciones;4,26 EUR;Envío gratis;Vendidos  10 sep 2021Artículo vendido;desde Estados Unidos;
Frogger (Nintendo Game Boy Color, 1998);6,39 EUR;+ 2,72 EUR de envío;Vendidos  8 sep 2021Artículo vendido;desde Estados Unidos;
Frogger 2-Nintendo Game Boy Color-Limpio/probado-Envío Gratuito;8,51 EUR;Envío gratis;Vendidos  8 sep 2021Artículo vendido;desde Estados Unidos;
Frogger Gameboy Color Cartucho! probado funciona!;5,96 EUR;+ 4,18 EUR de envío;Vendidos  8 sep 2021Artículo vendido;desde Estados Unidos;
Frogger (Nintendo Game Boy Color, 1998) Sólo Cartucho;1,07 EUR;+ 3,41 EUR de envío;Vendidos  7 sep 2021Artículo vendido;desde Estados Unidos;
Frogger-Game Boy Color Gameboy Juego-solo carro;2,55 EUR;+ 3,49 EUR de envío;Vendidos  6 sep 2021Artículo vendido;desde Estados Unidos;
Frogger 2-Game Boy Color GBC;3,40 EUR;+ 3,83 EUR de envío;Vendidos  6 sep 2021Artículo vendido;desde Estados Unidos;
Nintendo Game Boy Color Juego-Frogger. el éxito arcade clásico, Sellado;25,53 EUR;Envío gratis;Vendidos  6 sep 2021Artículo vendido;desde Estados Unidos;
Frogger 2 en Gameboy Color 7E;6,65 EUR;Envío gratis;Vendidos  6 sep 2021Artículo vendido;desde Estados Unidos;
Frogger (Nintendo Game Boy Color, 1998) CS7 -! envío Gratis!;5,48 EUR;Envío gratis;Vendidos  4 sep 2021Artículo vendido;desde Estados Unidos;
Frogger (Nintendo Game Boy Color) GBC;3,40 EUR;+ 3,83 EUR de envío;Vendidos  4 sep 2021Artículo vendido;desde Estados Unidos;
Nintendo Game Boy Color Consola de Juego portátil-Cerceta con Frogger Juego;51,14 EUR;+ 3,20 EUR de envío;Vendidos  4 sep 2021Artículo vendido;desde Estados Unidos;
Frogger Para Nintendo Game Boy & Color ~ Cartucho W. Case & instructions ~ Probado;10,22 EUR;Envío gratis;Vendidos  4 sep 2021Artículo vendido;desde Estados Unidos;
Frogger (Nintendo Game Boy Color, 1998) Completo Caja Manual caso juego Game Boy Color;18,43 EUR;Envío gratis;Vendidos  2 sep 2021Artículo vendido;desde Estados Unidos;
Frogger 2-GameBoy Color Juego;4,53 EUR a 9,06 EUR;+ 2,51 EUR de envío;Vendidos  2 sep 2021Artículo vendido;desde Estados Unidos;
Frogger Gameboy Color Cartucho (con manual) 100% Auténtico;11,89 EUR;Envío gratis;Vendidos  31 ago 2021Artículo vendido;desde Estados Unidos;
Clásico Frogger Arcade (Nintendo Game Boy Color, 1998) En Embalaje Nueva;58,81 EUR;+ 6,41 EUR de envío;Vendidos  31 ago 2021Artículo vendido;desde Estados Unidos;
Frogger 2 GameBoy Color | auténtico probado todavía guarda buenos ahorrar batería GBC #2;5,96 EUR;+ 3,96 EUR de envío;Vendidos  30 ago 2021Artículo vendido;desde Estados Unidos;
Frogger 2 (Nintendo Game Boy Color, 2000);0,89 EUR;+ 4,47 EUR de envío;Vendidos  28 ago 2021Artículo vendido;desde Estados Unidos;
Frogger 2 (Nintendo Game Boy Color, 2000);2,56 EUR;+ 3,54 EUR de envío;Vendidos  27 ago 2021Artículo vendido;desde Estados Unidos;
Frogger 2-Nintendo Game Boy Color Sistema sólo -;7,63 EUR;Envío gratis;Vendidos  25 ago 2021Artículo vendido;desde Estados Unidos;
Nintendo Gameboy Color Frogger 2 Lego ALPHA TEAM GBC Video Juego Bundle Lote Carro;9,36 EUR;Envío gratis;Vendidos  24 ago 2021Artículo vendido;desde Estados Unidos;
Frogger 1 y 2 Juegos Nintendo Game Boy Color juega en Advance SP Sistema;13,63 EUR;+ 3,54 EUR de envío;Vendidos  23 ago 2021Artículo vendido;desde Estados Unidos;
Frogger (Nintendo Game Boy Color, 1998);3,41 EUR;+ 3,41 EUR de envío;Vendidos  23 ago 2021Artículo vendido;desde Estados Unidos;
Frogger-Original Nintendo GameBoy Color Juego;9,06 EUR a 15,87 EUR;+ 2,51 EUR de envío;Vendidos  23 ago 2021Artículo vendido;desde Estados Unidos;
Frogger 2 (Nintendo Game Boy Color, 2000);6,81 EUR;Envío gratis;Vendidos  22 ago 2021Artículo vendido;desde Estados Unidos;
PAC-Man: edición especial de color y Frogger-GameBoy Color GBC GBA SP, 1999;10,90 EUR;+ 2,97 EUR de envío;Vendidos  22 ago 2021Artículo vendido;desde Estados Unidos;
Frogger 2 (Nintendo Game Boy Color, 2000);1,92 EUR;+ 2,61 EUR de envío;Vendidos  22 ago 2021Artículo vendido;desde Estados Unidos;
