Hoyle Casino (Nintendo Game Boy Color, de 2000, sólo cartucho/Folleto);6,97 EUR;+ 4,44 EUR de envío;desde Estados Unidos;
Hoyle Casino (Nintendo Game Boy Color, 2000) Vintage, Con Estuche;5,98 EUR;+ 3,80 EUR de envío;desde Estados Unidos;
Hoyle Casino (Nintendo Game Boy Color) - Excelente Estado!!!;11,11 EUR;+ 7,22 EUR de envío;desde Estados Unidos;
Hoyle Casino Nintendo Game Boy Color * forma agradable * más difícil encontrar!;11,08 EUR;Envío gratis;desde Estados Unidos;
Hoyle Casino (Nintendo Game Boy Color, 2000) Nueva. dados, ranuras, Poker, BJ, Pai Gow;16,08 EUR;+ 3,68 EUR de envío;desde Estados Unidos;
Hoyle Casino Nintendo Game Boy Color Game GBC Complete See Pics;10,14 EUR;+ 6,76 EUR de envío;desde Canadá;
Hoyle Casino Nintendo Game Boy Color Auténtico probado y de trabajo;7,68 EUR;+ 3,80 EUR de envío;desde Estados Unidos;
Hoyle Casino (fornintendo Game Boy Color solamente, 2000) Nueva Sellado de fábrica;25,45 EUR;+ 3,85 EUR de envío;desde Estados Unidos;
Lote de 3 juegos de Hoyle Casino Las Vegas Bill Bobs Juego Boy Color;11,10 EUR;+ 5,40 EUR de envío;desde Estados Unidos;
Hoyle Casino Gameboy COLOR GBC GBA * AUTÉNTICO *;6,83 EUR;+ 3,42 EUR de envío;desde Estados Unidos;
Hoyle Casino-Nintendo Game Boy Color (Nueva-Sellada;29,91 EUR;Envío gratis;desde Estados Unidos;
Hoyle Casino Gameboy Color + (poss Driver-falta la etiqueta engomada);5,12 EUR;+ 3,80 EUR de envío;desde Estados Unidos;
Hoyle Casino (Nintendo Game Boy Color, 2000) Nueva. dados, ranuras, Poker, BJ, Pai Gow;30,76 EUR;Envío gratis;desde Estados Unidos;
Hoyle Casino (Nintendo Game Boy Color, de 2000, sólo cartucho/Folleto);5,94 EUR;+ 4,23 EUR de envío;desde Estados Unidos;
Hoyle Casino (Nintendo Game Boy Color Cartucho) Advance & SP COMPATIBLE;7,65 EUR;+ 2,86 EUR de envío;desde Estados Unidos;
Hoyle Casino (Nintendo Game Boy Color, 2000) sólo folleto de instrucciones;5,12 EUR;Envío gratis;desde Estados Unidos;
Hoyle Casino Manual Nintendo Gameboy Color GBC Game Boy Original;4,23 EUR;Envío gratis;desde Estados Unidos;
Hoyle Casino (Nintendo Game Boy Color, 2000) GBC Completa;10,21 EUR;+ 4,23 EUR de envío;desde Estados Unidos;
Hoyle Casino Nintendo Gameboy Color * Solo Manual * Sin Juego;5,13 EUR;Envío gratis;desde Estados Unidos;
