Casper españolizado version española game boy gameboy gbc;150,00 EUR;+ 14,99 EUR de envío;desde España;
Casper para la Nintendo Game Boy Advance, en caja con manual, Reino Unido;23,40 EUR;+ 16,86 EUR de envío estimado;desde Reino Unido;
Jeu Nintendo Game Boy - Casper - EUR - Loose;8,90 EUR;+ 7,90 EUR de envío;desde Francia;
Casper Fantasma Espíritu dimensiones ps2 Juego Los Chicos Niños Niñas-Raro;7,01 EUR;+ 18,85 EUR de envío estimado;desde Reino Unido;
NINTENDO GAME BOY-Casper (en Caja);105,29 EUR;Envío internacional gratis;desde Reino Unido;
Nintendo Game Boy Casper EUR Très Bon état #1;10,90 EUR;+ 11,98 EUR de envío;desde Francia;
Nintendo Game Boy Casper EUR Très Bon état;10,90 EUR;+ 11,98 EUR de envío;desde Francia;
Nintendo Game Boy Casper EUR Très Bon état;7,90 EUR;+ 11,98 EUR de envío;desde Francia;
Jeu Game Boy Color en loose VF  Casper  EUR  Envoi rapide et suivi;6,49 EUR;+ 8,00 EUR de envío;desde Francia;
Gameboy Advance Rugrats Castillo Caspers;14,05 EUR;+ 16,68 EUR de envío estimado;desde Reino Unido;
Nintendo Game Boy - Casper - PAL - EUR;7,99 EUR;+ 5,00 EUR de envío;desde Francia;
Casper Nintendo Gameboy Cartucho De Juego Excelente Estado Raro Retro Vintage;58,53 EUR;+ 20,94 EUR de envío estimado;desde Reino Unido;
Casper y el trío fantasmal ps2 Juego Niños Boys & Girls-Excelente Estado;2,33 EUR;+ 18,76 EUR de envío estimado;desde Reino Unido;
Nuevo anuncioCasper (Game Boy GB 1995) Solo Cartucho;9,90 EUR;+ 12,90 EUR de envío;desde España;
Casper gameboy color OVP cib Boxed;30,00 EUR;+ 4,70 EUR de envío;desde Alemania;
Casper Gameboy juego en OVP, soldado, estado de coleccionista, rar!!!;1.800,00 EUR;+ 15,99 EUR de envío;desde Alemania;
Casper Game Boy Color;20,00 EUR;+ 3,70 EUR de envío;desde Alemania;
Nintendo Gameboy-Casper;8,38 EUR;+ 16,59 EUR de envío estimado;desde Reino Unido;
Nintendo Game Boy Color-Cartucho únicamente-Casper Buenas Condiciones;11,47 EUR;+ 18,42 EUR de envío estimado;desde Reino Unido;
Casper Nintendo Gameboy Colour juego aceptable;5,26 EUR;+ 18,32 EUR de envío estimado;desde Reino Unido;
Nintendo Game Boy Color Casper Notice / Instruction Manual;7,99 EUR;+ 2,75 EUR de envío;desde Francia;
Casper - Nintendo Game Boy Advance GBA GAME-EUR PAL;4,40 EUR;+ 19,00 EUR de envío;desde Italia;
Casper Nintendo Gameboy Game Boy Color Libro Manual De Instrucciones Solamente;5,26 EUR;+ 21,25 EUR de envío estimado;desde Reino Unido;
Casper NINTENDO DS LITE-GAMEBOY-SP-ADVANCE;10,52 EUR;+ 17,55 EUR de envío;desde Reino Unido;
Lot deux jeu GBA  (Super Mario  Advance + Casper )   Gameboy ;21,00 EUR;+ 5,90 EUR de envío;desde Francia;
★★ Jeu Gameboy : Casper (loose) ★★;10,17 EUR;+ 19,90 EUR de envío;desde Francia;
Jeu Gameboy Casper;166,29 EUR;+ 39,00 EUR de envío;desde Francia;
Varios ￼ Nintendo Gameboy folletos de instrucción Manual/sólo Inc. Casper, Mario;29,25 EUR;+ 20,71 EUR de envío estimado;desde Reino Unido;
Casper | Gameboy Game Boy Advance;13,11 EUR;+ 7,00 EUR de envío;desde Alemania;
NINTENDO GAMEBOY Casper Cartucho gastos de envío gratis en Reino Unido;12,83 EUR;Envío no especificado;desde Reino Unido;
Casper [FR] - Game Boy Color;9,99 EUR;Envío no especificado;desde Francia;
 ★ Game Boy Advance Casper ★ ;4,99 EUR;Envío no especificado;desde España;
