GB Genjin Nintendo Game Boy Japan Ver. Platform Hudson Soft 1992 Bonk Kid DMG-GK;34,19 EUR;+ 7,00 EUR de envío;desde Francia;
GB Genjin Tierra Viva chikkun Nintendo Gameboy Japonés Original Cartucho De Juego #2;23,41 EUR;+ 16,87 EUR de envío estimado;desde Reino Unido;
GB Genjin Land-Viva chikkun Nintendo Gameboy Japonés Original Cartucho De Juego;23,41 EUR;+ 16,87 EUR de envío estimado;desde Reino Unido;
GB Genjin A.C Niño Nintendo Gameboy Japonés Original Cartucho De Juego DMG-gkj;23,41 EUR;+ 16,87 EUR de envío estimado;desde Reino Unido;
Nintendo GameBoy - GB Genjin Land: Viva! Chikkun Oukoku JAPAN cartucho usado;28,99 EUR;Envío internacional gratis;desde Alemania;
GB Genjin Bonk Juego Boy GB Japón importación Vendedor de Estados Unidos;12,74 EUR;Envío gratis;desde Estados Unidos;
Hudson Soft GB Genjin 2 Nintendo Game Boy GB acción japonés Retro Juego Japón Usado;39,71 EUR;Envío internacional gratis;desde Japón;
GB Genjin Land Gameboy Nintendo 8070 GB;42,60 EUR;+ 14,48 EUR de envío;desde Japón;
GB Genjin Land Viva! Chikkun Oukoku (Nintendo Game Boy GB, 1994) Japan Import;20,03 EUR;+ 3,84 EUR de envío;desde Canadá;
GB Genjin 2 Game Boy Nintendo Gameboy probado Hudson Japón Japón probado Retro Usado;16,18 EUR;Envío internacional gratis;desde Japón;
GB Genjin 2 Nintendo Game Boy Japón;51,04 EUR;+ 12,78 EUR de envío;desde Japón;
Gameboy Nintendo GB Genjin Land Cartucho sólo * GBC;5,96 EUR;+ 14,48 EUR de envío;desde Japón;
GB Genjin Land Viva Chikkun Oukoku--Nintendo Game Boy--NTSC JAP--C-Ware;10,30 EUR;+ 0,99 EUR de envío;desde Austria;
GB Genjin Gameboy Nintendo 2687 GB;55,38 EUR;+ 14,48 EUR de envío;desde Japón;
GB Genjin tierra sin instrucción BDN Gameboy Nintendo 159 GB;20,45 EUR;+ 14,48 EUR de envío;desde Japón;
Gameboy GB Genjin del cartucho sólo * Nintendo GBC;10,22 EUR;+ 14,48 EUR de envío;desde Japón;
Gameboy Juegos GB/GBC "GB Genjin 2" probado/G0286;2,56 EUR;+ 21,30 EUR de envío;desde Japón;
GB Genjin Tierra Viva! chikkun Reino "buenas condiciones" Nintendo Gameboy Gb Japón;39,83 EUR;+ 11,93 EUR de envío;desde Japón;
GB Genjin Con Caja Y Manual [Versión Japonesa Gameboy];46,87 EUR;+ 17,04 EUR de envío;desde Japón;
Gameboy Juegos GB/GBC "GB Genjin" probado/G0283;2,56 EUR;+ 21,30 EUR de envío;desde Japón;
GB Genjin (Nintendo Game Boy, 1992) de Japón;8,95 EUR;Envío internacional gratis;desde Japón;
GB Genjin Tierra Viva! chikkun Kingdom Juego BOY versión japonesa;56,43 EUR;+ 17,04 EUR de envío;desde Japón;
GB Genjin Land: Viva! Chikkun Oukoku R9J - Nintendo GameBoy - NGB;7,88 EUR;+ 19,95 EUR de envío;desde Países Bajos;
GB Genjin / Bonks Adventure JPN - Nintendo GameBoy - NGB;17,56 EUR;+ 19,95 EUR de envío;desde Países Bajos;
GB Genjin Land Viva! Chikkun Kingdom con manual Japón Nintendo Gameboy GB VG!;11,07 EUR;+ 7,50 EUR de envío;desde Japón;
GB Genjin Land Juego Completo! Japón Nintendo Gameboy GB Muy Buen Estado +!;25,39 EUR;+ 7,50 EUR de envío;desde Japón;
GB Genjin Land (Nintendo Game Boy GB 1994) Import Japan;21,80 EUR;+ 0,48 EUR de envío;desde España;
GB Genjin / B.C.Kid (Nintendo Game Boy GB 1992) Import Japan;21,94 EUR;+ 0,34 EUR de envío;desde España;
GB Genjin / B. C. Kid (Nintendo Game Boy GB 1992) Import Japon;21,92 EUR;Envío internacional gratis;desde España;
GB Genjin/B.C. Niño (Nintendo Game Boy GB 1992) importación Japón;21,88 EUR;Envío internacional gratis;desde España;
GB Genjin Tierra Viva! chikkun Kingdom Japón Nintendo Gameboy GB Muy Bueno!;5,96 EUR;+ 7,50 EUR de envío;desde Japón;
GB Genjin Nintendo Game Boy GB importación Japón;49,84 EUR;+ 15,34 EUR de envío;desde Japón;
GB Genjin Land (Nintendo Game Boy GB 1994) Import Japan;11,54 EUR;+ 9,90 EUR de envío;desde España;
GB Genjin 2 NINTENDO GAME BOY;17,04 EUR;+ 17,04 EUR de envío;desde Japón;
2 GB Genjin Colección codeándose Conjunto Hudson Soft NIntendo Game Boy Usado 90s 866;24,34 EUR;+ 17,04 EUR de envío;desde Japón;
GB Genjin tierra sin instrucción BDN Gameboy Nintendo 159 GB;27,26 EUR;Envío gratis;desde Estados Unidos;
Nintendo GameBoy Juego-GB Genjin Land: viva! chikkun Oukoku Cartucho de Japón;20,44 EUR;Envío internacional gratis;desde Alemania;
GB Genjin 2 Nintendo Game Boy GB 15;17,03 EUR;+ 8,52 EUR de envío;desde Japón;
GB Genjin Tierra Viva chikkun Oukoku Nintendo Game Boy GB 14;17,03 EUR;+ 8,52 EUR de envío;desde Japón;
Nintendo GameBoy Juego GB Genjin Land: viva chikkun Oukoku Cartucho de Japón;23,41 EUR;Envío internacional gratis;desde Alemania;
Bp1275 GB Genjin Land Gameboy Game Boy Japan;5,38 EUR;+ 14,48 EUR de envío;desde Japón;
Bo9231 GB Genjin Gameboy Game Boy Japan;6,41 EUR;+ 14,48 EUR de envío;desde Japón;
Nintendo GameBoy - GB Genjin Land: Viva! Chikkun Oukoku JAPAN cartouche utilisé;26,99 EUR;Envío internacional gratis;desde Alemania;
Nintendo GameBoy - GB Genjin Land: Viva! Chikkun Oukoku JAPAN cartuccia usato;28,99 EUR;Envío internacional gratis;desde Alemania;
