Sensible Soccer-Nintendo Gameboy Game Boy-Buen Estado-Libre P&P;23,43 EUR;+ 16,87 EUR de envío estimado;desde Reino Unido;
Sensible Soccer Nintendo Game Boy Color Advance juego de fútbol Genuino solo carro;28,05 EUR;+ 7,03 EUR de envío;desde Reino Unido;
Sensible Soccer NOE Game Boy;16,00 EUR;Envío no especificado;desde Francia;
Sensible Soccer Game Boy juego completo con embalaje original y guía;79,99 EUR;+ 30,00 EUR de envío;desde Alemania;
Sensible Soccer Game Boy juego completo con embalaje original y guía;79,99 EUR;+ 8,00 EUR de envío;desde Alemania;
Gb-Sensible Soccer para Nintendo GameBoy;19,95 EUR;+ 17,50 EUR de envío;desde Alemania;
Sensible Soccer (losse cassette) nintendo gameboy gb;8,75 EUR;+ 20,00 EUR de envío;desde Países Bajos;
Sensible Soccer 2006 Vídeo Juego Para Microsoft Xbox Pal probado;9,36 EUR;+ 16,61 EUR de envío estimado;desde Reino Unido;
Sensible Soccer 2006 Vídeo Juego Para Sony PlayStation PS2 Pal probado;4,67 EUR;+ 16,53 EUR de envío estimado;desde Reino Unido;
Sensible Soccer-Sega internacional de juego de Mega Drive (probado-Pal);25,71 EUR;+ 18,31 EUR de envío estimado;desde Reino Unido;
Sensible Soccer PLAYSTATION 1 PS1/PS2 PS3 juego de fútbol;14,04 EUR;+ 19,62 EUR de envío estimado;desde Reino Unido;
Sensible Soccer 2006 vídeo juego PS2 Fútbol-Playstation 2 PAL;3,97 EUR;+ 16,51 EUR de envío estimado;desde Reino Unido;
Sensible Soccer-Sega Mega Drive Juego (probado-Envío Rápido-Pal);26,88 EUR;+ 20,56 EUR de envío estimado;desde Reino Unido;
Sensible Soccer-Sega Mega Drive Juego (probado-Envío Rápido-Pal);23,37 EUR;+ 20,50 EUR de envío estimado;desde Reino Unido;
Sensible Soccer 2006 y FIFA 06 video juego PS2 Fútbol-Playstation 2 PAL;2,92 EUR;+ 18,28 EUR de envío estimado;desde Reino Unido;
Sensible Soccer SEGA Mega Drive juego GENESIS con manual pal oficiales del Reino Unido;35,13 EUR;+ 17,08 EUR de envío estimado;desde Reino Unido;
Sensible Soccer Sony Playstation 1 juego PS1 Nuevo Sellado;19,90 EUR;+ 13,88 EUR de envío;desde Reino Unido;
Sensible Soccer 2006 Xbox Juego Original;9,96 EUR;+ 14,06 EUR de envío;desde Reino Unido;
Sensible Soccer (Sony PlayStation 2, 2006) PS2, Gratis Reino Unido P&p juego de fútbol;4,67 EUR;+ 16,53 EUR de envío estimado;desde Reino Unido;
Sensible Soccer 2006-PC CD-ROM Juego;3,46 EUR;+ 16,50 EUR de envío estimado;desde Reino Unido;
