Sensible Soccer NOE Game Boy;16,00 EUR;Envío no especificado;desde Francia;
Sensible Soccer Nintendo Game Boy Color Advance juego de fútbol Genuino solo carro;27,87 EUR;+ 6,98 EUR de envío;desde Reino Unido;
Sensible Soccer-Nintendo Gameboy Game Boy-Buen Estado-Libre P&P;23,27 EUR;+ 16,76 EUR de envío estimado;desde Reino Unido;
Sensible Soccer Game Boy juego completo con embalaje original y guía;79,99 EUR;+ 30,00 EUR de envío;desde Alemania;
Sensible Soccer Game Boy juego completo con embalaje original y guía;79,99 EUR;+ 8,00 EUR de envío;desde Alemania;
Gb-Sensible Soccer para Nintendo GameBoy;19,95 EUR;+ 17,50 EUR de envío;desde Alemania;
Sensible Soccer (losse cassette) nintendo gameboy gb;8,75 EUR;+ 20,00 EUR de envío;desde Países Bajos;
Sensible Soccer 2006 Vídeo Juego Para Microsoft Xbox Pal probado;9,30 EUR;+ 16,50 EUR de envío estimado;desde Reino Unido;
Sensible Soccer 2006 Vídeo Juego Para Sony PlayStation PS2 Pal probado;4,64 EUR;+ 16,42 EUR de envío estimado;desde Reino Unido;
Sensible Soccer-Sega Mega Drive Juego (probado-Envío Rápido-Pal);26,71 EUR;+ 20,42 EUR de envío estimado;desde Reino Unido;
Sensible Soccer-Sega internacional de juego de Mega Drive (probado-Pal);18,56 EUR;+ 18,07 EUR de envío estimado;desde Reino Unido;
Sensible Soccer-Sega Mega Drive Juego (probado-Envío Rápido-Pal);23,21 EUR;+ 20,36 EUR de envío estimado;desde Reino Unido;
Sensible Soccer PLAYSTATION 1 PS1/PS2 PS3 juego de fútbol;13,95 EUR;+ 19,49 EUR de envío estimado;desde Reino Unido;
Sensible Soccer 2006 Xbox Juego Original;9,89 EUR;+ 13,96 EUR de envío;desde Reino Unido;
Sensible Soccer Sony Playstation 1 juego PS1 Nuevo Sellado;19,77 EUR;+ 13,79 EUR de envío;desde Reino Unido;
Sensible Soccer 2006 y FIFA 06 video juego PS2 Fútbol-Playstation 2 PAL;2,90 EUR;+ 18,16 EUR de envío estimado;desde Reino Unido;
Sensible Soccer (Sony PlayStation 2, 2006) PS2, Gratis Reino Unido P&p juego de fútbol;4,64 EUR;+ 16,42 EUR de envío estimado;desde Reino Unido;
Sensible Soccer SEGA Mega Drive juego GENESIS con manual pal oficiales del Reino Unido;34,90 EUR;+ 16,97 EUR de envío estimado;desde Reino Unido;
Sensible Soccer 2006 juego de fútbol Xbox Completo Retro-MBC-Codemasters;6,92 EUR;+ 18,77 EUR de envío estimado;desde Reino Unido;
Sensible Soccer 2006 (Pc Juego) Nuevo y Sellado;11,62 EUR;+ 16,55 EUR de envío estimado;desde Reino Unido;
