Game Boy Color Micro Machines V3 en caja con instrucciones;23,34 EUR;+ 16,81 EUR de envío estimado;desde Reino Unido;
Micro Machines V3 para Game Boy Color Completo Con Caja Y Manual De Instrucciones;15,17 EUR;Envío no especificado;desde Reino Unido;
Micro Machines V3 Nintendo Game Boy Color Advance Juego Solo Carro Genuino;12,78 EUR;+ 7,01 EUR de envío;desde Reino Unido;
Micro Machines V3 Nintendo Gameboy Color Juego. GRATIS UK FRANQUEO con manual en muy buena condición;14,70 EUR;+ 16,65 EUR de envío estimado;desde Reino Unido;
Micro Machines V3 Nintendo Gameboy Color solo carro probado PAL;12,83 EUR;+ 16,63 EUR de envío estimado;desde Reino Unido;
Micro Machines V3-Juego Boy Color;8,16 EUR;+ 15,17 EUR de envío;desde Reino Unido;
Micro Machines V3 ORIGINAL NINTENDO GAMEBOY COLOR;26,84 EUR;