Juego Rayman Nintendo Game Boy Color Como Nuevo Gameboy;69,00 EUR;Envío no especificado;desde España;
Rayman-Game Boy Color-módulo-Nintendo-GameBoy muy buen estado-GBC;11,49 EUR;Envío no especificado;desde Alemania;
Nintendo Game Boy Color Juego -- Rayman -- 2000;11,58 EUR;+ 12,74 EUR de envío;desde Reino Unido;
Nintendo Gameboy Color-Rayman lógico Harry Potter filósofos Scooby Doo;20,81 EUR;+ 16,65 EUR de envío estimado;desde Reino Unido;
Nintendo Game Boy Color Rayman Cartucho;9,26 EUR;+ 16,44 EUR de envío estimado;desde Reino Unido;
Rayman JUEGO Nintendo Game Boy Color;8,10 EUR;+ 20,87 EUR de envío;desde Reino Unido;
Rayman Juego-Nintendo Game Boy Color-Original Cartucho sólo;10,42 EUR;+ 16,46 EUR de envío estimado;desde Reino Unido;
Rayman Juego Para Nintendo Game Boy Gameboy Color, sólo cartucho original;10,44 EUR;+ 16,46 EUR de envío estimado;desde Reino Unido;
Rayman 2 Forever para gameboy color y Advance;14,99 EUR;+ 8,00 EUR de envío;desde Alemania;
Notice Nintendo Game Boy Color Rayman EUR Très Bon état;4,90 EUR;+ 11,98 EUR de envío;desde Francia;
Rayman (Nintendo Game Boy Color, 2000);9,84 EUR;+ 18,23 EUR de envío estimado;desde Reino Unido;
Notice Nintendo Game Boy Color Rayman EUR Très Bon état;4,90 EUR;+ 11,98 EUR de envío;desde Francia;
Nintendo Gameboy Color-WWF traición, Robot Wars, Crazy Castle 4 & Rayman;17,33 EUR;+ 16,59 EUR de envío estimado;desde Reino Unido;
Rayman 2 Para Siempre | Nintendo Gameboy Color, Buen Estado-solo carro;25,45 EUR;+ 16,73 EUR de envío estimado;desde Reino Unido;
50180 manual de instrucciones-Rayman-Nintendo Game Boy Color () bloqueo-ayqp-EUR;9,26 EUR;+ 5,79 EUR de envío;desde Reino Unido;
Rayman - Game Boy Color - Version Europa - Cartucho;10,95 EUR;+ 7,95 EUR de envío;desde España;
Rayman Para Nintendo Game Boy Color;8,12 EUR;+ 16,42 EUR de envío estimado;desde Reino Unido;
Lote de 2x Original GameBoy Juegos: Tetris Plus + Rayman JUEGO Boy Color * Ganga *;9,84 EUR;+ 19,35 EUR de envío estimado;desde Reino Unido;
Rayman-Nintendo Gameboy Color;8,09 EUR;+ 13,33 EUR de envío;desde Reino Unido;
Niños Nintendo Gameboy Advance Juegos Y Gameboy Colour Games Spyro Rayman + más;23,18 EUR;+ 20,75 EUR de envío estimado;desde Reino Unido;
Rayman 2 Para Siempre | Nintendo Gameboy Color, Buen Estado-solo carro;23,19 EUR;+ 16,70 EUR de envío estimado;desde Reino Unido;
Manual game boy/ color/ advance lot x8 - Rayman F1 Race Tarzan Lord of the Ring ;15,99 EUR;Envío no especificado;desde España;
GBC-Rayman 2 Forever para Nintendo Gameboy Color;14,95 EUR;+ 9,95 EUR de envío;desde Alemania;
GAMEBOY POCKET Color Rayman Adaptador, MAGNIFIER, cable de enlace, Cig Enchufe Batt Pack;52,16 EUR;+ 26,66 EUR de envío estimado;desde Reino Unido;
Rayman-Nintendo Gameboy Color Cartucho de juego solo carro;6,92 EUR;+ 11,58 EUR de envío;desde Reino Unido;
Rayman gameboy color OVP cib Boxed;21,90 EUR;Envío no especificado;desde Alemania;
Rayman gameboy color Game Boy juegos rayo GBC envío módulo bien;11,90 EUR;Envío no especificado;desde Alemania;
Gameboy Color Rayman Oficial Nintendo bolso-muy buen estado;18,99 EUR;Envío no especificado;desde Alemania;
Rayman Gameboy Color Gbc Pal España;18,00 EUR;Envío no especificado;desde España;
