Metal Walker ✨ Nintendo Gameboy Color ✨ auténtico USA Capcom ✨ probado funciona & Ahorra;29,75 EUR;+ 2,98 EUR de envío;Vendidos  12 sep 2021Artículo vendido;desde Estados Unidos;
Metal Walker Nintendo Game Boy Color GBC auténtico probado Envío rápido;31,49 EUR;+ 2,77 EUR de envío;Vendidos  24 ago 2021Artículo vendido;desde Estados Unidos;
Metal Walker Nintendo Game Boy Color GBC auténtico probado Envío rápido;25,53 EUR;+ 3,53 EUR de envío;Vendidos  23 ago 2021Artículo vendido;desde Estados Unidos;
Metal Walker Gameboy Color 2001 Excelente Estado Con Todo Menos Manual Raro;59,58 EUR;+ 3,53 EUR de envío;Vendidos  22 ago 2021Artículo vendido;desde Estados Unidos;
Metal Walker Nintendo Game Boy Color Gameboy auténtico Original Retro Clásico!;45,93 EUR;Envío gratis;Vendidos  9 ago 2021Artículo vendido;desde Estados Unidos;
Bakusou Senki Metal Walker Nintendo Gameboy Color Carro De Juego Japón Importación nos vender;6,80 EUR;Envío gratis;Vendidos  23 jul 2021Artículo vendido;desde Estados Unidos;
Metal Walker Nintendo Game Boy Color GBC auténtico probado Envío rápido;42,55 EUR;Envío gratis;Vendidos  14 jul 2021Artículo vendido;desde Estados Unidos;
