Disney's Hercules Nintendo Game Boy Color Advance Juego Solo Carro Genuino;13,99 EUR;+ 7,02 EUR de envío;desde Reino Unido;
Disney's Hercules - Cart - Gameboy;5,00 EUR;+ 11,00 EUR de envío;desde Países Bajos;
Disney's Hercules viejo raro pequeño cartel/página de anuncio vintage Enmarcado PS1 Game Boy;25,49 EUR;+ 14,44 EUR de envío;desde Alemania;
Disney's Hercules pour game boy ;6,00 EUR;Envío no especificado;desde Francia;
Disney's Hercules (Nintendo Game Boy, 1997) sucia pero probado Carro;5,00 EUR;Envío gratis;desde Estados Unidos;
Disney's Hercules (Nintendo Game Boy, 1997) * solo Cartucho *;5,09 EUR;Envío gratis;desde Estados Unidos;
Game Boy Disney's Hercules;297,53 EUR;+ 17,00 EUR de envío;desde México;
Disney's Hercules Nintendo Game Boy Gameboy Original OEM auténtico juego!;6,72 EUR;+ 3,78 EUR de envío;desde Estados Unidos;
Disney's Hercules Nintendo Game Boy - Authentic Cart Only;11,05 EUR;+ 1,31 EUR de envío;desde Canadá;
Disney's Hercules (Nintendo Game Boy, 1997) Auténtico! probado Y Funcionando!;6,76 EUR;+ 3,53 EUR de envío;desde Estados Unidos;
Disney's Hercules Gameboy Cartucho De Juego Original limpiado & P12 Probado;10,16 EUR;Envío gratis;desde Estados Unidos;
Disney's Hercules -- Nintendo Game Boy -- Game Only -- ;18,73 EUR;+ 13,39 EUR de envío;desde Canadá;
Disney's Hercules (Nintendo Gameboy) cartucho sólo probado Funcionando;11,04 EUR;Envío gratis;desde Estados Unidos;
Disney's Hercules (Nintendo Game Boy) probado solo carro #41020;13,35 EUR;+ 2,55 EUR de envío;desde Estados Unidos;
Disney's Hercules Nintendo Game Boy;8,49 EUR;Envío gratis;desde Estados Unidos;
Disney's Hercules Juego De Acción-PC CD-ROM Juego-Win 95-Disney Interactivo;12,28 EUR;+ 16,66 EUR de envío estimado;desde Reino Unido;
