Juego de Nintendo Game Boy Pokemon Azul , ver fotos.;14,95 EUR;Envío no especificado;Vendidos  20 sep 2021Artículo vendido;desde España;
Pokemon Azul Gameboy;29,09 EUR;+ 19,99 EUR de envío estimado;Vendidos  20 sep 2021Artículo vendido;desde Reino Unido;
Juego Pokemon Azul Nintendo Gameboy Cartucho genuino nuevo ahorro de batería funciona #1;26,75 EUR;+ 16,81 EUR de envío estimado;Vendidos  19 sep 2021Artículo vendido;desde Reino Unido;
Original juego Pokemon Azul BOY JUEGO-solo carro;23,26 EUR;+ 18,50 EUR de envío estimado;Vendidos  18 sep 2021Artículo vendido;desde Reino Unido;
Manual Pokemon Azul Roja / Game Boy / Original;19,90 EUR;+ 10,00 EUR de envío;Vendidos  16 sep 2021Artículo vendido;desde Francia;
Pokemon Azul Nintendo Game Boy Reino Unido Juego Original (solo carro) ** GRATIS UK FRANQUEO **;23,26 EUR;+ 2,91 EUR de envío;Vendidos  14 sep 2021Artículo vendido;desde Reino Unido;
Nintendo Game Boy Juego Pokemon Azul Genuino Original;23,26 EUR;Envío no especificado;Vendidos  12 sep 2021Artículo vendido;desde Reino Unido;
Pokemon Azul Nintendo Gameboy/Advance/GBA Genuino Carro;34,90 EUR;+ 16,97 EUR de envío estimado;Vendidos  4 sep 2021Artículo vendido;desde Reino Unido;
