Antz mundo Sportz | Game Boy Color | solo carro | EUR;4,67 EUR;+ 16,53 EUR de envío estimado;desde Reino Unido;
Antz para Nintendo Game Boy GB color GBA instrucciones OVP juego Colour;29,90 EUR;+ 5,99 EUR de envío;desde Alemania;
Antz mundo Sportz Nintendo Game Boy Color * Región libre * Cartucho;7,72 EUR;+ 16,57 EUR de envío estimado;desde Reino Unido;
NINTENDO GAME BOY COLOR Juego-Antz mundo Sportz;9,37 EUR;+ 16,61 EUR de envío estimado;desde Reino Unido;
NINTENDO GAME BOY COLOR GBC Antz Cartucho europeo;4,25 EUR;+ 8,51 EUR de envío;desde Grecia;
NINTENDO GAME BOY COLOR Juego-Antz;9,37 EUR;+ 16,61 EUR de envío estimado;desde Reino Unido;
Nintendo Game Boy Color Antz World Sportz EUR Très Bon état;4,90 EUR;+ 11,98 EUR de envío;desde Francia;
🌟 Antz 🌟 NINTENDO GAME BOY 🌟 COLOR 🌟 SP 🌟 GBA 🌟 UK 🇬 🇧 vendedor 🌟 🌟 Envío rápido;11,65 EUR;+ 8,07 EUR de envío;desde Reino Unido;
Antz mundo Sportz Nintendo Gameboy Colour Color BOXED PAL;10,53 EUR;+ 20,73 EUR de envío estimado;desde Reino Unido;
Antz (Nintendo Game Boy Color, 1999) - Versión Europea Completo En Caja;9,36 EUR;+ 20,46 EUR de envío estimado;desde Reino Unido;
Antz Racing - EUR - Nintendo Gameboy Color - GBC;20,00 EUR;+ 25,00 EUR de envío;desde Países Bajos;
Antz World Sportz Nintendo Game Boy Color Loose;5,00 EUR;+ 30,00 EUR de envío;desde Italia;
Antz Racing EUR - Nintendo GameBoy Color - GBC;3,55 EUR;+ 19,95 EUR de envío;desde Países Bajos;
Nintendo Gameboy Color Antz;3,95 EUR;+ 11,00 EUR de envío;desde Países Bajos;
Antz-Nintendo Gameboy Color;5,80 EUR;+ 7,03 EUR de envío;desde Reino Unido;
Antz racing gameboy color OVP cib Boxed;40,00 EUR;+ 4,70 EUR de envío;desde Alemania;
Antz World Sportz - Game Boy Color - Anleitung B-Ware;6,95 EUR;+ 1,09 EUR de envío;desde Austria;
Nintendo Gameboy Color-Antz mundo Sportz-solo Carro-probado y limpiado;5,84 EUR;+ 18,31 EUR de envío estimado;desde Reino Unido;
Nintendo Gameboy Color & GBA Game: Antz (EUR);4,95 EUR;+ 5,00 EUR de envío;desde Países Bajos;
Nintendo GameBoy Color jeu - Antz Racing cartouche utilisé;13,99 EUR;Envío internacional gratis;desde Alemania;
Nintendo GameBoy Color jeu - Antz dans l'emballage utilisé;26,99 EUR;Envío internacional gratis;desde Alemania;
Nintendo GameBoy Color Cartucho De Juego Antz Racing;9,36 EUR;Envío internacional gratis;desde Alemania;
Nintendo GameBoy Color juego - Antz Racing cartucho usado;15,99 EUR;Envío internacional gratis;desde Alemania;
Nintendo GameBoy Color Juego Antz En Caja;23,41 EUR;Envío internacional gratis;desde Alemania;
Nintendo GameBoy Color Juego-Antz En Caja;20,44 EUR;Envío internacional gratis;desde Alemania;
Nintendo GameBoy Color gioco - Antz nell'imballaggio usato;28,99 EUR;Envío internacional gratis;desde Alemania;
Nintendo GameBoy Color juego - Antz en el embalaje usado;28,99 EUR;Envío internacional gratis;desde Alemania;
Antz Racing (losse cassette) Nintendo GameBoy Color GBC;3,46 EUR;+ 20,00 EUR de envío;desde Países Bajos;
Antz mundo Sportz Nintendo Gameboy Colour;8,19 EUR;+ 7,03 EUR de envío;desde Reino Unido;
Antz | Nintendo Game Boy Color EUR | Sin Caja;5,84 EUR;Envío no especificado;desde Reino Unido;
Nintendo Gameboy Color Antz GameBoy only Modul;4,49 EUR;Envío no especificado;desde Austria;
Gameboy Color Spiele Konvolut: Lucky Lucke, Rainbow Six, Antz Racing, Dave Mirr ;24,80 EUR;Envío no especificado;desde Austria;
Antz Racing para gameboy color y Advance;5,95 EUR;Envío no especificado;desde Alemania;
Fourmiz/Antz World Sportz (boite/notice) Gameboy Color GBC Nintendo PAL;13,91 EUR;Envío no especificado;desde Francia;
Gameboy Color -- Antz Racing -- CGB-BAZP-EUR -- Instruction Manual;6,99 EUR;Envío no especificado;desde Países Bajos;
Nintendo GameBoy Color Cartucho De Juego Antz Racing;8,51 EUR;Envío internacional gratis;desde Alemania;
Nintendo GameBoy Color game - Antz Racing cartridge;9,35 EUR;Envío internacional gratis;desde Alemania;
Nintendo GameBoy Color gioco - Antz Racing cartuccia usato;15,99 EUR;Envío internacional gratis;desde Alemania;
