Kirby's Star Stacker (Game Boy GB 1997) Japan Import;12,90 EUR;+ 9,90 EUR de envío;desde España;
Kirby's Star Stacker-Nintendo Gameboy Classic módulo;19,00 EUR;Envío no especificado;desde Alemania;
Kirby's Star Stacker (Nintendo Game Boy, 1997) -Cart Only ;83,69 EUR;+ 4,02 EUR de envío;desde Canadá;
Kirby's Star Stacker Nintendo Gameboy Cartridge ;30,87 EUR;+ 4,95 EUR de envío;desde Australia;
Kirby's Star Stacker (Nintendo Game Boy, 1997);33,47 EUR;+ 1,33 EUR de envío;desde Canadá;
Kirby's Star Stacker Gameboy 1997 Cart Only * Authentic & Tested * Free Shipping;60,25 EUR;+ 4,68 EUR de envío;desde Canadá;
Kirby's Star Stacker (Game Boy GB 1997) Japan Import;23,31 EUR;+ 0,43 EUR de envío;desde España;
Kirby's Star Stacker ( Game Boy GB 1997) Japon Import;23,56 EUR;Envío internacional gratis;desde España;
