Kirby's Star Stacker (Game Boy GB 1997) Japan Import;12,90 EUR;+ 9,90 EUR de envío;desde España;
Kirby's Star Stacker-Nintendo Gameboy Classic módulo;19,00 EUR;Envío no especificado;desde Alemania;
Kirby's Star Stacker (Nintendo Game Boy, 1997);33,39 EUR;+ 1,33 EUR de envío;desde Canadá;
Kirby's Star Stacker (Nintendo Game Boy, 1997) -Cart Only ;83,49 EUR;+ 4,01 EUR de envío;desde Canadá;
Kirby's Star Stacker Nintendo Gameboy Cartridge ;30,92 EUR;+ 4,96 EUR de envío;desde Australia;
Kirby's Star Stacker Gameboy 1997 Cart Only * Authentic & Tested * Free Shipping;60,11 EUR;+ 4,67 EUR de envío;desde Canadá;
Kirby's Star Stacker (Game Boy GB 1997) Japan Import;23,36 EUR;+ 0,43 EUR de envío;desde España;
Kirby's Star Stacker ( Game Boy GB 1997) Japon Import;23,56 EUR;Envío internacional gratis;desde España;
