Bonk's Adventure 1 y 2 GB Japón Nintendo Game Boy Genjin;36,55 EUR;Envío internacional gratis;Vendidos  7 sep 2021Artículo vendido;desde Japón;
Bonk's Adventure (Nintendo Game Boy GB) Manual De Instrucciones Original;19,54 EUR;Envío gratis;Vendidos  4 sep 2021Artículo vendido;desde Estados Unidos;
Bonk's Adventure 1 y 2 GB Japón Nintendo Game Boy Genjin;35,24 EUR;Envío internacional gratis;Vendidos  31 ago 2021Artículo vendido;desde Japón;
Bonk's Adventure Gameboy solo Carro-Electro cerebro variante DMG Raro;40,80 EUR;Envío gratis;Vendidos  26 ago 2021Artículo vendido;desde Estados Unidos;
Bonk's Adventure Manual Solamente! (Nintendo GameBoy);5,10 EUR;+ 4,17 EUR de envío;Vendidos  18 ago 2021Artículo vendido;desde Estados Unidos;
Nintendo Game Boy Cartucho sólo probado Bonk's Adventure Etiqueta agradable;25,49 EUR;Envío gratis;Vendidos  9 ago 2021Artículo vendido;desde Estados Unidos;
Bonk's Adventure-Nintendo Gameboy Cartucho sólo probado! ver DESCRIPCIÓN;20,39 EUR;+ 3,66 EUR de envío;Vendidos  7 ago 2021Artículo vendido;desde Estados Unidos;
Bonk's Adventure-auténtico-Nintendo Game Boy-Solo Manual!;13,59 EUR;+ 3,78 EUR de envío;Vendidos  31 jul 2021Artículo vendido;desde Estados Unidos;
GB Genjin Bonk's Adventure (Nintendo Game Boy GB, 1992) Japan Import;10,04 EUR;+ 3,85 EUR de envío;Vendidos  29 jul 2021Artículo vendido;desde Canadá;
Bonk's Adventure Nintendo Game Boy, 1992 solo Carro-Auténticos;26,84 EUR;Envío gratis;Vendidos  26 jul 2021Artículo vendido;desde Estados Unidos;
Bonk's Adventure (Nintendo Game Boy, 1992) Auténtico Raro;21,24 EUR;Envío gratis;Vendidos  18 jul 2021Artículo vendido;desde Estados Unidos;
Bonk's Adventure Nintendo Game Boy Juego-auténtico Probado;21,24 EUR;Envío gratis;Vendidos  30 jun 2021Artículo vendido;desde Estados Unidos;
Bonk's Adventure Nintendo Game Boy Juego-auténtico Probado;29,74 EUR;+ 3,53 EUR de envío;Vendidos  21 jun 2021Artículo vendido;desde Estados Unidos;
