Nintendo GAME BOY jeu F1 Race DMG-F1A JAPAN 1990  boitier plastique d'origine GB;5,90 EUR;+ 5,95 EUR de envío;desde Francia;
F1 Race Notice - Instruction Booklet Game Boy USA ;4,00 EUR;Envío internacional gratis;desde Francia;
F1 Race Game Boy juego con embalaje original y guía;39,99 EUR;+ 8,00 EUR de envío;desde Alemania;
F1 Race Gameboy Game Boy juegos rayo gb envío f-1 Race módulo DMG;4,90 EUR;Envío no especificado;desde Alemania;
F1 Race pour Game Boy Color;5,99 EUR;Envío no especificado;desde Francia;
F1 Race Nintendo Game Boy Cartucho sólo (Color, GBA, SP, Advance);5,80 EUR;+ 18,69 EUR de envío estimado;desde Reino Unido;
F1 Race e Puzzle Boy Game Boy Japan;5,00 EUR;+ 10,00 EUR de envío;desde Italia;
Juego F1 Race juego game boy;5,95 EUR;+ 20,95 EUR de envío;desde España;
