Nintendo GameBoy Color gioco - 10 Pin Bowling cartuccia usato;16,99 EUR;Envío internacional gratis;desde Alemania;
Nintendo GameBoy Color jeu - 10 Pin Bowling cartouche utilisé;14,99 EUR;Envío internacional gratis;desde Alemania;
Nintendo GameBoy Color game - 10 Pin Bowling cartridge;10,68 EUR;Envío internacional gratis;desde Alemania;
Nintendo GameBoy Color juego - 10 Pin Bowling cartucho usado;16,99 EUR;Envío internacional gratis;desde Alemania;
10 Pin Bowling Nintendo Game Boy Color Cartucho sólo probado Gameboy USA ESRB;21,29 EUR;Envío gratis;desde Estados Unidos;
10 Pin Bowling Juego Boy Color;14,03 EUR;+ 3,37 EUR de envío;desde Estados Unidos;
10 Pin Bowling Juego Boy Color probado Nintendo Rumble Gameboy Con Cubierta De Batería;25,55 EUR;+ 4,25 EUR de envío;desde Estados Unidos;
Nuevo anuncioVintage Chad Valley Zing Pin 10 Pin Bowling Juego De Mesa Completo En Caja;35,14 EUR;+ 69,10 EUR de envío;desde Reino Unido;
Juego De Escritorio De Madera De 10 Pin Bowling Juego Arcade Mini De Oficina Clásico De Bola De Bolos;9,96 EUR;+ 16,62 EUR de envío estimado;desde Reino Unido;
Juego De Escritorio De Madera De 10 Pin Bowling Juego Arcade Mini De Oficina Clásico De Bola De Bolos;14,04 EUR;+ 16,69 EUR de envío estimado;desde Reino Unido;
