Jeu Nintendo Game Boy Color - Looney Tunes - FRA - Loose;4,90 EUR;+ 6,70 EUR de envío;desde Francia;
Nuevo anuncioLooney Tunes Collector ataque de Marte Game Boy Color módulo envío exprés en D;5,95 EUR;+ 12,50 EUR de envío;desde Alemania;
NINTENDO GAME BOY COLOR - Looney Tunes Collector: Martian Quest! CGB-P-ALMJ-JPN ;95,00 EUR;+ 19,90 EUR de envío;desde España;
Looney Tunes Juego De Carreras Boy Color En Caja Completa Probada Funcionando GBC Gameboy;58,36 EUR;+ 17,44 EUR de envío estimado;desde Reino Unido;
Nintendo Console Game Boy Color ITA   Looney Tunes Collector Starring Bugs Bunny;29,00 EUR;+ 19,00 EUR de envío;desde Italia;
Looney Tunes Racing Nintendo Game Boy Color solo carro buena;11,62 EUR;+ 16,60 EUR de envío estimado;desde Reino Unido;
Nintendo Game Boy Color Looney Tunes Racing FAH Excellent état;6,90 EUR;+ 11,98 EUR de envío;desde Francia;
Looney Tunes (Nintendo Game Boy Color GBC 1999) Solo cartucho;6,07 EUR;+ 9,90 EUR de envío;desde España;
Jeu Game Boy Color en loose Anglais  Looney Tunes  sans etiquette  Envoi suivi;4,99 EUR;+ 8,00 EUR de envío;desde Francia;
Looney Tunes Collector: la venganza de marte gameboy color OVP cib Boxed #2;19,90 EUR;+ 4,50 EUR de envío;desde Alemania;
Nintendo Gameboy Color En Caja-Looney Tunes coleccionista Marciano venganza;32,63 EUR;+ 16,98 EUR de envío estimado;desde Reino Unido;
Looney Tunes Collector venganza de marte! gameboy color OVP cib Boxed;17,70 EUR;+ 4,50 EUR de envío;desde Alemania;
Looney Tunes Collector: la venganza de marte gameboy color OVP cib Boxed #3;19,90 EUR;+ 4,50 EUR de envío;desde Alemania;
Looney Tunes Collector: Attacke vom Mars | Nintendo Game Boy Color ;8,00 EUR;+ 9,00 EUR de envío;desde Italia;
Looney Tunes Juego De Carreras Boy Color En Caja Completa Probada Funcionando GBC Gameboy;49,03 EUR;+ 19,60 EUR de envío estimado;desde Reino Unido;
Looney Tunes Martian Alert! (Nintendo Game Boy Color GBC 2000) Solo cartucho;8,71 EUR;+ 9,90 EUR de envío;desde España;
Looney Tunes coleccionista Marciano alerta Nintendo Gameboy Color Juego;5,25 EUR;+ 19,40 EUR de envío estimado;desde Reino Unido;
Nintendo Gameboy Color En Caja-Clásico Looney Tunes El Pato Lucas aves Play;40,80 EUR;+ 17,13 EUR de envío estimado;desde Reino Unido;
Nintendo Gameboy Color En Caja-Clásico Looney Tunes El Pato Lucas aves Play;46,64 EUR;+ 17,23 EUR de envío estimado;desde Reino Unido;
Looney Tunes Collector-ataque de Marte-Nintendo Gameboy Color módulo;6,29 EUR;Envío no especificado;desde Alemania;
Nintendo Gameboy Color-Looney Tunes Racing;11,62 EUR;+ 16,60 EUR de envío estimado;desde Reino Unido;
GBC Game Boy Color Looney Tunes PAL EUR ORIGINAL Gameboy Genuine Nintendo;9,95 EUR;+ 2,50 EUR de envío;desde España;
Nintendo Gameboy Color-Crazy Castle 4 & Looney Tunes Marciano alerta & Revenge;19,79 EUR;+ 16,74 EUR de envío estimado;desde Reino Unido;
Nintendo Gameboy Color juego-Looney Tunes Racing (módulo) GBC;17,49 EUR;+ 67,99 EUR de envío;desde Alemania;
Nintendo Game Boy Color - Notice Looney Tunes - FAH;4,90 EUR;+ 6,70 EUR de envío;desde Francia;
Notice jeu Nintendo Game Boy Color Looney Tunes Instructions Booklet;3,99 EUR;+ 0,85 EUR de envío;desde Francia;
Looney Tunes Racing | cuadernillo | cómo jugar | Nintendo Game Boy Color |;9,95 EUR;+ 6,00 EUR de envío;desde Alemania;
Nintendo GameBoy Color juego - Looney Tunes Carrojo Crazy cartucho usado;22,99 EUR;Envío internacional gratis;desde Alemania;
GBC-Looney Tunes Collector: ataque de Marte para Nintendo Gameboy Color;7,95 EUR;+ 9,95 EUR de envío;desde Alemania;
Nintendo Gameboy Cartucho, Marciano alerta!, Looney Tunes Collector (sólo Color);29,18 EUR;+ 14,01 EUR de envío;desde Reino Unido;
Nintendo Gameboy Color Looney Tunes Bugs Bunny ataque de Marte Action Adventure;5,90 EUR;+ 5,00 EUR de envío;desde Alemania;
Looney Tunes Attacke Vom Mars Game Boy Gameboy Color (Instrucciones Sólo Manual;23,14 EUR;Envío internacional gratis;desde Francia;
