NINTENDO GAME BOY COLOR - Looney Tunes Collector: Martian Quest! CGB-P-ALMJ-JPN ;95,00 EUR;+ 19,90 EUR de envío;desde España;
Looney Tunes Collector ataque de Marte Game Boy Color módulo envío exprés en D;5,95 EUR;+ 12,50 EUR de envío;desde Alemania;
Jeu Nintendo Game Boy Color - Looney Tunes - FRA - Loose;4,90 EUR;+ 6,70 EUR de envío;desde Francia;
Looney Tunes Collector: la venganza de marte gameboy color OVP cib Boxed #2;19,90 EUR;+ 4,50 EUR de envío;desde Alemania;
Nintendo Console Game Boy Color ITA   Looney Tunes Collector Starring Bugs Bunny;29,00 EUR;+ 19,00 EUR de envío;desde Italia;
Looney Tunes Juego De Carreras Boy Color En Caja Completa Probada Funcionando GBC Gameboy;58,55 EUR;+ 17,50 EUR de envío estimado;desde Reino Unido;
Looney Tunes Racing Nintendo Game Boy Color solo carro buena;11,65 EUR;+ 16,66 EUR de envío estimado;desde Reino Unido;
Looney Tunes Collector: la venganza de marte gameboy color OVP cib Boxed #3;19,90 EUR;+ 4,50 EUR de envío;desde Alemania;
Jeu Game Boy Color en loose Anglais  Looney Tunes  sans etiquette  Envoi suivi;4,99 EUR;+ 8,00 EUR de envío;desde Francia;
Looney Tunes Collector venganza de marte! gameboy color OVP cib Boxed;17,70 EUR;+ 4,50 EUR de envío;desde Alemania;
Nintendo Gameboy Color En Caja-Looney Tunes coleccionista Marciano venganza;32,74 EUR;+ 17,03 EUR de envío estimado;desde Reino Unido;
Looney Tunes Marciano aviso | Nintendo Gameboy Color Advance | aceptable;4,74 EUR;+ 3,63 EUR de envío;desde Portugal;
Nintendo Game Boy Color Looney Tunes Racing FAH Excellent état;6,90 EUR;+ 11,98 EUR de envío;desde Francia;
Looney Tunes Collector: Attacke vom Mars | Nintendo Game Boy Color ;8,00 EUR;+ 9,00 EUR de envío;desde Italia;
Looney Tunes (Nintendo Game Boy Color GBC 1999) Solo cartucho;6,07 EUR;+ 9,90 EUR de envío;desde España;
Looney Tunes Collector-ataque de Marte-Nintendo Gameboy Color módulo;6,29 EUR;Envío no especificado;desde Alemania;
Looney Tunes coleccionista Marciano alerta Nintendo Gameboy Color Juego;5,27 EUR;+ 19,47 EUR de envío estimado;desde Reino Unido;
Looney Tunes Collector - De Wraak Van Mars - HOL - Nintendo Gameboy Color - GBC;15,00 EUR;+ 25,00 EUR de envío;desde Países Bajos;
Nintendo Gameboy Color En Caja-Clásico Looney Tunes El Pato Lucas aves Play;46,79 EUR;+ 17,29 EUR de envío estimado;desde Reino Unido;
Nintendo Gameboy Color-Looney Tunes Racing;11,65 EUR;+ 16,66 EUR de envío estimado;desde Reino Unido;
Looney Tunes Martian Alert - Nintendo Gameboy Color - Tested - w/ Manual and map;7,99 EUR;+ 25,00 EUR de envío;desde Países Bajos;
Nintendo Gameboy Color En Caja-Clásico Looney Tunes El Pato Lucas aves Play;40,94 EUR;+ 17,18 EUR de envío estimado;desde Reino Unido;
GBC Game Boy Color Looney Tunes PAL EUR ORIGINAL Gameboy Genuine Nintendo;9,95 EUR;+ 2,50 EUR de envío;desde España;
Looney Tunes Martian Alert! (Nintendo Game Boy Color GBC 2000) Solo cartucho;8,71 EUR;+ 9,90 EUR de envío;desde España;
Looney Tunes Collector - Gevaar van Mars! - Nintendo Game Boy Color;5,99 EUR;+ 7,00 EUR de envío;desde Bélgica;
Nintendo Gameboy Color-Crazy Castle 4 & Looney Tunes Marciano alerta & Revenge;19,85 EUR;+ 16,80 EUR de envío estimado;desde Reino Unido;
Attacke vom Mars - Looney Tunes für Gameboy Color / GBC;9,99 EUR;+ 15,10 EUR de envío;desde Austria;
Attacke Vom Mars - Looney Tunes für Gameboy Color / GBC;9,99 EUR;+ 15,10 EUR de envío;desde Austria;
Looney Tunes Collector: Martian Revenge! HOL - Nintendo GameBoy Color - GBC;5,06 EUR;+ 19,95 EUR de envío;desde Países Bajos;
Rache vom Mars Looney Tunes Nintendo Gameboy Color GBC;9,99 EUR;+ 15,10 EUR de envío;desde Austria;
Nintendo Gameboy Color juego-Looney Tunes Racing (módulo) GBC;17,49 EUR;+ 67,99 EUR de envío;desde Alemania;
Nintendo GameBoy Color Looney Tunes carred Crazy Cartucho De Juego;16,39 EUR;Envío internacional gratis;desde Alemania;
Nintendo GameBoy Color Juego-Looney Tunes carred Crazy Cartucho;15,38 EUR;Envío internacional gratis;desde Alemania;
Nintendo Game Boy Color - Notice Looney Tunes - FAH;4,90 EUR;+ 6,70 EUR de envío;desde Francia;
Gameboy Color Game: Looney Tunes Gevaar van Mars! [PAL] (Complete) [HOL];14,95 EUR;+ 17,50 EUR de envío;desde Países Bajos;
Looney Tunes Racing | cuadernillo | cómo jugar | Nintendo Game Boy Color |;9,95 EUR;+ 6,00 EUR de envío;desde Alemania;
Nintendo GameBoy Color gioco - Looney Tunes Carrosso Crazy cartuccia usato;22,99 EUR;Envío internacional gratis;desde Alemania;
GBC-Looney Tunes Collector: ataque de Marte para Nintendo Gameboy Color;7,95 EUR;+ 9,95 EUR de envío;desde Alemania;
Notice jeu Nintendo Game Boy Color Looney Tunes Instructions Booklet;3,99 EUR;+ 0,85 EUR de envío;desde Francia;
Nintendo Gameboy Cartucho, Marciano alerta!, Looney Tunes Collector (sólo Color);29,27 EUR;+ 14,06 EUR de envío;desde Reino Unido;
