London Union Jack Cap Kids OSFA Boys Baseball Hat Team GB Olympic Games;6,96 EUR;+16,55 EUR shipping estimate;Sold  Sep 14, 2021Sold Item;from United Kingdom;
All Star Baseball 2001 (Nintendo Game Boy Color, Colour) retro BOXED PAL TESTED ;9,75 EUR;+20,71 EUR shipping estimate;Sold  Sep 11, 2021Sold Item;from United Kingdom;
Nintendo Game Boy 💎Baseball (Mario)💎Game With Case💎;8,14 EUR;+23,35 EUR shipping;Sold  Sep 9, 2021Sold Item;from United Kingdom;
All-Star Baseball 2001 (Nintendo Gameboy Color GBC) NTSC;10,54 EUR;+20,37 EUR shipping estimate;Sold  Sep 9, 2021Sold Item;from United Kingdom;
Nintendo Gameboy Color - Ultimate Paintball, Baseball 2000, Roland Garros Open;11,54 EUR;+16,63 EUR shipping estimate;Sold  Aug 28, 2021Sold Item;from United Kingdom;
All Star Baseball 2001 Boxed - Nintendo Game Boy Colour Retro Cartridge NTSC;17,55 EUR;+17,50 EUR shipping;Sold  Aug 20, 2021Sold Item;from United Kingdom;
Baseball Gig GB Gameboy Color Sp Micro DGM GBA Nintendo;30,00 EUR;Shipping not specified;Sold  Aug 4, 2021Sold Item;from Italy;
DOOM Eternal Logo Snapback Cap - Official Game Merch, Difuzed Baseball Hat - NEW;19,84 EUR;+12,82 EUR shipping;Sold  Jun 27, 2021Sold Item;from United Kingdom;
Ken Griffey Major League Baseball Nintendo Game Boy Gameboy Original Authentic!;5,94 EUR;Free shipping;Sold  Sep 16, 2021Sold Item;from United States;
One Piece Going Baseball Kaizoku Yakyuu (Nintendo Game Boy Advance 2004) Japan;3,34 EUR;+3,85 EUR shipping;Sold  Sep 16, 2021Sold Item;from Canada;
Mizuno Youth Boy's Elite Mesh Game Baseball Jersey;20,40 EUR;Free shipping;Sold  Sep 15, 2021Sold Item;from United States;
All-Star Baseball 2003 (Nintendo Game Boy Advance, 2002);2,04 EUR;+3,53 EUR shipping;Sold  Sep 15, 2021Sold Item;from United States;
Ken Griffey Jr. Presents Major League Baseball  (Nintendo Gameboy Game, 1997) ;4,04 EUR;+2,76 EUR shipping;Sold  Sep 15, 2021Sold Item;from United States;
Backyard Baseball / Basketball / Football (Nintendo Game Boy Advance, GBA);3,77 EUR to 4,58 EUR;+0,91 EUR shipping;Sold  Sep 15, 2021Sold Item;from Canada;
Backyard Baseball 2006 - Game Boy Advance GBA Game;6,78 EUR;+2,51 EUR shipping;Sold  Sep 14, 2021Sold Item;from United States;
Baseball Advance (Nintendo Game Boy Advance);8,49 EUR;+3,66 EUR shipping;Sold  Sep 14, 2021Sold Item;from United States;
Nintendo Virtual Boy Virtual League Baseball Cartridge And Dust Cap With Manual;38,25 EUR;+3,61 EUR shipping;Sold  Sep 14, 2021Sold Item;from United States;
Ken Griffey Jr. MLB Major League Baseball Game Boy Gameboy in Box;29,33 EUR;Free shipping;Sold  Sep 14, 2021Sold Item;from United States;
Baseball Original GameBoy + Color + Advance | Authentic Game Cart Only Game Boy;3,39 EUR;+4,04 EUR shipping;Sold  Sep 14, 2021Sold Item;from United States;
Nintendo 3D Virtual Boy VB Virtual League Baseball US VERSION +Book No Box;37,40 EUR;+3,36 EUR shipping;Sold  Sep 14, 2021Sold Item;from United States;
Roger Clemens MVP Baseball , Game w/ Protective Case, Nintendo Game Boy;5,09 EUR;+1,70 EUR shipping;Sold  Sep 13, 2021Sold Item;from United States;
Backyard Baseball 2006 (Nintendo Game Boy Advance, 2005);3,39 EUR;+3,39 EUR shipping;Sold  Sep 13, 2021Sold Item;from United States;
Baseball Nintendo Game Boy Video Game Cart;7,51 EUR;Free shipping;Sold  Sep 12, 2021Sold Item;from United States;
Kids Baseball Guys Pretend Playset Action Figure Toys Boy Gift Game. Open Box;21,25 EUR;Free shipping;Sold  Sep 12, 2021Sold Item;from United States;
Chicago-White-Sox-GAME-Fitted-Hat-MLB-Cap-Baseball-Hip-Hop-Gorra-Black;21,12 EUR;Free International Shipping;Sold  Sep 12, 2021Sold Item;from China;
Mizuno Youth Boy's Mvp Pull Up Game Baseball Pant;12,75 EUR;Free shipping;Sold  Sep 12, 2021Sold Item;from United States;
Baseball (Nintendo Game Boy, 1989) *Cartridge Only*, Tested, dust cover;5,95 EUR;+3,57 EUR shipping;Sold  Sep 11, 2021Sold Item;from United States;
Uncle Sam’s Uncle - ROBLOX Virtual Game Code Only American Baseball Cap;4,21 EUR;Free shipping;Sold  Sep 11, 2021Sold Item;from United States;
Virtual League Baseball (Nintendo Virtual Boy, 1995) - Complete;42,50 EUR;Free shipping;Sold  Sep 10, 2021Sold Item;from United States;
Super Mario Hat Boys Youth Snapback Baseball Cap Video Game Kids Children;8,92 EUR;Free shipping;Sold  Sep 10, 2021Sold Item;from United States;
Mario Baseball Nintendo Gameboy;8,49 EUR;Free shipping;Sold  Sep 10, 2021Sold Item;from United States;
Baseball (Nintendo NES, 1985) Cart Only;6,37 EUR;Free shipping;Sold  Sep 9, 2021Sold Item;from United States;
